"beer_id","date","rating","text","user_location","user_name"
2,"2016-02-02",4.3,"Bottle I shared at the day-after RBWG hotel hangover party with the family, Muck, Turd, Pud, Beau, and others.

Overall: World class, insanely drinkable, perfectly blended masterpiece.

 Beautiful hazy shiny gold in the glass. Lime zest, passionfruit, lemonade, and subtle grass in the nose. Quite lactic and tangy, adult gatorade goodness, with amazingly blended passionfruit/grapefruit/grass notes that ups the complexity. Sharply dry and tangy finish. Crisp, delicate, and insanely drinkable. I could drink it all day.","Indiana, Pennsylvania, USA","italarican"
2,"2016-02-01",4.0,"At Ratebeer Best. Pours bright gold with a thick white head and a fruity aroma. There is a delicious sour malt flavor with a salty finish. Very refreshing with lots of sourish fruit.","Sacramento, California, USA","marcus"
2,"2016-01-31",4.5,"Color is a very hazy yellow with less than a fingers worth of fizzy white head. The smell is funk and citrus. There is a lot going on with the flavor. You get a citrus acidity paired with the tartness as the saltiness hits halfway through the taste. The feel is medium with a decent amount of carbonation. This is one of the best beers I've had in this style! I will be searching out another bottle.","Brooklyn, New York, USA","meyers1023"
2,"2016-01-26",4.1,"Bottle. Thanks Will. Nice aroma, pink grapefruit. Taste is good, light citrus, bit of funk, lots of grapefruit again. Easy drinking.","Tokyo, JAPAN","shoulderbroken"
2,"2016-01-26",3.9,"Bottle shared, thanks Will. Rich juicy lemon with a salty edge, lots of funk, brett, wheat, touch of tropical fruit, fairly dry finish. Drinks like a funky salty dog, fun and delicious, probably best Stillwater Ive had.","","biirusaikou"
2,"2016-01-25",3.9,"bomber. Funky, acidic nose, salty, grapefruit, brett. Pale gold color, lace. Great balance. Good level of tartness with some bretty funk and citrus. Very drinkable.","Kyoto, JAPAN","KyotoLefty"
2,"2016-01-24",2.9,"Bottle.

Head is initially small, frothy, white, mostly diminishing.
Body is hazy light yellow.

Aroma is lightly malty (toasted grain, corn starch), lightly yeasty (cobwebs), with notes of lemon zest, coriander, lavender.

Flavor is lightly to moderately sweet, moderately acidic, lightly bitter.
Finish is lightly sweet, moderately acidic, lightly to moderately bitter.

Light to medium body, watery texture, lively/fizzy carbonation, moderately astringent.

Not really much to talk about on this one, surprisingly. Starchy grain, citrus zest, and coriander, thats about all I can get in the nose. Quite dry in the mouth, very little residual sugar left and substantial sourness and astringency. Not bad but pretty dull.","Boulder, Colorado, USA","Ernest"
2,"2016-01-24",3.7,"Thanks wilisread for sharing the bottle!

Poured into a taster showing lightly filtered, cloudy, light whitish-yellow and no head. 

The nose shows lightly tart notes with a slight sea breeze note. 

The palate is low to no carbonation and full bodied. Moderate tartness, slightly foamy, dry hop is apparent in the light pine and cannabis notes on the mid-palate, and apparent malts on the finish.","Washington DC, USA","jc1762"
2,"2016-01-23",4.2,"Bottle shared. Big lemony tart nose with some light smoke and brine along with some juicy citrus notes. Fairly tart on the palate with light citrus and some light yogurt creaminess. Dry and tart finish. Love it.","Nashville, Tennessee, USA","willisread"
2,"2016-01-23",4.0,"Very cloudy hazy white color. Very nice tart smokey nose. Astringent. Slight salty, band aid in the nose. Very light tart mouth, smokey, green apples, dried bananas. Very tart light smokey finish. Superb","Tokyo, JAPAN","TimE"
2,"2016-01-17",4.1,"Pours a rather hazy orange tan color with a moderate white head on it. Nose is sour with a bit of funk to it and reminds me of a saison a bit. Taste is sour and has a bit of a bite to it, with citrus and some subtle salty notes coming through. Interesting.","Ft. Riley, Kansas, USA","unclemike"
2,"2016-01-08",3.4,"Bottle. Hazed sparkling gold with a fine white head. Aroma impression is musty bacteria, herbs / plants, lemon pound cake, dough, phosphorus / match sticks, sulfur and egg, plastic and mud. Medium-light bodied, acidic, lightly sweet, strongly salty and sour. Creamy and lush mouth feel, bright lemon juice acidity and moldy tropical fruit brett.","Boulder, Colorado, USA","3fourths"
2,"2016-01-08",4.5,"UPDATED: SEP 7, 2016 22oz bottle, undated but assumedly fresh, from Fort Point Market, drunk 1/5/16. Brewed and bottled at Crazy Mountain BrewingWonderful appearance, a rich, waxen, golden-yellow body with glowing haziness and a large white head that fades slowly to cover.Oh shit. Oh my, that is certainly unexpectedly incredible. Sublime balance of floral, spice, brett, and delicate, gentle tropical fruit and citric hops. Not explosive, not quite, but what it lacks in sheer power it more than makes up for in just pure, undeniable pleasure. Just an inherently ""good"" aroma and more or less perfect. Sniffed the stuff for many, many minutes before taking a sip and really could have kept on for much longer. Nothing dominates and theres no trace of metal, dirt, blandness, alcohol, heavy citrus or any other potential problem Ive seen in various goses.The flavor almost lives up to the aroma; not quite, as at times theres just a touch of yeasty blandness that somewhat dulls the brightness. Its pretty minimal, though, and youre still left with meyer lemon, clover honey, soft, fuzzy, warm brett tones, perfectly tight carbonation and attenuation and a substantial yet dry feel to it. Acidity is never punchy or forced and builds up slowly and gently, complementing the other notes. Hops are near-perfect here, adding very little bitterness, no resin or cattiness and coming across more like nelson sauvin (which is a compliment in my book). Though amarillo and citra, when done perfectly are both incredible hops, and I daresay amarillo in peak condition might rival nelson sauvin. Anyways, this beer blew me away and I hope I can find more of it (was the last bottle on the shelf).","Boston, Massachusetts, USA","ClarkVV"
2,"2016-01-08",3.9,"Pours hazy light straw yellow. Aroma is fruity, citrusy, a little Brett funk, very bright, mineraly. Flavors are very fruity, citrusy, sour, but not overpoweringly so, with a light bready finish. Perfect amount of sourness, a touch of fruitiness, balanced by nice bready flavors on the finish. Well balanced, and probably one of the most enjoyable goses Ive had.","Kumamoto, JAPAN","jdjuice"
2,"2016-01-07",4.0,"Bomber. Nicely tart with lots of lemons. Some salty notes. An earthy hay sort of aroma and finish. A little funky cheese on the finish as well. Diverse and sour and lots of entertaining funky things going on here.","Atlanta, Georgia, USA","jrob21"
2,"2016-01-06",4.1,"On tap at El Bait Shop. Hazy golden appearance with a white head. Aroma of lemon zest, tropical fruits, funky yeast, light biscuit and a hint of vanilla. Similar flavor, tart and citrusy with some barnyard funk, a hint of salt and a nice sour finish. Crush.","Denver, Colorado, USA","ajnepple"
2,"2016-01-03",4.2,"Bottle poured a cloudy pale yellow w/ large white frothy lasting head and minor lacing. Bold funky brett aroma. Initial flavor is light sweet w/ a bold sour finish. Tastes are milky lemonade, brett, and lime. Light bodied and lively carbonation. 

---Rated via Beer Buddy for iPhone","Colorado Springs, Colorado, USA","UncleKorm"
2,"2016-01-02",4.1,"Pour out of 22 oz bottle, nice hazy golden yellow pour with white head, aroma brought notes of tart lemon, biscuit, some orange, citrus peel into a bit of funk, tannic notes, some rotten apricots. Taste was a mix of slight fruit, vanilla, lemon, touch of funk, hints of salt, touch of grain, slight orange, hop notes, finishing slightly tart, slightly fruity. Nicely done, the addition of the hops add a nice fruity element.","East Lansing, Michigan, USA","arminjewell"
2,"2016-01-01",3.6,"22oz bottle thanks to Steve. Pours out a pale dishwater straw color topped with a white head. nose is pepper citrus lots of bread malts and belg yeast. Taste is belg yeast spice citrus.","Boise, Idaho, USA","BuckeyeBoy"
2,"2015-12-29",4.3,"Bottle from 1st release. Hops and tartness were very well balanced, I could drink this all day long. Hope to try again.","boise, Idaho, USA","boisebeerguy"
2,"2015-12-20",4.0,"Proletariat, NYC tap: pours hazy golden with a white head. Aroma is a whole lot of brett... I cannot really describe it further; however, it smells pretty great. Taste is flavorful hops, funky brett, and a nice bot of salt at the finish. High levels of complexity. Quite sour. Quite good.","Nueva York, New York, USA","mansquito"
2,"2015-12-17",3.8,"On tap at Ale Arsenal. Pours a hazy bright yellow with moderate white head. Aroma leans towards the hops, which the sour aspects appear more in the flavor. Solid and interesting.","Redwood City, California, USA","Zymurgeist2"
2,"2015-10-04",3.9,"Bottle at WTWBA 2015 in Minneapolis. This was really good. Hazy yellow pour. Tart/sour citrus, mild salt, easy drinking and refreshing.","Plymouth, Minnesota, USA","BVery"
2,"2015-10-03",4.4,"Well this is impressive. One of my favorites at Where the Wild Beers Are. Hazy yellow pour with a bunch of fruity flavor and is really tart but well balanced.","Minneapolis, Minnesota, USA","falco242"
2,"2015-08-27",4.0,"Pours a lightly hazy golden without much head but what is there leaves some lacing. Nose is of juicy fruits, yogurt and hops. Taste is of hoppy fruits, light salt and moderately bitter. Body is light, carbonation moderate and the acidity was incredibly refreshing. A really nice gose thats for sure! A bit americanized but in this case it worked quite well.","Québec, Quebec, CANADA","mathieuc"
2,"2015-08-24",4.3,"How: Bottle (22 oz). Shared at Mont-Carmel tasting. 

>>> A spectacular wild take on a Gose, reaching some great heights of brightness and freshness. 

-  Cloudy bright yellow-ish golden with a medium white head, good retention and good lacing. 
-  Aroma is fresh and bright with amazing funk alongside surprisingly intense hops features considering its already a bit old. 
-  Taste is a bit less bright, but it leaves the place for secondary flavors like salt, coriander, lactic notes, red fruits. Its intense, but it find a way to be rather well balanced. 
-  The acidic presence is strong, but still a bit less than Westbrook Gose. It fits the beer profile really well. 
-  Light body, good carbonation and a nice salty finish cut by a bright acidity. 
-  As wild and intense as it can be, it still keep nice Gose features. 

Flavors:  Bright funk, citrusy hops, coriander, salt, wheat, lemon, red fruits.","Quebec, CANADA","tom10101"
2,"2015-08-23",4.1,"pours hazy light but bright gold with a small white cap, reviving and leaving nice lacing. tart juicy limes and perfumey coriander, light to medium acidity - lactic, welcoming acetic hint; strawberries, spices, chalk. light carbonation, light body - oily; tart herbal-spicy finish. very fragrant and interestingly wild gose.","Québec, Quebec, CANADA","czar"
2,"2015-08-23",4.1,"Bottle shared. Clear pale gold pour with nice light lacy white head. Aroma is really nice, great dry-hopped sour aroma, citrusy, tons of amarillo citrusy notes. Taste is quite tart, nice hoppy flavor, really fresh zesty lemony flavor. Palate is light, nice body, good carbonation. Really good.","Trois-Rivières, Quebec, CANADA","JulienHuxley"
2,"2015-07-13",4.3,"this one has been staring me in the face for so long. Tons of lime juice, hops are still strong, lots of pineapple and tropical fruit. Tart is moderate-high for the style. Dry finish. Salty throughout.","Arizona, USA","Ernesto987"
2,"2015-06-13",4.0,"Bottle thanks to Darshan. Aroma is fresh juicy citrus hops, black pepper, mango, and pineapple. Tastes mildly sour and moderately salty. Juicy lemon, pineapple and mango. So good.","Flat Rock, Michigan, USA","umich03jm"
2,"2015-05-09",4.9,"Sour slight plastic aroma. Hazy pearl gold color. Sour salt amazing. It is light floral great bite and lip smacking salt.","truckee, California, USA","krumbum"
2,"2015-03-14",4.1,"Candy sweet, tart and sour. Lots of carbonation. Touch of salt. Compared to the original, a lot more tartness and a thinker body but less salt. A lot of flavor coming from just 4%. Id say this is a full on wild ale, not just a gose anymore.","Illinois, USA","rxeight"
2,"2015-03-10",4.8,"Served in a Teku from bomber. Served 6mo old. Oddly, prefer this 6mo old than fresh. 

Aroma  compelling scents of sea salt and acidity emanate from the surface of this brew. I have not encountered a Gose with aromatic qualities of this nature.

Appearance  opaque golden hue glistens and gleams. Moderate frothy, white head-retention dissipates over time, but remains for minutes after pouring into Teku. Sediment congregates at bottom of glass and appears goopy white from outside of glass, but is truly a brownish-white goop when peering in from above glass. As you pour the remaining bottle into the glass, the beer is murky, pastel-like yellowish-white.

Taste  fascinating, marvelous concoction of sour, funky, salty sensations. Subtle vestiges of Westbrooks Gose coalesce brilliantly with Stillwaters ingenuity. Skeptical one could notice the alcohol in this brew prior to reading the label.

Palate  For style, there is nothing this Gose does not accomplish. Goes Gone Wild delicately explores each and every avenue of the palate and exhibits its magnificence throughout each and every sip.

Overall  This beer is in a class of its own; a truly transfixing showstopper of a Gose. Typically, I do not compare styles... Sorry, but this is one of my favorite beers of all time. Drinkability wise and quality wise, I cannot put many brews of any style past this one. Take the time to smell the roses.","The Garden of the Beer Gods, North Carolina, USA","TheGoldenChalice"
2,"2015-02-22",4.2,"Pouring at BCTC 2014. Pours a faintly hazed gold with a large white head. Musk, funk and wheat on the nose. Salty and tart, lemon and floral, tangy and beautiful. Long tart and salty finish. I blame this beer for reducing the number of beers I tried during the festival proper, as I kept coming back and drinking this over just about everything else. So damned good.","Poughkeepsie, New York, USA","j12601"
2,"2015-01-19",4.4,"22 oz bottle shared by devman171 at the Annapolis tasting, thanks Devin! Never seen this in shops or on draft so I was happy to finally get to try this. Hazy yellow with off-white head. Aromas of floral notes, tropical fruit, light salt, tart fruit. Tastes of tropical fruit, salt, tart lemons. Medium-light body with a dry finish. Fantastic and lives up to the hype, nice tart and salty gose with a tropical fruit twist.","Falls Church, Virginia, USA","GenDV138"
2,"2015-01-19",4.3,"Bottle, Pours hazy yellow with white head. Light fruity and salty aroma. Taste is tropical fruits, brett funk, and a tart and light salty finish, excellent","Annapolis, Maryland, USA","devman171"
2,"2015-01-18",4.2,"UPDATED: FEB 12, 2016 Pours a slightly hazy yellow from the bomber with fluffy white head that leaves good lace. Aroma is nice funky citrus from both the hops and the base beer, hint of earth and lactic sour. Taste is amazing balance of sour and funk, citrus is huge, light and effervescent. Wow, a real treat and glad to have tried it.","Marietta, Georgia, USA","jbruner"
2,"2014-12-08",3.8,"It poured a hazy yellow color with a white head. The aroma was of fruit, tartness, funk, citrus and malts. The taste was tart, with funk, lemon, fruit, orange, hops, florals and malt. Wow, very nice.","Wentzville, Missouri, USA","jandd1983"
2,"2014-12-07",4.2,"Bottle shared. Pours a hazy yellow with a white head of foam. The aroma has funky wheat notes with a bit of a tropical fruit hop profile. The taste is all sour, which is delicious, but its missing the salt of the standard Westbrook Gose. Lighter body and medium to high carbonation.","Devola/Marietta, Ohio, USA","JStax"
2,"2014-11-25",4.2,"Grabbed the last bottle out of the fridge at Julios a few months ago. Time to share. Pours straw with a white head. Aroma is lychee, lemon. Flavor follows, with some salt. Really nice.","Massachusetts, USA","WillRunForBeer"
2,"2014-11-25",4.0,"Bottled shared by Willrunforbeer. Hazy gold with thin head Ina snifter. Aroma is tart lemons, Pilsner malt, grain. Flavor is mostly the same, lightly lactic, nicely tart. Salt is mild... Really damn refreshing brew!! Thanks Brain!","Epping, New Hampshire, USA","AirForceHops"
2,"2014-11-25",3.9,"Bomber, Thanks Brian for sharing. Very cloudy, 1 finger head fizzy yellow like lemon juice. Nose is nice tart lemonade, juicy-fruit and sure salt, why not? But not huge.Oooh, lots of peach, lemon, mango and juicy I like this a lot. Its sour but not too much.","Enfield, New Hampshire, USA","AdamChandler"
2,"2014-11-06",4.2,"22oz bottle via Sloths free beer contest. Thanks a ton Bert! Id tried to land this bottle a few times and kept failing. Glad to finally check this off. Pours a very hazy, sort of opaque, pineapple gold with some lacing, soapy white head. Nose is cool, the gose base is definitely there, lemony, briny, yogurty but I also get a shot of dank hops, fresh tangerine, some bright grass, even a little bit of horsey funk lurking. Flavor smacks you with lemony tartness right off the bat, vitamin C tablets, really tart/fresh yogurt, grassy, straw, some muddled citrus - meyer lemon and white grapefruit. The brett is a little lost. This would be an interesting beer to age a bit. Youd lose the dank hops on the nose, but you could get some extra funk in the flavor. Either way, very cool.","SouthWest, Washington, Washington DC, USA","nimbleprop"
2,"2014-11-05",4.2,"Large, white head, staunch with a thin lace. Murky, milky white color. Nose is juicy with lemon lime, yeasty bready notes, tart with some notes of burnt wiring as it warms, dare i say,,, danky?? Body is light, carbonation is wonderful, spritzy and the tang is ginormous! A real palate awakening! Dry, lightly bready malts, brash citrus flavors and of course that dry saline enhanced profile.Think the hops have faded somewhat but still good juice! Dry, highly acidic finish is big and tart and the salt on the lips makes this one savory brew. Lemon lime notes are juicy and just really enhanced with the salty notes. Really nice stuff. Potent! Bomber from statelineliquors.Bottled version seems a bit moreish than the draft version i have had.","Ceciltucky, Co., Maryland, USA","sloth"
2,"2014-10-17",3.9,"Bottle @ Gregs palace. Thanks Luke! Pours a bit hazy golden appearance with a big white head. Big citrus, grapefruit, guava, tropical fruity nose with some light funk and sea water. Pretty fucken tart. Some salt and funk along with a ton of grapefruit and guava. Tart, refreshing, and quite hoppy. Kind of a fun beer.","Fort Collins, Colorado, USA","adnielsen"
2,"2014-10-13",4.0,"Salty sour and citrusy. Pours cloudy golden with great head and lacing. Finishes tart with some sour plum and lots of salt. Great beer, some zest in here as well. Tap at Of Love and Regret.","Washington D.C., Washington DC, USA","solidfunk"
2,"2014-09-22",3.9,"Sample at a bottle share. Pours a cloudy pale gold with a nice white head. Aroma of citrus, funk, and spice. Taste is citrus, tropical, funk, spice, and salt. Very nice.","Lansing, Kansas, USA","RobertDale"
2,"2014-09-21",4.0,"Draft. Pour is hazy yellow. Brett, citrus on the nose. Slight salt taste with a hoppy citrus and brett finish. Very nice beer. Interesting combination of funk, citrus and light malt.","Huntingdon Valley, Pennsylvania, USA","oOJUXEOo"
2,"2014-09-15",4.5,"Bomber. Uh, pardon me Sir, may I have another? And another after that? Just keep pouring this down my throat with allowing me at least 5 minutes to take each sip properly, thoroughly and fully. Thank you. This is one incredible funked up Bretted straw and salty filled amazing piece of beer. YES.","Earth, Washington, USA","skoisirius"
2,"2014-09-11",4.7,"Bottle. Pours hazy butterscotch with a large off-white head, puffy and creamy, slow to dissipate, great lacing. Aroma is, oh yeah, Brett!, lots of citrus, lemon, grapefruit. Medium tart. Flavor is dry, a bit funky, salty, a citrus bomb for sure. Light body, Absolutely yummy. This is god nectar. Moar.","Sunnyvale, California, USA","bytemesis"
2,"2014-09-09",3.9,"Poured from bottle to glass. Hazy straw hue with fizzy white head that lingered. Aroma is huge lemon, straw, peppercorn, ripe key limes. Mouthfeel is fantastic with a medium light body and crisp carbonation. Taste is dry throughout with a nice salty bitter finish. Overall this was a very enjoyable brew.","Sweet Home, Oregon, USA","Salmoniform"
2,"2014-09-06",3.8,"Cloudy straw pour. Big white head. Plenty of lacing. Hoppy sour aroma. Huge tartness. Pepper. Lemon.","Crestview, Florida, USA","suprchunk"
2,"2014-09-01",4.4,"Bottle thanks to max. Pours a beautiful hazy milky orange body with thin white lacing. Aroma is incredibly delicate salty tartness, lime, dank Nelson and light passion fruit. Mouthfeel is perfectly tart with notes of sour fruit - lemon, passion fruit, lime, salt, peach, lemonade and funky. Awesome.","New York, New York, USA","jredmond"
2,"2014-08-24",3.9,"pours slightly hazy yellow. Smell is sour lemon and hops. Interesting. like a funky gumballhead. Pretty tart, and fairly hoppy. Not quite as sour as WEstbrook Gose, but close, and a nice dose of hops with some light sweetness in the aftertaste. Pretty interesting and enjoyable.","Austin, Texas, USA","lb4lb"
2,"2014-08-20",4.5,"Bottle at Churchkey. Cloudy yellow color, white head. Aroma of funky lemons left in attic corners to collect dust and black pepper. Taste is softly sour peach, lemon, summer fruit. Holy cow!","Charlotte, North Carolina, USA","Travlr"
2,"2014-08-15",4.2,"On tap at Apex. 

A: Clear golden straw w/ a fluffy white head.

N: Lemon, lavender, crackers, salt mines, watermelon and cantaloupe. Oranges and grapefruit rind. 

T: Salty and most pleasantly sour. 

M: Light and drinkable. Sharp carbonation. 

O: People have told me how good this is, and I am very glad I listened to their recommendation. This is the best Gose I have had, hands down.","Portland, Oregon, USA","Sarlacc83"
2,"2014-08-12",4.0,"Incredible gose sour hopped up treat. Cloudy yellow with lace sheet. On tap at wirld of beer charlotte.rich citrus orange premier white wine aroma.","Toronto, Ontario, CANADA","Sammy"
2,"2014-08-11",3.9,"Draft at Belmont Station, Portland. Pours a slightly hazy light straw, very effevescent. Nose lively and funky, aged cheddar. Body very lively, arch and dry with a slight sour kick. This is some good stuff.","Eugene, Oregon, USA","ericdevin"
2,"2014-08-08",4.0,"Bottle at PIB, pours a cloud orangey blonde with a small white head. Nose brings out a nice mix of funk and salt, with a dry hoppiness to it. Flavour is very funky and moderately salty, with horse blanket and salt that dominate. Very complex and drinkable. One of the most elegant goses Ive had. Excellent job here.","Vancouver, British Columbia, CANADA","mcberko"
2,"2014-08-07",3.8,"Growler thanks to Russell. Pours a cloudy yellow orange with medium frothy off white head that lasts. The aroma is strong citrus, brett, tart fruit, funk. Thin mouthfeel with a nice tart citrus, funk, light salt, easy to drink, very good.","Houston, Texas, USA","djd07"
2,"2014-08-07",4.2,"UPDATED: AUG 8, 2014 Bottle. Rating 8,100. Pours orange gold white head. Nose/taste of tart lemon, sea salt, sour wheat, sour banana, spritzy lemon juice, bretty citrus and grapefruit and funk. Lighter medium body.",", New Jersey, USA","jtclockwork"
2,"2014-08-04",4.0,"Bottle @ home. Thanks, Jake. Hazed golden pour with a white head. Fruity, tropical, acidic aroma. Lots of pineapple and guava. Sticky honey and vanilla. Good lemon and green apple, a bit of straw as well. Flavor has a nice acidity to it. Lots of lemon, tropical fruit, and grass. Some green apple and sweet honey. Huge mango and passion fruit. Slight guava preserves. Good stuff.","Dublin, California, USA","brokensail"
2,"2014-08-01",3.9,"Keg @ Hair of the Dog. Slightly hazy gold with a small head. Nose is pineapple, pear, peach. Rotting fruit funk. Taste is of salted Capri sun, and I mean that in the best way possible. Nice and bright, flavorful.","Minneapolis, Minnesota, USA","jackl"
2,"2014-08-01",4.3,"carried over from untapped to try and organize my beers for syncronicitys sake.","North Carolina, USA","Rrauth"
2,"2014-07-31",3.7,"gose bright yellow pour with fluffly white head. Aroma peach mango fruity hops. Some funk. Tastes big lemons. Moderate brine some wheaty character. apple cider vinegar. sharp acidity slight syrup smoothness","Seattle, Alabama, USA","nealblind"
