"beer_id","date","rating","text","user_location","user_name"
2,"2014-07-30",4.4,"22 ounce bottle into tulip glass, no bottle dating. Pours moderately hazy golden orange color with a 2 finger dense and rocky white head with good retention, that reduces to a small cap that lingers. Nice spotty soapy lacing clings around the glass, with a fair amount of streaming carbonation. Aromas of big tart lemon peel, lime, green apple, grapefruit, orange zest, pineapple, mango, white vinegar, brine, herbal, hay, straw, grass, musty funk, white bread, and yeast earthiness. Fantastic aromas with great balance and complexity of fruity/funky yeast, citrus/tropical hops, and brine/pale malt notes; with great strength. Taste of big tart lemon peel, lime, green apple, grapefruit, orange zest, pineapple, mango, white vinegar, brine, herbal, hay, straw, grass, musty funk, white bread, and yeast earthiness. Good amount of fruity acidic tartness on the finish; with lingering notes of lemon peel, lime, green apple, grapefruit, orange zest, pineapple, mango, white vinegar, brine, herbal, hay, straw, grass, musty funk, white bread, and yeast earthiness on the finish for a while. Incredible complexity and robustness of fruity/funky yeast, citrus/tropical hops, and brine/pale malt sweetness; with an awesome malt/acidity balance and zero cloying flavors after the finish. Medium carbonation and body; with very smooth, crisp, and moderately briny/acidic mouthfeel that is great. Alcohol is well hidden with no warming present after the finish as expected of 4.3%. Overall this is an absolutely incredible hoppy gose style! All around fantastic complexity and robustness of fruity/funky yeast, citrus/tropical hops, and brine/pale malt flavors; and very smooth and crisp to drink with the balanced acidity. An extremely delicious offering.","Michigan, USA","superspak"
2,"2014-07-28",4.1,"Draft wob. Aroma is lemon pledge, brett, and orange peel. Cloudy gold color. Sips tart and citrusy. The salt really gives it a boost and crisp umamines in the finish. Body is medium and crisp with a nice sour bite. Very refreshing and lemony. Not sure how many I c pulse drink, but this one is hitting the spot.","Seattle, Washington, USA","Davhgbrew"
2,"2014-07-28",4.2,"[ Bottle ][ 22oz ][ Tasting ][ Tasting ][ Globe ][ 7.26.14 ]
>> Cloudy white peach pour with dwindling foam. Nose is powerful yuzu fruit, amazing citrus, similar to Westbrook Gozu. Taste is mouth puckering mega lime, holy monkey, yuzu fruit power. Nom nom, feels a bit too sour, but very similar to the Gozu though perhaps more sour. Still, refreshing and super bright, super citric.","San Diego, California, USA","GT"
2,"2014-07-27",4.0,"Hazy straw yellow color with a big bright white head that lasts forever and leaves good lacing. Aroma is tart with lemon and citrus as well as some cracker malt. Taste is similar with a big tartness that is tempered somewhat by the cracker malt flavor. Lemon drops and citrus along with a minerality. Finishes crisp with some tartness. Mouthfeel is crisp with a light/medium body and high carbonation. Really nice tartness that is balanced but not overtaken the other flavors.","Missouri, USA","jeremyh70"
2,"2014-07-24",3.9,"Bottle: Thanks, Mike. Slightly muddled, bright yellow body. A soapy white film leaves moderate spots of wet lacing behind. Aroma has a solid mixture of lightly acetic lemon, sour lacto, & sweaty jockstrap funk. Elements of salt, coriander, & milled grains can be found buried underneath, but this is a sour ale first and foremost (on the nose, anyway). Nice lemon juice tartness from the first sip, puckering. Quite sour! Mild brine-like notes with sour lacto, grains, some funky hay, leading to a finish thats quite acidic & super dry. Funky & sweaty funk (thanks to the Brett) grows with time. Like a Lemon-Head flavored sweatsock.... with a hint of salt. Perhaps its just me, but I dont get much from the addition of Citra or Amarillo... the Brett & lacto seem to just devour the tastebuds. A very tasty ""sour ale"", but honestly I think I prefer Westbrooks regular gose.","Michigan, USA","tectactoe"
2,"2014-07-19",4.0,"Bottle from Covenhoven. Matte applesauce color with a finger of frothy white Head. Some webbing. Beautiful. Aroma of lavender, sawdust, wheat and fresh cherries. Medium body. Lots of fresh squeezed grapefruit, light brine, Brett and earthy good. Lip snacking good.","Brooklyn, New York, USA","BLADT"
2,"2014-07-19",4.3,"Tap at Maxs. Pours lightly hazy yellow with a medium, frothy white head, medium retention with good lacing. Aroma is lemon, salt, light Pils malt, earthy wheat and lactic, barnyard sourness. Aroma is dank hops, lactic grapes and lemon, earthy and spicy wheat malt, cracker notes, salt and a dry finish. Light body and lively carbonation.","Escondido, California, USA","BeerandBlues2"
2,"2014-07-17",4.2,"On draught... a buncha times.
Pours a hazy bright yellow with a good head and some nice lacing on the glass. 

The aroma is super bright with nice fruit notes of lemon, lime, & some peaches. Its got a light leathery funkiness to it and a touch of brine. 

The flavor is very tart, its got some raw rhubarb character, some lemon, and a whole bunch of peach. The saltiness is mild but noticeable, the hops are very bright and fruity, & the beer is dry with a pretty high level of sourness. 

I just really like it a lot.","Pouring Bus, Iowa, USA","CanIHave4Beers"
2,"2014-07-09",4.2,"22 oz. bottle from Conn. Ave Wine & Liquors. Hazy gold pour, fluffy white head. Nose and flavor are ridiculous, with huge sour lemon, unripe apricot & peach, pithy bitter orange and grapefruit, lip-smacking salinity, and aggressive acidic funk. Really more of a sour than a true gose by traditional standards, but sweet Jesus is it quenching and delicious.","Seattle, Washington, USA","craftycarl21"
2,"2014-07-09",4.0,"At APEX with Stephen. Pours hazy neon orange no head. Aroma is sour tart, light citrus, melon, hint of slalt. Taste is sweet tart, salty, funky, tangy light fruits, fresh drinkable. Fantastic funky gose.","Dallas, Texas, USA","Experiment_Ale"
2,"2014-07-09",4.0,"On tap at Apex. Pour is hazy golden with a frothy white head and great lacing. Big sour lemon lime, biscuit, lightly salty, urine, lacto, straw, and funk on the aroma. Big sour lemons, lactic, margarita salt, light graininess, horse blanket, hay and stone fruits with a big sour finish. Medium body with high carbonation. Really awesome gose with high sourness yet highly crushable.","Denver, Colorado, USA","Steve_0"
2,"2014-07-08",3.9,"Draft. Pours a hazy straw yellow color with a small white head. The aroma and flavor have strong tart/sour citrus, grapefruit, orange peel, salt, acidic, puckering at times, but surprisingly very drinkable. This was not something I was looking for, but turned out to be very good.","Cincinnati, Ohio, USA","alexsdad06"
2,"2014-07-06",3.5,"Pours a pale almost banana yellow. Very cloudy. Medium white head. All fine foam. Little lacing but it could be the glass. Aroma is odd. I think its a mix of hops, lacto and spice, but its hard to separate things out. I like it, but the initial smell was a bit of a shock. Kinda pickley. Strong yogurt sour note with tropical fruit and citrus. Taste is quite lacto sour. Big tropical hop flavor. Some butyric acid, a tad off putting. Lots of pucker. A bit of yogurty body and otherwise light. Very interesting but I cant say that I love it.","San Francisco, California, USA","popery"
2,"2014-07-04",4.2,"22. Boom! This stuff is fucking amazing. Pours a cloudy medium gold with a loose sudsy white head that sticks around for a while as film. Big tangy orange peel nose, even when cold. Salty and citric and pleasant. Creamy medium body with lively carb. Orange peel, orange pith, juicy, tangy, oily, puckery. Super intense and forward but in a very balanced way with body and carbonation that balance it perfectly. Long puckery finish. Awesome beer.","Mukilteo, Washington, USA","after4ever"
2,"2014-07-04",3.9,"Bottle. Cloudy gold with a foamy white head. Strong sour fruit, funky yeast, wheat, grains, salt and spice with yogurt notes. Taste is big sour fruit, yogurt, toasted wheat, grains, salt, funky yeast, floral and earthy hops and zesty citrus. Body is light with a strong bubbly carbonation and a lingering acidic tartness. Ends with more yogurt, sour fruit, funky yeast, floral hops, citrus, lots of wheat, grains and earthy funk.","Newport News, Virginia, USA","TheBeerGod"
2,"2014-07-03",3.8,"Draught. Pours a rather hazy orange tan color with a moderate white head on it. Nose is sour with a bit of funk to it and reminds me of a saison a bit. Taste is sour and has a bit of a bite to it, with citrus and some subtle salty notes coming through. Interesting.","Snohomish, Washington, USA","maxwelldeux"
2,"2014-07-03",4.8,"UPDATED: AUG 12, 2016 Draft pour. Pours a beautiful hazy dark yellow. Super sour fruit aroma. Perfect tart fruit flavor. Some orange and maybe a little peach. Nice, sour wheat finish. Incredible beer to say the least. Everything I love about sour beers is in this one. Loved it.  UPDATE.  This is consistently my go to for the style.  I rated this a long time ago, with way less beer miles on me, and I cant change my rating.  I love everything about this beer.  Quintessential sour.","Kenmore, Washington, USA","andrewje41"
2,"2014-06-30",4.9,"Numerous bottles and a few times on draft as well. Fuck yes. This beer has everything I love. Lots of funk and lots of hop aroma and pure flavor. Begins with an amazing sour and saltiness, leading to copious amount of lemony and tropical fruity hops. Flavor follows suit..lots of fruity hops and funky sharp saltiness. Shit, Ive probably had this 10-15 times now and every time it nails it. Cant say that about too many beers...even some of the whitest whales. One of the best beers I have had all year and ever. Seriously. Cant believe there are so few rates on ratebeer.","Durham, North Carolina, USA","TURDFERGUSON"
2,"2014-06-30",4.7,"UPDATED: SEP 20, 2014 Hazy gold, bright lemon with puffy large white head, nice lacing with wispy island. High acid nose compared to the westbrook, mushroom salt funk with higher acidity, sharp with a little BO. High acid front palate, salty with huge grapefruit rind and tangerine mid before lightly doughy finish, moderate citric acids burn chest in hoppy, lightly skunky finish. Very refreshing if too hot, as much a sour as a gose.

Have had 3-4 glasses of this on tap recently. UN-BELIEVABLE. Bombers dont come close. Something unseen, a 3% lactic session sour, saddle and leather so faint, ungodly high-acid lime softness throughout the whole thing, ethereal salt slakes the palate near-finish like a down pillow to the face from the girl in only her panties that youll bang for the first time T-10.","Baltimore, Maryland, USA","MrChopin"
2,"2014-06-29",3.9,"Pour is hazed pale yellow with a good bit of white head and some larger bubbles. Nose is quite hoppy, lots of citrus and citra hops with a light tinge of salt and a dose of acidity. Taste is similar, tons of citra hop, a bit of acidity and moderate grain presence. Lots of citrusy flavors and just a hint of saltiness. Lighter carb with a juicy finish.","Pittsburgh, Pennsylvania, USA","cpetrone84"
2,"2014-06-28",3.3,"Draft at Ale Arsenal. Hazy golden color with a lasting white head. Big salty lemon herbal aroma. Flavor is a little bit ammonia-like but otherwise good. Salty with a bit of a Lysol/ammonia flavor - good in a way and a bit off-putting in another. Medium body with a bit of astringency. Pretty good but not too polished.","San Francisco, California, USA","nickd717"
2,"2014-06-28",3.9,"Tried this on tap. Hazy light yellow orange body. Aroma is sour and bready. The beer is pretty sour tasting, but is balanced well by a sharp bready taste. Sort of like sour dough.","Madison, Wisconsin, USA","kkleu357"
2,"2014-06-27",4.0,"This is a think of beauty. Pours hazy golden / orange with a small white head. The aroma has brett funk, barnyard, hints of pale malt, pineapple, mango and spice. It has a light crisp body with lots of fairly soft carbonation. The flavor begins with coriander, smooth malt, lots of juicy tropical fruits and some salt. The finish has boatloads of fruitiness, pepper, light funk and it is utterly refreshing. There is a lingering saltiness. Excellent.","Florissant, Missouri, USA","vyvvy"
2,"2014-06-26",3.7,"On tap at Taps in Petaluma. Pours a hazy golden color with a bit of head. Very sour from start to finish. Some slight hop flavors emerging towards the end.","California, USA","Bule"
2,"2014-06-26",3.9,"bottle. aroma of potent juicy kiwi fruit, lemon lime citrus zestiness. bit of musty fog character. bright apricot peachy fruit. moderate heavy bright kiwi lemon lime yogurt sourness. dry. would prefer toned done sourness, as a less sour version would lend to more chugeability. but aroma is quite fun. petes fine.","pouring bus, New Brunswick, CANADA","SrSilliGose"
2,"2014-06-26",3.8,"Bottle, shared by B3shine, thanks! Pours hazy gold, white head. Aroma of funk, dust, citrus, tropical fruit, bread. Taste is lightly salty, tart, funky, dust, tropical, citrus, wheat. Palate has average carbonation, slick, tart finish.","Indiana, USA","tastybeer"
2,"2014-06-26",4.0,"This beer pours a hazy pale yellow-gold color with a medium white head that dissipates steadily in an outer ring. Spotty lacing on the glass. Aroma of tart citrus, spices and wheat. Light-bodied with flavors of funky citrus, peppery yeast and hops. The finish is tart with a lingering tropical fruit and hops aftertaste. Good beer all around.","Columbus, Ohio, USA","Dogbrick"
2,"2014-06-25",4.1,"On tap at the Brick Store Pub 17th anniversary. Pours a hazy, light gold, with a big white, foamy head. The aroma is mango, grapefruit, grass, lemon juice, salt, and some light brett and lacto funk. Immediate, sharp sour flavor, with some light saltiness and a nice citrusy sweetness. While theres no perceptible hop bitterness, it seems like the hopping has balanced out the flavor quite well. Light to medium body, acidic and sharp, and a little mineraly. This is an amazingly well-made, balanced, and delicious beer. The extra hopping lights up the aroma wonderfully, and it seems to serve to balance out the harsh sourness, resulting is a sour, but balanced and very drinkable beer. I could drink a lot of this...","Colorado Springs, Colorado, USA","GTAEgeek"
2,"2014-06-25",4.5,"Bottle. Pours cloudy yellow, aroma is hoppy. Taste is quite unique. Its kind of a hybird of a ipa with a gose. Imagine a stillwater hoppy beer finishing with a westbrook gose. This one was a treat try.","Ontario, CANADA","Ontbeertaster"
2,"2014-06-22",4.0,"Courtesy of mrebeks
Bottle: The aroma consists of lemon, pepper, minerals, sulfur, salt, and a touch of smoke. It pours a hazy/cloudy golden-orange with a small white head that quickly fades to a thin film outlined by a slightly thicker ring. The flavor starts with huge lemon tartness. The finish has sweet tarts and faint mineral salt. Its light-medium bodied with moderate-lively carbonation.","Rochester Hills, Michigan, USA","Pailhead"
2,"2014-06-21",4.2,"Hazy yellow in color... Aroma of passion fruits, barnyard funk... Flavor is amazing, really wheaty mouthfeel, but tropical fruits, citrus is extremely prevalent throughout, hints of funk on the finish... So refreshing, so puckering, really enjoyed this 

---Rated via Beer Buddy for iPhone","California, USA","baraciisch"
2,"2014-06-21",4.1,"On tap at ORiley & Conways, pours a cloudy gold with a thin white head, aroma is of big tropical fruit notes with a good amount of salt and funk, the flavor has a huge amount of lemon zest and funk at first with a sour and salty finish, seriously awesome, pulling up a chair as we speak and enjoying a few of these","Quad Cities, Illinois, USA","cbfobes"
2,"2014-06-17",4.0,"22 ounce bottle from The Beer Trappe. Wow. That is some nose. Tropical fruit and something sour in aroma. Upfront salt, tropical fruit, slight brett like flavors. Citra really change the nature of the gose here. Excellent.","Lexington, Kentucky, USA","drfabulous"
2,"2014-06-12",4.1,"Another great bottle from Brother Lukaduke! Easily one of the best Goses Ive ever tasted. I like a truly salty Gose and this one delivers. But it goes even further, with brett and tropical hops adding complexity and punch. Well carbonated with a beautifully long finish. Layer after later of flavor. Gose hard!","Valley Village, California, USA","Ontape"
2,"2014-06-11",4.2,"UPDATED: JUL 5, 2014 22oz bottle in a tulip. Pours cloudy golden with a lacy, white head. Aroma of the base beer - a gose with the tartness, light wheat and malts, and the salt and coriander - plus an amazing citrusy hoppiness that adds to the beer. Flavor the same with such an awesome blend. Average to lighter texture. An amazing beer, with a nice improvement from the original beer with the hops blending well and adding to an already awesome Gose.  Edit: Pineapple and awesomeness. A great beer.","Connecticut, USA","jkwood04"
2,"2014-06-09",4.0,"Pours a hazy yellow with a white head. Fruit, tart, funk, citrus and malt aroma. Tart, funk, lemon, stonefruit, orange, hop, floral and malt flavors. Light body and a very tart mouthfeel. Citrus and tart finish. Reminds me of sour candy.","California, USA","beertholomeus"
2,"2014-06-09",4.1,"22oz bottle pours hazy pale straw yellow with 2 finger head. Nose is musty stonefruit, funky citrus, tart fruit juice, touch of cereal. Taste is super bright crisp acidic lacto lemon, orange, grapefruit, some subtle cereal malt and toasted white bread emerges as it warms. Finish is acidic sour lemon, lime, cereal, lacto, subtle saltiness. Nice!","Hampton Roads, Virginia, USA","JBPortland"
2,"2014-06-03",4.6,"UPDATED: JUN 5, 2014 On tap at good Dog with Eric and Craig. pours hazy golden orange. Aromas is heirloom Asian fruit most notably lychee and mangosteen. Flavor is peach skins, passionfruit, guava, tangerine, salt, pink lemonade and asian candies. Slightly rustic on finish hit mostly salivating pucker. Best draft beer of the week so far. Tried again at Cambridge...still amazing but $8 bucks for a 6oz pour of a 4.6% alcohol beer is bullshit.","Philadelphia, Pennsylvania, USA","PhillyCraft"
2,"2014-06-03",4.2,"UPDATED: JUN 4, 2014 Pours a hazy yellow golden color with two fingers of sticky white foam. Nose is punchy with citrus, yuzu, grapefruit, lime, hints of barnyard brett fresh grass and fresh sea water. Palate follows nicely, bright citrus acidity, ruby grapefruit, lemon, lime, even some flint like stuff going on in here that adds a nice complexity. Cranked up is a great way to describe this,sour,  juicy puckering acidity, mellow salinity, round wheat... wow nice soft mouthfeel, great carbonation ! Tasty.","Gray, Maine, USA","Lukaduke"
2,"2014-06-01",4.2,"Draft. Golden hazy pour with white head. Brett, tart, salty, light citrus and funky aromas. Flavor is a cluster of salty gose, Brett, light citrus hop tones.","Wayne, New Jersey, USA","vtafro"
2,"2014-05-31",3.8,"bottle enjoyed with Rudolf, Lackey & Bar Hop boys at Blue Monk, Buffalo. Lemon tartness, touch of salt, earthy bitterness, citrusy citra. Quite tart, full mouthfeel. Very Nice","Buffalo, New York, USA","swoopjones"
2,"2014-05-30",3.7,"Draft to goblet. Looks good; a hazy golden orange with white head. Smells hoppy and bretty. Tastes like it smells with some tart citrus notes as well as some salt. Pleasantly puckering on the palate. Good beer.","Indiana, USA","b3shine"
2,"2014-05-28",4.4,"Holy barnyard batman. Tons of funk with some slight lemon undertones. Of course the normal salty component. The citrus is prominent and very refreshing. The tartness dries it out. Lots of passion in this one. The lemon and the sourness just continue to build into exceptional bliss. Awesome","Melboring, Florida, USA","Homer321"
2,"2014-05-25",4.0,"Bottle from GBX. 
Aroma is yeasty, citrus. Lemon, orange. A little sourness. 
Truely a fascinating appearance. Almost like hazy lemonade... but its not a shandy! Nice lacing and head retention.
Taste is sour, sweet, salty. Yeasty. A hint of hops (not getting the ""massive dose"") Sour seems to overpower a bit, but combos well with the funkiness from the brett.

Palate is pretty aggressive on the sourness. Medium body. Pretty smooth.

A very complex, yet easy drinking ale. The gose series from Westbrook has been on point. Gozu, gose, and now this one. A really great beer. Wish I knew I could get it again.","Atlanta, Georgia, USA","Jamesthebrit"
2,"2014-05-22",2.2,"On tap at Ridgewood (Raleigh)

Pours a murky yellow. Aroma is mild, with hints that this is a sour. Then you taste it. SOUR. TART. SOURLY TART. 

Had to wash the sourness out of my mouth with a rich stout. 

---Rated via Beer Buddy for iPhone","","TimsRatings"
2,"2014-05-18",4.1,"UPDATED: JUN 25, 2014 Bottle from CBX. Hazy deep straw color with a fluffy white head. Aroma of tons of citrus hoppiness, sweaty, cheesy Brett funk, subdued mineral salinity and wheat grains. Gripping, puckering, salivating sourness with lemon and grapefruit juice, lemon rind, cheesy Brett funk and light wheat grains. Smooth body with just the right amount of carbonation. Very solid, massive version of the Westbrook Gose.","Florida, USA","rbrazell"
