"beer_id","date","rating","text","user_location","user_name"
3054,"2008-04-27",4.1,"UPDATED: APR 28, 2008 Poured from a 750 ml bottle.  Rich chocolate brown pour skinned with a bit of off white cream.  Brilliantly evocative aroma of toasted coconut, pineapple, brown sugar, powdered sugar, raisins, creme brulee; all sweetness, but all of a caramelized or seared quality.  Warm.  Bits of raisin, alcohol, plums, and cake batters.  In sight of the summit of barrel aging of any type, if not reaching it.  Little wink of tartness in the oak flavor here; beside the beautiful irish cream texture and balanced honey sweetness, a bit of pear and dried fig simmered in maple syrup lends a soft touch of outdoorsy, tangy fire-baked fruit character.  Brazen smokiness and reduced-jam sugariness, seeming just a bit young.  Cocoa dusted pineapple, apricot, chocolate liqueur; a bit of dry wine and spirit alcohol drying out in the mid palate.  Texture of honey and bitten with a bit of nutty bitterness; full, oily, completely decadent.  Long finish with lots of tropical fruit and sweet cinnamon bread and prickly warmth in a pulsating, thick decadence.  Youth seems to win out, altogether, but with even just a slight rub of age theres not a doubt as to the wonders this could achieve.  Thanks Andy!","Minneapolis, Minnesota, USA","Stine"
3054,"2008-04-20",4.1,"Thank you pepsican.  Dark mahogany pour, almost no head.  smells of brandy and feet.  Tastes of candy corn, brandy, some booze.  Nice","Seattle, Washington, USA","DicksMcGee"
3054,"2008-04-18",4.4,"Bottle. First I have to thank Linus_Stick for sharing this gem with me. WOW if every barley wine tasted like this I wouldnt drink anything else. Pours a rich dark brown with a huge thick tan head that really lasts. Aroma was amazing moss and peat mixed with oak and vanilla it was like a 25 year Macallan. Taste was fantastic, rich, and filled with oak, vanilla, and earth. Mouthfeel was thick but not sludgy, warm from the high alcohol level, and with just enough carbonation to remind you that you were drinking a beer instead of a single malt scotch. I could drink this all the time... if only it were available at shops here in PA.","Pittsburgh, Pennsylvania, USA","MrStitch"
3054,"2008-04-17",4.1,"Wow what a great sipping beer! I waited a long time to get a hold of this and it blew my expectations away! The aroma was absolutely perfect! Strong oak, vanilla and chocolate with a heavy alcohol note. Pour was also perfect. A cloudy deep dark brown/near black with a 4 finger tan head. Taste was out of this world. Strong vanilla and oak with an earthy peat backbone with a scotch alcohol burn in the aftertaste. The oak and the burnt caramel malt flavors come in and out and justify the burn. Outstanding!","Moon Twp, suburb of Pittsburgh, Pennsylvania, USA","LinusStick"
3054,"2008-04-14",4.5,"It is so nice to live in SD because of the number of great brewers.  Lost Abbey is right at the top and Angels Share is one of their best. 

Such a hard beer to find (even in SD) and worth every penny I paid.  

Hues of dark cherry red in appearance but not taste.

A proper hint of Brandy.  Perfect palate from start to finish. 

Bought at the Linkery in South Park.  Got the last bottle for $42 a pop.","USA","ccoalier"
3054,"2008-04-09",3.9,"Sampled courtesy mgumby10.  Dark brown in color, sparse tan head.  Decent amount of brandy, oak, fruity malts, alcohol on the nose.  Very rich.  Mostly smooth on the taste, despite a little alcohol burn, fruity finish.  The sweetness and barrel dont overpower, but they dont really combine into what I was expecting for the hype.","Florida, USA","JMFG"
3054,"2008-04-05",4.7,"UPDATED: OCT 1, 2011 Re-rate, draft @ Cheeky Monk in Denver. Comes nearly black, with an espresso-like head that is pink-tinged tan. Aroma is tremendous. It is the kind of aroma that begs of contemplation, and for which words can do no real justice. The predominant character is a caramelized chocolate graham cracker cookie crust cake bottom. It is a lot like the chocolate crumbly bottom of ice cream cake. The body is silky smooth, and unbelievably creamy for such a strong beer. In tandem with the flavors, the palate has a mascarpone quality. The alcohol thins and dries the palate. But there is also a natural acidity that accomplishes the same thing. And there are also late tannins on the scene, as if raw oak was used for conditioning. So the beer is never too sweet, in spite of being dessert-like. The cookie crumb flavors never become cloying in the least, and the Bing black cherry and raspberry flavors never become tart. It all comes together in a harmonious fruition. A mature, sophisticated nightcap that is fabulous to behold.

Bottle, Merritt Island Throwdown. Pours muddy brown. Intense fig, prune in nose. Yeasty and sweetish with prune as well as fresh plum, and apple. Slightly sour. Finishes clean. Silky palate with low carbonation. Rated this a 3.9","VANCOUVER, British Columbia, CANADA","Beershine"
3054,"2008-04-05",4.0,"Pours a dark dark brown with a small tan head. Aroma of caramel, dried fruit, sugar, alcohol. Nice flavor, but the alcohol is a little too much.   copyright grimreeser","Eden Prairie, Minnesota, USA","undsioux7"
3054,"2008-04-05",4.3,"Thanks a TON miketd!!! Thanks to turdferguson I got to try this side to side with its bourbon barrel aged self. Poured a beautiful dark ruby brown with a one finger creamy tan head. Less carbonated than its bourbon version. The aroma was sweet, dark fruits, molasses, light subtle oak, nice light brandy aroma. The flavor was sweet, dry alcohol, nice oak character, vanilla,  malty, caramel, raisin, oak tannin. The palate was warming and sweet with a nice oak background.","Chapel Hill, North Carolina, USA","emacgee"
3054,"2008-04-04",4.3,"The color was very dark brown/ruby.  The head was very thin, fizzy, and light beige.  The aroma was alcohol, dark fruit, and chocolate/caramel.  The flavor was alcohol, grape, tart, hoppy, spice, and dry.  The palate was thick-bodied.  The finish was warm.","Chapel Hill, North Carolina, USA","aubreya"
3054,"2008-04-04",4.0,"Pours a dark dark brown with a small tan head. Aroma of caramel, dried fruit, sugar, alcohol. Nice flavor, but the alcohol is a little too much. Have to let this sit for a while.","Minnesota, USA","grimreeser"
3054,"2008-04-04",4.5,"I really love this beer......great oatmeal cookie character and super strong and smooth......I am having a hard time figuring out which I like more the bourban or this one.....but this beer is almost perfection.....","portland, Oregon, USA","ironchefscott"
3054,"2008-04-03",4.2,"Courtesy of Dunk.  Pours a murky brown, with a small swirly light cream colored head.  Smells of vagrant apple brandy aromas, Belgian malts, oak, and caramel notes.  The flavor has a good bit of the apple brandy flavor that I got in the nose and a good dose of oak as well.  The alcohol was slightly noticeable and had some mild burn going down the throat.  Seemingly well balanced though for a barrel aged brew.  Full on flavor and well crafted.  Maybe didnt totally live up to my high expectations, but certainly didnt disappoint.","Jupiter, Florida, USA","mgumby10"
3054,"2008-04-02",4.4,"courtesy mgumby big thanks: pours a muddy and murky dirty brown with no head. aroma is fantastic with great oak, some of the brandy, rich caramels adn some candied fruits. flaovur is great some alcohol but mostly from the rich brandy flavour, very good caramel , a bitter finish that is fantastic. lived up to what i expected.","Merritt Island, Florida, USA","mcbackus"
3054,"2008-03-31",4.1,"Courtesy mbumby10....thanks Mike!  Pours a muddy dark chestnut brown with golden/burnt orange highlights at the edge.  A small, bubbly tan head leaves behind minimal spotty lacing.  A swirl of the glass yields thick, droopy legs.  The nose is deep, showing ultra-rich notes of caramel, toffee, chocolate, vanilla, and a variety of dark fruits and spices.  Brandy isnt distinctly detectable, the oaky component is quite nice.  Flavors follow along those same rich, chewy lines.  Caramel and vanilla are just huge here.  This one is definitely malt dominant, with spicy, earthy hops showing just a bit on the back end.  Feels quite substantial and smooth in the mouth.  This is a great beer, but the Bourbon Barrel version is even better.","Orlando, Florida, USA","Beerlando"
3054,"2008-03-31",4.2,"UPDATED: APR 4, 2009 Rating number 600! Vintage 2006! Thanks to mreush for this treat!   Dark brown with a thin  khaki head.  Excellent carbonation. Complex aroma oak, brandy, carmel, and molasses. Velvety mouth-feel Big and malty strong alcohol presence on the finish","raleigh, North Carolina, USA","ucusty"
3054,"2008-03-30",4.0,"UPDATED: JUN 4, 2008 Merritt Island Throwdown 08: Bottle, courtesy mgumby10. Pours a turd-water brown, with wet dripping lacing and virtually no head. Caramel aromas, brown sugar, molasses; chocolate and vanilla interplaying. Rich flavors, mostly caramel and brown sugar, with a vanilla cake-like richness that doesnt go unnoticed, and a unique maple syrup-like finish. Medium-bodied, and very sweet. Delicious.","Tampa, Florida, USA","gunhaver"
3054,"2008-03-30",4.8,"bottle from the linkery.  Garnet red with a tan fluffy head.  Chocolate, caramel, earthy herbal spice aroma.  Chocolate, molasses, raisin, vanilla, brandy and an oaky finish.","Berkeley, California, USA","badlizard"
3054,"2008-03-30",4.1,"Courtesy of Mgumby10. Pours a medium brown with no head. Aroma is mostly caramel. Tastes of caramel, nuts, dark fruit, and some molasses dominate this magnificent brew. Palate is sticky with a alcohol presence.","Raleigh, North Carolina, USA","elmatador00"
3054,"2008-03-30",3.8,"UPDATED: APR 5, 2008 Thanks Gumby, I still hate the sea gull.  Poured a cola brown.  Aroma is a melange of sweetness and richness.  Vanilla, oak, brown sugar, malt, malt and more malt.  The flavor is deep and rich, malt dominant, with the slightest hint of booziness.  Life is good.","Saint Cloud, Florida, USA","CheesedMan"
3054,"2008-03-28",4.4,"Thank you Tony owner of Oldsmar Taphouse for sharing this outstanding beer with me! - one of the best beers to ever cross me path. - ink black body with a whispy tan head. the aroma of oak,  coffee, vinallia, rum, molassas an figs... yeah... its about as un-forgetabol a beer as i have yet to encounter!","Tampa, Florida, USA","matta"
3054,"2008-03-23",4.5,"UPDATED: AUG 9, 2008 thanks to cmubeerman for this monster.  deep mahogany color bordering on opacity. minimal head. strong apple/pear rind aroma with plenty of alcohol. lots of wood, lots of honey. very sweet aroma. flavor is super alcoholic, possibly too much so.  sweet and fruity, a fantastic barleywine. a bit vinegary., lots of malt and dried fruit.  pretty full bodied and chewy. goes down easy.  a stellar beer with tremendous balance.... rerate: a lot less hot this time. ... every time i put this glass down i’m surprised again by how awesome it is.   uprating.","chicago, Illinois, USA","sersdf"
3054,"2008-03-23",4.4,"Deep burgundy brown pour with little to no head. Notes of brandy and wood in the nose on a sweet, toasted malt wave. Sweet malt flavor with touches of dark, dried fruit and a sharp alcohol bite. Smooth on the palate with a lingering sweetness. Wonderful.","Cullman, Alabama, USA","RichJ7"
3054,"2008-03-20",3.6,"Not really what I expected out of this.  Thanks to Dirty_Martini for this.  Shared w/imadeadguy and was not as impressed as him.  Smelled like wood and tasted really warm going down.  Very warming with an overpowering alcohol taste.  Got few hints of vanilla and dark fruit.  Will try again to re-rate it.","The-No, California, USA","TheRealBastard"
3054,"2008-03-18",4.3,"Thanks to TheRealBastard for sharing his 07. Pours deep black with small brown head. Aromas of caramel, rasins, and sugar. Wonderful  flavors of malt, caramel, oak, and fruits. Wow, awesome BW!","back in NJ!, New Jersey, USA","imadeadguy"
3054,"2008-03-14",4.1,"Dark black body with a small creamy light brown head. Huge rum soaked fruit, raisins, caramel and molassas. Sweet fruit flavor, light raisins, caramel. Medium full body with moderately low carbonation and a very smooth creamy sweet finish.","Baltimore, Maryland, USA","maniac"
3054,"2008-03-12",3.6,"750, corked and baled. Thanks, after4ever and IBrew2or3! Pours a hazy very dark brown with an off-white head. Boozy oak and sweet toffee aroma. Toffee, caramel and vanilla taste. Semi-sweet oak finish. Maybe it was because I was expecting to be blown away by this beer that I wasnt. Dont get me wrong, this is nice stuff. But earth-shattering? No.","Kirkland, Washington, USA","bitbucket"
3054,"2008-03-12",4.2,"2007 750ml bottle, thanks to after4ever!  Dark amber maroon pour.  Intense, yet amazing nose full of oak, vanilla, sweet malt, alcohol, and more.  Flavors are more of the same with a beautiful hoppy barleywine lying somewhere underneath.  Amazing brew.  Would love to try the Bourbon Aged version at some point!","Earth, Washington, USA","skoisirius"
3054,"2008-03-12",4.1,"High expectations always precede the Port brewers, and Angels Share was perhaps at the highest level. The pour is a great surprise, almost stoutish in hue, its black depth is set ablaze by maroon contours and a creamy dark foam that recedes rapidly. The nose shows an obvious maturity, a complex amalgam minutely arranged. Darkness imbues the essence of this brew, from the dried figs, prunes, raisins and cranberries to the deep caramel and molasses. Oak and its vanillin are notable influences of the barrel aging, as are the hints of whiskey. Dusty cocoa powder is apparent, added to cherry, hazelnut and grape bubblegum. Unfortunately whiskey becomes almost obtrusive on the palate, particularly as it melds with an alcoholic heat present throughout the experience. The sweet, somewhat sticky mouthfeel reminds of toffee, cubeb pepper, anise and mint. It is a powerful brew yet the complexity is delicate and the texture surprisingly creamy and soft. A rich Carambar-like caramel flavor lends a strong malt backbone supplemented by Nutella and highlighted by tonalities of plum, vanilla, licorice and even banana. The Angels Share is a vigorous effort that nonetheless retains thoughtfulness and balance. The long complex aftertaste is a testament to the impressive technique of the brewers, but when all is said and done, I wish the barrel aging had not been so overpowering as I always like to see a beer speak for itself. (31/03/2007)","Los Angeles, California, USA","kepano"
3054,"2008-03-10",4.1,"750, corked and baled. Thanks, IBrew2or3! Dark brown, grainy, almost black. Very thin tan head. Big fruity, caramelly, blackberry nose. Rich, creamy, high-side-of-medium body. Rich raisins, blackberries, caramel, and a dark roast on the mid-palate. Big tart lovely orangey finish.","Mukilteo, Washington, USA","after4ever"
3054,"2008-03-10",4.1,"Dark brown, golden at the edge,lots of caramel, a touch of chocolate, some fig, vanilla, some alcoholic warmth, very smooth, rich texture, lingering, fruity finish.  By far the most enjoyment I have ever gotten from a barley wine, a style that is not usually among my favorites.","San Diego, California, USA","IEBAILI"
3054,"2008-03-08",4.4,"2007 bottle.  Franksnbeans hooked me up with this bottle, and the chat room offered the excuse to open it.  This is a dark beer in the snifter, with reddish brown hues only coming through at the bottom of the glass.  The beige bubbles could only manage a galaxy shaped whisp and a ring.  This is one of those beers that you could smell for hours.  Dark fruit, raisen, oak, vanilla, alcohol, and caramel.  The alcohol sneaks up on you like a velvet hammer.  The flavor is a wonderful combination of the toffee, caramel, and chocolate marshmellow sweetness.  This is a classic combination of the wood and alcohol with a first rate barley wine.  Vanilla, oak, dark fruits, toffee and burnt caramel sweetness.   This beer kicked my ass, Ill admit.  One bottle is not necessarily a single serving.","St. Marys, Ohio, USA","jsquire"
3054,"2008-03-06",4.0,"2006 bottle - Very dark brown body with a not to big a bit to fast disappearing light brown head; Not to big but very balanced nose, a little to sharp from the barrels, but great deep fruity notes behind; Super smooth body balanced sugary, even though the barrels sharpness is very balanced it gives it a little to sharp thin bite; Long finish that again becomes thin from the barrels sharpness that somehow overpowers the sugary sweetness, near no bitterness in this beer.  Somehow the sharpness from the barrels, even though it is very balanced in this beer, hides to many of the ""normal"" BW qualities.","Aarhus, DENMARK","henrikb"
3054,"2008-03-04",5.0,"Pours a dark brown with a medium sized tan head.  Malty aroma that is dominated by whiskey, oak and vanilla.  I continued to smell this beer for several minutes before even taking a sip.  Flavor is domintaed by whiskey, oak and vanilla, with hints of roasted malts, chocolate, caramel, dark fruit and spice.  This amazingly complex beer is the greatest beverage Ive ever had.","philadelphia, Pennsylvania, USA","corby112"
3054,"2008-02-29",4.4,"UPDATED: MAR 4, 2009 07 bottle thanks to dirty martini, thanks a bunch Larry.  Poured a murky brown color with a moderate tan head that slowly diminished.  Aroma of light brandy, sweet caramel malts, and fruit.  Flavor consists of light brandy upon entry that leads into a sweet caramel malt flavor with undertones of fruit (apple, pear, and light citrus) with a great drying oak finish with hints of vanilla.  Smooth and pretty creamy on the palate, awesome finish.  Glad I finally decided to open it up, it was an awesome beer.  Thanks again Larry.","Aurora, Colorado, USA","BlackForestCO"
3054,"2008-02-29",4.2,"Bottle courtesy of Rudolf. Shared with Hopson, Molias & others. Pours a deep brown. Aromas of booze, oak, vanilla, caramel sweetness. Nice full mouthfeel. Two years ago I would not have liked. Change is GOOD. Whisky-bourbon oakiness. Slight smoke. Nice rich barleywine taste. Extremely delicious","Buffalo, New York, USA","swoopjones"
3054,"2008-02-28",4.2,"Courtesy of Swoop Jones, sampled at Coles in Buffalo- big time boozy molasses aroma. smelling the whisky as well. First sample revealed some major licorice, ginger, and even coconut flavors. The whisky was in there as well. As this thing warmed, it got better and better. A great sipper by a fire and with a cigar. Nicely done.","Williamsville, New York, USA","hopson"
3054,"2008-02-25",4.1,"Big thanks to Secret Santa for this one.  Almost black in appearance, very little head that dies fast, there is some slight reddish light that barely passes through.  Rich raisin and molasses aroma, lots of dark fruit.  Flavor is very similar, but with a bit of wood and vanilla note as well.  Excellent integration of flavors, bourbon in no way leaping out from this.  Good.","Glen Allen, Virginia, USA","Kinz"
3054,"2008-02-20",4.4,"Fabulously complex dessert beer. Lost Abbey is certainly at the top of US brewers for interesting, impeccably balanced, beers that are both original and deeply inspired by other classics.","Cherry Hill, New Jersey, USA","Jayb0"
3054,"2008-02-18",4.6,"Bottle from ebay purchase, sampled with Dennis Bell. Pour was a velvety/hazy brown with a thin beige head. Aroma was captivating, a fig, raison, bourbon/alcohol swirl with a mild hint of chocolate. The taste ""wow what a punch"" Bourbon was the first thing that stood out followed by fruit and chocolate. The finish was a burn that was quite incredible. WARNING ""YOUR STOMACH WILL BE FULL AFTER THIS"".

A+ WORK","Levittown, Pennsylvania, USA","MadIndian"
3054,"2008-02-15",3.4,"Very dark brown in colour, thin off-white coloured head, very light lacing.  The aroma was very hot and alcoholic, dark fruits, caramel, oak, caramel, wood, whiskey, lightly sweet.  The flavour is very alcoholic, lots of caramel sweetness, vanilla and lots of bourbon.  Bitter mouthfeel, medium body, medium carbonation.  Finishes very hot, lingering.  Becomes way too much, the alcohol in this is a major distraction.  Quite a bit of bourbon in this, I cant imagine the Bourbon Barrel version.
750ml bottle shared by <a
href=http://www.ratebeer.com/ViewUser.asp?U target=blank>rudolf, thanks Rudy.
Opened on December 1, 2007.
Vintage 2007.","Peterborough, Ontario, CANADA","radiomgb"
3054,"2008-02-13",4.5,"Wow, the nose on this thing. Promises a lot, then keeps it. Pours dark brown with diminishing tan head. Sweet, vinous aroma... dark fruits and rum. Yum. Flavor is sweet and raisiny, but theres also a quick, restrained bitterness. Warming, warming. Reminds me a lot of an excellent Trappist quad with oaky-tannin elements. Awesome. Great experience.","Berlin, GERMANY","JoeinDahlem"
3054,"2008-02-09",4.3,"UPDATED: FEB 20, 2008 From a 750ml bottle.  Pours deep plum with a medium head.  After a highly-anticipated first sip, I was struck by a deep booziness and an elegant undertone of grape must.  Really creamy and refined.  Vanilla, oak, and dark fruits.  More like Avery Mephistopheles (the first, really good batch) or Worldwide Stout than a barleywine.  Carbonation died heavily near the end of the bottle.  Elegant and highly alcoholic.","Philadelphia, Pennsylvania, USA","JAXSON"
3054,"2008-02-08",4.8,"Bottle at Monks café (also have a bottle from miketd  thanks man, I really had no idea I would get to try one here in Philly  now I have one to lay down for a bit!)  Dark plum colored pour with a light off-white head.  Wonderful aroma of brandy, vanilla, bourbon, apples, wood, plum, and various sugars.  Flavor is a fantastic blend of brandy barrel and dark fruit goodness.  Fresh apples and plums, maple syrup, vanilla, and woody-brandy flavors abound.  Great mouthfeel  thick, sticky, and rich.  Saying its the best barleywine just doesnt do it justice.  This truly is one of the best beers in the world.","Bucks County, Pennsylvania, USA","JB175"
3054,"2008-02-05",4.2,"2007 bottle shared by kp at the footsex gathering.  The big dogs keep on coming and I couldnt say no. I didnt take too many notes on this one either.  Just something like ""sweet, dark, tasty.""  Wow, thats descriptive.  I will make sure to go back and re-rate this when I receive another bottle through the patron sinner program.  Till then, Ill have this record of this amazing experience sharing some of the most coveted beers on the site.  Thanks a bunch, kp!","Durham, North Carolina, USA","TURDFERGUSON"
3054,"2008-02-04",4.4,"Aroma at first was strictly oak,heavy caramel, molasses, and toffee, thought it was a little tepid at first,was going to put this in the 7 range, but after even more warming, the rich bourbon started coming out,and this became a treasure to inhale, taste was a rich buttery caramel, you could almost chew it, teasing soft bourbon and vanilla, absolutely no fruit ester,odd for a barleywine,fantastic smoothness. You have to have a little patience with this one, it dosent want to yield it s charms immediately, but bear with it and youll be rewarded. Thanks Overlord","Muskego, Wisconsin, USA","brewblackhole"
3054,"2008-02-03",4.2,"Barleywines are not my favorite style but this had a big hype so i had to try,this was a very interesting beer with lots of malts and a strong vanilla presence,also very sweet and i think with age this will be a great beer.CHEERS!","Kissimmee, Florida, USA","railcat1"
3054,"2008-02-01",4.0,"Pours a dark brown, with almost no head and spotty  lacing. Aromas of oak, roasted malts, caramel, some dark esters, and very light vanilla. A slight alcohol smell also comes through. Flavors of roasted malts, caramel, light molasses, and hints of vanilla. A little bitter, but over all sweet and smooth. Feeling of alcohol warmness on the way down.","Mescal Lakes (wherever that is), Arizona, USA","DoubleBubble"
3054,"2008-02-01",4.2,"UPDATED: JUN 28, 2008 Pours a dark brown with a minimal head.  No lacing.  Aroma gives away a high ETOH punch.  Aroma also sweet with vanilla notes.  Taste is warming but a little too sweet for me.  Definitely warms you down to your toes","Morganfield, Kentucky, USA","Acknud"
3054,"2008-01-31",4.2,"Thanks to Mike for this one.  Dark brown body.  Aroma is sweet, kind of sticky, with elements of vanilla, whiskey, and coconut.  Flavor is expectedly sweet, vanilla, chocolate, caramel, and whiskey characters emerge.  Very thankful to try this, it is exquisite.","Lexington Park, Maryland, USA","wickedpete"
3054,"2008-01-30",4.0,"UPDATED: DEC 20, 2008 11/10/07 release. Doesnt quite live up to my expectations but really only in the mouthfeel, too thin. Pours a deep dark murky brown with a thin, maybe 1/2"" inch brown head. Head fades pretty quickly to just a ring around the glass. Very little to no lace. Really, all I get in the nose is wood and whiskey. Tastes of dark fruits and bourbon. Woody of course, whiskey-ey of course. I am tasting dark, fermented fruits. Plums and alcohol. The palate is what really let me down. Too thin, I want some body to a barrel aged beer, especially one with 11%abv. Carbonation is good though. The bourbon is very prevalent right now, but not overwhelming. This beer is very drinkable.","San Diego, California, USA","doubleo"
3054,"2008-01-30",3.7,"Bottle, thanks for sharing golubj. Pretty decent BW overall. Not too complex but some nice fruit flavors. Light carbonation brings some alcohol and barrel aging flavors through. A bit sticky as it warms, pretty good.","Kingston, New York, USA","yobdoog"
3054,"2008-01-28",4.3,"Bottle.  Murky brown pour with a reddish hint.  Aroma is oak, vanilla, sweet alcohol, some roasted malt, and nuttiness.  Flavor is rich malt, vanilla, light bourbon, and some slightly roasted malt also.  Balanced and flavorful.","San Mateo, California, USA","golubj"
