"beer_id","date","rating","text","user_location","user_name"
3054,"2009-12-07",4.2,"Pours deep brown with a thin head and no lace.  Alcohol is heavy in the aroma along with chocolate and raisin.  The taste is bourbon, brandy, raisin, chocolate, vanilla with an intense warming ability.  Yum.","Portland, Oregon, USA","gracefullypunk"
3054,"2009-12-06",2.7,"2008 version. Pours a  very thick mud-like brown with no head. Smells of brandy, vanilla, coffee, and wood. Tastes is quite thick, almost shake thick, and you get flavors of some fruits, wood, and a big blast of booze. No carbonation whatsoever. Definitely not worth the $30.00 price tag.","Elmwood Park, Illinois, USA","guerinfbfan"
3054,"2009-12-04",4.5,"UPDATED: AUG 20, 2010 Edition 2008. Dark brown colored brew. Aroma and flavor is sour. Maybe infected, molenbrouwer (thnx!) was thinking of an infection maybe. Must re-rate it. And have older versions!

20th of august 2010:
Thnx Daknole for this beauty!!
Black colored brew. Very nice aroma! It has sweetness, vanilla, caramel, dried fruits. Beautifull. Flavor has vanilla, caramel, sweetness, prumes, dried fruits and oak. Oaky, whiskey, alcohol is in the aftertaste, very subtle and very warming. Good, very good. Its complex and extremely well balanced. Beautiful, just beautiful!","Zeist, NETHERLANDS","NoiZe"
3054,"2009-11-26",4.3,"2009 Bottle from jessup plaza. Poured a murkey brown color with no carbonation at all. Aromas jump from the glass and bottle with tons of earthy oak aromas as well as dark fruit, alcohol, spices, vanilla. Taste is huge amounts of oak and dark fruit, raisons, dates, alcohol. Mouthfeel is silky smooth but this one warms as it goes down. Great flavors all around on this one. The lack of carbonation did not hurt this at all. Great!! Might have to lay one down for a couple years as well cause this one is still young.","Scranton, Pennsylvania, USA","grandet"
3054,"2009-11-22",3.7,"2008 375ml thanks to Odeed.

Pours a cloudy brown with no visible carbonation.  CARAMEL, raisin booze, cherry, soy sauce, maybe some vanilla aromas show up. Flavor is sweet, malty, and somewhat salty, finishes with malt flavor that reminds me of the color red.  Mouthfeel is thick and syrupy with an inkling of carbonation.  Overall its very good, but hasnt blown me away.","Ohio, USA","TearsforBeers"
3054,"2009-11-21",4.0,"On tap, 12.5% ABV.  Pours a deep, dark brown with a very slight tan head.  Appealing aroma of raisin and vanilla.  The flavor is a pleasant mix of oak, vanilla, raisin, and dark malt.  Really enjoyable, but not substantially better than a number of other high quality barley wines.","Seattle, Washington, USA","crackedmachine"
3054,"2009-11-20",4.4,"On tap in my brothers kitchen.
Pours a perfect dark hue and refreshingly smooth considering the alcohol content.
Minimal head, but who cares, especially after drinking a few.  Nose is just enough without being overpowering.  Goes down with a bourbon, wood flavor, with a slight burn for a finish.  I feel my whole body warm instantly after it touches my lips.","Shoreline, Washington, USA","hbmason"
3054,"2009-11-15",4.4,"27th June 2008. Sumptuous almost creamy dark ale. Lots of lovely brandy fumes and flavours. Woody and vanilla tones. Rich, different and incredibly drinkable.",", Essex, ENGLAND","madmitch76"
3054,"2009-11-13",3.2,"Vintage 2008. Very dark brown with no head and very low carbonation.Aroma of figs, raisins, cherries, almonds and cognac. Very sweet and full-bodied. Flavour is apples, vanilla, figs, sugary and a bit muddy. Not that impressing. I dont think its bad, but a bit... out of balance.","Aalborg, DENMARK","beeranarchist"
3054,"2009-11-10",3.5,"well I finally got around to opening my bottle of 2008 angels share. cork comes off without any force and it pours flat with a dark nutty brown color. nice rich nose of oak, vanilla, brandy, and dark rich fruit. the mouth feel was a bit hard to take becoming thick and port like due to the stillness. flavor had plenty of barrel wood roast, brandy, vanilla, raisin, and plumbs. the flavors are all there but the consistency is just too much for me to overcome with this one.","Connecticut, USA","blklab2007"
3054,"2009-11-09",4.2,"2007 vintage, an official bad day at work beer.  Bottle pours, a murky mahogany with a medium tan head.  Very evil looking.  Strong and complex aroma of red wine, oak, vanilla, brandy, and green raisins.  Wow, nice red grape, raisin, spiced apple, and brandy finish with vanilla and oak notes that are very dry on the tongue like a good red wine.  Very nice and suprising.  This is like a glass of brandy, a glass of red wine, and a sweet british barley wine all in one.  I love it.","Tucson, Arizona, USA","fata2683"
3054,"2009-11-09",3.8,"FoBAB 2009. This one was on tap  so therefor it had carbonation. And at a tasting this did not cost me $30 to try. The pour is dark, had some head from the carbonation. Aroma of dark fruits, plums and figs. Taste is similar with a alcohol presence. A bit on the heavy side.","Chicago, Illinois, USA","hombrepalo"
3054,"2009-11-08",4.2,"UPDATED: NOV 16, 2010 Sweet, irony mineral flavors lead into complex mocha bean, sour black fruit, plum, raisin and dark chocolate notes. Very complex, creamy and delicious. Sour hints linger, adding complexity and great balance.","Chicago, Illinois, USA","fraternie"
3054,"2009-11-07",3.5,"Brownish black, and almost headless.  Aroma is spicy and vinous with soy sauce umami notes.   That umami is present in taste, but merely a background element to the rich, figgy oxidized tastes that dominate to the point of being hard to drink. Finishes with lingering toffee and coffee flavors not otherwise present.  Yet another oxidation bomb that brings me back to SA Triplebock 8$/10 oz","portland, Oregon, USA","Arayaga2"
3054,"2009-11-04",2.4,"Reviewed 8/10/2009 (Bottle 2008):

Pours a very dark reddish colored body. Small off-white head, diminishing. Smells like whiskey, brandy. Smooth fruity aroma. A little funky smelling. Muted aroma, not very strong. Slick taste, dark fruit aftertaste. Some roasted flavors, doesnt taste like beer at all. Funky taste, slick like whiskey. Not sure how to rate this, doesnt taste like any beer Ive had before. Better as it warms, some chocolate taste comes out. Dark fruit like fig.","Houston, Texas, USA","jujubeast6000"
3054,"2009-11-03",3.5,"Bottle was flat, never carbonated.  Was yeast in the bottle.  Not bad though.  Wouldnt say it was outstanding, but something I could enjoy.  Lots of sugars in the aroma, caramel, toffee, white chocolate.  Similar flavor","East Setauket, New York, USA","zapprentice"
3054,"2009-11-02",4.2,"10 oz. draft at Tria.  Pours a deep dark brown, with slightest hints of ruby.  No head at all.  Nose is filled with brandy (booze, apple, cherry and currants), molasses/caramel, and hints of wood.  Incredibily sweet on the tongue with only the slightest hint of a bitter coffee finish.  Full mouthfeel.  Drinks like a fine cognac or brandy and I see no reason for any carbonation.","Chicago, Illinois, USA","cprochak"
3054,"2009-11-02",4.3,"Draft: Pours a dark redish-brown (so dark that is almost black) with no head, aroma of booze, vanilla, oak, dark fruit, taste is heavy on the brandy, dark fruit, vanilla and oak, fairly full mouthfeel and a nice warming finish.  I now see why this is so highly rated.","New York, New York, USA","bp"
3054,"2009-11-02",4.7,"2008 bottle from De Bierkoning. Dark brown with a small beige froth. Rich chocolate and vanilla aroma, deep fruity vintage port and noticeable alcohol. Mellow vanilla oakiness and rich chocolate flavours with fruit and hints of wood. Oily, full body, soft as velvet. Worth every penny and gives the best vintage port a run for the money.","Oslo, NORWAY","thebeertourist"
3054,"2009-11-01",4.0,"Not much head at all,carbonation not strong but okay,aroma alcohol whiskey(bourbon)dark fruit,malt caramel brown sugar sultana,plum,cognac note,flavour raisin,bourbon,velvet like,caramel like,cognac taste,smooth bitter,prunes,good strong flavours not quite strong enough to block the 12% alcohol but close,finish smooth almost velvet like tastes nice bitter to go and a fizz on the palate.","brisbane, AUSTRALIA","gam"
3054,"2009-11-01",3.9,"bottle, vintage 2008, mit Riesendankeschön an Allen! Deep brown colour, almost black, no head at all. Aroma of caramel, roasetd malts, smoke, dried fruit, prunes.... Very full-bodied, very complex flavours of caramel, chocolate, smoke, dfied beries, prunes, plums, dates... Lingering finish. Very malty with a sweet character, balanced off by the alcohol. Very interesting, fascinating and hard to describe.","Down South, GERMANY","Quack-Duck"
3054,"2009-11-01",3.2,"2008 small bottle version.

Pours ugly black.
Soy, dried fruits and slightly sour. 
Smooth and still.
This beer is more odd than interesting.","Stockholm, SWEDEN","finol"
3054,"2009-10-31",3.4,"Bottle, 2008 375 mL. Aroma of very sweet fruits, caramel, toffee, vanilla. Flavor the same, quite sweet, though noticeably brandy-sweet as opposed to typical barley wine malt-sugar-alcohol sweet. No carbonation, but honestly that didnt bother me in the slightest, and having had this now, I really have no idea why it bothered everybody else so much. All that bothered me was that it seemed like a boring, predictable beer.","Pittsburgh, Pennsylvania, USA","fredandboboflo"
3054,"2009-10-31",3.6,"Live rate from the map room, on draft.  Pours a very very dark brown, glassy, doesnt look as viscous as I remember, small light tan fizzy froth.  Aroma is surprisingly full of oxidation notes, raisins, almost a touch grassy and doughy sweet like a German dunkler bock, dark fruit, smells bitter.  Flavor is like a burnt tootsie roll, surprisngly dark, sharply rich and aggressively boozy, actually ridiculously harsh and im usually not one to complain about a bourbon/brandy burn, flavor lacks any depth whatsoever and yet is seemingly completely oxidized, the brandy is sort of just there, long alcohol, dark malt and raisin aftertaste, also surprisngly bitter.  Medium/full bodied, sharp fizzy carbonation that doesnt seem to belong, odd consistency, like a powdered mixed drink.   


Ive now had this (and the bourbon) about 4 or 5 times, and now Im sure that it isnt worth it.","Chicago, Illinois, USA","17thfloor"
3054,"2009-10-30",3.3,"Bottle. Vintage 2008. Big dissapointment. Lots of things going on, in fact too many... soy, alcohol, liquor chocolates, dried fruits etc. Very vinous! But this beer is just too much of everything without being very complex or tasty.","Stockholm, SWEDEN","hirigalzkar"
3054,"2009-10-29",4.3,"Vintage 2008. Bottle from Bierkoning. Dark brown with tan slight head. Sweet, malty whiskey nose. Rich taste of sweet molasses, toffee and caramel. Prickly mouthfeel. Delectable sweet finish.","Chevy Chase, Maryland, USA","altonbrownd"
3054,"2009-10-28",3.8,"on tap at the Roadhouse. A beer so dark that it saps the light out of the room. Absolutely still with no head. Smell was a strong rich bread with a caramel element as well. Alcohol was in both nose and taste but was used well as an accent in such a strong beer. Taste was slightly sweet and does have a port element. The fact that I was able to finish this fairly quickly despite her strength attest to how well crafted it is.",", Massachusetts, USA","TheGent"
3054,"2009-10-26",4.6,"Bottled 375ml. Vintage 2008. Aroma: Vinous with tarragon, vanilla, tobacco, raspberries, mocha, caramel, lavender, oak, cognac and rosemary showing up. Milk chocolate sneaking in. The caramel, oak and mocha components are most prominent. Appearance: It pours a beautiful, deep ruby brown beer with a very small bubbly head which dissipates rather quickly. Flavor and palate: Full bodied. Caramel, mocha, tarragon, oak and lavender appearing. Sweet. Practically no carbonation. Vinous. Smooth. White grapes showing up. Very low bitterness. Sweet complex finish which is reminiscent of lavender, mocha, mint, liquorice allsorts and caramel. Overall impression: Excellent. I love the first layer of mocha and caramel characteristics combined with the vinous second layer of oak, white grapes and the third layer of lavender and rosemary. Mindblowingly good. One of best beers I have had so far. Sharing it with a friend :-)","SWITZERLAND","Embrouille"
3054,"2009-10-25",4.4,"Dark brown pour, little head. Huge, inviting aroma! Dark brown sugar, chocolate, caramel, vanilla on the nose. Similar sugary taste with a tremendous amount of vanilla coming through. Alcohol is there but not as obvious as youd think a 12% barley wine would be. Palate made for some very easy drinking. Simply awesome!","Havertown, Pennsylvania, USA","jmm635"
3054,"2009-10-24",2.8,"2008 bottle.  Absolutely no pop at all upon uncorking.  Pours a flat dark brown with absolutely no head nor any carbonation.  Lots of floating yeast particles.  Aroma of booze, raisin, and lots of malt.  Flavor is also boozy (although I dont get liquor specifically) with lots of sweet malt, prunes, raisin.  Cloying and sweet.  Not very complex nor tasty to me.
5/3/5/3/12 [2.8/5]","Pittsburgh, Pennsylvania, USA","LilBeerDoctor"
3054,"2009-10-24",4.4,"750 ml bottle shared by Eyedrinkale.  Pours a deep ruby brown, just about black, with a light brown head.  Very pleasant aroma of caramel, vanilla, malt, prunes and oak.  The flavor is more intense than the aroma with caramel, vanilla, honey, malt, prunes and oak.  Lovely smooth buttery texture not unlike a rich chardonnay.  Well hidden alcohol.  Properly carbonated.  Just an excellent beer.","Laurel, New York, USA","beerbill"
3054,"2009-10-18",4.0,"Dark Brown, Burgundy pour.  No head or fizz.  Aroma is a staggering amount of sweet musty malt with dark burnt sugar, vanilla, port-like hazelnut sweetness, Cocoa powder and tobacco.  Totally flat, unappealing mouthfeel - thin and oily.  Flavor is sweet hazelnut, chocolate, sweet oak and vanilla with some booze at the finish.  Dark raisin date fruit.  The flavor comes through despite the horrific mouthfeel.  Id love a good bottle of this, even flat its good","Chester, Vermont, USA","Jblauvs"
3054,"2009-10-18",3.9,"750ml -- 2009.
fairly dark brown -- but thin around the edges and zero(!) head.
aroma is ridiculous -- tons of raisins, vanilla, prunes, oak, wine, and strong alcohol. also a bit of Manischewitz, but in a good (?) way.
flavor has the same dark fruits but without the slightly cloying sweetness. theres tons of chocolate and its like a vanilla coffee.
body is flat and oily, a bit thin even and just not up to the flavor.
this was great overall, but completely flat -- otherwise would have been near-perfect.","New York, USA","kopher"
3054,"2009-10-13",4.7,"375mil bottle.  Enjoyed at home on the first rainy day of the autumn of 2009.  Pours a beautiful ebony with a sustainable light tan head.  Incredible depth in the aroma.  Chocolate with a mild vanilla.  Hints of roast blended with a kind spice and sweetness.  The flavor lingers long the with oak and caramel notes.  Very deep barley wine yet is not cloying with sweet like many.  Finishes moderately dry which just makes the beer more inviting and palatable.  This is one amazing beer.  I may even drive 8 hours down to San Diego to get some more.","Sonoma, California, USA","bumpskier"
3054,"2009-10-12",4.6,"UPDATED: JAN 7, 2015 Bottle split with Pat. This session of Lost Abbeys totally blew my mind, and it ended with an epic Barley Wine - unlike anything I have ever tasted within the style. It pours a dark, dark ice tea body with lots of sediment. The aroma is way more chocolatey than I have ever experienced in a Barley Wine, also notes of raisin, malt, vanilla and honey. The flavor is incredibly smooth, and the alcohol is completely hidden. The mouthfeel is excellent with notes of honey, roast, chocolate, and vanilla in the taste.","New York, New York, USA","jredmond"
3054,"2009-10-12",4.7,"UPDATED: OCT 13, 2009 Bottle. (2008) 25.4 oz. Split this baby with James. Pours deep, brown/amber with absolutely no head and no lacing..Aroma is absolutely insane; chocolate, raisins, roated malt, walnut, barley, and hints of vanilla, honey, and coffee. Body is completely unique. Not quite, full, more of a robust, bold, warm moutfeel. Finish is insanely long and beautiful. Hands down, one of the best brews I have ever tasted in my entire life. EPIC.","Philadelphia, Pennsylvania, USA","patrickfannon"
3054,"2009-10-07",4.1,"Bottled. Vintage 2008. Dark brown reddish colour. Almost no head, but what I can see is quite fluffy and light brown. Aroma of spice, caramel, berries, light sourness, oak, Flavour is a bit citric, full of berries, spice, has a tad of fruits and a light touch of caramel. Meidum to full bodied. Dry spicy and fruity end. Has a alcohol touch on lips and palate. Very very nice in my book. A bit flat, but still great beer.","Søborg, DENMARK","madsberg"
3054,"2009-09-29",4.0,"Pours dark ruby brown with no head. Notes of raisin, plum, toffee, salty red wine, leather, and earthy malt. Heavy bodied with very soft carbonation. Absolutely delicious, but I would have enjoyed some carbonation.","Louisville, Kentucky, USA","TheBeerOrg"
3054,"2009-09-28",4.4,"UPDATED: JAN 21, 2011 2010 Brandy Barrel on tap at The Brick Store Pub for the Lost Abbey launch in GA.  black pour with a 1/4"" tan head.  burnt nose with layers of oak, molasses, toffee and raisins.  medium to thick body with caramel, big sweet dark fruits, molasses, brandy, oak, and apples.  sweet finish with some heat - more oak, sweet fruits and a light tartness.  wonderful complex beer!  Happy to see Lost Abbey / Port in GA now.

2009 Brandy Barrel Finish draft sample at The Denver Rare Beer Tasting event during GABF week on 9/25/09.  pours a deep reddish / dark brown color with no head... deep vanilla, oak and sweet caramel aromas... the nose is a bit hot, but so smooth... somewhat thin body, but really holds up throughout... a touch of sour apple towards the finish along with big strong malts and a smack of alcohol... really dynamic powerful finish that leaves you wanting more.  Overall an excellent Barley Wine that should be tried by all at least once.... I can understand the price tag given the labor and cost that is involved, but its still very high and really pushes the envelope of what I can afford...","Fort Collins, Colorado, USA","craftbeerdesign"
3054,"2009-09-24",4.0,"2008 bottle. Poured with little or no carbonation and coppertone color. Tasted of alcohol, and can definitely taste the brandy and barrels. Definitely  a great beer to enjoy with a cigar.  Too bad cant get it any here in Dallas.","Texas, USA","LONESTAR"
3054,"2009-09-15",4.0,"750ml bottle, 2008 vintage shared at Immys Backyard Throwdown. Pours cloudy copper in color with no head at all and no carbonation. Aroma  sweet, toffee and spicy. Taste caramal, alcohol and spicy with bitter finish.","Norfolk, Virginia, USA","LooseCannon"
3054,"2009-09-14",3.9,"2008 Bottle. Pours super dark- Black. No carbonation at all, weird and thin. Smell is interesting- caramel, vanilla alcohol, cocoa and coffee. Tastes alcoholic, liqueur-y and sweet. Chocolate, caramel, sugar and fruits. Its light without being too watery, the palate is not bad. its a weird and scary drink. Good for a sip or too, but really strong.","Brooklyn, New York, USA","thewombat"
3054,"2009-09-11",3.3,"08 Vintage bottle Timfoolery scored from South Bay Drugs. This beer had no carbonation what so ever. The alcohol burn was very bad. Sweet beer tasting of carmel and dark fruits. Maybe next years vintage will be better.","Winters, California, USA","DTM"
3054,"2009-09-08",2.2,"08 bottle thanks to kegbear!Murky mahogany, and yes, absolutely no carbonation. Sweet but pleasant nose of brandy, vanilla, some alcohol. Flavor has some brandy, caramel, and alcohol burn. Palate is a total washout. When I read ""no carbonation,"" I didnt picture this. Absolutely nothing, strains the flavor out and makes it alcoholic. Absolute failure, and I was really hoping to like it. Cant imagine how anyone would rate this above a 3, even Tomme himself.","Baltimore, Maryland, USA","MrChopin"
3054,"2009-09-06",3.0,"UPDATED: NOV 8, 2009 The controversial 2008 version.  As promised, this beer pours flatter than any beer I have ever had.  Not even a trace of head forms after a fairly aggressive pour.  The liquid is brown with some red highlights.  Aroma is actually quite enticing, even surprisngly subdued compared to its bigger bourbon brother.  Caramel, Vanilla, tobacco come out.  Can the flavor survive the mouth?  Im dying to find out...The answer is yes and no.  The flavor, showing similar hints of the scent characteristics, is clearly good, quite great even.  It certainly is there, but it is not enough to overpower the water-like level of carbonation.  I like my big beers thick and nearly flat.  This isnt nearly flat, this is still.  This is an example of pushing that too far.  I have to give the palate a 1 for the fact that I can count on one hand where mouth made or broke a beer.  This is one such example, and LA should be ashamed for releasing it as it is.","Donora, Pennsylvania, USA","Sonicdescent"
3054,"2009-09-02",3.6,"Bottle. Deep brown pour with nice head. Sweet boozy aroma. Tastes of dark fruit, vanilla, toffee, sweet, strong. Also had this on draught at GBBF 2008. A typical American Belgian style clone. Nice beer but unimaginative really, perfectly drinkable though.","Northwood, Greater London, ENGLAND","evergreen0199"
3054,"2009-08-29",4.6,"2008 bottle from Malt & Vine. The aroma of this one fills the room, and makes me wonder, ""where have I smelled this before?"" And then it hits me, this smells almost exactly like 3 Floyds Dark Lord! Carbonation is almost nonexistent, but the beer does cartwheels on your tongue. Body is dark and sticky. Almost zero lacing, but leaves ""legs"" like a fine wine. Had me heading for the humidor for a well conditioned Cuban. Bravo Lost Abbey!","Austin, Texas, USA","ManvsCity"
3054,"2009-08-17",4.3,"No shocker as far as appearance goes, the barleywine division is pretty well established as a headless horseman of sorts, making you wonder where is the head of this dark beast, seconds later splitting your head in half with its weapon, melting through your tongue 1st and then splitting your corpus callosum.  Your head writhes with agony and yet adulation.  This nightrider comes at you with a very dark brown body that is totally opaque.  The head long disappeared likely in the wort many months ago.  Well the first taste is surprising I expected to be split in half, I am writing so let me tell you what I found.  The initial taste is a combination of pinot noir, roast, and scotch very softly melded together to form an amalgam of beer majesty.  The figs also shine, the dark fruits are tied to the roast with a licorice and vanilla accent.  This beer is flavor rich as your going to find.  Not for the novice, and yet open enough for a beginner with red wine or whiskey leanings could sample.  Initial aromas range from soft vanilla to dark anisette licorice in between lies a dark port wine intensity, a deep dark roasted malt, a well hidden bit of fig also lurks, as it warms burnt sugar emerges.  The feel is very complex, a nice richness that is velvety, alcoholic sting is vouchsafed by the intense flavors, but be sure its the real deal.  Your not going to not get laced, its spirits quickly consume at a heady 12.5%, and if you age it be even more prepared.  If your out somewhere that actually has this, be prepared to get a ride.  It is surprisingly smooth, I usually cringe when I hear barleywine.  This is warming and yet not too alcoholic or sweet to the taste.  This is really a splitter or for rebottling and used only as a complimentary beverage.  Its character and alcohol allow it to sit provided you have the means to recork  Nightcap as well, works here.","Jim Thorpe, Pennsylvania, USA","DandyWolfFloyd"
3054,"2009-08-17",3.3,"UPDATED: MAY 14, 2015 Bottle at RBESG 08 ... Deep red copper ... toffee malt nose ... Sweet and woody ... rich toffee and spirity ... brandy ... bit rushed :-) 4.0... GLAD its  gonna be on TAP at GBBF and ive got a bottle :-) 
Bottle at Fins ... Deep brown ... cheesy slight sour ... plum and cherry nose ...coconut bourbon ... meaty toffee ... quite rought ... just not great... Its not Sour Sour ... so dont know if this bottle one of those to have gone ... but its just not great at all ... very disapointing. 2.9 
Bottle at home ... from about 2009 ... deep brown .. thin tan lacing ... soft meaty toffee roast malt ... big meaty alcohol nose ... dark roast ... darm malts ... massive umami ... dark roast ... sweet chcoolate ., meaty dark roast ... 3.4","Edinburgh, SCOTLAND","cgarvieuk"
3054,"2009-08-16",3.7,"Luscious charred browned head with scrapes of oak barrel atop a deep scotch pool of beer. Intensely wood-aged aroma of brandy, oak, vanilla, and lactose off-sweetness. The nose is under assault. Almost sickening, yet entrancing as it changes, chameleon-like. Flavors of of intense candi and caramel sugar leave a flourish on the tongue.","Seattle, Washington, USA","BillKismet"
3054,"2009-08-15",3.7,"Stop being g.y. This is a great beer but.... Darker than a black steers tookas on a moonless prarier night their was no bottom. I hear its a little flat its totaly flat. Im glad I knew that going in. Aroma of fig date and paper. Drinks better nice finish with booz and sweet sassy mo lassy. Great beer but never again... By choice.","New York, USA","sleepylopes"
