"beer_id","date","rating","text","user_location","user_name"
3054,"2011-07-30",3.3,"38cl, Vintage 2009, at 11.5%Vol, as Angels Share (Brandy 09 imprinted on the bottle), exclusive American brew, from Den Bierzolder Heule, complex brew, sweet/alcoholic and slightly roasted, heavy, not balanced, hazy, nearly no head, nice brew, yet way too expensive!, needs to be revised","Gent, BELGIUM","BoBoChamp"
3054,"2011-07-28",4.5,"Bottle at unos in neshaminy.  Aroma is a sweet bourbon, red wine, dark fruits conglomerate.  A sweet taste of cherries, oak,  fruits,  bourbon is followed by a mild sour bite.  Toes the line between beer and wine.   Some brown sugar in there as well.  Mild alcohol burn is only a hint or the power underneath.","Philadelphia, Pennsylvania, USA","stangger"
3054,"2011-07-25",4.6,"(375 ml bottle). Pours black and viscous. Aroma of bourbon and vanilla with similar flavor. Soooo rich. This beer hides the alochol very well. Superb!","Scottsdale, Arizona, USA","dcschiller"
3054,"2011-07-22",4.5,"Maple cloudy color with some white yeasty specks floating around. No head to speak of. Aroma of pear, fig, vanilla and brandy. Taste like a smoky brandy with molasses, vanilla, dark fruits. You can hold this on your tongue and it produces new complexity the longer you let it sit. Then you are rewarded with the results of months of oak aging as you swallow.","California, USA","doublebock"
3054,"2011-07-22",3.7,"Im drinking the 2010.  Pours a hazy deep brown.  There is no head to speak of, but there is a lot of activity on the surface of the beer.  Aroma is sour sweet with dark fruit, brown sugar and citrus mixed together.  The flavor changes a lot very quickly in the mouth.  The beer starts relatively sweet, gets sour quickly, and then slowly works it way back to a smooth brown sugar and molasses finish.  I dont know that Ive had a beer that changes flavors so abruptly and aggressively.  If you are looking for a beer that has a unified bouquet this is not the beer for you.  If you are looking for a different and interesting beer with very strong flavors that will keep you guessing this is definitely worth a try.  I appreciate this beer for what it is, but Im not sure I would drink it on a regular basis.","Bozeman, Montana, USA","natejgood"
3054,"2011-07-17",1.1,"What happened?? 2009 purchased from Whole Foods in Napa, CA. I was very excited to try this beer, as Ive been a fan of other Lost Abbey brews. This was absolutely horrible. Im going to assume that I purchased a ""bad"" bottle somehow, I cannot imagine anyone brewing something like this, bottling it, and trying to sell it to the public! A sour, rotten, nasty mess of a flat beer. Im not going to rule this one out for future purchase...but I will make very sure that its fresh and properly stored before I spend any money.","Birmingham, Alabama, USA","b79turner"
3054,"2011-07-17",2.5,"En 2010 ABV från Systembolaget. Tyvärr var min som så många andras lite sur. Antagligen påverkad av bakterier under fatlagringen. Svårt att därför ge betyg på smaken.","Malmö, Sweden, SWEDEN","NordicV"
3054,"2011-07-17",3.8,"#1500. Bottle pours a murky muddy brown pour with no head. Scent is dark over ripe fruits, chocolate and some whiskey. Taste is sweet and sour.","Idaho, USA","beernovice39"
3054,"2011-07-15",3.7,"Bottle from Vinmonopolet (Vika), Oslo. Opaque, dark brown colour. Miniscule, beige head. Sweet, concentrated aroma of raisin, caramel, whisky, fermented fruit. Full-bodied, yet nicely drinkable. Carbonation is fairly flat, but theres also a tingly sensation on the tongue. Taste is initially very sweet, but gradually a herbal bitterness becomes dominant. Finishes with an alcohol burn and a herbal aftertaste, which I find a bit rough.","NORWAY","berlinoise2go"
3054,"2011-07-14",4.1,"Brandy barrel on tap .... Deep reddish brown pour thin off white head ... aroma of dark fruits/brandy and oaky with some vanilla even more so as it warmed .... taste is of brandy/dark fruits and oak, caramel malts and grainy as well as vanilla which came out more as it warmed ... bitter warming finish ... An awesome sipping barley wine","Penndel, Pennsylvania, USA","italianjohn"
3054,"2011-07-11",1.3,"Well there isnt much to say other than there is an obvious issue with this one. The aroma has elements of vinous fruits, malts and barrel but the taste is watery and acetic vinegar. Horrible. Infected barrel or something.","Grand Rapids, Michigan, USA","wnoble"
3054,"2011-07-10",1.1,"2010 vintage, 375ml.  Smelled fine, really malty with lush darker fruits and sweeter aromas.  Too bad the palate was horrible, unbalanced, cloying sweet mess of a beer.  Im going into this ignoring the flat abbey remarks, but this needed something, carbonation, whatever.  Sour finish.  So bad!","South Hadley, Massachusetts, USA","cakanator"
3054,"2011-07-09",3.7,"Bottle shared at Øl og matfestivalen.
All black without head.
Malty aroma with oak, dark fruits, coffee.
Spicy complex taste with chocolate, cinnamon, alcohol and coffee.
Good rich body","NORWAY","daje"
3054,"2011-07-04",4.0,"UPDATED: JAN 30, 2015 I was very excited about trying this beer. Id like my money back please. Tastes disgusting. Tastes like watered down poor quality brandy. Shouldnt really be classed as a beer. Pours completely flat, very dark brown. Smells of alcohol/brandy. Very strong brandy/alcohol taste. Tastes like bad medicine. Putrid stuff. Very disappointing. Interesting isnt always good.

Take 2. . Dark brown with tan head. Aroma is rich, wood, chocolate, tootsie roll. Taste of oak, chocolate brownies, malty, molasses. Quite flat,  bitter. A different beer.","Edinburgh, SCOTLAND","BenH"
3054,"2011-06-25",4.5,"Bottle, 375ml, at Haandverkerstuene, shared by OleR, thx a lot. An unclear, brown beer with a small, beige head. Looking quite good, and still its all upwards from there. Wunderbar aroma of plums, prunes and raisins, caramel sugaryness, alcohol, and some hints of choclate, cellar and medicine. Its full-bodied and appropriately low on carbonation, some might say flat, I say it suits the beer perfectly, and theres an alcohol warmth that adds to the perfection. A nice bitterness follows you from the first sip and until all the beer is gone, supported by caramel sweetness, dried fruits and a chocolate raisin touch. A fantastic beer indeed. 110211","Kristiansand, NORWAY","yngwie"
3054,"2011-06-24",4.0,"UPDATED: SEP 4, 2011 2010 bottle. 
Very dark reddish brown with a minimal tan ring around the glass that disappears quickly.
Aroma: chocolate, licorice, liqueur, some kind of candy.
Taste: vinous, licorice, chocolate, blackcurrants, wine gums, candy, tart/acidic, dry finish.
Almost still, quite full-bodied.
Big and warming, a sipper. Still though, I was hoping for more.","Göteborg, SWEDEN","LoFi"
3054,"2011-06-23",3.7,"[keg at BrewDog Edinburgh] Pours a nightmarish black with almost no head. Looks like a glass of creosote  hugely viscous and oily when swirled around. The aromas give you the impression you could paint a fence with it as well  massive alcohol and dark fruit on the nose, vanilla, some oaky wood maybe. On the taste, as it totally coats the palate theres a wallop of prunes, raisins and figs before the alcohol takes over. Next time I have a sore throat, this would be tremendous. As a drinking beer its maybe a touch heavy for my personal taste, but you cant deny its not fascinating [18062011]","Edinburgh, SCOTLAND","BeerCast_Rich"
3054,"2011-06-22",3.8,"From notes.  May 2010.  Sample thanks to armin. Pour is a clear, very dark brown, with no head, only a few bubble rising to the surface.  Aroma is dominated by dark fruits, primarily raisins, and is sweet to the point of being heavy, which really covers up some of the other more subtle tones.  Flavor though, is great.  Huge burnt brown sugar notes, lots of vanilla, light oaky undertones bringing it together, with the same dark fruits, though in the backseat.  Just a touch of carbonation on the tongue, but enough to lift it and keep it from being cloying.  Not a bad beer at all, but just a touch aroma heavy for me.","California, USA","LamarBurton"
3054,"2011-06-20",1.9,"2008 bottle pours a dark brown with no head. Caramel, vanilla, brandy, boozy smell. Flat, dry mouthfeel. Stale caramel, booze, vanilla, dark toffee flavors--","Same Trailer, Different Park, Louisiana, USA","AmEricanbrew"
3054,"2011-06-17",3.8,"2009 version 
head: none 
colour: dark red / brown
smell: red fruits, malts, banana, cheesy , yeasty 
taste: soury oaky start, boozy, red fruits, caramel, woody, grapes, wineous , ginger ,melon , bubblegum, strawberrys, somewhat boozy and acidic end , great !!","Antwerp, BELGIUM","BelgBeerGeek"
3054,"2011-06-16",1.2,"Dark brown cocacolaish with no head. Aroma malty, coffee, licorice. Taste sweet sour coffee and some salty licorice. Full body, text thick, oily, smooth, no carb. Finish long sourness. Not my kind at all. Had great expectations.","USA","holdan"
3054,"2011-06-15",4.4,"33cl bottle @ Brewdog Bar in Edinburgh. Pours a murky chocolate-brown with no head. The nose is intriguing - really savoury with blue cheese, then sour cream against an earthy background note. The taste has chocolate and again there is blue cheese and tangy-winey note. The palate has a big structure, a really thick texture and then a fairly sharp, perhaps tangy-sour (rather than bitter) finish. Overall, this is a stunning multi-dimensional beer which is still somehow incredibly balanced and restrained.","Edinburgh, SCOTLAND","AshtonMcCobb"
3054,"2011-06-12",4.0,"Bottle from Vinmonopolet in Valkendorfsgate, Bergen. Ive had the famous bourbon barrel version before, now its time to see what the original is like. :-) Pours a near-black deep brown body with a small, light beige head which disappears quickly - as expected. Nose is fantastic, with deep malty caramel notes blended with oaky peanut vanilla and port hints, along with notes of that barley wine woody hazelnut aroma I like so much. Taste is a sophisticated composition of alcohol-propelled wooden vanilla tones, peanuts, burnt caramel, nuts, deep malts, dense bitter hops and hints of salty licorice. Extremely well-balanced, as Ive known Lost Abbey to be in most - if not all - occasions. Warming alcohol finish, subtly wrapped in bitter licorice hops. A really great winter warming barley wine, which most beer geeks like me enjoy just as much in the summer. Another winner from Lost Abbey! :-)","Bergen, NORWAY","ClubGonzo"
3054,"2011-06-09",0.5,"This review reflects a bottle of 2010 Brandy Angels Share that I opened on 5/21/11. It cost me $16.99 for the 375 ml bottle. Let me first say that I find this brewery to be a bunch of cowards. See the end of review for clarification.The cork came out with no sound. It poured black with no head and zero carbonation-not a hint. The aroma was nothing like brandy or any barrel. It was very tart with tons of dark fruits, cherries and lots of grapes but it also seems moldy or like a pile of poop The taste was unbelievably bad and exteremely undrinkable. Massive tart cherry and grape like taste with a moldy taste and Im not making this up-poop. I tried to muster the strength to down it but it was THE WORST BEER IVE EVER HAD. Complete drainpour.


I decided to email the brewey and send them some feedback about it in a respectful way to see what they could do about it. Also to give them a chance to make it right. Now this was 2 weeks before the V009 release and Im sure they are busy people. I heard nothing back just crickets and they totally ignored me. Fast forward to a few days after the V009 release and a user on another site complained about a missing V009 label. He said he emailed the brewery and they responded back within the same day and said they would fix that situation. This is a missing label mind you not the actual product inside. I was a little peeved that I had emailed them more than 2 weeks before about the actual product and they ignored me. But they were really quick to respond about a very minor issue. I sent another email to ask if they care about there customers(which they dont) since they ignored me. After hounding them they offered me a T-shirt ( I wouldnt want to sport your gear now)and told me they couldnt refund my money because a lot of bad seeds had taken advantage of them. Let me tell Lost Abbey you are the ones taking advantage of people not the other way around.


This brewery could learn a lot from stand up breweries like Deschutes and Cigar City who admit when they make mistakes. Intstead these Lost people are hiding behind a curtain and refuse to address a problem because they are cowards. I respect a brewery who when they find a QC problem make a formal announcement(blog post, BA or RB post, just something) and try to make it right. Instead these cowards would rather there customers buy a defective product and screw us consumers over just so they can move on to the next batch. That is horrid customer service and I do not know how I can not give this beer any points because 1) It was a terrible beer and 2) they refuse to acknowledge anything when given the chance to make it right. Clearly these people are Lost at the ""Abbey""","San Antonio, Texas, USA","Hopper"
3054,"2011-06-08",3.1,"UPDATED: JUN 9, 2011 2010 bottle. Pours deep brown, no carbonation. Nose is vanilla, wood, and a touch of charcoal.

The taste is quite good. Vanilla, some bittersweet cocoa, very nice oak and roasted malt, just a touch of brandy. Interesting acidity, very high. Almost has a sour note to it. Dont know if this is by design or if its poor storage on the part of the market. My initial thought is that its by design, as it tastes very good. It is, however, a little out of balance which is why Im a little curious. Tastes as though its a product of the brandy, as that seems a prominent partner.

Overall great beer. No alcohol, very surprising for 11.5%. The acidity was a little out of balance and the oak/brandy is a little too domineering for me to give this a better score. Very happy, though.

EDITED TO ADD: The ""sour"" note got more and more pronounced with each sip. By halfway through it was wildly out of balance. Did some research and it looks like maybe this batch was infected. 

Still a good beer, but got hard to drink the whole thing. You could tell something was off, and messing with the flavor of an otherwise stellar effort.","San Diego, California, USA","tool2scream"
3054,"2011-06-04",3.4,"Bottle from SAVOR. Poured a dark, near-black color with a small tan head. Aroma was raisins, prunes, vanilla notes, alcohol. Flavor was alcohol, oak notes, raisins, prunes. A bit like a wine, though the alcohol really shines through it.","Alexandria, Virginia, USA","radagast83"
3054,"2011-06-03",3.9,"Bottle shared. Totally black,no head or lacings. Aroma has soya sauce, coffee and chocolate. Body has some acids, full bodied with some sweetness. Feel is oily. Finish is quite hoppy and bitter. Nice","NORWAY","esp0r"
3054,"2011-06-01",4.2,"bottle from trade w/Norcalgrowler - this beer blew my mind a little.. huge arouma, exudes vanilla bean, molasses, whiskey, oak and earth. Very sweet, but perfectly balanced by dry oak. Very creamy, chocolate, toffee. Velvety mouthfeel, warm booziness at the finish, coconut, cocoa dust, creme brulee. Some bitter sticks to the tongue. Would make an amazing baking beer, though I cant imagine myself ever wasting it like that. lovely warming notes that makes me want to start drinking whisky","New York, New York, USA","zdk"
3054,"2011-05-31",4.1,"28-05-11 Bouteille: Belle couleur cuivrée, avec une légère effervescence et pratiquement sans mousse. Aromes complexes de brandy, de caramel, de fruits, de sirop dérable, de boisé. Moyement  sucré, avec des saveurs complexes qui sentremlent parfaitement. Le brandy est toujours bien présent, mais prend sa place sans plus. Très drinkable pour une biere de cette puissance. Corps puissant, ronde en bouche avec une carbonisation plutot faible et une finale sucrée et alcoolisée. On en redemande!","Montreal, Quebec, CANADA","OliverG"
3054,"2011-05-29",3.9,"Alcohol and brandy on the nose.  Very little carbonation.  Brown sugar and brandy on the palate.  Tongue coating.  Overall very good.","Virginia Beach, Virginia, USA","GandGKevin"
3054,"2011-05-28",3.3,"2008 Bottle from Cavie.  Murky dark pour with no head or carbonation.  Aroma is alcohol, chocolate, vanilla, and wood.  Taste is thick, chocolate, vanilla, sherry, and alcohol.","Arlington, Texas, USA","Fratto"
3054,"2011-05-28",3.9,"UPDATED: JUN 2, 2011 2008 bottle with big thanks to drowland! I tried to shoot the cork and it drooped out by my feet. Pours a dark brownish red color. Low low low carbonation. Aroma is dark fruit, cherries, play doh clay and wood. Flavor is heavy dark fruit with a huge alcohol burn. Clay flavor also. Woody malty notes. Finishes sweet and clay.","Arlington, Texas, USA","Cavie"
3054,"2011-05-28",3.3,"2010 vintage poured into a wine glass. Pours a dark, murky brown with absolutely no head. No activity at all, for that  matter. Id heard this batch was infected and the carbonation took a hit for it, and it looks to be true. The aroma is still amazing: tons of dark fruit, vanilla, brown sugar, and molasses notes. The flavor is predominantly vanilla, brown sugar, caramel, prune, and a slight bitterness in the finish. Not much alcohol warmth at all for 11.5% abv. Mouthfeel is utterly flat and disappointing. Like drinking a warm Coca Cola that had been sitting on a store shelf for 2 years. Id had high hopes for this, but it just didnt measure up. Not bad, for being infected, by any means, but I certainly wont be comparing other barley wines to this...","Vancouver, WA, Washington, USA","Brewchacho4"
3054,"2011-05-27",3.3,"Pours a thick reddish brown color with no head. Hardly any hiss when the cork was popped. Notes of vanilla, oak, vinegar, cognac, brown sugar, and caramel. Flat as all hell. Maybe infected, maybe under carbonated. Either way, its not very good.","Arlington, Virginia, USA","ilovedarkbeer"
3054,"2011-05-24",3.7,"Bottle. Pours a muddy and dark brown beer with no head. The aroma is malt, sweetness, raisin and coffee. The flavor is same as the nose with additional alcohol and notes of acidity. The palate is sweetness with alcoholwarmth. Overall a good beer.","DENMARK","stobbe74"
3054,"2011-05-24",3.0,"2010 vintage. 375 mL bottle. Lost Abbey tulip.

APPEARANCE: Black. Tinge of light caramel brown/cola.
Head is practically inexistent and minimal foam dissipates quickly. Minimal amount of light tan foam left only around circumference of glass. Zero lace. 

AROMA: Caramel, cola, chocolate, brandy, brandied raisins. 
Hints of prunes, vinous character, as well as some faint nutty notes. 

TASTE: Vinous, caramel, cola, brandy, brandied raisins, grape juice, chocolate, oak. More vinous and cola character on finish.
Hints of tart red stone fruit (e.g., cherry).  

MOUTH FEEL: Nearly inexistent carbonation. Alcohol is relatively mellow for the abv  i.e., alcohol warmth is quite light. Light puckering on finish  due to vinous character. 
OVERALL: Avoid the 2010 vintage due to infection. Although it seemed infection in this particular bottle had yet to take over the ale completely (as some others have written about this vintage) it was definitely undesirable. Unexpected vinous character is prominent on taste, with mild tartness on finish. Despite the above, the caramel, brandy, and cola notes on the nose are fairly pleasant. Would like to try another vintage without infection. Taste is more like barley wine like aged with bacteria in red wine barrels rather than brandy barrels.","San Diego, California, USA","AHTOH"
3054,"2011-05-20",3.1,"This was quite an interesting beer. Not necesarily my favorite, but very unusual. The aroma was a wine/raisin smell. The taste was unquestionably pure prune juice. Its been quite a while since I have had prune juice and that was never voluntarily. Maybe in the 60s? Should keep me regular, I guess.","Georgia, USA","AR"
3054,"2011-05-17",3.6,"375ml bottle, 2010 vintage.  Pours a dark brown color with *zero* head.  Aroma is sweet, dark fruit, rasins, alcohol.  Heavy on the palate with *zero* carbonation.  Completely flat.  Flavor is sweet, malty, alcohol, oak, with a dry, tart finish.

I opened this due to rumors that it might be infected, but I dont think this one is.  If it is, the infection hasnt taken over yet.  It is certainly not as infected as the bottle of Mirror Mirror I had.  Overall, a decent beer, but it would be much better if it werent *completely* flat.","Milwaukee, Wisconsin, USA","sherm1016"
3054,"2011-05-15",3.7,"I was really looking forward to this one, but it didnt really work for me.  And its because it was totally and completely flat.  The aroma was there - loads of dark fruits, vanilla, caramel mostly.  Definitely smells like brandy.  But theres no head at all and no movement in the glass.  The taste is actually very good - grape and prune flavors, vanilla, tons and tons of caramel and something sour on the finish.  A nice warming effect as well, but Im really put off by the complete lack of carbonation.  Its a great tasting beer and doesnt need much, but completely flat just seems wrong.","Georgia, USA","emarkd"
3054,"2011-05-14",4.0,"375ml bottle from 2009. Pours a reddish brown but clear, nice carbonation. Nice aroma - plumbs, caramel, vanilla, prunes. Little thin but very nice taste - sweet, still get some alcohol, get some oak and brandy that lingers very nicely.","Ottawa, CANADA","pushkinwow"
3054,"2011-05-07",3.0,"Oak and whiskey nose, strong. Brown and headless. Smooth, easy carbonation. Sweet whiskey flavor, but not overly sweet. First sip is deceptively light and alcohol isnt distracting. It burns on the back end. Finishes with peanut and oak. Not my thing.","Staunton, Virginia, USA","obguthr"
3054,"2011-05-06",4.4,"Bottle. Pours dark brown with a medium beige head. Aroma is caramel, oak, booze, hops, wood, and toffee. Flavor is toffee, oak, caramel, nuts, booze, hops, and figs. Medium/full body with nice heat.","Spring Hill, Florida, USA","BrianDorry55"
3054,"2011-05-04",3.7,"Tap, Brick Store Feb. 11. Mahogany, dense, with a thinner tan head. Plums and chocolate feature the most in the aroma with a light sweetness, and a bit of yeast and a bready sourness. Really surprisingly filled with chocolate, plum, and rich dark fruits.  Syrupy body, viscous, and a nice layer of carbonation.  Nice treat, but a bit of a chore after a while.","Alexandria, Virginia, USA","Nickls"
3054,"2011-04-27",3.7,"Pours a hazy brown with no head.  Pours flat and no carbonation.  Smells of chocolate, heavy caramel malts, tangy fruit, heavy vanilla, fresh cut oak, char, and more cherry.  Just a wonderful aroma that is heavy and rich.  Tastes very rich with loads of chocolate and fruit.  This is very much like wine and shows its brandy heritage.  The brandy barrel comes through offering vanilla, oak, dark fruit, and loads of chocolate in the finish.   But its flat, very flat and no beer should be flat, irregardless of how it tastes.  Having said that, it still tastes marvelous.","North Canton, Ohio, USA","beerchugger"
3054,"2011-04-27",3.8,"12.7 oz  pours brown and almost looks like a dark apple cider and no carbonation. Smells odd to me, I smell something sour, oak, maple syrup and a hint dark fruits. This reminds me more of a wine than a beer. Lots of flavors here, vinous, chocolate, oak and a certain tartness. Mouthfeel is medium and finish malty and tart.","Canton, Ohio, USA","bittermestupid"
3054,"2011-04-26",3.0,"2010 bottle. Pour looks like flat coca cola there is also a dent in the cork looks like it struck the top on the way in and looked soggy starting to get scared. Aroma super sweet, prunes, plums, dates, bourbon and vanilla. Taste vanilla, bourbon, dark fruit, grape or prune juice? candy like sweetness, butterscotch, caramel. Full thick syrupy body no carb. Overall a sad face not for me at all I want to retry in hope that this was not as intended.","Kitchener, Ontario, CANADA","JB84"
3054,"2011-04-18",4.3,"smores chocolate. dark brown no head.  spices, chocolate, marshmallow, cinnamon, pepper.  heat with a medium body","Florida, USA","gregthekeg14"
3054,"2011-04-16",4.1,"UPDATED: JAN 28, 2013 On tap at ColLAboration LA event. Unsure of the vintage. Simply wonderful. Dark brown with a thin tan head. Aroma is vanilla, caramel, chocolate, and BRANDY for days. Flavor is sweet and powerful, some fruity sweetness, chocolate, vanilla and lots of brandy taste. This was a great beer. Thrilled to have had it. *RERATE* 1/25/2013. 2008 Vintage Bottle. Deep brown with no head. Aroma is coffee, toffee, vanilla, caramel. Taste is sweet, brown sugar, caramel, toffee; just long on the malt and very smooth. No carbonation. Beautiful; it has legs. Its incredible. Interesting that the years of aging completely neutralized the brandy notes. I have to say they were indeed missed but it turned into something etill quite phenomenal.","Highland Heights, Kentucky, USA","Chuckaduck"
3054,"2011-04-14",4.0,"(bottle - corked & caged 750 ml - 2008 vintage) Dark brown pour with a very thin layer of tan head. Huge boozy and brandy aroma followed by a heavy caramel and vanilla aroma. Flavor is very boozy, surprising for 3 years old, with a nice caramel malt and vanilla sweetness in the middle. Finishes with a smooth and sweet oak and brandy combination. Warming and really silky on the palate.","Henrietta, New York, USA","zach8270"
