"beer_id","date","rating","text","user_location","user_name"
3567,"2016-04-22",3.5,"Bottle from Appalachian Vintner. Pours golden with a thin white head. leaves some lacing in the glass. Solid salt lick on the nose with a hint of fruit. Lots of salt and sourness on the tongue. I cant say Im getting a lot of the lactose influence. Its a good gose but not as spectacular as I was hoping.","Lewisburg, Pennsylvania, USA","DiarmaidBHK"
3567,"2016-04-22",3.8,"Tap @ Kittys Public house. Pale hazy yellow with small white head. Citrus, strawberries, salt, something yoghurt-like. Mango, other fruit. Sightly sour and very lightly salty or at least not sweet. Quite nice.","","Jyrsa"
3567,"2016-04-20",2.5,"Not as fruity as I would like. The sour taste was nice. OK but not that much more.","Göteborg, SWEDEN","lopisar"
3567,"2016-04-15",3.6,"Refrigerated brown bomber poured into a glass. Hazy yellow with small white head. Aroma is nice tart, light body, lower carbonation, and pretty good small-bubble lacing. Taste is tart, mango, some brine, and hints of lactose.","Charleston Area, West Virginia, USA","weihenweizen"
3567,"2016-04-11",3.4,"UPDATED: SEP 24, 2016 Keg at the cellar bar Chester... Off funk fruit nose... Juicy zezty fruits... Big salty zezty fruits","Edinburgh, SCOTLAND","cgarvieuk"
3567,"2016-04-11",3.8,"330 ml bottle at home. Pours clear straight yellow with a medium white head, fine bubbles but low on carbonation overall. Interesting aroma of mango puree indeed, with tropical hops scent (I think Citra). Mouth filling body that is the result of the combination of low carbo, high acidity and the saltiness. Nice and weird at a time (is it the style or this particular beer/brewery?). The taste is majorly salty light malt,","Linden, BELGIUM","gEUS"
3567,"2016-04-11",3.4,"Bottle sharing @ Budapest. golden with a white head. Aroma of mango and floral and herbal notes. Taste is tart and a hint of mango.","Budapest, HUNGARY","SeniorZozo"
3567,"2016-04-11",4.2,"Best gose ever had. Nice lacto and mango notes, salt really increases mango and lactose sweetness, some other fruity notes like pineapple and oranges, salty finish. Nice white head, orange color.","Szczecin, POLAND","ArtificialCyst"
3567,"2016-04-09",3.7,"The Sampler, Brooklyn bottle: pours slightly hazed gold with a white head. Aroma is lactose, sour funk, fruitiness. Tste is sour. Body is quite creamy and easy to drink. Pretty salty. Lots of citrus. Dont know about the mango. Pretty nice.","Nueva York, New York, USA","mansquito"
3567,"2016-04-09",4.4,"Opis dodam jutro ..............................aktualnie nie mam jak. Siedemdziesiat piec znakow gwarantowane.","","Uhhmeister"
3567,"2016-04-08",4.1,"On tap at Cafe Sara, may 2nd 2015. Hazy orange body, lively white head. Aroma is zesty grapefruit, funky brett, dry mango. Taste is lactic sour, dry, with lots of citrus fruits, mild salty. Truly a refreshing beer, and at the low abv yet another winner from Omnipollo.","NORWAY","daje"
3567,"2016-04-05",4.0,"Bottle from uba ja humal. Hazy yellow color, white head. Aroma has lots of sour notes, mango, pineapples. Nice sour taste, mango, peach, other fruits.","Tuusula, FINLAND","k0mpsa"
3567,"2016-04-04",3.8,"UPDATED: JAN 4, 2017 Bottle. Pours almost clean, golden in colour, no head. Aromas of citrus, lots of mango and sour lacto notes. In taste mango sweetness with citrus and lacto sourness. Finish dry and medium sour in lacto way.","Poznań, POLAND","mateuszk"
3567,"2016-03-28",3.9,"Bottle. Light yellow pour a touch of head. Salty, sour, citrus aromas. A touch of funk, sour, lemon/lime citrus, and salt Flavors.","Wayne, New Jersey, USA","vtafro"
3567,"2016-03-28",4.0,"UPDATED: APR 14, 2016 Bottle - pours yellow - nose and taste of lemon, sea salt, sour lactose - med body.Earlier Rating: 3/10/2016 Total Score: 4Bottle - pours yellow gold white head - nose and taste of mango, sea salt, sour lactose and sour wheat - med body",", New Jersey, USA","jtclockwork"
3567,"2016-03-28",3.3,"Tap at Brewdog Helsinki, Helsinki. Colour is very cloudy golden with small white head. Aromas and flavours: Fruits, tropical fruits, salt and lactose. Interesting lactose elements.","Oulu/Helsinki, FINLAND","VastActiv"
3567,"2016-03-28",3.8,"On keg at Thomas Tallis Canterbury. Pale gold lasting white head. Berliner weisse with mango. lots of mango on aroma. Then lots of lemon in the mouth. Really sour. Rather delicious though. Very good. Impressive.","Ashford, Kent, ENGLAND","harrisoni"
3567,"2016-03-27",3.9,"Pours with slight haze, pale and a bit of foam. Huge ripe mango in the nose. I like mango. Spikey. Taste is sour, fruits there but mango not that strongly. Sour and lingering fruity salty goodness. Nice fun beer to have.","ESTONIA","jinroh"
3567,"2016-03-18",3.9,"22 ounce bottle - $9.99 at Dogwood Growlers in Acworth, Georgia.

Appearance: Pours a lightly hazed, lightly bubbly pale gold body with a thin, white head.

Smell: Tropical fruits with a mango leaning on the aroma, also hints of lemon and even lime juices. Modest crackery malts dusted with black pepper.

Taste: A little citrusy and sour with touches of sweetness and salinity before the sourish mango saunters on in. Slender crackery malts underneath it all. Solid acidity, a meager dollop of yogurt. Softly spicy with a pinch of coarse ground black pepper on the finish.

Mouthfeel: Light-bodied. Medium carbonation.

Overall: Its good and sour and refreshing.","Woodstock, Georgia, USA","ChainGangGuy"
3567,"2016-03-17",3.8,"22 ounce bottle. Light hazy yellow. Some of that wheat gose followed by mango tropical fruit. Pretty tasty.","Lexington, Kentucky, USA","drfabulous"
3567,"2016-03-17",3.4,"Kråkan tap st: Patrick. Fin frisk arom med rund toner. Nice överhuvudtaget. Tycker Bettan också.","","Roger60"
3567,"2016-03-16",3.5,"UPDATED: FEB 23, 2017 kran w jabeer, w sumie dosc takie proste piwo wyszlo - sporo owocowosci (Mango wcale nie dominuje, sa i jakies brzoskwinie i liczi, i winogrona i ctryna i costam jeszcze) sporo kwaskowatosci, fajnie wywazone... bardzo dobre, ale jakichs specjalnych wrazen brakOcena potraktowana skryptem do przeliczania ocen (uzgodnienie UT/RB).","Warszawa, POLAND","rami_pl"
3567,"2016-03-13",3.7,"Bomber from Whole Foods. Pours turbid gold with white head. Nose is tart fruit, mango, lactic acid. Tastes tart, with notes of lemon, mango, salt, lactic acid, and a smooth and tart finish. Delicious.","Lower Pottsgrove, Pennsylvania, USA","DocLock"
3567,"2016-03-13",4.0,"Bottle. Hazy yellow color, big white head. Aroma is acidic, lactic, lemon, zest, orange, passion fruit, hint of mango. Taste is medium sour, dry, light bitter. Flavor of lemon, lactic, zest passionfruit and some mango notes. Aftertaste is tart and lemon flavor.","Lodz, POLAND","Mesjasz"
3567,"2016-03-13",3.2,"Slightly hazy yellow beer, big soapy white head, disintegrates quickly. Nose is earthy, fruity, some funky notes, citrus, hops. Flavor is slightly salty, mango, tart notes. Hops and lemony sourness in the finish. Lingering funk, tartness and fruit. Fairly crisp palate.","ESTONIA","suurjuust"
3567,"2016-03-11",3.3,"Tried in a bottle from Colonna & Hunter. Hazy golden colour with a thick white head. Big mango aroma up front, taste lemon sherbet sour.","Lincoln, Lincolnshire, ENGLAND","Mr_Pink_152"
3567,"2016-03-10",3.9,"On tap at Hops and Pie poured a hazy yellow with a lasting white head. Aromas of straw, saltiness, yeast, mango and citrus. Palate was light bodied and crisp with a dry tart finish. Flavors of straw, citrus, yeast, saltiness and light mango with a crisp dry tart lingering citrus finish.","Arvada, Colorado, USA","Ratman197"
3567,"2016-03-08",4.0,"keg at tilt, brum (and previously a bottle from alesela which I forgot to rate!)hazy pale amber, mid bodied, fruity, tart, refreshing, juicy, salty finish. Excellent gose","NORTHERN IRELAND","Beersiveknown"
3567,"2016-03-06",3.9,"On tap @ RateBeer Best 2016. Hazy straw beer with a finger of white foam. Intense citrus, tropical fruit, and tangy lemon. Theres a good bit of tropical fruit like mango, kiwi, and even a touch of pineapple. Some peach, too. Nice lime, lemon, and a bit of salt. Solid sourness and fruit character. Maybe a little bit spicy and herbal on the finish.","Dublin, California, USA","brokensail"
3567,"2016-03-05",4.1,"On tap at Grumpys NE. Pours a cloudy pale yellow with a white head that starts and remains at the edges. Aroma has notes of sour mango with a slight earthiness and a light sweet grain. Flavor has tropical fruit throughout with a growing tartness and a light acidic bite.","Minneapolis, Minnesota, USA","deyholla"
3567,"2016-03-04",3.8,"Trübes rötlich pinke Farbe, kein Schaum. Geruch leicht säuerlich, rote Beeren, leicht salzig. Geschmack nach dezent säuerlichen Himbeeren, kraut, leicht säuerlich, kerne.","P´Castle, GERMANY","Beerhunter111"
3567,"2016-03-02",4.2,"22 ounce bottle into tulip glass; no bottle dating, but is a recent release. Pours lightly hazy golden straw color with a 1-2 finger dense white head with good retention, that reduces to a thin cap that lingers. Light spotty soapy lacing clings around the glass. Aromas of big sour lemon, lime, grapefruit, mango, melon, papaya, berry, pear, green apple, sea salt, hay, straw, wheat, cracker, light pepper, and yeast earthiness. Damn nice aromas with great balance and complexity of fruity/acidic yeast, mango, sea salt, and light pale malt notes; with great strength. Taste of big sour lemon, lime, grapefruit, mango, melon, papaya, berry, pear, green apple, sea salt, hay, straw, wheat, cracker, light pepper, and yeast earthiness. Moderate fruity/acidic tartness and light yeast spiciness on the finish; with lingering notes of tart lemon, lime, grapefruit, mango, melon, papaya, berry, pear, green apple, sea salt, hay, straw, wheat, cracker, light pepper, and yeast earthiness on the finish for a good bit. Fantastic complexity, robustness, and balance of fruity/acidic yeast, mango, sea salt, and light pale malt flavors; with a great malt/sour/spiciness balance and zero astringent flavors after the finish.  Good dryness from acidity and yeast spiciness as well. Medium carbonation and light-medium body; with a very smooth, crisp, moderately acidic/saline, and slightly creamy/bready balanced mouthfeel that is great. Alcohol is very well hidden with zero warming present after the finish. Overall this is an outstanding fruited gose style. All around awesome complexity, robustness, and balance of fruity/acidic yeast, mango, sea salt, and light pale malt flavors; and very smooth and crisp to drink with the balanced acidity. A highly enjoyable offering.","Michigan, USA","superspak"
3567,"2016-03-02",4.0,"Cloudy light yellow pour with a slight white head on draft at ChurchKey in DC. Mild tropical citrus nose. Really nice taste, a hint of salt, complex mouthfeel from the lactose, fruity and citrus going on with a medium-light tartness. All of a sudden my glass was empty!","Twin Cities, Minnesota, USA","Bacterial"
3567,"2016-03-01",3.1,"Clear yellow color with white foam ring. Fruity sour nose. The taste is milky sour with a fresh fruity touch. Little saltiness with sour fruity aftertaste. Quite refreshing.","SWITZERLAND","King_Alex_II"
3567,"2016-03-01",4.4,"Wow, Salty lemonade. Amazingly refreshing and easy to drink. i want to have this on a hot day.","ESTONIA","beer2809"
3567,"2016-02-27",4.0,"1pt 6fl oz bottle from Urbandale Hy-Vee, in a Sam Smith pint glass. Aromas of English yeast, ripe fruit, lemon zest, cantaloupe and seawater. Pours a faint, slightly cloudy yellow color, more like watery lemonade than beer really, with a thin bubbly head that breaks up into a foamy ring in a few minutes. Salt and crackery malt flavors up front, followed by a tangy twist that strikes me as more pineapple than mango with that gose sourness in play, with a finish of fresh lemons and salt. Complex but inviting and so easy to drink. Extraordinarily light. As light as beer gets and still stays beer. Lightly mouthcoating and sour, balanced by salty gose astringency. A surprisingly refreshing, uncomplicated and satisfying brew. A great introduction to Omnipollo brewing. Would love to do this again and explore the rest of their stable. Cheers!","Des Moines, Iowa, USA","saltyseadog"
3567,"2016-02-26",3.7,"Bottle shared, thanks Raul. Quite a pleasant surprise, definitely works as a gently soured mango lassi brew, nicely smooth and balanced. Would be great paired with curry, impressive brewing effort.","","biirusaikou"
3567,"2016-02-25",3.6,"Bottle. Hazed straw gold with teeny head. Light nose of straw, grassy citrus zest, clean minerality, light belgian esters, and young mango. Flavor starts off bright, tart, and salty, moving on to crisp minerality and grassiness, a bit of a mango-lemonhead pucker hugging the sides of your cheeks. Finishes easy with a hint of rock salt and fruity yogurt lingering. Quite good.","Cleveland, Ohio, USA","mambossa"
3567,"2016-02-25",3.1,"fra fad
duft: citrus sødme lidt jordbær frisk 
smag citrus sød lime ananas frisk","århus, DENMARK","llkc"
3567,"2016-02-24",3.6,"Aroma is mangoes/tropical fruit, wheat and a hint of odd sweetness/lacto. The flavor is mangoes, tropical fruit, mild salt/minerals, a hint of lacto/milk in the texture and a mix of slight sweetness and tart/slightly sour in the finish.","Quad Cities, Iowa, USA","wlajwl"
3567,"2016-02-20",3.8,"330 ml. bottle. Thanks Nikos! Pours a cloudy pale gold with a decent white head. Aroma of citrus and tropical. Taste is lemon, mango, pineapple, and a bit of salt. Very good.","Lansing, Kansas, USA","RobertDale"
3567,"2016-02-20",4.0,"(bottle)
Aroma: mango juice combined with lemony/coriander hint,some herbs in the back.
Taste:medium to strong sourness, fruity tart flavour, very salty finish, long sour and lemony aftertaste.
Palate: light side of medium body, high carbonation,
Overall: Extremy fruity and refreshing beer, sourness is right there but it doesnt overwhelm hole flavour,each sip made my salivary glands wet.Lovely!","POLAND","creppyiceman"
3567,"2016-02-19",3.3,"clear golden liquid with white head. aroma of mango. taste of salt, mango, iron, light sweetness, medium bitterness, medium sourness, light body, creamy, average carbonation, long finish,","Tartu, ESTONIA","tarmok"
3567,"2016-02-17",3.9,"Pours bright gold with a thick white head that recedes quickly. Sweet and sour aroma, citrus. Taste is juicy sour; citrus, mango and a hint of salt.","ESTONIA","Stultus"
3567,"2016-02-16",3.9,"12 oz draft pours golden with a white head. Aroma of mango and floral and herbal notes. Taste is tart and a hint of mango.","nashville, Tennessee, USA","edgallow"
3567,"2016-02-10",3.9,"Thanks to jinroh for sharing the bottle!

Poured into a taster showing cloudy yellow with two fingers of clean white foam.

The nose shows a lot of pineapple and pine with light hints of mango. The mango was either underripe but it seems a bit too young to be placed into the beer as the mango is not fully expressed on the nose and seems a bit green. 

The palate is moderately carbonated and full bodied. Moderate tartness, pineapple forward with mango on the end. Surprisingly pretty good on the palate.","Washington DC, USA","jc1762"
3567,"2016-02-10",3.8,"Bottle shared at Ratebeer Tokyo W & CB Tasting. Thanks Raul! Nice cloudy, glowing straw color with a finger of foam. Mango bomb on the nose with lots of punchy tropical notes and a hint of yogurt. Spritzy carbonation with a lightish body. Good crackery malts. Sea salt with good tartness that changes to dryness on the finish. Some very light brett-like funk.","Nashville, Tennessee, USA","willisread"
3567,"2016-02-10",3.5,"Big frothy white head. Huge mango lassi nose. Tart mango character, very light body. Very fun.","Tokyo, JAPAN","TimE"
3567,"2016-02-09",3.7,"Tap at the Rate Beer Awards Festival. Ripe, sweet mango nose, salt, vanilla, citrus. Funky, tangy mango and citrus flavor. Tasty.","Kyoto, JAPAN","KyotoLefty"
3567,"2016-02-07",3.7,"Draft - Intense citrus. Cloudy yellow. Bright citrus, salty and a long sour finish. Nice.","Burnaby, British Columbia, CANADA","Ferris"
3567,"2016-02-06",3.7,"Draft at RateBeer Best. It pours a very hazy pale yellow color. The aroma seems oddly hoppy with some herbal notes, mango, kiwi and grass. The flavor is mildly tart with more kiwi and lime. Very mild saltiness. Seems a bit hoppy for the style. Enjoyable stuff.","Livermore, California, USA","joeneugs"
3567,"2016-02-05",3.8,"Pour @ RateBeer Best Festival. Somewhat cloudy yellow appearance with a white head. Aroma has lemon, peach, and some tropical fruit along with a bit of acid. Light body. Moderate low sweetness and low bitterness. Somewhat fruity flavor but thats balanced somewhat well with the fruit. Easy to drink and refreshing.","Fort Collins, Colorado, USA","adnielsen"
3567,"2016-02-03",3.5,"Unclear, yellow colored, small white non lasting head. Aroma is of strong mango, tropical fruit, very citric lemony, some herbal notes, bit minerals. Taste is light to moderate sweet mango, very lemony and citric acid, moderate+ sour, dry finish. Light+ bodied, average carbonation. Zesty and refreshing. 
(bottle, Bierhalle Deconinck, Vichte)","Zagreb, CROATIA","kajser27"
3567,"2016-02-03",3.5,"On tap at RB fest 
Cloudy white with a medium sized white head, good lacing. Aroma of bright citrus and mango. Flavors of mango, citrus, salty with a tart finish 
Good","Utah, USA","Sledutah"
3567,"2016-02-03",3.5,"0,33l bottle at home from trade with bursprak, big thanks. BB 06/2016. light gusher, light yellow very hazy color, medium big white head. smells of horse blankett, some citric notes, some exotic fruits, grassy, herbal, bit flowery, interesting if a bit weird smell. light body, bubbly carbonation, slick mouthfeel. tastes rather citric, some lemon grass, herbs, flowery, acidic, light funk, some leathery notes, quite a bit of grass, very light salty notes. finishes lightly acidic with notes of lemon grass and herbal notes. overall good, a bit weird combination of flavors, not totally convincing, but quite drinkable none the less...","Vienna, AUSTRIA","Werckmeister"
3567,"2016-01-31",3.7,"On tap rbwg festival. pours out a cloudy pale straw color topped with a small head. nose is mango tart big brett funk sweetness. taste is more of the brett mango tart and funk.","Boise, Idaho, USA","BuckeyeBoy"
3567,"2016-01-26",3.4,"Rated ti 26.01.2016.bottle. Yellow golden clear. Pretty well carbonated. Strong mango, yellow fruity tropical nose. Bland wheat malty, some unspecific bit peppercorny spices. Med light bodied, dryish light tart. Savoury, dry wheaty, quite flavourful.-- bb","FINLAND","jookos"
3567,"2016-01-26",2.2,"(bottle) hazy pale golden colour with a frothy white head. aroma of soy sauce and heavy rubber, with lots of iodine, cheyenne pepper and some light straw. flavour is mostly burnt rubber and band-aid, slightly salty, with a touch of orange peel, some barnacles and a semi-dry finish. light- to medium-bodied with average carbonation.","GERMANY","jfb"
3567,"2016-01-26",2.7,"Bottle. Cloudy yellow, white head. Onion, salt, selerie, tropical fruits. Light bodied, foamy, seasalt - quite a bit, unbalanced of tropical to salty burned pizza.","Garching b. München, GERMANY","jonas"
3567,"2016-01-26",3.5,"Hazy yellow golden color with white head. Aroma is tropical fruits, lacto yoghurt. Taste is more tropical fruits and lacto character, with a nice salt character. Feels quite heavy. A crazy beer, but not bad.","Garching b. München, GERMANY","SinH4"
3567,"2016-01-26",3.7,"UPDATED: MAY 7, 2016 Pale yellow colour. Medium head. Sticky froth. Vinegar, mango, seawater in the aroma. Lactose, salt, vinegar at first. Some hints of mango in the middle. Citruses and spicyness in the end. The mango taste seems to be different from the mango taste from IPA-s. Its more like the mango icecream taste. Light bodied, medium carbonated, quite refreshing, 
rather freaky, but drinkable beer. However do not like the creamyness. It s hard to fit it with the essence of gose.

Bottle. Last tasting was a underrate. Not so lactic anymore. Refreshing nicely balanced. Very drinkable. Fruity.","Tallinn, ESTONIA","Rask0lnikov"
3567,"2016-01-25",3.8,"From tap. Pours cloudy yellow with a thick, firm white foam. Aroma is citrusy. Mango and salt. Taste is yet again citrusy. Mango, passion fruit, dry apples and a hint of salt. Very good, very refreshing. Excellent! Though... Maybe it lacks a bit sourness..?... Yes, it does! Despite of that, very good!","DENMARK","DonKromann"
3567,"2016-01-24",4.0,"Aroma is mango and a little floral. 
Pours golden, airy white head. 
Taste is very clean and fresh. Good balance between light sweetness and light bitterness. 
Feels silky on the tongue, medium body and average carbonation. 
Best low ABV beer Ive had.","Aalborg, DENMARK","BrettGT"
3567,"2016-01-21",4.4,"Pours a hazy yellow, pineapple juice colour. Aroma is orange peel, heavy pineapple, mango slightly, floral.
Taste: Pineapple, Mango, citrus

Very Tart but if you like Sour and Gose, woah this is good. Great beer! Great Brewery!","Leeds, West Yorkshire, ENGLAND","maxismax"
3567,"2016-01-19",3.6,"22--thanks, J! Pours a Hazy medium golden amber with a loose white head that dissipates. Sweet tropical nose, soft mango notes, light caramel, some seawater. Creamy medium body with soft carb. Saline, slightly sweet mid palate. Mild finish.","Mukilteo, Washington, USA","after4ever"
3567,"2016-01-17",4.8,"Smells like fresh slightly under ripe mangos, tart and astringent. Cloudy yellow just slightly able to be seen through. Very thin ring and island of head. Heavenly full mouth feeling and flavor of mango, as it fades the salt makes its apperance. Wonderful!","truckee, California, USA","krumbum"
3567,"2016-01-17",3.9,"22 Oz bottle poured. Cloudy lemon yellow pour with no head. Big lemon, and sweet fruit aroma. Flavor is slightly tart, and a mango background. Not quite as dominant as expected but definitely there. Salt finish, and a late lemon linger. Makes me thirsty drinking this. Good beer here, and quite unique. Glass of water with this would be nice to keep hydrated.","Kenmore, Washington, USA","andrewje41"
3567,"2016-01-17",3.8,"Bottle from Beer Gonzo webshop, Earlsdon, Coventry, consumed at home Saturday 16th January 2016   Lemony in colour with a filmy white head. Wow this has an amazing aroma, you get mangos, but there is also a peachiness. In the mouth it is essentially what it says on the tin, i.e. mango and milky (yoghurty) but also with a salty, light briney lick. Like this, its unusual and to be fair best suited to summer as it is refreshing but regardless I am drinking it sat in front of an open fire at home in mid January and it is still good. A8 A3 T8 P3 Ov16 3.8","Merton, Oxfordshire, England, Oxfordshire, ENGLAND","Fin"
3567,"2016-01-14",3.3,"A very good gose though I felt the mango flavor could have been more forward. Still great though.

---Rated via Beer Buddy for iPhone","St Petersburg, Florida, USA","fluffy"
3567,"2016-01-14",3.2,"6% version
clear yellow, white head.
aroma is spicy peppery sourish fruity wild yeasty salty aroma. kinda strange, even for a gose.
flavor is bitter, salty, bretty, slightly fruity, sourish, slightly herbal, interesting flavor indeed, but a bit challenging too, compared to other gose it seems to be more herbal and more weird, less clean. Not entirely to my taste.","Copenhagen, DENMARK","Pinball"
3567,"2016-01-13",3.7,"Bottle @ Van Moll Brewpub. Slightly unclear yellow color, medium to full sized white head. Aroma is wheat, citrus peel, citrus, soft sour-bitter. Flavor is sourish, citrus, citrus peel, sour-bitter and perhaps indeed a little salty. Suitable body, average carbonation. Quite pleasant.","Oirschot, THE NETHERLANDS, NETHERLANDS","Benzai"
3567,"2016-01-08",3.1,"small sample poured from draft in goteborg sweden. poured a light amber orange colour with a white head. nose is fairly sweet, juicy mango, apricots, lime, lactose, slight salty notes, and a little bit tart aswell. pretty weird beer","Alingsås, SWEDEN, SWEDEN","markextrae"
3567,"2016-01-07",1.8,"330ml bottle (thanks FatPhil). Clear pale golden color. Medium size, white head, stays. Saison yeast, burnt rubber, fruity in aroma. Sour, acidic, fruity, burnt plastic and yeast in taste. Acidic fruits in aftertaste. Sharp mouthfeel. Foul brew. Nope not a beer for me.","Reval, ESTONIA","Marduk"
3567,"2016-01-07",3.9,"Draft. Clear golden color, medium white head. Aroma of tart and earthy yogurt. Taste has tart yogurt, sour fruit. Tasty.","Charlotte, North Carolina, USA","Travlr"
3567,"2016-01-05",3.5,"650ml bottle. Brewed at Crazy Mountian, not Buxton. And it is damn fresh, only arriving to chi on 12/30. It still manages to smell like a stale euro brew, but the flavor is really nice, tart mango candies, sweet orange, and some spices. Good.","Chicago, Illinois, USA","crossovert"
3567,"2016-01-04",3.3,"On draught
Pours a pale orange, very hazy with a very small head.

The aroma is sweet, fruity, sort of chalky, and has some wet
Limestone. 

The flavor has a reasonable amount of mAngo flavor & some light sweetness. Its tart and has a bit of minerallity and saltiness.","Pouring Bus, Iowa, USA","CanIHave4Beers"
3567,"2016-01-04",4.0,"Pours a hazy light yellow with salmon tinge and a finger of gaseous bubbles. Lots of tart fruit on the nose with underlying foggy field of wheat, tropical fruit and some lacto fuzz. Palate is bright and tart, layers of mango, pineapple, lemon yogurt, fizzy mouthfeel, soft round grain nuances. Overall a delicious light handed fruited gose with great lingering salinity !","Gray, Maine, USA","Lukaduke"
