"beer_id","date","rating","text","user_location","user_name"
3567,"2016-01-03",3.0,"Vraiment indéfinissable...
Le nez part sur un genre dipa, on trouve très bien la mangue, un fond lacté et des relents de vinaigre.
En bouche : adieu lipa, bonjour lacidité ! La mangue devient timide et franchement amère. Le côté vinaigré est omniprésent. Choquant même.
Pas à mon goût du tout.","Lyon, FRANCE","Bawelt"
3567,"2016-01-02",3.9,"22oz bottle pours hazy pale orange with a tiny head. Nose is fruity dusty mango, peach, orange and light cheesy grain. Taste is crisp medium acidity, nice juicy mango, peach, and orangey stonefruit notes with a soft grain backbone and nice subtle minerality mid-palate. Finishes tart, lingering mango, tropical, earthy salinity, light grain.","Hampton Roads, Virginia, USA","JBPortland"
3567,"2015-12-31",2.2,"330ml bottle (Pothouse, Tallinn)
Hazy yellow, small head. Freaky sour lacto and fruity aroma. Not sure I like it. Some belgian yeastiness. Tastes worse, a complete mess. Salty and sour, some wheatiness, yeast, dirt, what the fuck. Where the fuck is the fucking beer? Kraft beer is getting worse and worse by the month. Oooh, my beer was hazy, but Annas was clear. Annas tastes better, its cleaner. Marduks too, clear and has more fruitiness too. Probably give that one 2.3-ish. Can pop up overall by one to average the 3 samples.","Tallinn, ESTONIA","FatPhil"
3567,"2015-12-31",3.9,"Bottle at home. Poured a light tasty yellow with white foam. Delicious aromas of mango and milk. Light salty and sour. Actually reminiscent of a lassi. Fantastic!","Kristiansand, NORWAY","nudiebear"
3567,"2015-12-26",3.8,"Bottle. Pours a hazy golden beer with a big white head on top. Aroma is very fruity, loads of tropical fruits, mango, pear, grassy notes. Flavor is fairly bitter, very fresh, fruity and very full bodied for such low abv. Well carbonated, well balanced, medium long finish and overal just a nice, fresh, fruity beer. Good stuff!","Den Haag, NETHERLANDS","MrHangover"
3567,"2015-12-26",3.3,"Bottle (6%) from Uba ja Humal in Tallinn ( 4.90). BB 06.06.2016. Love the design - a bottle to keep. Pours an almost clear pale yellow with a big off-white head. The first sniff, damn it, pissy pungent! Unripe fruits later on, a hint of its extreme green raw sourness... Tastes really sweet n sour, unripe tropical fruits... very green, close to tomato haft. Yea, green tomato rather than mango, or if mango, then unripe ones. Raw, really raw. The sweet and sour are really battling in this one, cant say whos winning, but Id rather they not do that. A tiny saltiness hangs in the roof of the mouth after swallowing, whereas in the throat its the same sweet and sour (this time, the sour seems to be winning). Light on the palate, but a bit too overcarbonated. Definitely more interesting - and at that, more controversial - than the last few doped up Goses Ive had. Not really sure if its worth the 96/100.","Tallinn, ESTONIA","Kauge"
3567,"2015-12-24",3.7,"draft at Blue Monk, Buffalo NY. somewhat murky cloudy golden pour. Tart, acidic, light salt, mango fruitiness. Nice","Buffalo, New York, USA","swoopjones"
3567,"2015-12-19",3.0,"Bottle, 6% ABV (from UJH). Pours clear golden with white head. The head stays for some time. Aroma is sweet and sour, fruits, mango, medicinal notes, some alcohol. Flavor is sour and slightly sweet, citrus, lemon, mango, some salt. Carbonation is high. Overall: feels simple and I really dislike over carbonated beers, so this is ok-ish.","Tallinn, ESTONIA","martjoobolut"
3567,"2015-12-19",3.6,"Geel goud ondoorzichtig bier met een goede witte schuim kraag. Ruikt fruitig, citroen, hop, mango. Smaakt apart. Citroen limonade achtig. Hop. Raar bier.","s-Hertogenbosch, NETHERLANDS","Abijen"
3567,"2015-12-04",4.4,"Bottle. Aroma: fresh juicy mango, Green mango, milk, butterscotch, canned tangerine, banana, clove. Golden/pale color, cloudy, white foam, minimal head.light sweetness, medium bitterness, lightly sour, salty, medium body, slick feel, average carbonation, long finish.","Warsaw, POLAND","Dominik92"
3567,"2015-11-25",3.4,"[email protected]/* <![CDATA[ */!function(t,e,r,n,c,a,p){try{t=document.currentScript||function(){for(t=document.getElementsByTagName('script'),e=t.length;e--;)if(t[e].getAttribute('data-cfhash'))return t[e]}();if(t&&(c=t.previousSibling)){p=t.parentNode;if(a=c.getAttribute('data-cfemail')){for(e='',r='0x'+a.substr(0,2)|0,n=2;a.length-n;n+=2)e+='%'+('0'+('0x'+a.substr(n,2)^r).toString(16)).slice(-2);p.replaceChild(document.createTextNode(decodeURIComponent(e)),c)}p.removeChild(t)}}catch(u){}}()/* ]]> */ Hazy golden colour, small white head. Aroma is mango, some toffee and mild lactose sourness. Flavour is tart edged mango and tropical fruits along with some slight salty notes to it as well. Surprisingly OK, considering it sounds a bit messy with the ingredients...","Vasa, FINLAND","oh6gdx"
3567,"2015-11-23",3.7,"Bottle, 3.8% version, from boxbeers.dk
Pours pale yellow, bit hazy, with a medium white head. Smell of citrus hops, mango, light malts, hints of lactic acids. Moderate sweet, a touch of lactic acids, moderate sour, alot of mango, light salty,quite subtile, very nice. Refreshing and nice!","Kronoby, FINLAND","adamnase"
3567,"2015-11-23",3.9,"Wow, from a beautifully presented bottle , this pours clear pale yellow, with a foamy head . The mango dominates the aroma, and there is enough salt in the finish to clear it away. Very tasty","York, North Yorkshire, ENGLAND","Mjp12"
3567,"2015-11-21",3.4,"Tap @ In De Wildeman, small sample, thanks SImon! Clear, pale yellow color. Aromas: citrussy hops, unripe mango. Retronasal its mango, light salty, sweetnsour. Flavor is fruity sour, light salty. Light bodied. Light bitterness in the finish, salty and sour as well. Still not a big fan of salt in my beer, but it was OK.","Amsterdam, NETHERLANDS","PotjeBier"
3567,"2015-11-20",3.4,"Acîîiîîîde .... Robe très claire. Du raisin un peu trop mûr. Une amertume agréablement de traviole ... Un côté crémeux. Une bière étrangement sympathique même si jen boirais pas tout les jours. A ""reboire"" aux chaudes journées ...","FRANCE","procraste"
3567,"2015-11-16",4.6,"Wildly unusual mix of flavours, slight smoke from malt on the nose more than the fruity flavours, smoke lost to salty, barnyard palate. About as subtle as a punch in the face, but delicious.","","ChronicYouth"
3567,"2015-11-16",3.2,"0.33 l bottle from Sterk Avondverkoop, best before June 2016. Clear, straw yellow with a huge, dense, stable, white head. Sourish, fruity-grassy aroma of lemon peel, mango, gooseberry and rhubarb. Sourish, fruity-mineral taste of lemon peel, mango, gooseberry and rhubarb, followed by a medium long, tart and slightly salty finish. Thin to medium body, effervescent and astringent mouthfeel, lively carbonation. Rather sour, way too much carbonation and a tad too salty as well. Somewhat unbalanced Gose but at least the fruitiness is nice.","Hagen / Bonn, GERMANY","Zlotta"
3567,"2015-11-10",3.8,"Bottle at home, bought at Bierhalle Deconinck. Mango, sweetish, sour, light salt but not disturbing, very fizzy. Maybe a bit too much carbo on it, better to let it sit for a while. Nice beer.","Scheldewindeke, BELGIUM","ElManana"
3567,"2015-11-09",3.4,"0,33 l bottle cheese, Mango, fruits, golden, hazy, frothy, white foam, salty, light sweetness, lightly bitter, medium body, oily feel, slick feel, average carbonation, long finish,","Freising, GERMANY","hawanna"
3567,"2015-11-09",4.2,"Pours a vibrant, hazy peach pulp - golden color, with a froth, one finger broad head.

Smells of a unique, mineralic saltiness which even more amazingly blends flawlessly into sappy exotic fruits, tied together by white bread earth. Reminds me of a sour fruit bonbon, while revealing a refreshing fruit note of papaya, orange and lemon, with no sugary sweetness to it at all. 

Fruits and lively carbonation provide a smooth mouthfeel, with a zingy sourness coating them up. Has a very light, but fulfilling body, utmost refreshing and light in the finish, due its salt supported lactic sourness.

Tastes of smooth exotic fruits from the very beginning, with a soft minerally flavor to them, revealing a whiff of bread balanced salt. This invites a medium lactic sourness to the palate, adding an unripe, sour quality to the fruits, which turns even more pronounced during the beers finish, as its initial fruit quality vanishes. That opens up the tastebuds to an even more focussed and present sourness, gently balanced by a stony bread foundation, with just a whiff of salt to it, also featuring a smoothing aqueous softness.

Utmost refreshing and witty, while sticking to its style, even by adding a skillfully entangled juicy fruit note, creating a pleasant depth to the beers otherwise very light body.","GERMANY","aleigator"
3567,"2015-11-08",4.0,"Bottle tall boys beer market. Golden foamy white head. Aroma is mango lemon. Taste same nice sweetnees good mango sharp bitter lemon salt comes through in the finish nice balance good bitter finish!! Deceny body carbonation. Very good.","wakefield, West Yorkshire, ENGLAND","s_hartshorne"
3567,"2015-11-08",3.9,"Bottle at Tilt Brum; clear golden amber pour with a big frothy white head, aroma has light citrus and big mango, taste has prominent salt well blended with big mango and citrus action, some tart fruits, along with a hint of funk.","Birmingham, West Midlands, ENGLAND","RichTheVillan"
3567,"2015-11-03",5.0,"Nice, fruity and extremaly refreshing. Tarty, sour and great. Beautiful mango aftertaste.","","horrorcore69"
3567,"2015-11-03",4.3,"Great, fresh, sour and extremaly refreshing gose. Nice aroma of acid and BUNCH of mango. Nice once. Very nice.","","scarab"
3567,"2015-11-03",3.6,"Hazy yellow, snow white airy froth. Fruity citrus hops aroma, could very well be mango. Dry with citric bitterness and salty finish. Fluffy and refreshing.","Haderslev, DENMARK","martin00sr"
3567,"2015-11-01",3.1,"(Draught at Omnipollos Hatt, Stockholm, 16 Sep 2015) Yellow colour, slightly hazy, with frothy white head. Malty, fruity nose with notes of wheat, citrus, grass and mango. Malty taste with wheat, soap, grass, hay, citrus, tropical fruit and a dry finish with a light salt flavour and a balanced citric bitterness. Medium body, quite dry. Interesting and tasty with both salt and sourness coming through. Quite weird, but enjoyable.","Hässelby, SWEDEN","Svesse"
3567,"2015-10-20",3.9,"Bright golden color with a nice and stable head.
The aroma barsts of exotic fruit, milk acidity and hints of salt. Very fresh nose, feels like a summer breeze at sea.
The taste is dominated by a heavy lacic acidity, fruits come second giving a hint of exotic fruit yoghurt, mango is definitely present. The uncommon combination of fruit and gose is intriguing, the finish is salty bitter - this beer will not leave you indifferent. Hate it, ok, but youll miss something truely different. And if youre open for it, youll admire!","Vught, NETHERLANDS","TheFoamhead"
3567,"2015-10-19",3.9,"330 ml. bottle. BBF 2016-06-06. 6 % ABV version. Gorgeous label as usual from Omnipollo. After disappointing Finish beer there is now Swedish beer (brewed in Belgium). Finland is oddly lagging heavily behind the other Scandinavian countries in beer it seems to me. All of this being irrelevant to this beer. Clear pale sparkling golden, creamy white head. Nose is heavily lactic, very strong, lactic exotic fruit yoghurt, strongly mineral, touch salty, faint lactic banana. Sparkling. Taste is very heavy lactic mineral salt, puckering pineapple & manog yoghurt, huge thick lactic yoghurt, lactic banana, citrus. Carbonation is huge, thick lactic body. Interesting in its excesses, hugely lactic & hugely salty, mineral. Excessive. Excess makes the heart grow fonder (the late great Jhonn Balance, much love).","Antwerpen, BELGIUM","77ships"
3567,"2015-10-19",3.9,"Bottle, 3.8% version, bought at Gulating Lørenskog
Pours pale yellow, quite hazy, with a big white head. Smell of citrus hops, mango, light malts, hints of lactic acids. Moderate sweet, a touch of lactic acids, moderate sour, alot of mango, light salty,quite subtile, very nice. a fantastic beer in the summer heat!","NORWAY","esp0r"
3567,"2015-10-17",3.7,"Cloudy yellow, huge head. Fruity mango aroma, sour fruity finish. Very nice but a bit one dimensional.","Reykjavik, ICELAND","haukur"
3567,"2015-10-17",4.0,"Hazy yellow color, white head. Aroma is tart and fruity. Lime comes to mind. Taste is tart but not really sour. Fruity, light on the palate, not very carbonated, easy to drink. Really nice overall.","Timisoara, ROMANIA","ciocanelu"
3567,"2015-10-16",3.7,"Draught
Aroma-lemon, fruits
Appearance-golden, hazy, white foam, 
Taste-medium sourness, light sweetness, salty, 
Palate-medium body, slick feel, average carbonation, long finish, 
Oberwało-very good","Krakow, POLAND","msbernac"
3567,"2015-10-14",3.6,"Bottle @ home from Kris Wines - Color: pale hazy blond beer with small carbonation and medium white foam. Smell: very fruity and sour domination. Notes of pineapple and grapefruit. Mango and white grapes. Taste: light body, astringent, white grapes taste. Sour, and exotic fruits as mango and pineapple. Notes of grapefruits. Very interesting. Attenuation as white grapes and small white wine taste. Very interesting. Aftertaste: exotic fruits, grapefruits, astringent. Sourness. Interesting beer, not so drinkable but very nice.","FRANCE","sir__v"
3567,"2015-10-12",3.7,"Bottle. Lots of mango, complemented by notes of lychee, citrus and elderflower. Reasonably tart though not over the top; not rally salty. Some lactose slickness to round things up. Excellent stuff.","Mikołów, POLAND","ElDesmadre"
3567,"2015-10-11",3.6,"From tap at CBC 2015. Hazy yellow colour with a white head. Aroma and flavour of spice, mango, pine, citrus and peach.","Albertslund, DENMARK","Borup"
3567,"2015-10-10",3.8,"Flaska på Stallyktan, Örebro. Blekgul med rejält vitt, fast skum. Doftar frisk och syrlig mango och hö. Smaken är ännu friskare, med fräsch syra. Mangon är där, men inte i dess söta form. Något sträv och med lagom beska. En riktig törstsläckare som går ner lite väl lätt!","Örebro, SWEDEN","Samuel214"
3567,"2015-10-09",3.9,"Bottle with thanks to Alex! Pours quote hazy golden orange, medium puffy white head with good staying power and nice clingy lacing. Aroma is mango, sea salt, wheat. Flavor is light sweet, light tart, mango and salty wheat. Medium body, fairly high carbonation. Tasty.","Sunnyvale, California, USA","bytemesis"
3567,"2015-10-05",3.7,"Clear golden yellow with big sticky white head. Aromas of mango. Taste of salt, mango, lime. Sharp and refreshing. Nice.","Stockport, Cheshire, ENGLAND","likeatrainwreck"
3567,"2015-10-04",3.5,"Bottle from The Beerhive. Hazy golden body with a thin white head. Lively carbonation. Faint lacing. Aroma of limeade, green mango and herbs. Flavour of salt, lime and white sugar. Medium body with a spritzy texture. Lively fizz. This is what Pic Tor should have tasted like.","Edinburgh, SCOTLAND","jamestulloch"
3567,"2015-09-27",4.0,"Bottle at home. Aroma of juicy fruits, salt, mango, grapefruit, citrus, bitter lemon, some herbal notes. Flavour is medium sour with a salty note and a little bitterness in the finish. Nice medium body, just the right carbonation. Delicious and refreshing, an excellent brew.","Steenwijk, NETHERLANDS","tricksta_p"
3567,"2015-09-26",3.7,"Bottle in the hotel. Pours clear golden, nose is toffee, salty, herbal, taste is salty, mango, herbal, juicy.","Edinburgh, SCOTLAND","Stuu666"
3567,"2015-09-19",3.6,"UPDATED: SEP 20, 2015 Pours golden yellow woth a thin white head. Aroma; Mango, grapefruit, citrus and fruity hop. Flavours mango, grapefruit with a semi bitter malt aftertaste.","SWEDEN","Jokestereo"
3567,"2015-09-19",3.4,"A: Light with a small thin lace. N: Hay, mango, seaweed T: Hay, mango, passionfruit, salt, coriander O: More hops than expected, still a nice gose though.","SWEDEN","AdmiralVernon"
3567,"2015-09-18",3.8,"Flaske i gave fra esp0r. Uklar lys gul, moderat karbonert med hvit skumtopp.smaker sitrus og mango med ettersmak av salt druestein og melkesyre. En forfriskende fruktig gose dette.","NORWAY","Simonsen"
3567,"2015-09-13",3.5,"Gul, ganska dimmig öl med bara lättare vitt skum. Doft av mango och en lätt mjölksyra med inslag av citrus. I smaken tillkommer viss kryddighet. Sältan är mycket lätt.","Malmö, Sweden, SWEDEN","NordicV"
3567,"2015-09-12",3.6,"3.8% bottle. Appearance- hazy, very light golden, a large rocky white head, resembles champagne. Aroma- yeast, sour fruits, rhubarb crumble, white wine, slight mustiness, stewed apple, saltwater. Taste- quite salty, pineapple, gooseberry, tart fruit, mango, Pinot Grigio, yeasty finish with citrus fruits. Very well-crafted.","Kent, ENGLAND","hohops"
3567,"2015-09-11",3.8,"Hazy straw, white head. Very hoppy nose for a gose.. Very fresh and fruity in character. Taste: lemony gose w a little lactic sourness. Some mango but just a tiny hint. Mouthfeel is light, carb is soft, semi dry lactic sour aftertaste. Thirst quenching!","DENMARK","Hoprider"
3567,"2015-09-10",3.7,"Bottle from saveur-biere.com. Clear gold. medium white head. Thin fizzy body. Medium sweetness. Low to medium saltiness. Aroma is mango. Flavour is fruity, citric, mango, salt.","Lisbon, PORTUGAL","andrepintado"
3567,"2015-09-09",4.4,"Bottle @home. Hazy pale golden color, thin foam on top nice lacing. Tropical aroma with a touch of acidity. Taste is sour, tropical, not as much mango as in the smell, probably due to sourness - rhubarb-ish. Bit of saltiness in the background. Very much balanced fruity sour ale, lingering aftertaste, very clean, dry, refreshing, altough a bit watery what the fruit and salt balances out. Awesome!","HUNGARY","SirBolts"
3567,"2015-09-05",3.3,"Hazy and thin-looking, very pale golden body with a large, white, creamy, very long-lived head, good lacing. Strong aroma of truckloads of tropical fruits, the first fruit that comes to my mind is actually pineapple. I guess this illustrates why raters get different fruits from the hops in beers, when Im not even able to instantly single out the mango in a beer that has been added mango purée. Ok, I do get mango as well, but also peach, rhubarb and grapefruit. Also a distinct background of sodium hydrogen carbonate (Nyco®). Quite strong flavour that follows the aroma. Light sweet, light acidic, light bitter and quite salty taste. Light body, dry and lively carbonated. My bottle doesnt mention salt, but I doubt that a beer can taste this salty without a few pinches of salt. A fruity, acidic, crisp, salty and unusual one. 
[33 cl bottle, 3.8% ABV, enjoyed 10 months before BB date, from Gulating Arendal]","Oslo, NORWAY","tfredvik"
3567,"2015-08-23",3.6,"Looks.. Light dusty yellow, med head
Smells.. Mango, sherbet, lemon.
Tastes.. Lemon, spritzy mango, so fruity, a little tart too.","Perth, West Australia, AUSTRALIA","NBird"
3567,"2015-08-20",3.4,"Cask at Buxton Tap House. Hazy yellow shade. Ring of head that vacates. Nice and juicy with lots of fruit rind and pulp flavours. The slightest sour edge to it. The cask dispense renders it a bit too flat. Nice fruitiness but doesnt have the creamy, yoghurty feel of a lassi.","Cheshire, ENGLAND","Nocturne"
3567,"2015-08-19",3.5,"Bottle, 3.8% ABV. Pours hazy very light yellow, with a big creamy head. Aroma is tart lactic acid and lemon peel, and notes of sea side and salt, as well as sweet fruity notes of mango and passion fruit. Light to medium body, with average carbonation. Flavour is tart lactic acid, with fruity notes of lemon, sweet mango and litchi, as well as light salt. Nice, funky mango lassi.","Bergen, NORWAY","tmrmwel"
3567,"2015-08-18",3.2,"Bottle 330ml (Saveur, ABV 3.8%)
Bright yellow color, lots of bubbles, small white head. Aroma has light lactose tartness and condoms. Light-bodied. Salty lactose tartness, tropical fruityness, lemon zest. Not really all mango, other fruits maybe too. Refreshing summer drink and of course 3.8% is totally different thing than 6%. And of course this is not a Gose. Good beer anyway.","Pori, FINLAND","TBone"
3567,"2015-08-17",3.7,"Cask. Buxton Tap. Cloudy, yellow gold. Pillowy, sticky, lasting, white head. Aroma of mango yoghurt. Some straw, and grainy malts. Lemon rind hop. Taste is lemony tart. Crisp dry. A little saline. Crisp, but smooth mouthfeel. Finishes with a light bitterness. The saltiness comes through most on the close. Good stuff. I might have preferred it via keg or bottle, though.","Sheffield, South Yorkshire, ENGLAND","Garrold"
3567,"2015-08-09",3.5,"Bottle at home.Pours yellow with a white head. Aroma of tropical fruit, mango herbs, tangerine grain. Taste is same, with some tart.","Odense C, DENMARK","MrOrla"
3567,"2015-08-09",3.9,"UPDATED: JAN 23, 2016 Sample at C4. Hazy yellow body with a medium white head. Citric, lemon, lemon zest, salty, fruity. Nice and drinkable.","Odense SV, DENMARK","hallinghansen"
3567,"2015-08-04",4.1,"Tap at Una, Sweet smell of mango, grass and subtle spice. Medium carbonation, easy to like.","Bergen, NORWAY","novair"
3567,"2015-08-03",3.6,"On tap @ Patricks (think it was the 3,8 % ABVversion). Unclear yellow body with a rather small, lacing white head. Refreshing aroma with mild mango juice and hint of salt. Flavor is even more refreshing than expected, sweet, mild mango, acidic berries/fruit, rather salty and slightly spicy. Medium body and nice, slightly sour, fruity aftertaste with a salty finish. Very pleasant and tasty, a perfect summer beer.","Kristiansand, NORWAY","Beer5000"
3567,"2015-07-30",4.0,"30.07.2015, 0,33l bottle @ home:
02.07.2015, tap @ UNA:
01.05.2015, tap @ CBC:
Nice slightly bubbly-creamy mediumlasting head. Aroma is mild grassy, rubber, sorrel, bark, citrus acid, dried tropical fruits, soda powder, lemon, salt water. Taste is slightly fresh sour-ish, soda powder, sorrel, rubber, bark, salt water, citrus acid, grass, fresh wood. Medium bitterness, slightly dry mouthfeel. Nice.","Loddefjord, NORWAY","Inbreak"
3567,"2015-07-28",3.7,"Pour hazy bright yellow, small white head.
Aroma has a lot going on - mango juice, lime peel, salt n peppa, slight grassy hops, green leafs. 
Tasty is a mix of bitter and sour up front, but is rather balanced. Quite tasty tho. Watery bodied, with a fizzy carbonation. Quite the thirst quensher.","Aalborg, DENMARK","MotherBrother"
3567,"2015-07-27",3.5,"On bottle from Gulating Ølutsalg, Sandefjord. Pale hazy golden color, good foam. Medium aroma intensity; fruity, citrus; some stable notes. Medium/ light body & complexity. Salty and sour- balances well. Enjoyable 

---Rated via Beer Buddy for iPhone","Oslo, NORWAY","Arve_Christian"
3567,"2015-07-26",4.0,"Keg at the siren sours and sessions fest. Clouded yellow / straw coloured pour with a big lasting white head. Frothy. Beautiful beer. Aroma is really nice pollen floral lemon, sour, fresh, little lemon. Really fresh on the nose. Wheat. Flavour is composed of fresh wheat, pollen, lemon. Really fresh. Palate is crisp lemon sour and sharp, highish carbonation. .","Hertfordshire, ENGLAND","mR_fr0g"
3567,"2015-07-26",4.2,"Key at the Buxton Tap. Clear golden in colour, small amount of bubbles round the glass, mango and a bit hoppy on the nose. Really fruity flavour, slightly fizzy and very refreshing. Lovely.","North Yorkshire, ENGLAND","apickles"
3567,"2015-07-16",3.3,"33 cl, flaske, 3,8 % ABV, BB: 06/06/16, købt i Boxbeers.dk, 16. juli 2015. 
Lys honning-farvet og ufiltreret Gose med 1 cm hvid skumtop, som svinder til kant og overflade. 
Syrlig og sødlig aroma af mango og lemon. Gærnuancer af kælder. 
Smagen er præget af salt med en større underliggende syrlig-/bitterhed af grapefrugt. Meget forfriskende og afvekslende OG langt fra den gængse opfattelse af øl. Solid sur, let bitterhed og let sødme. 
Fin let krop med en middel karbonering og en tynd konsistens. Afslutningen er bittersød med overvægt på det bitre og pludselig kort. 
Det er første gang jeg smager denne tyske type øl, og umiddelbart minder den mig om grapefrugtsaft med bismag af øl. Men et spændende bekendtskab, det er det. Og velegnet til sådan en sommerdag.","Valby, DENMARK","PapaVillum"
3567,"2015-07-16",3.9,"Flaska på Haket, Göteborg. En riktigt frisk, ganska syrlig och väldigt citrusfruktig gose. Både citrusjuice och skal, ganska stram syrlighet. Märker ingen större mangosmak men saknar det inte. Riktigt trevlig sommaröl.","Malmö, SWEDEN","Vignale"
3567,"2015-07-15",3.6,"Draught @De Klomp, Linköping. Pale golden color, thin white head. Lime, yoghurt sourness, citrus in aroma. Flavor has lime, sourness, citrus juice. Very juicy stuff. Nice balance, refreshing and very easy to drink. Bit salty finish, lime stays in your mouth forever long after. Mouthdrying finish.","Vantaa, FINLAND","Hermod"
3567,"2015-07-12",4.0,"From tap at The bottleshop on Druid Street, London. Pours cloudy light yellow liquid, small white head, Aroma: fruity, spicy, tar, Taste: light sweet, light to medium bitter, medium sour, citrus, lemon peel, spicy, sour, refreshing, Palate: light body, slick mouthfeel, average carbonation, long sour citrus finish, Overall: nice sour, refreshing, spicy.","Bratislava, SLOVAK REPUBLIC","HerrBierkoenig"
3567,"2015-07-11",4.0,"Raz słono, raz kwaśno, raz słodko owocowo - co łyk inaczej i za każdym razem smacznie. Czy wspominałem o tym że alkohol nic, a nic niewyczuwalny ? Genialne piwo. I do szybkiego picia, i do wolnego sączenia - co kto lubi.","POLAND","ogniskowicz"
