"beer_id","date","rating","text","user_location","user_name"
3567,"2017-06-20",3.9,"Delikatnie pachnie mango. w smaku w zasadzie te mango dominuje, lekko kwaśne i gdzieś tam słabiutko wyczuwam tę sól. Piwo bardzo rześkie i smaczne, na upalne dni chciałbym mieć skrzynkę tego pod ręką.","POLAND","dzudohonor"
3567,"2017-06-16",3.9,"bottle @ home
clear golden, minimal quickly disappearing white head
yellow fruit, passion fruit, light cream, mango, grapefruit, red orange juice, grape
tropical, pineapple, mango, grape, citric","Orsenigo, ITALY","Sissio"
3567,"2017-06-06",3.7,"Mocno mętne, bardzo gładkie, dużo osadu. Zapach owocowy, mało intensywny, ale w smaku bardzo soczyste, intensywnie owocowe, lekko kwaśne, bardzo pijalne.","POLAND","pjotrapostou"
3567,"2017-06-03",3.6,"Barwa słomkowa, spore zmętnienie, niewielka piana. Piwo zdominowane przez mango, może nie oszałamia intensywnością, ale daje to, co obiecuje. Wyraźna kwaśność, sól na granicy autosugestii. Rześkie, bardzo pijalne.","POLAND","Szopeen"
3567,"2017-05-28",2.5,"Aroma of onion and paraffine oil mainly. Im not sure if there are some mango notes, maybe a bit...
Taste is mainly sour, there are also some delicate salt notes.
A little hazy, very pale color.
It would be nice, if there werent such the bad aroma. DMS?","Kattowitz, UPPER SILESIA, ","oberschlesier"
3567,"2017-05-27",3.7,"wzmocniona alkoholowo wersja nie zyskuje na szlachetności, jest oczywiście bardziej charakterna, ostrzejsza, może nawet kwaśniejsza - ale gose powyżej 4 volt jakoś do mni nie przemawia","warszawa, POLAND","wojanex"
3567,"2017-05-26",3.8,"Keg @ New Bohemia, Nordeast. Deep gold pour with a small head. Really bright mango on the nose. Some citrus and a bit of lacto. Flavor is tart and somewhat lactic. More mango. Spritzy and light, easy drinking. Nice warm weather biere.","Minneapolis, Minnesota, USA","jackl"
3567,"2017-05-24",3.7,"clear golden, litle retension, smells delicious, taste is something completly different,
salty, fruity, tropical, taste explosion, enjoyed this one","Amsterdam, NETHERLANDS","hesiodus"
3567,"2017-05-19",3.5,"Pours clear gold into a tulip. Bright white head with little retention recedes to hug rim. Mango and lactose aromas. Sharp with mango and lychee upfront turning to sour lactose and freezer burn in the abrupt finish.","Marblehead, Massachusetts, USA","thornecb"
3567,"2017-05-19",3.9,"Piwo skonsumowane. Ocena na podstawie retrospekcji w celu uzupełnienia profilu.","Tarnobrzeg, POLAND","beton"
3567,"2017-05-13",3.9,"On tap at Underground. Pours a faintly hazed gold with a thin white head. Soft floral notes, fruit, soft musk. Medium bodied, tangy, tart, slight salinity, bright and briney. Tangy and lovely. Soft acidity into the finish. Beautiful and easy drinking.","Poughkeepsie, New York, USA","j12601"
3567,"2017-05-04",3.0,"3.5, last of the keg at Beer NV. Light orange color. Aroma and flavor is light mango and a hint of tartness and salt. Thin. Pretty ho hum for a style I like.","Reno, Nevada, USA","slowrunner77"
3567,"2017-05-02",3.9,"3.5% version. Super bright and pale grapefruit juice colour. Murky. Aroma is mango, lemon juice, and sea salt. Taste is incredibly salty with lots of fresh mango juice and hints of kiwi and lime.","Brussels, BELGIUM","adamnowek"
3567,"2017-04-29",3.3,"Drank 28-4 with Lennart @ Piet Huisman (3,8 ABV). I liked the mango. Apart from that, this one didnt really do much for me. Not that complex or deep-sour taste.","Nijmegen, NETHERLANDS","Maarten1993"
3567,"2017-04-28",3.7,"Bottle 0.33l at Majstor za Pivo Belgrade, Serbia. 12.04.2017. Taste with Ogi and Vlada. Pour it hazy yellow color with no head. Aroma lemony, nice sea salt note. Taste nice citrus, some grass on the back, salty, fruity finish, lightly bitter, lightly sour, light sweetness, medium body, slick feel, average carbonation, bitter finish.","Belgrade / Amsterdam, SERBIA","markoijelena"
3567,"2017-04-27",4.3,"Really enjoyed this beer! Great balance between the acidity, mango, and salinity.","NYC, New York, USA","rickybobby"
3567,"2017-04-23",2.6,"Tasted on 4/22/17 from a 12oz bottle, thanks to Hyman. Pours clear dark copper with an average white head that slowly recedes to average lace. The nose is primarily tart lemon, sour cream, with some malt and fruit. The flavor is about the same, primarily tart with much more malt than I usually like from this style, and some fruit. The body is fairly light, but with some pretty intense tannin, and a long tart and pretty malty finish.","Nashville, Tennessee, USA","wedgie9"
3567,"2017-04-10",3.7,"Pours a pale golden color with a white foam head. Aroma is salt and funk and subtle mango. Flavor is tart fruit, salt, with a touch of creaminess from the lactose. Has a crisp body. Quite good.","Royal Oak, Michigan, USA","chucklemation"
3567,"2017-04-07",3.1,"Pours a dark golden (tending toward reddish) clear with little foam. Saline and fruit in the nose with a touch of tart. Light body, light fizz, slightly slick. The saline dominates the flavor, but the mango appears toward the end and especially as it warms. The finish is comparatively long, but I dont think the mango / gose combination is very successful.","Pennsylvania, USA","PanMarek"
3567,"2017-04-05",3.9,"Piwo wypite przed założeniem konta na RB, ocena w celu uzupełnienia profilu.","Warszawa Ursus, POLAND","matoss"
3567,"2017-04-04",2.6,"12 oz. bottle from Old Town; shared with Boo; as ""Omnipollo Bianca"" says nothing about rock salt or mango on the label, only ""ale with natural flavor and lactose added."" Also, that it was brewed by Crazy Mountain Brewing Company in Denver, CO. My comments are going to end up longer than this rating. Goodness. Aroma: Lactose forward and a little tart fruitiness besides; salt isnt far behind. Appearance: Mostly still light copper with a bubbly tan head that settles into a wispy skin. Flavor: Lactose and fruit tartness up front; tartness lingers and is met with salt towards the finish, but not totally quenched. Palate: Light body, slick texture, soft carbonation, long finish. Overall: Just another Gose, Im afraid. Nothing that makes me want to buy this again over the cheaper, more widely available options as summer draws near.","Louisville, Kentucky, USA","ContemplateBeer"
3567,"2017-04-04",3.5,"33 cl. bottle, bb 20.04.2018
Aroma is a lot tangerine and ripe mango that are present in taste again. Its only slightly salty but with a nice acidity that is well embedded making the beer a sour juicebomb that finishes quite bitter. Rather resembles a sour mash pale ale than a gose.
Little bit flat but overall a nice refreshing and fruity beer for the summer.","Freibierg, GERMANY","impuritylaw"
3567,"2017-03-25",3.3,"KØLF 041116. ABV 3,5 %. Golden-yellow color with a white head. Aroma is mango, lime, lemon. Flavor is mango, lime, lemon, lactose, sugar, salt. Ordinary beer.","Kristiansand, NORWAY","gunnfryd"
3567,"2017-03-20",4.1,"Color between white and bright yellow. Solid thin layer of foam on top. A lot of residuals in the bottle (sweet, probably mango, but there was little taste in it). Low soft carbonation. Medium body. Sourness is very evident. Aroma: a lot of mango, orange, lemon. Taste: tart, citrus. Dry a bit harsh aftertaste.","North Rhine-Westphalia, GERMANY","prof222772"
3567,"2017-03-19",3.8,"12 oz bottle. Pours a gold/amber with light head. Aromas of salt, mango, limes, and light wheaty malts. Flavors of same. Quite salty but very nice. Almost like a margarita.","Vancouver, British Columbia, CANADA","Gerbeer"
3567,"2017-03-17",4.3,"Aroma: mango, mango and a little bit of mango
Taste: Pretty well balanced between mango and bitterness.
Really worth its price","POLAND","swglsk"
3567,"2017-02-28",3.8,"On tap at Ratebeer Best. Pours a hazy yellow with small frothy white head. The aroma is strong sea salt, dough, mango juice. Thin body, mango, sea salt, light tartness, dry finish, very good.","Houston, Texas, USA","djd07"
3567,"2017-02-23",3.4,"On tap at Hops & Pie, listed at 3.5%. (No mention of mango, but i was redirected here through an alias) Deep golden and clear appearance with a white head. Somewhat mild aroma of grains, light fruit and light minerals. Similar flavor, grainy and mildly tart with a light body, a thin feel and a mild puckering finish. Decent gose overall.","Denver, Colorado, USA","ajnepple"
3567,"2017-02-20",4.1,"Pale, hazy. Nice aroma of mango, sour. Good balance between sour, salt and sweetness. Medium carbonation. Fruity finish.","","Pikodeth"
3567,"2017-02-19",3.1,"33cl bottle at home from Only Good Beer, Budapest. Nose is sourish fruit yogurt, floral, chemical. Body is clear pale, head is small, white, frothy, mostly diminishing, good lacing. Aroma is fruity, mango, floral, leaves, yogurt. Light sweet, hint of bitter, medium fruity sour, light salty. Finish is medium lasting fruity acidic light sour, medium umami, light salty. Light body, dry texture, average carbonation. Quite easy, very interesting, not my style, but OK.","Maarssen, NETHERLANDS","androman"
3567,"2017-02-18",3.7,"Bottle. Hazy golden body with a white head that reduces to a lading 1cm pad. Fragrant freshnpeelwd Mango nose, very nice. Perfumey Mango , light yoghurt, lightly tart finish. Elegant and very tasty.","the land of bitumen, beef & beer, Alberta, CANADA","DuffMan"
3567,"2017-02-17",3.9,"Aroma: Sour mango, and bit of hopps. Colour: Pale, hazy, without head, only a smal white ring. Taste: sour, salty, realy refresing, drinkable. light body, soft carbonation, long finish, thin feel.","Gdańsk, POLAND","Gebels"
3567,"2017-02-17",3.8,"UPDATED: FEB 21, 2017 Extrem interessantes Gose. Fruchtlover und sanfter Whitey. Mineralisch säuerliches Finish unterstützt die Masterclassthese :). RARE BEER TASTING, BRAUKUNST LIVE 2017. 3,6% Version.","Kiel, GERMANY","ALIBALI"
3567,"2017-02-15",3.5,"For me too sour and eye squinting. The aroma is lovely, and it really is quite the refreshing thing, but that sourness washes everything out for me. and thats never a good thing.","Auckland, NEW ZEALAND","Pdubyah"
3567,"2017-02-13",3.6,"Decatur, Ga - on tap at Brick Store Pub with my son. Bright, sparkling copper colored pour, slight off white head. Organic aroma, slight sea salt and mango. Flavor has a slight mango twist, some sea salt briney notes, nice subtle sourness. Nice dry, crisp mouthfeel. Very different and enjoyable.","Tallahassee, Florida, USA","PorterPounder"
3567,"2017-02-02",4.2,"Cloudy straw colour, with a medium white head, some legs. Strong aroma of mango and some floral hops. Bubbly and smooth on the palate, fresh and not too sour. Taste is lot of mango (they added real mango purée here, not just a ""hop effect""), salt, some floral hops. Booze is very low in this batch, but tastewise its awesome!","HONG KONG","colui72"
3567,"2017-02-01",4.1,"W aromacie sporo nut słodkiego jogurtu o smaku mango-brzoszkwinia, kwaśność na wysokim bardzo przyjemnym poziomie, a wszystko to zwieńcza leciutka goryczka. Genialnie się pije. Świetne.","POLAND","Copid"
3567,"2017-02-01",3.7,"Lots of mango, cream and bit of hops. Very sour and quite salty. Bitterness is rather low. Very straight but also very good.","Warsaw, POLAND","fidgetymidget"
3567,"2017-01-30",3.6,"It is mainly sour but you can feel the mango. Med carbonation. Nothing special except the mango aftertaste.","Warsaw, POLAND","czlowiekmotyka"
3567,"2017-01-29",4.0,"On tap @ BBF16. Small sample. The aroma has lactics, strong mango, lime. Bit hazy, golden coloured beer with a thin, white head. The taste is light tart, light salty, has lime, mango, lactics. Easy drinking beer, but strong in taste for a gose.","Baarn, NETHERLANDS","skortila"
3567,"2017-01-24",4.0,"Draught at the brewery, 11/29 and 11/30/16.A good haziness to this canteloupe-bronze colored beer with a small, beige-flecked white head atop.Very, very juicy in the nose with strong acidity and light salinity vying for dominance. The mango puree is authentic and incredibly juicy and the tartness on the end punctuates the beer well. Very clean, no alcohol.Soft, easygoing malt, salt and milk sugar textures round out the intensely juicy, moderately tart mango and lactic character. Tight, medium carbonation helps keep it very drinkable, while fruitiness and salinity play off each other well on the finish. Clean and highly refreshing with a good deal of the flavor coming from the mango.","Boston, Massachusetts, USA","ClarkVV"
3567,"2017-01-22",3.6,"Bottle. 6 % abv. Cloudy straw-yellow color, fine white foam. Aroma: mango and other tropical fruits, juicy. Taste: sour, mango, brine and a little yeast, salt.","Minsk, BELARUS","alex_leit"
3567,"2017-01-11",4.0,"Dziwne, bardzo smaczne gose. Pianę miało niską, lacingu nie zostawiło, a na dodatek było żółtawe i mętne. Akurat wyglądało okropnie. Na szczęście o jedyna wada. W aromacie po pierwsze mango i cytrusy, lekko kwas mlekowy, cytrynka i dosłownie nutka takiego typowo mlecznego charakteru (może się zasugerowałem). W smaku natomiast po pierwsze oczywiście mango i marakuja, do tego umiarkowany kwas, który podwyższał swoją intensywność podczas dłuższego przytrzymania w ustach. Sól wyczuwalna na wargach w granicach rozsądku. Do tego słodycz, pewna miąższowość, coś jakby sorbetowość. Ogólnie bardzo pijalne.","Łódź, POLAND","PhilosophyGuy"
3567,"2017-01-08",4.1,"0,33l fles gedeeld met mark in wapse. Amber met een bescheiden kraag. Mango yoghurt lactose witte grapefruit en een klein beetje kwark in de afdronk","NETHERLANDS","rikstar"
3567,"2017-01-08",3.5,"Sample at Borefts 2016. Poured a hazy straw colour with a big frothy white head. The aroma is zesty citrus yeast. The flavour is moderate sour light sweet with a light crisp yeast, citrus fruit palate. Light to medium bodied with average carbonation.","Kuala Lumpur, MALAYSIA","jmgreenuk"
3567,"2017-01-04",4.1,"Piękny wygląd. W aromacie dużo mango i nuta czegoś przypominającego cebule, ale generalnie jest okej. NIe pije się tego super lekko jak na styl, ale doznania smakowe są ciekawe, dosyć mocno słone i kwaśne. Niewątpliwie jest to Gose z charakterem","Lublin, POLAND","Piotrek4"
3567,"2017-01-03",3.4,"Pours gold with a fading head.
Nose shows lemon peel, soft funk and elderflower.
Flavours include lemon peel, a fair whack of acidity and a weird greek yoghurt note.","Melbourne, AUSTRALIA","Davros"
3567,"2017-01-02",3.3,"330 mL bottle. Pale yellow body. Smells of yogurt, mango, and some sorta sour citrus. Tastes of mango. Low sourness. Like, barely sour. Sweet lactose. More of a grain flavor. Some salt in the back. Light body. Nowhere near as good as the blueberry version.","Florida, USA","ctipping"
3567,"2016-12-30",3.9,"On tap at Borefts Beer Festival, 2016. Pours cloudy yellow, white head. Fruity, mango, tropical fruit, citrus, lactic, lemon, light to moderately sour, light saltiness. Creamy, soft carbonation, light to medium bodied. Easy drinkable.","CROATIA","Iznogud"
3567,"2016-12-28",4.1,"Hazy yellow of color with a white head. An aroma of salt, plastic, peach, pineapple, sour milk and sour. A flavor of sour milk, salt, peach, pineapple, dry and fruity.","Vadum, DENMARK","Enjoyit"
3567,"2016-12-26",3.2,"Nice and refreshing plenty of mango which goes well with the salt and slight tart flavours.","Surrey, ENGLAND","Gramoit"
3567,"2016-12-14",3.9,"Butelka z datą: 2018-04-20
AROMAT: Bardzo intensywny. Sorbet mango-marakuja. W tle wyczuwalna morela, porzeczka, zboża oraz cytrusy.
WYGLĄD: Barwa słomkowa, mętne. Piana bardzo niska, krótka. 
SMAK: Słodowe, kwaśno-słone. Grejpfrut przełamany słodkim mango. Kwaśność wysoka, choć krótka. Na podniebieniu zostaje smak mango.
OGÓLNIE: Nie wiem do jakiego stylu przypisać to piwo, więc dopiszę je do tych ""robiących różnicę"". Wielbiciele ""kwachów"" będą zadowoleni. Koneserzy dobrego smaku również.","Warszawa (Warsaw), POLAND","KW92"
3567,"2016-12-13",4.1,"Omnipollo Bianca Mango Lassi z nowej warki totalnie mnie zmiotło, piękny lifting przeszło to piwo. Już barwa mocno dziwi, nie jest klarowne jak bywało kiedyś. Teraz ma jakąś kosmiczną barwę, żółto-białą? (serio)

Kolejny szok to aromat. Totalnie pachnie jak waniliowo-śmietankowe lody z mango. W smaku znów dużo owoców, świetanka, wanilia, wyraźne lacto, kontrastujący z resztą kwaśny, wytrawny finisz. 

Znakomite piwo.","Warsaw, POLAND","Korcz"
3567,"2016-12-10",3.9,"22 ounce bottle .. Goes crazy .. Mango, salt, fruit skin, taffy .. . Mouth is solid, nice spritz .. Good finish .. . Now clap your hands three times",".....Manchester United.........., Texas, USA","SudsMcDuff"
3567,"2016-12-08",4.0,"0,33L bottle bought at the Bottle Shop Hong Kong. 
Appearance: Pours a cloudy, bright yellow colour with white head that looks very creamy.
Aroma: Dominated by Citrus, mango and tropical fruits such as lemon, passionfruit with some pineapple.
Taste: Strong and intense tartness and acidity of lemon and mango. No bitterness at all. There is some very mild saline taste (from the rock salt?) when swallow.
Palate: The texture is quite creamy which is quite unusual compared to ordinary gose or sour ales. Is it because of the lactose that contribute to this creamy texture? The body is on the light side. Fruity and tart aftertaste. The tartness of the mango and lemon kicks back strongly afterwards.
Overall: A very enjoyable gose with extremely aromatic and pungent aromas of tropical fruits like mango, citrus and lemon. The tartness or acidity is not as strong as some sour ales out there, yet it is pronounced enough to give some freshnesses and juicinesses in hot summer days. The appearance of the beer is unbelievably beautiful. In fact, I have admired the bright yellow liquid and foamy white head for quite a bit. The drawing of the fur on the bottle has also uplifted the overall sensation of this gose. Definitely looking forward to trying the raspberry and blueberry version.","North Point, HONG KONG","nosajhongkong"
3567,"2016-12-06",3.4,"Kevyt, pirtsakka, vähän siiderimäinen ja hapan. Kevytversiogöse. Sitä mango lassia en kyllä tästä löytänyt.","FINLAND","gormio"
3567,"2016-12-04",3.7,"Tart lemon, bread crust aroma. Hazy golden, headless. Tart lemon and mango. Bread crust finish. Medium body, moderate carbonation, intense tartness. Nice intensity of tartness, good transitions, delicious.","Staunton, Virginia, USA","obguthr"
3567,"2016-12-03",4.3,"Omnipollos Gose doesnt hit you with sourness right away. It goes back to the palate without much notice before the acidic tartness grabs the rear sides of your mouth. Overall, this is a rather unusual Gose. The lactose gives this beer a strange creaminess. At the front of the mouth, flavor is tangy without being hugely acetic. Theres salt and a dank, funky tropical note. You can tell its a Gose but, it has some surprises and is quite approachable.","Lincoln, Nebraska, USA","MetalNHopHead"
3567,"2016-12-02",3.1,"Bottle.

A- Mango, subtle funk, salt, lactose, nutty.

A- Yellow color, clear liquid, white head.

T- Slightly sour, mild funk, salty, lactose.

P- Light body, average texture, average carbonation, slightly tart finish.

O- Not much mango on the palate and certainly not lassi like. The bottle didnt say mango on it and the no fruit version is aliased with this one so I guess it is supposed to have mango. Anyways, it was decent. Not my favorite gose or Omnipollo offering by any means but easy to drink. Lots of salt and lactose.","Ravenna, Nebraska, USA","HuskerTan"
3567,"2016-12-02",2.7,"Not much aroma or flavour or salt for that matter - sl mango in the burp but thats it. Disappointed.","Perth, AUSTRALIA","Hop_Hedonist"
3567,"2016-11-26",3.9,"Piwo barwy żółtej, mętne. Piana biała, średniej wielkości, po chwili znika całkowicie. W zapachu dużo tropików (oczywiście głównie mango), cytrusy, trochę kwasu mlekowego. Smak to ponownie mango i cytrusy, do tego sól i trochę ziół. Wysycenie wysokie. Goryczka niska, posmak cytrusowy.","Cracow, POLAND","19Michi38"
3567,"2016-11-23",3.5,"Piwo lekko metne w kolorze jasnozlotym z biala sredniopecherzykowa niezbyt obfita piana. W aromacie fajny cytrus i mango z dodatkiem ananasa. W smaku raczej kwasne w strone cytryny, raczej wytrawne z wysyceniem i goryczka na srednim poziomie. Sol wyczuwalna troche na finiszu ale niezbyt intensywnie. Lekkie, pijalne i orzezwiajace.","POLAND","bonev"
3567,"2016-11-21",4.1,"24/IX/16 - on tap @ Borefts Bier Festival - BB: n/a (2016-1147) Thanks to the Belgian ratebeer crew for sharing todays beers!
Clear bright yellow beer, big solid ice cream head. Aroma: lots of citrus, very fruity. MF: soft carbon, medium body. Taste: lots and lots of citrus, bit lemony, pretty sour, lots of tropical fruits, pineapple, bit saline. Aftertaste: sourish, very lemony, lime juice, slightly bitter, some tannins.","Gent, BELGIUM","tderoeck"
3567,"2016-11-18",3.3,"Bue en bouteille de 33cl. Bière légère, fine bulle, mangue, fuite jaunes. Pointe salée discrète. Chouette.","Besançon, FRANCE","Renobob"
3567,"2016-11-17",3.8,"0,33l bottle. Hazy thick yellow colour with quickly shrinking small white head. Aroma: Strong tropical aromas mostly mango, citrus and pineapple, almost like an IPA with the aromatic hops. When it gets warm the yeast aromas getting stronger and shows some matured cheese notes. Taste: Strong and intense sour acidic start with a quite intense and strong bitter mouthfeel. Has some fruity sweet hiding tone and also lemon/grapefruit peel like bitterness. Very dry, almost like a brut champagne. Light body with medium carbonation. Has some sour finish that becomes bitter with time but isn?t lasts for a long time and makes a long tropic taste in my mouth. A bit far from a regular beer or any special one but it?s great.","Budapest, HUNGARY","Demens"
3567,"2016-11-17",4.2,"Wersja 3.5% ABV: Średnio oczkowa piana szybko znika do zera. Barwa słomkowa, opalizująca. W aromacie intensywne cytrusy, mango, cytrusy, iglaki i zioła. Klasa! W smaku dość wytrawne, lekko kwaskowe, owocowe, czuć mango, cytrynę, mineralne i rześkie w odczuciu. Goryczka niska do średniej, żywiczno zestowa. Wysycenie średnie do wysokiego, szczypiące.

Jedno z lepszych Gose jak do tej pory, dodatek mango i nowofalowe chmiele to strzał w dziesiątkę.","Kalisz, POLAND","alteregoo"
3567,"2016-11-16",3.6,"UPDATED: FEB 25, 2017 Piwo koloru jasno żółtego. Lekko mętne, po wlaniu do szkła występuje mała śnieżnobiała pianka. Jeśli chodzi o aromat to wyraźnie czuć mango i grejpfrut. W smaku mango, jest troche kwaśne, lecz nie za bardzo. Jest też mało słone, jednak lekki posmak soli zostaje w ustach. Piwo bardzo pijalne i orzeźwiające.","Rybnik, POLAND","imperial_suchy"
3567,"2016-11-13",2.9,"UPDATED: DEC 13, 2016 1st time: Aroma: mango, citrus, lemon
Taste: heavy sour, light sweet, mango, lemon, salty 
Update: sulfur, citrus, mango
Taste: medium sour, mango, citrus, sulfur","POLAND","sokuzs1"
3567,"2016-11-10",3.6,"Bottle 33. Couleur blond clair et mousse bien blanche, abondante. Odeurs de violette, de pamplemousse, de mangue, dautres fruits. Lentrée en bouche est surprenante avec une acidité évidente à la limite de lagressivité pour le palais puis apparaissent des bonnes saveurs de fruits (citron, mangue bien sûr) où se greffe une assez forte amertume et une finale sèche. Surprenante et agréable par sa fraîcheur mais je ne saurais pas boire cela tous les jours.","Flémalle, BELGIUM","ardeo"
3567,"2016-11-04",3.7,"Bottle. Pours yellow with a white head. Aroma of mango, lemon, herbs and salt. Flavor is sweet and fruity with some mango, lime and herbs. Medium body, average carbonation.","Kristiansand, NORWAY","Geokkjer"
3567,"2016-10-26",3.8,"CBC2015, Pours yellow with a beige head, aroma of orange, lemon, acidic and fresh, flavor is sour with salt, orange and lemon, medium bodied, very nice","Ramat Gan, ISRAEL","zvikar"
3567,"2016-10-24",3.8,"At BBF, hazy yellow color, aroma of grapefruit, herbs, onion, shrubs and some mango in the back, strong aromatic onion flavor, mellow sourness and some sweetness creeping in and some salty lingering. Really nice and enjoyable.","Rishon Le Zion, ISRAEL","tomer"
3567,"2016-10-22",3.4,"330ml bottle pours a slightly hazy straw color with a finger and a half of white head that leaves a few spots of lacing on the glass. Aroma is mango with some lemon and malts. Taste is a light lemon tartness with a mango and malt sweetness. Light bodied with abundant carbonation. Overall, a well balanced and tasty brew that suits the style well. Recommended.","Edmonton, Alberta, CANADA","reebtogi"
3567,"2016-10-21",4.5,"Unbelievable aroma. Many mango notes. Very good fruit beer. The best gose what Im drinking","Moscow, RUSSIA","Rammer"
3567,"2016-10-17",3.4,"Piana wysoka, dość trwała. Aromat owocowy, ale tak szczerze, to bardziej mi się kojarzy z płynem do mycia naczyń o zapachu owoców tropikalnych. No ale mango faktycznie jest. W smaku gładkie, owocowe, z lekko słonawym finiszem, który mimo wszystko burzy złudzenie wcinania sorbetu z mango. Kwaśność średnia, może w stronę niskiej. Tak szczerze, to jakoś super mi nie podeszło, ale jest okej.","Lublin, POLAND","Estebanik"
3567,"2016-10-06",3.4,"On tap at Borefts, shared.
Thick white head. Murky lemon pour. Light sourness and saltiness. Some mango","Chiang Mai, THAILAND","deanso"
3567,"2016-10-02",3.9,"Its a very good combination of sweet sour fruity tastes. Its fresh, but quite full (for such a light beer) as well. Very complete and good beer.","Bergen op Zoom, NETHERLANDS","PietS"
