"beer_id","date","rating","text","user_location","user_name"
476,"2015-05-01",4.0,"A black beer, a head is weak but a colour is beautiful, dark brown. Aroma has strong roastiness and black coffee, vanilla, some sweetness. Enjoyable. Taste has strong coffee and roastiness, not totally dry. Only medium bodied, smooth low carbonation. The great aroma, the roasted and coffeeish taste isnt the same. Enjoyable and very good beer, anyway.","Kaarina, FINLAND","TET"
476,"2015-04-30",3.6,"Bottle at home, poured a dark Black colour with a Nice beige head. Aroma of dark charred espresso beans, green chili, cacao, vanilla, sweet bakers chocola, milk chocolate, theres some charred smoky oak in the aroma, and marshmallow, but i couldnt detect any Bourbon in the nose. Strong bitter coffe in the taste, full bodied mouthfeel, but again no Bourbon in the taste. Def. Not worth the 3x extra price tag compared to the regular beer geek breakfast","Alingsås, SWEDEN, SWEDEN","markextrae"
476,"2015-04-18",3.1,"Bottle @ WWT IV, small sample. Dark color, short head. Aroma of roasted malts, bit coffee. Malty bitterness. Wheres the bourbon? Just on the label I guess. Disappointing really.","Bunnik/Utrecht, NETHERLANDS","caesar"
476,"2015-04-17",3.4,"Bottle at WWT. Black with beige head. Old coffee, very dry cocoa beans, wood, bitter herbs, some metallic notes. Quite bitter and dry. Medium bodied leaning towards the light side.","The Hague, NETHERLANDS","Maakun"
476,"2015-04-17",3.5,"Bottle shared at WWT IV. Pours near black with a ring brown head. Aroma of roast, licorice, dark chocolate, toffee. Flavour is over moderate sweet and heavy bitter. Medium bodied with soft carbonation. Not so much bourbon.","The Hague / Amsterdam, NETHERLANDS","kermis"
476,"2015-04-17",3.7,"Bottle sampled at WWT IV.
Very thin tan head. Clear black pour. Light bourbon","Chiang Mai, THAILAND","deanso"
476,"2015-04-17",3.5,"Bottle @ WWT IV. Opaque pitch black color, average sized light brown head. Smell and taste malts, a hint of wood, clearly barrel aged but it doesnt really strike me as bourbon imo, firm roast, roast bitter. Medium body, decent carbonation.","Oirschot, THE NETHERLANDS, NETHERLANDS","Benzai"
476,"2015-04-17",4.4,"[email protected]/* <![CDATA[ */!function(t,e,r,n,c,a,p){try{t=document.currentScript||function(){for(t=document.getElementsByTagName('script'),e=t.length;e--;)if(t[e].getAttribute('data-cfhash'))return t[e]}();if(t&&(c=t.previousSibling)){p=t.parentNode;if(a=c.getAttribute('data-cfemail')){for(e='',r='0x'+a.substr(0,2)|0,n=2;a.length-n;n+=2)e+='%'+('0'+('0x'+a.substr(n,2)^r).toString(16)).slice(-2);p.replaceChild(document.createTextNode(decodeURIComponent(e)),c)}p.removeChild(t)}}catch(u){}}()/* ]]> */ Pours black with a brown head. Taste is roasted malts, coffee, bourbon, chocolate, vanilla notes. Full body. Oily texture. Slightly bitter roasted finish. Quite good.","Hammel, DENMARK","Niller"
476,"2015-04-17",4.2,"(bottle 17/04-2015) low brown head, black color, smooth roasted Bourbon taste, soft co2.","Hasselager, Aarhus, DENMARK","bax"
476,"2015-04-15",4.0,"33cl bottle @Dangerous Bottleshares 7.0. Pours a pitch black with a small, brown head. Aroma has lots of fruity coffee, roasty malts, coffee berries, hints of oaky bourbon, vanilla. Taste of roasty and coffee bitterness, slight sweet malt and vanilla, but almost no bourbon presence. Some lactose-like sweetness, probably from the oatmeal. Ends off very dry with lots of coffee. Medium full body, medium carbonation.","Aarhus C, DENMARK","Vestergaard"
476,"2015-04-11",3.5,"Sort skum brun lidt kort 
Kaffe træ støv vanjile 
Bitter modrtar sød modrate 
Oile blød @f1","Holstebro, DENMARK","back"
476,"2015-04-11",4.0,"Bottle @ Post-Easter Procrastination, Ulfborg. Pours cloudy very dark brown with airy tan head. Clear aroma of malt, caramel, vanilla, coffee and barrel. Roasty flavour with notes of barrel and vanilla, and touches of coffee and liquorice. Bitter and roasty aftertaste. Very decent.","Sønderborg, DENMARK","Bamsen78"
476,"2015-04-11",4.0,"Bottle @ fonefan tasting. Black with a brown head. Aroma is roasted malt, coffee, chocolate and bourbon. Flavor is quite sweet and moderate bitter. Dry and roasted moderate bitter finish. 110415","Beder, Aarhus, DENMARK","Rasmus40"
476,"2015-04-11",3.9,"Bottle 33cl, a dark beer with medium copper head. Nose is on brown caramel, dark malt, licorice, plum. Aroma is on a creamy dark chocolate, apricot and prune body, dark malt astringency, oak notes, less vanilla hints, intense espresso finish. Easy drinkable, good creamy body.","Strasbourg (Alsace), FRANCE","jaghana"
476,"2015-03-30",4.0,"Bottle. It pours jet black with a creamy beige head. The aroma is roasted coffee and vanilla with roasted notes. Oak, ash, roast and vanilla notes in the flavor. Not much bourbon notes tbo. Coffee ashy notes in the finish.","Helsinge, DENMARK","Plovmand"
476,"2015-03-29",4.1,"Bottle @ Dangerous Bottle Share 7.0. Pitch black with a small tan head. Nose has coffee, roasty notes, ash and some light chocolate. Taste has fresh coffee, subtle barrel notes, vanilla fudge, roasty, tar and some light caramel.","Aarhus, DENMARK","bursprak"
476,"2015-03-24",4.5,"330 ml. bottle. Procured by Kraddel. Joint purchase. Drank ½. Blackish brown. Sweet umami, bourbon, sugar, lots of bourbon vanilla, light soy in the nose, touch bitterness. The new beer geek breakfast is thicker, more roasted & bitter than the original, also better in my opinion. Taste is bourbon, lots of bourbon sugar, vanilla, lots of sugar, quite bitter, touch herbal, soy, plenty of roast mixed with the big bourbon sweetness. Easy body, touch lower carbonation. Quite nice.","Antwerpen, BELGIUM","77ships"
476,"2015-03-23",3.6,"Pours pure black. 
Small white head. Smell is bit vanilla, dark malts. Taste is bit bitter , coffee, intense, grainy a bit as well. Dark malts. Only mild bourbon , more oaky . Bit of vanilla. OK . Too thin mouthfeel for my taste, especially compared to past beers by them.","Antwerp, BELGIUM","kraddel"
476,"2015-03-23",4.0,"Bottle shared @ the ever awesome dangerous bottleshare #7 . Pours black with a brown head, The aroma is pretty coffee forward, fresh light roasted coffee indeed. Also some vanilla, sweet liquorice, cocoa beans and some weak milky sweetness. The barrel is very subtle here. The taste is also coffee forward with some dry woody notes, vanilla, liquorice, a milky sweetness, oatmeal, roasted malts and fruity coffee. Really really good. But the barrel is very low key. Beer geek breakfast is a fine ass beer and this is no exception. Liked it better than the old bourbon edition!","Aarhus, DENMARK","RasmusOtt"
476,"2015-03-23",4.1,"20-MAR-2015, bottle @home, from Kihoskh.
Black with lasting Brown head.
Aroma is whisky and roast. Taste is whisky, coffee, chocolate, peat. Creamy, medium++ body, medium carbonation. Nice.","Copenhagen, DENMARK","jesperhammer"
476,"2015-03-22",4.0,"Shared at Dangerous Bottleshare #7. Pours pitch black with a small dark brown head. Aromas of coffee, light smoke, licorice, bourbon, some vanilla, oats, chocolate, some green-ish notes. Taste is roasted, licorice, salmiak, light green coffee, chocolate, vanilla, very little bourbon, dry woody finish. Slightly disappointing.","Aarhus N, DENMARK","Klimaet"
476,"2015-03-19",3.6,"330ml bottle at home. Black color with beige brown head. Roasted malty aroma, coffee, wood - whiskey and vanilla notes in the beginning, light chocolate, smoked - tar notes. Light sweet and heavy bitter taste like the aroma. Light to medium oily body with soft carbonation.","GREECE","rouhlas"
476,"2015-03-11",3.8,"Botella de 33 cl en el momento en el lúpulo el 11-03-2015. (R11) color negro intenso con poca espuma oscura. Aromas maltosos tostados algo dulces con predominio de toques de bourbon, madera y algo de vainillas. Cuerpo medio a intenso con 7.5 vol. Fácil de beber y sensación de licor. Sabores fuertes con maltas tostadas, ligeramente quemadas con maderas y toques dulces de bourbon, algo de cacao y vainilla. Bastante amargo con sensación seca y algo áspera. Bastante buena con el añadido de los sabores de bourbon. Para repetir sin duda.","oviedo, SPAIN","angel77"
476,"2015-03-04",4.1,"Schwarzes Bier mit einer fingerbreiten braunen Schaumkrone. Geruch sehr schokoladig, Kaffee, Vanille, gering holzig. Geschmack sehr röstmalzig, mild, schokoladig, Kaffe, Vanille, sehr lecker!","P´Castle, GERMANY","Beerhunter111"
476,"2015-03-02",3.7,"Pitch dark brown, faint swirl film and sticky thin brown ringed. Sticky dates, vanilla and light burn. Initial taste is choc, soap dust and neat sweetness. Cooling enough, not overly cloying. Finish is softly sweet and the coffee firmly comes through for a steely linger. Bottle, Mikkeller Online, Sake Monday Tasting","Edinburgh, SCOTLAND","McNeillR"
476,"2015-03-02",3.8,"Bottle. Black with tan head. Aroma of bourbon, coffee, chocolate, not too powerful. Taste of bourbon, roasty, oak, burnt, coffee. Quite thin with a long finish","Edinburgh, SCOTLAND","BenH"
476,"2015-03-02",3.1,"Bottle at Craigs. Pours black, nose is quite soapy, fairy liquid, vanilla, taste is dry roasted, coffee, chocolate, again quite soapy, disappointing.","Edinburgh, SCOTLAND","Stuu666"
476,"2015-03-02",3.4,"bottle at home ... deep black ... thin tan lacing ... soft dark chocolate roast ... light whisky ...dark malts ... dark chcoolate roast ... dry chcolate ... long soft whisky linger ... whisky fades to leave some ligth coffee on linger ...","Edinburgh, SCOTLAND","cgarvieuk"
476,"2015-03-02",3.1,"Bottle at Craigs. Pours black with a thin tan head. Aromas of coffee, light booze, bourbon. Taste is coffee, soapy, thin. Dry finish. Lots of coffee at the end.","Edinburgh, SCOTLAND","allmyvinyl"
476,"2015-02-23",3.9,"33cl bottle enjoyed @ home. Pours pitch black with a tan head. Aroma is coffee, chocolate, oak and some bourbon. Flavour is medium bitter. Medium bodied, carbonation is soft. Finish is coffee and bourbon.","Copenhagen, DENMARK","Zakoon"
476,"2015-02-23",3.8,"Bottle. Pours pitch black, very small brown head, leaving nice ring on side of glass. Aroma is coffee, vanilla, cake. Burnt malts, dark chocolate. Taste is rich, medium sweet, burnt caramel, oaky vanilla, dry oak and roasty coffee finish. Some cocoa powder too. Some smooth oath mouthfeel. Quite caky for the ABV but could have used some more body, because its quite potent. Light to medium body and medium carbonation.","Aarhus, DENMARK","Lukasmh"
476,"2015-02-15",3.9,"330 ml bottle poured into a snifter. 7.5% ABV, light pink/flesh colored Keith Shore label. Jet black with thin tan sporadic head. Aromas of bourbon, toasted oak, roasty notes, dark chocolate, coffee. Tastes of dark chocolate, roasty notes, oak, balanced bourbon, coffee. Medium-full body with a dry finish. Would like just a bit more barrel character.","Falls Church, Virginia, USA","GenDV138"
476,"2015-02-14",3.9,"Fresh batch. Pour is pretty darn black, with a small mocha brown head. 
Aroma of oatmeal, coffee beans, some hops, slight chocolate, subdued bourbon vanilla notes, roasted malts, slight smoke to it. A mixture of the green hoppy stuff, with delicious sticky bourbon sweetness. I do prefer the sweet sticky stuff, so Maybe six months in the celler would do this beer good, to me atleast. Taste is slightly sweet up front, with a somewhat heavy bitterness. Medium bodied, with a flat but pricking carbonation. I like this no doubt, but a bit ""green"" for my likings.","Aalborg, DENMARK","MotherBrother"
