"beer_id","date","rating","text","user_location","user_name"
1833,"2010-03-14",3.4,"[email protected]/* <![CDATA[ */!function(t,e,r,n,c,a,p){try{t=document.currentScript||function(){for(t=document.getElementsByTagName('script'),e=t.length;e--;)if(t[e].getAttribute('data-cfhash'))return t[e]}();if(t&&(c=t.previousSibling)){p=t.parentNode;if(a=c.getAttribute('data-cfemail')){for(e='',r='0x'+a.substr(0,2)|0,n=2;a.length-n;n+=2)e+='%'+('0'+('0x'+a.substr(n,2)^r).toString(16)).slice(-2);p.replaceChild(document.createTextNode(decodeURIComponent(e)),c)}p.removeChild(t)}}catch(u){}}()/* ]]> */ bottle-pours a tan ring and brown color.  Aroma is dark malt-anise/molasses, dark fruit.  Taste is dark malt-anise/molasses, dark fruit, secondary earthy hops.","Florida and, New Jersey, USA","jcwattsrugger"
1833,"2010-03-12",4.2,"tasting on 3/6/10.  dark brown pour with small tan head... roasted malt aroma... medium body with notes of coffee, chocolate, roasted malts and some lingering dark fruits... very nice Baltic Porter.","Fort Collins, Colorado, USA","craftbeerdesign"
1833,"2010-03-11",4.0,"dark amber brown color. creamy and sweet aroma.  tastes like a smooth ceamy taste.  great feel and mild aftertste.  great!","Rome, Georgia, USA","FSUScott"
1833,"2010-02-14",3.7,"Bomber poured a clear dark brown with a small lingering tan head. Aromas of bitter chocolate, vanilla, light roastiness and a hint of coffee. Palate was medium to full bodied and smooth. Flavors of bitter chocolate, vanilla, light roastiness and a hint of coffee with a smooth lingering chocolate finish.","Arvada, Colorado, USA","Ratman197"
1833,"2010-02-10",3.9,"Poured from a bottle into a tulip. Beer is black and has nearly no head at all. Carbonation is low and there is no lacing. 

Aroma is slightly sour but mostly sweet and roasty.

Beer is medium to light in body, was expecting more body but oh well, slight roast, some chocolate maybe, now Im picking up some chocolate in the aroma as well. There is a growing bitterness in the back of the mouth. Drinkability is fine as well as mouthfeel.","Maryland, USA","drabmuh"
1833,"2010-01-26",3.8,"09 bottle courtesy of flandersned. nice bottom ferment porter, i like it but am not super crazy about the syrupy lager finish and aftertaste. otherwise the flavors are great, the nice, and it has a nice medium body.","Notown, California, USA","wavers1"
1833,"2010-01-07",3.1,"Bottle at toncatchers 2.  Dryish.  black.  Fast fading small tan head.  Hint of some chocolate. I prefer sweeter beers.","Cupertino, California, USA","wetherel"
1833,"2010-01-02",4.2,"Thanks to MReusch for this amazing bottle! Thick black pour with a creamy tan head. Wonderful interplay of cocoa, dark fruits (fig, raisin, plum) and roasted grains in the aroma. Taste is dominated by a wonderful smooth chocolate and cocoa with some hints of roasted grain poking through. Just an awesome brew.","Orlando, Florida, USA","dchmela"
1833,"2010-01-01",4.3,"I really liked this. Dark reddish brown, big beige head. Nicely fruity, coffee-ish aroma. Really easy to drink, smooth without being thin, definately quaffable. Tastes like coffee and prune and other dark fuits, really nice mix of sweet and bitter. Dries out a bit as it warms. Very nice brew. Thanks, Secret Santa!","Knoxville, Tennessee, USA","Suttree"
1833,"2009-12-01",3.7,"Bottle. Dark reddish brown with a medium off white head. Liquorice, roasted malt and espresso coffee in the aroma. The flavour is mainly roasted malt with notes of coffee and chocolate. Soft and creamy texture. Very nice.","Helsinge, DENMARK","Plovmand"
1833,"2009-11-28",3.6,"22 oz bought at brewpub. Pours dark and cola like. Lots of chocolate in the first sip. Some fruit too. Aroma doesnt stand out, but the taste is a brown sugar/cocoa concoction. Nice. Not the football drinking beer Im making it be...but good.","Lexington, Kentucky, USA","drfabulous"
1833,"2009-11-28",3.5,"UPDATED: JUN 26, 2010 Bottle at Papsøs - Thanks. Almost black - white head. Oxidation, metallic, light cardboard, fruity, burned, berries, chocolate, bread, light sourness. Sorry - its bad/infected !!! (5/3/3/2/9) - ReRate: Roasted. Light burned. Bitterness. Not infected. Light smokey. Licorice. Very nice. Ryrbread.","Frederiksberg, DENMARK","Theis"
1833,"2009-11-27",3.6,"Bottle 22fl.oz.Clear dark red brown color with a average, frothy to creamy, good lacing, mostly lasting, beige head. Aroma is light heavy malty, roasted, burnt, licorice. Flavor is moderate to heavy sweet and bitter with a long duration, english licorice acidic notes. Body is medium, texture is oily and sticky, carbonation is soft. [20091123]","VestJylland, DENMARK","fonefan"
1833,"2009-11-26",3.4,"Bottle 65 cl. Courtesy of Tweety. Clear dark brown with a small light brown head. Hard roasted malt in the nose. Medium body, hard roasted malt and a little vanilla and licorice. Mouthfeel is a litle tired. Discreetly bitter. 231109","Frederiksberg, DENMARK","Papsoe"
1833,"2009-11-24",3.4,"Sweet aroma with hard roasted malt, chocolate and caramel notes. Flavour was sweet with roasted malt, caramel, chocolate and hints of toffee. Finished sweet.","Frederiksberg C, DENMARK","KimJohansen"
1833,"2009-11-23",3.6,"cloudy brown, small brown head
slightly boozy, gorasted grains, 
flavor is faint dark fruits, sweetnes, brown sugar, faint chocolate (good chocolate). it all melts together to give a very nice sweet impression.","Copenhagen, DENMARK","Pinball"
1833,"2009-11-23",3.8,"Bottled. Deep reddish brown coloured. Light brown head. Roast, fruits, coffee, light molasses in the aroma. Flavour of coffee, roast, herbs, caramel, dust and fruits. Medium to full bodied. Dry roasty light bitterness.","Søborg, DENMARK","madsberg"
1833,"2009-11-23",3.6,"Bottled. A deep red beer with a thin brown head. The aroma has notes of roasted malt and chocolate. The flavor is sweet with notes of roasted malt, chocolate, and lighter notes of alcohol, leading to a dry alcoholic chocolate finish.","Citizen of the universe, DENMARK","Ungstrup"
1833,"2009-11-23",3.7,"22 fl oz bottle. Pours dark brown with a small tan head. Aroma is roasted chocolate and malty. Sweet and roasted malt flavoured. Bitter and roasted flavoured. Roasted and light fruity to bitter base into the finish. Bitter and roasted finish.","Copenhagen O, DENMARK","yespr"
1833,"2009-11-13",4.4,"Thanks to fishingnet for sharing this one.  Pours dark brown/ black with an off-white head.  Nose is dark fruit, chocolate, roast, smoke, and lots of awesomeness.  Flavor matches this level of awesomeness with the 8% ABV hidden real well.  Add to that vanilla, complexity, love, chocolate, plums, burnt sugar, and fruit.  Excellence in a bottle.","North of Tampa, Florida, USA","markwise"
1833,"2009-11-01",3.9,"Sampled from 22-oz bomber as Killer Kapowski during Darkness Day 2009 in Brooklyn Center, MN. Pours an opaque dark brown colored brew with light tan head that slowly dissipates to a thin film top. Aroma of caramel malt, dark chocolate, a hint of candi sugar and coffee. Taste is full bodied, flavors of roasted dark malt, chocolate, a hint of coffee and some candi sugar. Finish is semi-sweet that slowly disappears.","Papoose Jct, Minnesota, USA","Skyview"
1833,"2009-11-01",4.2,"Big thanks to fishingnet for scoring yet more tasty Flossmoor brews. Pours deep mahogany with tan head. The aroma has chocolate, some roast and then it seems to move into thick dark fruity esters. The taste begins creamy with some velvety pelt like fuzziness bringing a touch of earthiness and then rich chocolate. By midway it moves into more earthiness and loads of musty prunes, dates and figs. It ends with drying roastiness and chocolate. All the chocolate is pretty darn yummy and amazing but pulls this a bit out of style. But big deal. Its damn good.","Tempe, Arizona, USA","Ibrew2or3"
1833,"2009-10-31",4.0,"bottle thanks to ilovedarkbeer.  Pours dark brown/black with thinnish head. Aroma of chocolate and vanilla.  Flavor is ash, malt, caramel, coffee.. everything good.  Really good beer.","Dallas, Texas, USA","bhops"
1833,"2009-09-30",3.6,"22 oz. bottle - second time trying this one; thanks Tom and Colin!!  thin, cola brown with aromas of toffee and bread; texture is quite thin and comes of slightly on the sweet side; raw candy and sugar; love the nose, but comes off kind of bland","Seattle, Washington, USA","SuzyGreenberg"
1833,"2009-09-15",3.7,"Bottle thanks to ilovedarkbeer.  The  smell is malts, chocolate, coffee, toasty, and roasty.  The look is brown to black in color with a beige colored head.  The taste is malts, roasty, coffee, and chocolate.","Dallas, Texas, USA","travita"
1833,"2009-08-25",3.6,"First Flossmoor, risng star,  Black is the colour, a tiny Caesar head, perhaps truncated by cap crooked off...a little worse for shipping but still a great baltic. Mellowed, as understated carbonation perhaps reflecting shipping, coca-cola-ish mixed with Baltic.  It refreshes, its on the sweet side. Above average mouthfeel.","Toronto, Ontario, CANADA","Sammy"
1833,"2009-08-23",3.6,"From the Jug at the GABF Colorado Convention Center, Denver 09/10/2008
Fruit and some roast aroma. Black and strong in alcohol with a little dryness in a crisp and bitter roast finish.","Northwich, Cheshire, ENGLAND","DJMonarch"
1833,"2009-08-22",3.7,"Bottle thanks to ilovedarkbeer. Deep brown in color with a decent sized beige head. Aroma is of roasted malt and dark fruit. Taste is of roasted malt, light licorice, and chocolate.","Arlington, Texas, USA","jkwalking05"
1833,"2009-08-16",4.1,"bottle thanks to ilovedarkbeer.  deep brown with a cream head. nose is chocolate, sweet malts and fruit. nice thickness and a very smooth chocolate flavor that finishes with a hint of fruit.","Dallas, Texas, USA","mar"
1833,"2009-08-08",3.6,"Bottle thanks to ilovedarkbeer. Pours a dark brown/black with a beige head. Nice aroma of dark roast, malt, nuts. Flavor of dark roast, malt, nuts and alcohol. Mouth feel is medium body with medium high carbonation. Overall, very tasty porter!","Mata Gorda, Texas, USA","SphinxTX"
1833,"2009-07-31",3.7,"Bottle courtesy of ilovedarkbeer. Dark brown that lightens towards the top. Has a doughy aroma with hints of fruit. Alcohol is felt on the nose. Roasted and smoky on the taste. Bits of heavy malt. Nice and complex. Fairly heavy sitting also.","Arlington, Texas, USA","Cavie"
1833,"2009-07-30",4.0,"Bomber courtesy of hellbilly. Aroma at first was sweet ginger and cinnamon licorice candy. Second pour aroma more of a roasty nose. Sweet candy laquers the palate along with the ginger and some roasty malt in the mix. Second glass from bomber was more roasted malt and thicker body texture. One of those complex brews had so much going on with it. Enjoyable brew thanks Josh.","Mesa, Arizona, USA","Bockyhorsey"
1833,"2009-07-30",3.3,"Appearance: Pours out a dark brown, near black body with a smallish, ivory-hued head.

Smell: Surprisingly simple nose smelling lightly of roasted barley, unsweetened chocolate, licorice, and, well, thats about it.

Taste: Roasted barley with sweetish, somewhat diluted tastes of basic chocolate, caramel, and licorice. Low earthy, roasty bitterness. Darkened grains and hints of dark fruits. Roast and a warming alcohol presence on the otherwise light, clean finish. A ""killer"" it is not.

Mouthfeel: Medium-bodied. Medium-low carbonation.

Drinkability: The tastes within were subtler and far more understated than Id prefer. Also, the body seemed a bit on the lean side. While Im happy to have gotten the chance to try this, it just didnt win me over.","Woodstock, Georgia, USA","ChainGangGuy"
1833,"2009-07-07",3.8,"Bomber.  Pours dark brown with a tan head.  Smells of roasted malt, pepper, fruity. Tastes of roasted malt, chocolate, touches of coffee, burnt licorice, some nice bitterness on the finish.","Connecticut, USA","Cletus"
1833,"2009-07-06",3.6,"A Mes rate. Bottle at Pre ZBF thanks to Urbs.Good black and tan looks. Fruity and malty with some slight bread. Faint chocolate and fruit but not enough complexity to really make it sing. A fairly basic Baltic porter but enjoyable all the same.","London, Greater London, ENGLAND","MesandSim"
1833,"2009-07-02",3.2,"Attractive deep brown pout with a thin tan head. Nose and flavor were sweet and metallic. Iron like. That was overwhelming any other influence. Full mouthfeel.","SF Bay Area, California, USA","AgentSteve"
1833,"2009-06-29",3.6,"Liquid Sunshine VII Tasting  Kirkland, WA
Aroma: Dark malt aroma with a strong alcohol aroma with chocolate.   
Appearance: Black in color, Clear with a thin head.  
Flavor: Big dark malt beer with lots of alcohol with chocolate flavors the smoke also lingers.     
Palate: Dry Strong Baltic Finish, with a Good Mouthfeel.  
Overall: Big beer this was it would catch you fast if your not careful. Loved the dark flavors and lingering chocolate.","Olympia, Washington, USA","BrewDad"
1833,"2009-06-29",3.5,"Thin coffee aroma, very dark brown, thin tan head.  Gentle smoky quality, full mouthfeel.  Chocolate comes in the finish nd increases in density.","Bothell, Washington, USA","scrizzz"
1833,"2009-06-28",3.8,"22oz Bottle. Nice, soft wheaty roasted aroma. A bit of charred tang, and some light bourbon. Calm. Pours a dark brown, molasses-caramel-colored, with a fringe edging sienna-orange and rim in dark khaki. Flavor is even more subtle than I expect. Somehow, a very traditional eastern European character develops first with cool lager crispness, then the pils character, before a more subtle and subdued roast and char. The slightly lower viscosity and the slightly higher carbonation makes this drinkable, but dont quite give it the dense punch that I would expect from something like Koff. Still, fresh, flavorful, balanced, relatively dry, and the alcohol is very well integrate. A nice example. Nothing crazy. Thanks Steve!","Ithaca, New York, USA","auerbrau"
1833,"2009-06-18",3.4,"Thanks to that mook below me for sharing this brew. I was actually less impressed by this than my fellow tickers. While the pour was handsome enough (though nothing particularly memorable or appealing), and the aroma inviting with its promise of malts and sweetness, I found the body to be way too thin for this style. Missing, too, was the lactic quality that I was anticipating and I found the result to be a fairly solid strong porter but not much more.","Durham, North Carolina, USA","JCB"
1833,"2009-06-18",3.6,"Thanks StFun. Pours a dark black with a light tan head. The nose is sweet, malty, roasty, some chocolate. Flavor is chocolaty, mildly oxidized, some sweetness, coffee roast, acetaldehyde. Palate is a tad thin and sweet.","Chapel Hill, North Carolina, USA","emacgee"
1833,"2009-06-17",3.7,"Thanks to Ethan for sharing !  Dark brown pour with a beige head and spotty lace.  Light roast and bittersweet chocolate on the nose.  Kinda thin for the style.  Nice bitterness especially upfront. Chocolate, fruits and roast.","raleigh, North Carolina, USA","ucusty"
1833,"2009-06-13",3.8,"22oz bottle courtesy of wkcyr4 poured into a tulip.

Pours a dark, dark chestnut brown with a small tan head that dissipates quickly and leaves a small ring and decent lacing.

There a big sweetness right from the outset in the nose with lots of dark malts and semi-sweet chocolate.  There are hints of both dark fruits, raisins maybe, and espresso.

The taste is just as sweet with lots of chocolate and caramel hitting up front with the underlying malt base being slightly toasted.  There is a bit of bitterness in the finish, mostly from the chocolate and a hint of alcohol burn.

The body is on the fuller side of things with a soft carbonation and fairly dry finish.

This is a big Baltic porter whose complexity and heft border on that of an impy stout.  Its got tons of flavor and body and is another great offering from Flossmoor, who continues to impress.","Atlanta, Georgia, USA","GAManiac"
1833,"2009-06-11",3.9,"22oz Bomber on Pizza Plants Miss Buffalo Cruise. Metzger!!! Labeled Killer Kapowski. Dark pour. Aromas of dried fruit, anise, chocolate. Taste was full flavored, anise/ licorice, dried fruits, roasty. One very good porter. Bill, get a keg next tome","Buffalo, New York, USA","swoopjones"
1833,"2009-06-08",3.8,"22. Thanks, Pantanap! Pours an ebony darkish black with muted caramel highlights and a thin tan rim. Mild chocolatey nose. Gorgeous creamy medium body. Big chocolatey mid-palate with little bits of roast and anise there as well. Long roasty, chocolatey finish. Beautiful, unflawed, straightforward baltic. Delicious.","Mukilteo, Washington, USA","after4ever"
1833,"2009-06-04",3.8,"Kopalski bottle, via trade with STFun.  Pours blackish with a tan head.  Nose is sweet, malty and rich.  Taste is sweet, malty, rich and awesome!","Portland, Oregon, USA","WeeHeavySD"
1833,"2009-05-29",3.9,"Pours translucent dark brown with a thin tan head. Soft and sweet chocolate taste and aroma with little bits of roasty flavor dancing around it.","Kirkland, Washington, USA","bitbucket"
1833,"2009-05-27",3.9,"Bottle. Pours a dark black brown color with medium to large sized canvas head. Tastes like smoked apple wood chips, dark caramel, cocoa nibs, and a little bit of candied apple. Labeled as Killer Kapowski as a tribute to Ms. Saved by the Bell, nice. Supple mouthfeel and decent finish. Enjoyable.","Arlington, Virginia, USA","ilovedarkbeer"
1833,"2009-05-22",3.8,"On tap @ Flossmoor.  Pours darkest brown/black with a thin tan head.  Malty aroma with dark fruit and coffee.  Malty chocolate flavor up front, then dark fruit and licorice with a coffee finish.  Good stuff.","Capital City, Ohio, USA","JaBier"
1833,"2009-05-20",4.1,"Bottle from BrewCzar - Pours a thin dk brown with a medium tan head...aroma is cocoa, dark fruity malt, fresh hop resin...flavour is similar, dry cocoa liquore, old fruit, a bit of charred wood bitterness...finish is coffee with a bitterness that fades, but the flavour sticks around, almost no alcohol presence...nice brew...","Boise, Idaho, USA","ditmier"
1833,"2009-05-19",4.0,"Bomber picked up @ Whole Foods Cicero & Peterson. Opaque black color, beautiful creamy expresso head, lace. Chocolaty, a bit milky aroma. Very liquerish palate. Roasted, burnt malty flavors. Milky flavors like in some sweet stouts. A bit sticky finish. Smooth and balanced, although not very complex. Excellent brew!","Chicago, Illinois, USA","hombrepalo"
1833,"2009-05-18",4.6,"This beer is a very very nice baltic porter. its thiner than the duck rabbit baltic or the alaskan baltic but the flavor and complexity is top notch. I can see why this medalled at gabf.","Texas, USA","BgThang"
1833,"2009-05-17",3.9,"Poured pitch black, but bright ruby highlights when swirled. 
Nose of dark chocolate
Tastes of dark fruits, dark chocolate, bitter black malt","San Diego, California, USA","tokyogoat"
1833,"2009-05-17",4.0,"22oz bottle.  Pours a very deep brown that turns to black in the glass.  A thick tan head sat a top the midnight brew (I should be a writer)......haha.  Dark fruits and bitter sweet chocolate were dominant with some coffee in the background.  Medium sweetness, dark fruits and chocolate flavors.  Finish was long and of medium sweetness.","San Diego, California, USA","Snojerk321"
1833,"2009-05-15",3.9,"Bottle shared by Sparky27...THANKS ERIC!!!  First taste of something from Flossmoor and I wasnt at all disappointed.  Black at its center but a mixture of crimson and chestnut at its outer edges.  The latte-colored head left a number of sticky ringlets on the inside of the glass.  Aroma fills the nose with bitter dark chocolate, fresh roasted coffee, and burnt caramel.  Flavor is rich cocoa, ash, and dark fruit.  A little smokey and very good.","Phoenix, Arizona, USA","BOLTZ7555"
1833,"2009-05-15",3.7,"Light hints of black olives in the aroma.  Flavor has a rather nutty side.  Quite full flavored.  Pretty good stuff.","Waltham, Massachusetts, USA","RCL"
1833,"2009-05-12",4.0,"Bomber.  Pours dark reddish brown/black with a one finger tan head.  The nose is dark fruits, roasty malt and cocoa.  The taste is ashy cocoa, burnt malt, milk chocolate and some bittering hops in the finish.  Medium creamy mouthfeel.  Very good.","Phoenix, Arizona, USA","Sparky"
1833,"2009-05-02",3.6,"Floosmoor pre DLD ... Deep black ... thins lacing ... deep deep roast ... little coffee nose ... roast malts ... again deep toffee ... more bitter than i like ...little chocolate...","Edinburgh, SCOTLAND","cgarvieuk"
1833,"2009-04-30",4.2,"im going to say this one came from noblesquirrel though i got the hookup from a bunch of guys!... many thanks to you all.

it pours brown at the edges but nearly black in the middle with a big ol tannish head. 

the nose is a delicious mix of fudgy chocolate, dark raisins, molasses, toasty grain, spent black barley and faint flowers with a smokiness in the back ground. 

there is a defined ashiness and light sourness hanging around the palate...both are a nice balance to a rich mix of creamy chocolate, barley earthiness, cooked dried figs, wood, molasses and just a touch of sweetness. that tartness comes in to clean off the palate so  a chocolate bomb and toasted nuttiness can linger on the aftertaste.

the medium to medium-full body is rich, lux and soft yet terribly easy to drink as the tartness provides a nice counter. 8/4/8.5/4/17/4.15","scottsdale über alles, Arizona, USA","hellbilly"
1833,"2009-04-28",4.3,"UPDATED: MAY 5, 2009 16oz draft at brewpub pre-DLD. pours damn near jet black with a thick, sandy brown head. aroma is amazing with big, dark roast coffee, black cherry, dark chocolate, sweet pistachios, and big dark caramel malts. flavor was absolutely delicious with big tastes of black coffee, chocolate covered raspberries, roasted walnuts, and rolled oats with a touch of hops and big, bitter coffee finish with a touch of brown sugar sweeness. palate is full bodied, smooth and buttery, with solid carbonation. simply the best baltic porter ive had the pleasure of tasting.","Norfolk, Virginia, USA","ksurkin"
1833,"2009-04-28",3.9,"This poured an almost black color with a big light brown head. Aroam was strong residually sweetness and roasty but not burnt at all. Flavor was thixck sweet dark mlants, hitns of light coffee and some molasses maybe as well. A very very good Baltic Porter","Pittsburgh, Pennsylvania, USA","Beerman6686"
1833,"2009-04-27",3.8,"Tap at Flossmoor, pre-DLD. Rich, juicy porter. Deadish black pour with no head. Flat dark chocolate and sweet stone fruit aroma. Huge plum and boozy, woody chocoate flavor. A demanding beer, not for the faint of heart. The strongest legit Baltic Porter Ive had. Idve liked to take a bottle to go but I kind of forgot.","New York, New York, USA","puzzl"
1833,"2009-04-26",4.2,"On-tap pre-DLD 09 (but with a number of bottles to enjoy later!).  I loved this beer.  Very smooth, great raisin-y flavor and some lovely residual sweetness.","Chicago, Illinois, USA","Tweety"
1833,"2009-04-14",4.1,"22oz bottle, also sampled on draft at release party.  Pours a dark near black with a large frothy tan head that fades into a dense froth 4.5.  Tangy aroma of roasted malts, light fruit, faint chocolate, some grassiness, sweet figs, a bit floral.  Great baltic porter taste, not too sweet, quite rich, some acidity, bitter dull roast, rich flavor but not exceptionally sweet, very smooth, dry and bitter, slight butter quality, hint of grassiness, lots of bakers chocolate, subtle licorice aftertaste 8.5.  Similar acidity, tannic, fruity, bitter qualities as Stones RIS. 
Full mouthful, slightly chalky and less creamy, very smooth, smooth fluffy carbonation 4.5.  Great beer, very drinkable and quite dry.","Chicago, Illinois, USA","17thfloor"
1833,"2009-04-12",3.8,"CPLYFO 09.  Deep dark brown with ruby highlights, and a foamy beige head.  Aroma is nutty chocolate, light roast, hints of coffee, toasty sweet malts, caramel, burnt toast, and hints of diacetyl.  Chocolate flavor - brownie with sea salt- like the ones you get at trader joes, chocolate and vanilla butter cream with the diacetyl, along with some slight soy and sherry oxidation that goes well with the sweet malts and nice smooth chocolate. Unique stuff.","Hoboken, New Jersey, USA","Dickinsonbeer"
1833,"2009-04-09",3.6,"Bottle shared by Hophead22. Can you say chocolatey goodness? Also with some coffee aroma. Dark red almost black in color. Flavor is opposite the aroma,  nice coffee flavor with a touch of chocolate. Very  nice.","California, USA","NickTheElder"
1833,"2009-04-07",3.9,"Bottle shared by Hophead22.  This was DuffmanSWs mystery pour.  Fuckin Sean.  Pours a clear reddis black with a tan film.  Aroma is chocolate and a load of roasted coffee.  Flavor has the same coffee and chocolate with a touch of smokiness.  Hints of tobacco in there.  Nice medium to full bodied and creamy.  Full of flavor but simple.  I like it.","Alta Loma, California, USA","mspindler"
