"beer_id","date","rating","text","user_location","user_name"
1833,"2014-10-12",3.4,"From old notes -- bottle at tasting. Black with ring. Chocolate coffee aroma. Chocolate coffee minimal fruit vanilla wood medium rich soft body. Not a fan of the style, but good.","Springfield, Vermont, USA","malrubius"
1833,"2014-05-18",4.0,"(backlog) From beer temple. Dark brune pour with tan head. Chocolate, roasted, fruit and malt aromas. Full bodied brew, flavor follows aromas. Nice.","Wayne, New Jersey, USA","vtafro"
1833,"2013-05-12",3.5,"Bottled Killer Kapowski version. Dark brown pour with a khaki head. Lots of roasted malt and cocoa. Some coffee, a bit of toffee sweetness, and some sweet dark fruit notes. Licorice on the palate along with roasted malt, cocoa, and coffee. Light malt sweetness, dark fruit, and a hint of ashy bitterness.","Dublin, California, USA","brokensail"
1833,"2013-05-01",3.4,"Bottle: Poured a deep brown/black color porter with a medium size dark brown foamy had with good retention and minimal lacing. Aroma consists of chocolate with light raisins notes and some residual sugar. Taste is dominated by some residual sugar with some chocolate notes and some dry raisins. Body is quite full with good carbonation and light warming alcohol notes.  Overall taste is quite intense and this ends up being a real sipper which I think could be addressed by bring additional attenuation to increase the drinkability factor.","Gatineau, Quebec, CANADA","Boutip"
1833,"2013-02-02",3.7,"22 oz. bottle, sent from StFun (thanks Josh), pours black with a small tan head. Aroma is a bit oxidized but not too bad, with some fruitiness, cardboard, and chocolate. Flavour brings out notes of raisins and milk chocolate dominantly, with a bit of wet cardboard and a hint of roast. Finishes on notes of milk chocolate and light roast. Though not in prime condition, this has actually aged quite well. Very enjoyable baltic porter.","Vancouver, British Columbia, CANADA","mcberko"
1833,"2013-01-30",3.3,"650 mL bottle courtesy of StFuncool, thanks! I wish I had adamantium claws to deal with all the electrical tape wrapped tightly around the cap these days. But, anyway, it pours a a vinegary, wooded darkish brown sustaining a frothy tanned ring which rested atop. Aromas of leather, banana peppers, raisins, aniseed, toast crumbs, milk chocolate... cardboard? Chestnuts? Yeah, okay. Perhaps some bourbon as well? Tastes of nuts, caramel, yeast, with a touch of heat, ash and toast by mid-palate to swallow. Incredibly reminiscent of a Scotch ale, albeit one whose flavors are a little on the imbalanced-side. Still deciding whether or not I actually like this beer.","Massachusetts, USA","radarsock"
1833,"2012-09-16",4.6,"Bottle from the deliriumfest cellar sale (guessing this one is a few years old).  Thick dark black pour, ring of light brown carbonation and an awesome aroma of rich black cherries, plums and slightly sweet dark chocolate.  Flavor is just as good as the aroma, black cherry skins, some sweet alcoholic raisins, plums, a little soy/peat and finished with some bitter chocolate.  Even with some slight hints of age, this was stellar.  Would like to get a fresh bottle or a growler to compare.","Eden Prairie, Minnesota, USA","DalzAle"
1833,"2012-08-07",3.8,"bottled, thanks to SS, crimson brown pour with thin bubbly foam , aroma is chocolate, dates, roasted nuts, coca cola, flavors of dates, raisin bran, chocolate, malty, rye whiskey, nice","Dallas, Texas, USA","blutt59"
1833,"2012-06-26",3.5,"Bottle at home, from my Minneapolis Town Hall glass, with thanks to Doodler - Ive been trying to track this one down for a while! Poured into my Minneapolis Town Hall glass, showing really nice chocolate brown colour with an opaque core. Medium-thick pale tan head is short lived, with ropey lacing. Nose is tart berries, cocoa powder, wood, and dense fruit, with a whiff of smoke as well. Flavours of tart berries, Tootsie pops, cocoa, very tart, moderate to light carbonation. Good, but not great.","Lethbridge, Alberta, CANADA","Savvy1982"
1833,"2012-04-13",3.6,"Bottle.  A little all over the place with a wide range of flavors.  It seems like it cant make up its mind between being fantastic and outright offensive.  Somewhere in the middle though there are lots of flavors including chocolate, caramel, smoke, tar, roasted malts, and a large amount of dark fruit.  Despite its brief downfalls, such as a weird carrot juice thing, it remains to be a pretty good baltic porter.  However, it will have a hard time competing against others in its class such as Smuttynose Baltic Porter.","Dayton, Ohio, USA","Bigmmartin"
1833,"2012-03-09",3.9,"Pours dark unclear amber brown in color with a decent caramel head. The aroma is like a barleywine with some smokiness added. The flavor of sweet roasted and smokey malts with some bitter notes that trail off easily on a smooth but full body.","Royersford, Pennsylvania, USA","Damico"
1833,"2012-02-24",3.5,"Bottle @ Dans place, Denver. Pours very dark brown with a fading offwhite head. Aroma of raosted malts, burnt caramel, dark chocolate, coffee, dark fruit. Taste is malts, dark chocolate, caramel, roasted toast, coffee, raisin and other dark fruit. Medium body, soft carbonation. 220212","Hasselager, DENMARK","Camons"
1833,"2012-02-22",3.8,"Pour out of bottle, thanks to Aaron for the pour! Dark brownish black with red at the edges, aroma has notes of cocoa nibs, toffee, dark fruit with raisin, figs, plums, touch of burnt toast.  Taste is a mix of nice roasted coffee, bitter roast, some slight dark fruit, hints of cocoa, touch of biscuit, finishing fairly sweet but dry.  Interesting.","East Lansing, Michigan, USA","arminjewell"
1833,"2012-02-22",3.7,"Bottle @ Dans house. Black appearance with a small brown head. Nutty, dark chocolate, caramel, a touch roasty, raisin, plum aroma. Creamy, somewhat burnt, toasty, dark chocolate, toffee, caramel flavor with a creamy mouth feel.","Fort Collins, Colorado, USA","adnielsen"
1833,"2012-02-19",3.9,"Pours a jet black with tan head. Nose and taste are of dry hops, sweet malts, dark fruits like fig, raisin, plum. A very solid offering.","Long Lake, Illinois, USA","JoePeesie"
1833,"2012-02-04",3.8,"Bottle shared by MrPickles...thanks Andy! - Pours mahogany with a thin tan head. Nose is roasty coffee, with dark fruit and sugary dark malt. Taste has the same coffee note, with the same raisin, prune, and dark fruit. Pretty sweet and malty, with a long dark fruit finish. Nice smooth body, well-carbonated, and medium-bodied. Very nice stuff.","Middleton, Wisconsin, USA","madvike"
1833,"2012-01-27",3.9,"Bomber pours dark brown/black with a slight amber hue and a medium tan head. Aroma of soy sauce, dark fruits, chocolate, molasses, and nuts. Taste similar to aroma with slight coffee, very well balanced and drinkable. All the mentioned flavors come together under a nice level or roasted malts ending on a slight bitter note. Really nice, very enjoyable!","Minneapolis, Minnesota, USA","Atom"
1833,"2011-12-20",3.8,"In short: A rich and well balanced Porter.  Surprisingly easy to drink.  Very good
How: Bottle 22oz.  Consumed approximately when 6 months of age.  Bottle sent to me by FullObs, thanks a lot Brett 
The look: Near-black body with red highlights topped by a medium tan head
In long: Nose smells rich with cocoa beans, Fig Newton, milk chocolate and more.  Taste is surprising by its drinkability.  Some roast A lot of desert-like flavors (date squares, Fig Newton, milk chocolate, nougat, mocha coffee) but also a good amount of leafy spicy that provide a good balance.  Mouthfeel was full and creamy.  I went through my bomber as if it was a 5% session stout, thats a good sign.  Named after Walter ""Killer"" Kowalski, a pro-wrestling star from this TV show where company advertises to reach the coveted 65 to 85 IQ demographic.","Montreal, Quebec, CANADA","Glouglouburp"
1833,"2011-12-09",4.0,"UPDATED: FEB 17, 2015 Quite good. A little like a dopple bock in some of the malt flavor. Has some flavor of dried fruits soaked in brandy. Serving: Bottle","Chicago, Illinois, USA","rubbishystuff"
1833,"2011-12-02",4.2,"Bomber bottle from a trade with Dchmela! Nice thick pour with a thin fast disappearing head. Sweet toasty malts with coffee and chocholet balanced in. Fantastic pallet!","Tucson, Arizona, USA","Maltajo"
1833,"2011-11-27",4.1,"My 2000th rating.  A big thank you goes out to all the great bottle shops and beer bars in the DC area who carry a progressive lineup of beer that is always evolving.  Thanks to all those proprietors who take pride in stocking the freshest, best beers available both in the United States but also from all across the world.  I need to say thank you to everyone here on the best, most informed, most unbiased beer related site on the internet; Ratebeer.com.  I have been truly blessed to have found a great number of friends and acquaintances thanks to Ratebeer.  I have been significantly more informed as a result of my Ratebeer participation and have had opportunities to attend tastings and events; big and small, formal and informal, which have afforded me the opportunity to try beers from all over the world.  Thank you to the other DC/Baltimore Ratebeerians who have attended or hosted all of the great tastings I have had the opportunity to attend.  Thank you to all the great Ratebeerian Traders who have been so generous and so kind in trading their beers to me.  Thanks to all the great BeerAdvocate traders who have helped me out when a deal couldnt be worked out on Ratebeer.  Thanks to my wife, who graciously puts up with me when I take her to all the out of the way brewpubs just because they have a top rated Kolsch or Brown Ale.  What makes Ratebeer truly special and truly unique is that we are the very definition of a community centered upon the advocacy of great craft beer.  I am thankful that I can be a part of it and hope that I can give as much to the craft beer community as they have given to me.  A little ironic this is the 200th rating of this beer on our site.  22oz bottle I scored via the BA Gang Bang BIF.  Pours a translucent deep mahogany brown with one ring of creamy off white head.  Nose is sweet, brown sugar, light chocolate, dried fruit, a little cherry, toasted bread.  Flavor is awesome, sweet, malty, cherry, toasted bread, light licorice, chocolate, a little cola, light coffee.  Medium bodied, dry finish.  Very drinkable.","SouthWest, Washington, Washington DC, USA","nimbleprop"
1833,"2011-10-29",3.8,"This brew pours a clear dark brown color with a medium light beige head that diminishes steadily. Patchy lacing on the glass. Aroma of roasty malt, anise bread and chocolate. Medium body with flavors of chocolate malt, black licorice, earth and fruit. The finish is peaty malt and chocolate. Pretty unique, above average beer all around.","Columbus, Ohio, USA","Dogbrick"
1833,"2011-10-18",3.9,"Bottle. Almost black and opague. malt, coffee and maple syrup in the aroma. Full bodied. Creamy flavor with chocolate, mocha. Sweet. Hints of licorice in the aftertaste, Well balanced. Good.","La Tropica, NETHERLANDS","bierkoning"
1833,"2011-10-14",4.0,"Date: October 14, 2011 Mode: Bottle Source: Trade with FullObs Appearance: Opaque dark brown with slight amount of head. Aroma: Chocolate, roasted, nutty, and maybe some caramel. Flavor: Consistent with aroma except not a sweet chocolate, full bodied, smooth with a slight bitter and alcohol/dry finish. Other: Liked everything about this until the finish.","Bourbon County, Minnesota, USA","ryanfolty"
1833,"2011-09-30",3.5,"not cool to name a beer after a killer, this beer murdered my sister!! .. . Pours a deep brown, medium foam .. . chocolate, light roast, and deep fruit roast .. . decent .. . . 

not on our show, skippy!",".....Manchester United.........., Texas, USA","SudsMcDuff"
1833,"2011-09-29",3.6,"Bottle shared by phaleslu. Thanks Peter! Pours dark brown with a very thin tan head. Beer seems pretty flat. Aroma is chocolate, molasses, cocoa. Flavor is cocoa, chocolate, coffee and molasses. Medium bodied with little to no carbonation.","St Louis, Missouri, USA","jckp64"
1833,"2011-09-28",3.6,"22 oz. bottle from TheAlum- thanks, Adam! Killer Kapowski. Should have been wearing my Windy City Rollers shirt when I opened this one. Anyway, I noticed the cap wasnt on very well so I brought it out sooner than I had planned on opening it. Pours a deep, flat cocoa brown with a minimal beige ring. Aroma of chocolate, soy, cocoa powder, molasses, and some hints of oxidation- thanks, weak cap. Flavor of coffee, cocoa, nuts, tobacco, earth, and molasses. The flavor was roastier than the sweeter nose. Not showing the same oxidation as the nose, but there wasnt really any carbonation to speak of. Light-medium bodied. Nice, and probably better fresh and on tap.","Cincinnati, Ohio, USA","phaleslu"
1833,"2011-08-17",3.8,"Old bottle (2009?) from a trade a long time ago. Pours with a near black body with a small tan head that lasts decently well. Aromas of dark fruits, fig, molasses, tar, light oxidation. Chocolate, subtle fruit notes, bready. Flavors are chewy, fudge, currant, figs and tar. A bit of bready malt. Light oxidation and a hint of a metal flavor. Medium to light bubbles with a fuller body. Smooth, lightly warming.","Los Angeles, California, USA","BMan1113VR"
1833,"2011-07-22",3.5,"Aroma is roast, coffee, some malt sweetness, chocolate.  Pours black, tan head with average retention.  Chocolate and roasty flavor, creamy and smooth, sweet caramel notes.  Medium-full body, smooth and silky, medium carbonation.","Iowa, USA","ekoerper"
1833,"2011-06-29",3.9,"Bottle from bauermj.  Pours dark brown, some amber highlights sneaking through, with a thin head on top.  The aroma at first is incredibly chocolaty.  Its like opening up a box of fresh assorted chocolates.  A toasty nutty scent with dark fruit follows.  This drinks very smooth and creamy with some ashy notes in the finish.  Getting plenty of the chocolate here too but its maybe not quite as strong as the aroma.  Graham cracker, prune, and a dash of a coffee liquor note gives this some depth.  Slightly roasty but its far more on the creamy side.  This is really solid stuff.  Love the drinkability, wish I had more.","Lake Mary, Florida, USA","changeup45"
1833,"2011-06-08",3.9,"Bottle shared with RB/BA folk...  Poured dark brown, near black with an off-white head.  Really wonderful, some roast and vanilla, and a decent sweetness.  Nice, light body and great yeast character with dark fruits, cherries, cocoa, dark malts, and a clean finish.","Portland, Oregon, USA","boFNjackson"
1833,"2011-06-07",3.5,"(22oz bottle) rich dark brown pour, nice film of wispy offwhite bubbles. Nose of a bit of oxidation, leather, molasses, mildly vegetal and chocolaty. Taste of toasty cracker, bit of dry unsweet chocolate, tiny bit salty, alcohol kick and some nutty elements. Crisp but soft carbonation.","Dallas, Texas, USA","thirdeye11"
1833,"2011-06-03",3.6,"Bottle. Pours a clear dark brown with a grayish brown head that dissipates slowly and completely. Aroma has notes of bittersweet chocolate with a light roasted malt note and a bit of underlying dark fruits. Flavor is similar with chocolate in the start that is joined by some roasted malts that grow through the finish.","Minneapolis, Minnesota, USA","deyholla"
1833,"2011-05-25",3.5,"66cl Bottle kindly shared by Rciesla and Vtafro at Beer Temple, cheers guys! Deep dark brown to black colour, light beige head. Aroma of sweet rye, some chocolate, dark fruits, roasted malts, a bit bock-like. Flavour is sweet, malty, rye, chocolate, roasted malts, light coffee taste, light bitter malty finish. Light to medium bodied. Nice.","Zaandam, NETHERLANDS","Borresteijn"
1833,"2011-05-16",3.4,"Bottle.  Dark brown pour with a small white head.  Aroma is chocolate and roasted coffee.  Taste is sweeter with a slightly boozy finish.  Chocolate, roast malt, slight coffee.  Overall just a bit sweeter that I was expecting.  Almost like a sweet stout.  Meh.","Minnesota, USA","mattyb83"
1833,"2011-05-16",3.5,"Bomber.  Pours a deep cola brown with some jet black highlights and a tiny off white head after an aggressive pour.  A lot of the smokiness comes through on the nose with a woody, chocolate backbone, but not so much smoke in the taste.  The smoke is definitely more along the lines of subtle peat, and not necessarily campfire.  Sweet chocolate dominates the palate along with coffee, dried prunes, and roasted malt.  Full bodied and rather sweet for a baltic porter, yet drinks like a sweet stout.","Murderapolis, Minnesota, USA","mtjoseph"
1833,"2011-05-14",3.6,"22oz bottle from sleestak 
Appearance: Pours clear dark brown with a medium beige head and some lacing 
Aroma: Sour dark malts and chocolate 
Taste: Tart, woody and toasted malts  
Nice, easy drinking","Utah, USA","Sledutah"
1833,"2011-05-13",3.5,"Bomber thanks to Craig. Pours a totally opaque black color with a medium beige head. The aroma is caramel and chocolates. The flavor is a smooth easygoing brew; chocolates, light bitterness. caramel, sugars, sweetness throughout. Nice.","Portland, Oregon, USA","douglas88"
1833,"2011-05-07",3.6,"Bottle pours dark brown with tan head.  Aroma a little sour with malts and roast.  Taste sweet malts, roast, caramel, chocolate, a little coffee.  full mouthfeel with a lot of carbonation.  Finish caramel and roast.  Alcohol slightly apparent.  This seems little on the milder side for a Baltic porter but overall its good.","Iowa, USA","Rando7"
1833,"2011-04-04",3.1,"Deep brown pour.  The aroma is rich and chewy.  Soft milk chocolate and a soft chewy sweetness.  Lightly vegetal as it warms up - which is unfortunate.  Meh.","Toronto, ON, Ontario, CANADA","JoeMcPhee"
1833,"2011-03-30",3.4,"650ml bottle poured into my Bruery tulip, latest batch... Pours with a very dark brown body, a faint hint of amber deep in the center. A light tan head only raises to leave a thing ring. Poor lacing... The aroma is very sweet, tons of milk chocolate, little too sweet for me. A little roasted grain too, smells like a porter, but a little simple... Taste packs much more of a punch. More smoke and bitter coffee notes, gets ride of the sweetness, Im a fan of that. Chocolate pokes its head out on the finish but so does a touch of alcohol. The front is successful but then a little down hill... The mouthfeel is nice, very full and chewy for a porter. 

Slightly above average porter. Drinkable for 8% though.","Chicago, Illinois, USA","chibuck"
1833,"2011-03-24",3.7,"Bottle that I took Max and Jesss place (since we never got around to opening it post EBF).  Pours a deep dark black with a thin beige head.  Roast and chocolate, cocoa.  Tons of roast, dark fruit, but very faint.  Fuzzy dark fruit notes, warm roast and malt, and some chewy tannins on the finish.","Poughkeepsie, New York, USA","j12601"
1833,"2011-03-20",3.3,"Bottle generously shared at Maxs FF winnings tasting. The name is awesome. Good looking black pour with persistent lacing. Aroma is odd of grass, feet, and caramel. The flavor ismuch better: caramel, pine needles, and coffee grounds. Earthy finish with plenty of wet coffee grounds. I liked it overall but would have had no clue this was a baltic porter.","Indiana, Pennsylvania, USA","italarican"
1833,"2011-03-19",3.8,"Bottle at Maxs tasting. Pours near black with a beige head. Roasted malty aroma, with floral hops, a touch of coffee, and chocolate. The flavor has roasted malts, a light sweetness, and floral hops. Nice.","La Mesa, California, USA","blipp"
1833,"2011-03-19",3.6,"Bottle at Maxs tasting. Pours black. Tan head. Nose of vanilla and chocolate malt. Taste of coffee, roast chocolate malt, vanilla and dry chocolate finish.",", New Jersey, USA","jtclockwork"
1833,"2011-03-16",3.3,"Im pretty sure this bottle is form 2011 and not 2009 since I just recently saw it at my local liquor store.

650ml bottle.

It pours a thick dark brownish black with a foamy light tan head. It leaves some decent lacing as it recedes.

The smell is interesting, it smells like an equal parts mix of plain Perrier, Czech pilsener, and coffee. Weird.

The flavor is the same way oddly enough, a bit roastier though. It has this mineral water quality to it that I dont mind but it just seems odd. It gets better with progressive drinks, and it also gets sweeter.

A bit of an oddity, it is a decent porter.

Serving type: bottle

Reviewed on: 02-02-2011 04:52:10","Chicago, Illinois, USA","crossovert"
1833,"2011-03-03",4.3,"Bottle from the brewery at Hi-Fi release. Not sure what this Kowalski alias is about, but delicious all the same! Poured brown black with a thin white head. Smell is coffee and chocolate with sweet roasted malts, very rich. Taste is just as rich, smooth and delicious as hoped. Chocolate and roasted malts. Lovin it.","","Roonai"
1833,"2011-01-08",3.9,"Dark brown pour with a foamy head.  Aroma is chocolate, roasted malt, and coffee. Flavor is chocolate, dark fruit, coffee, caramel, and roasted malt.  A good all around porter.","Beautiful Sunny Mesa, Arizona, USA","SuperDave"
1833,"2010-10-23",4.3,"From notes.  Tasted from a bottle purchased at Lush Roscoe.  Pours an opaque dark amber with a thick tan head that displays excellent retention.  The nose is sweet roasted malt with chocolate, bitter coffee, and a bit of vanilla.  The flavor is somewhat sweet with dark roast, some smokiness, nuts, coffee, chocolate, and light vanilla.  The body is full and sticky with light carbonation and a long roasty and vanilla finish.","Nashville, Tennessee, USA","wedgie9"
1833,"2010-09-30",3.6,"Getting some molasses and raisin aroma. Nice smooth full bodied flavor with a bit of milk chocolate malt and creaminess. A decent sweetness adding an extra bit of body.","Atlanta, Georgia, USA","jrob21"
1833,"2010-09-29",3.7,"Traded bottle. Absolutely gorgeous freakin pour; very lively too. Medium size tan head on top of a black body. Decent lacing. Sweet aroma with some roasted malt and strawberries? Surprisingly full mouthfeel. Coffee, burnt malt, dark sugar and some fruitiness. Very well done.","Panama City, Florida, USA","BelgianBeerGal"
1833,"2010-09-24",3.8,"Bottle thanks to markwise: Poured a dark brown with light corners. The aroma is dark chocolate, fruit, and oldish roasted malt. Taste is more chocolate, roasted malt and hints of dark fruit.","Wasilla, Alaska, USA","SHIG"
1833,"2010-07-21",4.0,"Handbottle from Duane. aroma has big chocolate, licorice, faint hop bitters in the backend. Flavor is all chocolate up front, faint coffee, big pine resin in the finish. Really well rounded for a bigger beer. Mouthfeel is a tad syrupy. Well done.","Lincoln Park, Michigan, USA","Styles"
1833,"2010-07-18",3.6,"Bottle. Pours a dark brown/black color with a small off-white head. Has a sweetish roasted malty chocolate aroma. Roasted malty chocolate and caramel flavor. Has a sweetish roasted malty chocolate finish with some bitterness in the aftertaste.","Malmö, SWEDEN","anders37"
1833,"2010-07-06",3.9,"Brown red pour with tan head and lace. Chocolate and light coffee aroma. Chocolate, roasted malt, and a good medium bitter. A medium full bodied beer. Very nice","decatur, Tennessee, USA","decaturstevo"
1833,"2010-06-19",4.0,"Bottle courtesy of flssmrbrewalum. Pours a nice deep brownish black with a light brown head. Aroma is licorice, chocolate, roasted barley. Flavor is toasted nuts, chocolate, roast, barley, licorice. Also, Some vinous fruity notes delicately linger behind all of it. Nicely balanced and medium bodied with a good dose of bittersweet choco-roast-barley bitterness balanced out with just enough sweetness.","Mesa, Arizona, USA","Rusty"
1833,"2010-06-07",3.6,"cheers to markwise for the share.
pours dark brown, than/mocha head.
aroma, chocolate, cocoa, some hops and malts.
flavors, light bitter dark chocolate, medium carbonation, notes of roasted malts/coffee, powdery cocoa nibs, touch of yeast and possibly some lingering spices.
Solid brew.","Enghien, BELGIUM","sebletitje"
1833,"2010-05-09",3.5,"Pours brown with a thin tan head. The aroma is big raisins, prunes, with some chocolate and a hint of coffee. The flavor is pretty much the same with the alcohol noticeable at 8%. Not too sweet and a little anise on the palate. It has  a big roasty, nutty finish.","Livermore, California, USA","joeneugs"
1833,"2010-05-02",3.7,"Bomber of Killer Kapowski shared by hansgrubers crew at DLD.

Pours pretty dark brown with a small off-white head and some decent lacing.

Aroma is nice and roasty.  Coffee, dark fruit notes, and anise as well.

Flavor is somewhat sweet and roasty.  Not too sweet.  Some dark chocolate notes, vanilla, coffee, and earth.  Very slight dried fruit aspect.  Tasty stuff.

Medium-full bodied and fairly smooth.  Pretty dry and slightly bitter on the palate.

Nice beer overall.  I enjoyed this one.","San Francisco, California, USA","nickd717"
1833,"2010-04-20",3.7,"Curtesy of After4ever, thanks Tom! Its black with a red hue and a huge, light-brown, lasting, creamy head. The aroma has notes of roasted malt, dark fruits and licorice. The flavour is moderately sweet with notes of roasted malt, licorice, vanilla, light dark fruit and the finish is dry. Its a nice one.","Thisted, DENMARK","Maria"
1833,"2010-03-25",3.7,"Had at the Rav Pig during RBWG 2010!  Big sweet chocolate up front with some malt.  The flavor is a bit lighter, but still full of malt, cocoa powder, milk chocolates, cream, and more. This is good stuff.","Georgia, USA","drowland"
1833,"2010-03-19",3.9,"bottle, pours black with a thin tan head.  Toffee and espresso aroma.  Sweet upfront chocolate ice cream turns lightly peaty with some heat from the alcohol.  I like it.","Tucson, Arizona, USA","fata2683"
