"beer_id","date","rating","text","user_location","user_name"
1833,"2009-04-06",3.9,"Bomber.  Pours a dark and rich mahogany color, glowing an ever so slightly lighter shade when backlit.  A dense, creamy, British khaki head fades to a thin film, leaving broken sheets and splotches of lacing behind.  The nose shows rich, raw cacao nibs, with caramel, sweet tobacco, and perhaps some hints of spicy green peppercorn.  Theres a healthy dose of earthy hops, along with some roasted chicory, all of which works really well together.  Flavors are melded beautifully, raw, woodsy, bittersweet cacao and dark caramel fighting for supremacy, with roasted coffee and dark fruits serving as backup.  Some lactose comes through in the form of mocha, while peppery, earthy hops finish things off.  Bitter spices linger on the finish.  The palate displays excellent balance, substantial and sweet up front, transitioning to a somewhat dry finish.  Very creamy on the tongue.  Really nice brew.  This is definitely up there in the upper echelon of the genre.","Orlando, Florida, USA","Beerlando"
1833,"2009-04-05",3.9,"22oz bottle from drewbeeme. Dark red pour.Aroma of chocolate and a little coffee. Flavor is coffee as well with a little chocolate, pretty good.","Redlands, by way of Wisconsin,, California, USA","Hophead22"
1833,"2009-04-02",3.7,"22 oz bomber courtesy of Todd.  Pours a dark mahogany cola with a medium sized light brown head.  Aroma of hay, chocolate and light molasses.  Taste of light molasses, chocolate, cocoa powder and roasted malt.","Doylestown, PA, USA","adrian910ss"
1833,"2009-04-01",3.9,"Bottle thanks to inkubus27. Dark black with little head. Tons of chocolate and roasted coffee in this one. Some nuttyness that goes very well with thte roasted flavors. Very good.","Orange, California, USA","kegbear"
1833,"2009-03-22",3.0,"Light on body, and not much head. Small aroma similar to taste of coffee and sweetness.","Kingston, New York, USA","yobdoog"
1833,"2009-03-19",3.2,"Bottle at the Alvinne pre Zythos event 09. I think that the CapedBrewsader got this right with the word ""ketchup"" and cheers to Phil for being great throughout the weekend.  Choccy porter.  Bit powdery and dry in the mouth.  Bith thin in fact.  Its ok but that reminder of ketchup runs through it.","Ashford, Kent, ENGLAND","harrisoni"
1833,"2009-03-17",4.0,"Another huge thanks to Honkeybra for this one.  Crushed with Jakebra.  Very roasty and tobaccoy on the nose.  Flavor is dominated by chocolate, big time, but the good bitter kind, not the sweet shitty kind.  Really, really liked this one.  Velvet mouthfeel.  A great dark brew.","Colorado, USA","That1Guy"
1833,"2009-03-17",3.9,"Bottle from the Otown throwdown.  Man I am glad I got to try this one!!  Dark dark brown pour.  Lots of chocolate and molasses in this one. Flavor has chocolate, vanilla, coffee and roast.  Good stuff!!","Scottsdale, Arizona, USA","daknole"
1833,"2009-03-15",3.9,"22 oz bottle.  Dark brown with a spongy tan head.  Nose is molasses and hay with hints of date.  Slick, medium body; kind of oily with a mild carb sting.  Taste is mocha, plum and licorice with bits of tar and tobacco.  Fruity with nice earthy touches.  Very good.","Media, Pennsylvania, USA","TheEpeeist"
1833,"2009-03-12",2.4,"Sample from a bottle at alvinne. Alround rating: Massivly roasty porter, dry and alcoholic, lots of dry bitterness. Totally not my style.","bantervile, Bedfordshire, ENGLAND","DonMagi"
1833,"2009-03-10",3.9,"On tap at the brewpub. Poured a black/brown tone with a foamy, tan head that left some good, clingy lacing. The aroma was immediately dark roasted malt, dark coffee notes and some dryness on the nose. The flavor continued the roasted malt nature and added some sweetness and caramel. A full bodied brew with a silky mouthfeel, and a nice, medium bitter finish. Now I can leave my beer locker bottle from the KK launch party alone ...for awhile.","Lombard, Illinois, USA","tmoreau"
1833,"2009-03-09",4.0,"Bottle compliments of Pantanap.  Rich and yummy - this is the equivalent of another great beer, the Dark Horse Black Bier.  I loved it and cant wait to try it on tap.  Bigger, badder and richer than your everyday Porter.","Dallas, Texas, USA","dukefan"
1833,"2009-03-07",3.6,"Head only lasting seconds; deep brown, cola-coloured beer. Sweet, pumpernickel bread, and alcohol in the nose. Sweet, very alcoholic impression, sweet bread, cake, wafflessyrup, maple, but somehow, not cloying. Almonds appearing in the finish. Very think, chewy MF, full bodied. Certainly not mindblowing, and a bit strange for the intended category. Yet I enjoyed it - thanks to MvW and Urbain!","Ursel, BELGIUM","JorisPPattyn"
1833,"2009-03-02",4.0,"650 ml bottle via trade from Noblesquirrel. This bottle is a Killer Kapowski--an alias.  Pours an opaque black with a small beige head that recedes to a fine film.The aroma was moderate in strength with chocolate, mocha, and some dark fruits. The flavor has a big coffee presence with mocha, molasses, chocolate and figs. The mouthfeel is smooth a nd creamy. The finish is long and dry with lingering biter chocolate.  Overall: A very, very good Baltic porter. Much enjoyed. Thanks Brian.","Ouray, Colorado, USA","StefanSD"
1833,"2009-03-02",4.1,"Excellent example of a Baltic. Had in growler and in bottle form. Pours an excellent black with a perfectly think head. Nice lacing. Aroma is bitter chocolate and cream, with some roasted grains. Flavor is all of this and more, with a bigger roasted profile, a touch of hops, candied plums, and toffee. Everything is held almost perfectly in balance. On tap, the mouthfeel is very creamy, but in the bottle this is replaced by a bitter milk character. I could drink a lot of this.","Indiana, USA","StFun"
1833,"2009-02-27",4.1,"Bottle. Pours dark brown, with a light brown head. Aroma is chocolate, roasted malt, and coffee. Flavor is chocolate, dark fruit, coffee, caramel, and rioasted malt.  Meduim body.","Mount Laurel, New Jersey, USA","zathrus13"
1833,"2009-02-24",4.0,"On tap at Twisted Spoke. Dark Chocolate noise, smooth palate, sweet coffee notes, barely a wiff of that 8%. Their commercial description is spot on.","Evanston, Illinois, USA","kiplog"
1833,"2009-02-22",3.9,"Bomber. Pours dark brown with nice light tan head. Aroma is chocolate, roasted malt, dark fruits and caramel. Flavor is smooth with chocolate with roasted malts, dark fruit ad some caramel notes. Solid brew like all other Flossmoor Station brews.  Thanks Matt and Andrew for this great brew","Mount Prospect, Illinois, USA","msante79"
1833,"2009-02-16",4.1,"22oz. bomber, with thanks to HonkeyBra for my first taste of Flossmoor Station brews!  Pours a dark brown with a two finger tan head.  Aroma is earthy spices, chocolate, molasses, and dark roast ground coffee.  Flavor and palate really shine, with a nice blend of dark roast coffee, chocolate, ripe dark fruits, I guess anise, and roasted malts.  Very drinkable and silky smooth.  Crap, this even exceeded my expectations, I only wish I had traded for a couple more bottles.  Thanks again Andy, much appreciated, and my first Flossmoor experience did not disappoint!","Olathe, Kansas, USA","mreusch"
1833,"2009-02-16",3.9,"on tap at the release.  A delightfilly rich lager...chocolate flavors dominate with notes of anise and coffee.  very smooth.  delightful, yet perhaps not quite worthy of all of the effort to hand-bottle so many cases -- but i did buy a couple of bottles and cant wait to open one.","Saint Louis, Missouri, USA","SkyinBrian"
1833,"2009-02-15",3.9,"Draft @ release.  Pours dark brown/black.  Aroma: Malt, Chocolate.  Has a slight sweetness which evolve to a coffee bitterness on the back end.  Great Beer!!!","chicago, Illinois, USA","jamvin23"
1833,"2009-02-12",3.8,"On tap on the release date.  dark in color, almost black.  looks like a stout.  great flavor.  chocolate and some dark fruits.  very sweet.","Chicago, Illinois, USA","mixinnixon2000"
1833,"2009-02-09",3.9,"22oz bottle. Pours black with a foamy tan head. Heavily carbonated. Nice tan lacing lasts for nearly the entire beer. Aroma is of chocolate, malt, dark fruit, sugar, grain, and tobacco. Smells very sweet and inviting. The taste starts off very mellow with dark fruit, sugar, chocolate, and grain. After the initial sweetness, the tastes of lightly roasted malt, tobacco, and coffee. No presence of the alcohol detected. The mouthfeel is thick and very sticky. Body seems lighter than it should be, but makes this one easier to drink. I very much enjoyed this one.","Burbank, Illinois, USA","BeerBunker"
1833,"2009-02-08",4.0,"Had a pint at the release. Pours out pretty dark, almost opaque, nice small fluffy head. Aroma is nice and malty, a little bit of roastiness, and a ton of sweetness. Flavor is about the same, not too bitter, much more emphasis on the roast, and sweetness. Its almost a little bit buttery. This is great stuff.","highland, Indiana, USA","inkubus27"
1833,"2009-02-08",4.0,"Draft at the Brewpub on KK day. Pours an opaque black/brown. Nose is sweet and grainy, with some molasses lurking in there, as well as stone fruit. Taste is sweet, some licorice and a touch of roast, chocolate and noticeable alcohol. A pretty tempting and interesting beer with a silky/oily mouthfeel. Pretty damn good.","Chicago, Illinois, USA","NobleSquirrel"
1833,"2009-02-07",3.9,"Pours very dark with a small head. Aroma is very roasty, some cigar, chocolate, burnt sugar, molasses. Flavor is roast, some tobacco, and dark chocolate. Maybe a bit of licorice too. Alcohol is not noticeable, Delicious and fun to drink, though.","Lemont, Illinois, USA","HonkeyBra"
1833,"2009-01-22",3.7,"UPDATED: AUG 17, 2009 (Draught)  Pours a dark mahogany body with a small beige head.  Aroma of burnt molasses, toasted grain, caramel, roastiness, plum, chocolate, and raisins.  Flavor of roasted malt, chocolate, raisins, vinous, oak, and molasses with a dry finish.","Frisco (Dallas), Texas, USA","bu11zeye"
1833,"2009-01-20",4.3,"UPDATED: DEC 17, 2013 TAP: at Flossmoor - summer 2008. Dark, roasty, malt/licorice, 8% ABV. Excellent beer!","Plymouth, Minnesota, USA","BVery"
1833,"2008-12-13",3.9,"Draft @ Flossmore.  Pours very dark brown to black with a smaller beige head.  The aroma  was mainly bakers chocolate with hints of plums.  The flavor was dark chocolate, cocoa, some roast, and molassess type sweetness.  Medium bodied with a drier finish.  I have had this on a couple of occasions and it is always enjoyable.","Cincinnati, Ohio, USA","alexsdad06"
1833,"2008-10-25",3.7,"tap at FFF....dark brown almost black pour with a thin wispy off white head..... aroma was more focused on a cocoa chocolate flavor with a light roast.... flavor were, as assinuated by the nose, of the cocoa variety with a drier finish than the topless.  carbonation kept this one lively.  overall, both of the baltics were quite good but the advantage, although very slight, goes to FFF.  well done on both accounts.","Chicago, Illinois, USA","pantanap"
1833,"2008-10-22",4.0,"GABF 2008. Deep amber brown, almond head. Rich chocolate, cigar box, cedar, fig paste. Beautiful!","the land of bitumen, beef & beer, Alberta, CANADA","DuffMan"
1833,"2008-10-21",3.6,"GABF 08: Dark burnt sienna with tan halo.  Roasty nose with tobacco and grains galore. Thick mouthfeel but also wet.  Roasty, almost smoky flavors are caressed by a little bitterness in the finish.  Average among the decent.","San Diego, California, USA","DaSilky1"
1833,"2008-10-19",3.7,"On tap @ FFF.  I actually liked it more than FFF’s Baltic Porter they had on tap.  Pours brown with a thin tan head.  Nice coffee and chocolate aroma and flavor.  Good stuff.","","User29624"
1833,"2008-10-17",3.6,"Draught at GABF 2008.
Clear brown coloured with a small off white head.
Roasted aroma of caramel, rye bread and chocolate.
Sweet and roasted flavour of caramel, dried fruits, chocolate and hops.
Roasted finish.","Frederiksberg, DENMARK","joergen"
1833,"2008-10-15",4.1,"UPDATED: MAY 1, 2009 Sample, on tap at FFF Brewpub. Pours black...very black. Coffee and choc. aroma. EXCELLENT roasted coffee and dark choc. taste. Very rich; slight alcohol taste comes through, but flavor balances it nicely. Wonderful.","Indianapolis, Indiana, USA","awiseman01"
1833,"2008-10-15",3.0,"Pour is a black with a small tan head.  Aroma is a small chocolate followed by a strong burning.  Flavor is roasted with some peat smoke and coffee.  Tasty but not really a style i like.","St.louis, Missouri, USA","thegreenrooster"
1833,"2008-07-06",4.0,"Growler from Flossmoor.  Pour was into a Ubiquitous Red Cup (tm HCwDB), so didn’t get to fully enjoy the dark mahogany color or the sturdy cream-colored head as I did at the brewpub last week.  Coffee and dark chocolate aromas.  Flavor follows the nose, and adds substantial molasses sweetness and a faint alcohol burn in the finish.  Last week’s draft had much more roasty character than was found in the growler, but that was likely a serving temperature issue.  As much as I love this complex, hearty beer, it probably wasn’t the ideal brew for a hot July 4th weekend.","Williamston, Michigan, USA","sleestak"
1833,"2008-06-10",3.5,"Black with a beige head that has no lacing and very little retention.  Smell is of coffee, burnt grain, dark fruits and some booze.  Taste was roasty, with some toffee, alcohol, and bitter chocolate.  An interesting beer, but not my favorite Baltic Porter.  A little less than medium carbonation and medium bodied.  Id love to drink this guy again next time Im near Flossmoor.","Iowa, USA","badbeer"
1833,"2008-05-15",3.7,"On tap at Flossmoor Station and served in a shaker.  This beer poured a deep, dark brown with a thin head of tan foam that quickly settled into a lasting ring.  A small amount of lace coated the inside of the glass.  The aroma of the beer was made up of mild bittersweet chocolate, dark fruits, and a touch of earthy yeast esthers.  The flavor included a smooth roasted note, dark fruits, chocolate, and a hint of alcohol warmth at the finish.  The mouthfeel was full-bodied with mild carbonation.  A nicely crafted Baltic porter.","Griffith, Indiana, USA","MoDog"
1833,"2008-05-06",3.4,"Draft. Deep brown/garnet with a tight tan head. Aroma is black licorice sweet with some dark roasted malts. Light/medium body. Flavors are dry black licorice and bitter blackened malts with a light pit fruit sweetness to finish. Not too bad","Same Trailer, Different Park, Louisiana, USA","AmEricanbrew"
1833,"2008-05-01",3.2,"Pours dark brown and slightly reddish.  Smell is chocolatey roastiness.  Taste is mild roasty and nicely hoppy.  Dark, dry chalky flavor too.  Pretty decent roast flavor, but a tad thin again.  Didnt strike me as what I thought a baltic porter would be like, but certainly wasnt bad.","Austin, Texas, USA","lb4lb"
1833,"2008-04-29",3.9,"On tap at Flossmoor.   Pours dark brown, nearly black, with a smallish tan colored head.   Aroma is roast, chocolate, caramel.   Flavor is chcolate, caramel, roast, toffee.   Palate is full bodied, medium to mild carbonation, finished bitter.   Very good baltic.","Ohio, USA","ogglethorp"
1833,"2008-04-28",3.3,"Pours a very dark brown. Smells malty. Sweet with aromas of caramel malts. Hints of milk chocolate. Full bodied. Tiny hints of smoke/peat. Low carbonation. Kinda one sided.","Copenhagen OE, DENMARK","sunevdj"
1833,"2008-04-27",4.0,"Hazy brownish black with a creamy straw head.
Thick, sweet, roasty aroma.
Some sweetness and strong roast, caramel, toast, and bisuit flavor.
Thick and full palate without being cloying.","Iowa City, Iowa, USA","couchand"
1833,"2008-04-25",3.8,"On tap at the brewpub. Pours black with garnet highlights and a creamy mocha head that reduces to an oily surface. The nose is of dark roast, chocolate cake, dark fruit and a light ashiness. Full-bodied and oily with a roasted, lightly bitter finish. Dark roasted malt blends with notes of dark fruit and chocolate ending roasty and lightly dry. This is a tasty brew.","Stilwell, Kansas, USA","Gregis"
1833,"2008-03-28",3.7,"UPDATED: MAR 15, 2009 Sampled from the full sampler at Flossmoor Station. Poured an almost black with some deep red undertones with a nice head. Smells of roasted darker malts with a bit of sweetness. Syrupy strong taste with roasted malts and a nice warming effect. Roasted malts, chocolate, coffee, caramel notes and alcohol are the most prominent features of taste. Finishes slightly sweet. 

Rerate - On tap at FFF Brewpub, tasting in honor of back-to-back GABF Medals. This beer is much improved. The sampler was a bad place to rate this originally. Largely chocolatey malt sweetness up front with some roastiness balanced with a boozy back end that is pleasant and warming. A brew very welcome for the coming winter. Cheers","Aurora, Illinois, USA","TheAlum"
1833,"2008-03-23",4.0,"Pour is light brownish with ruby highlights and a thin tan head...smell is toasty and sweet with caramel and toffee...the tast is strongly sweet at first with the same toffee and caramel....the finish was a little sharp and alcoholic...","Austin, Texas, USA","Walt"
1833,"2008-03-13",3.4,"thick thick dark black color, thick thick tan fluffy head.  mild aroma of fruit and cocoa mixed with air.  flovor starts thick, grainy, with  a roasty tone coming through.  finishes lighter than i expected with slight sweetness in the finish.  best of the night.","Monee, Illinois, USA","dm9831"
1833,"2008-03-03",3.9,"On tap at the 2007 GTMW: Black colored with red tints. Aroma is mildly roasty with dark caramel, alcohol, and lactose. Taste mirrors the aroma and comes across as sweet & syrupy.","Prairie Village, Kansas, USA","csbosox"
1833,"2008-02-18",4.1,"On tap some time ago at Flossmoor.  Wish I had taken notes, but it was the best baltic porter I had tried.  Very think and compelx wihtout being too syrupy or cloyingly sweet.  Its like a big version of a session beer-- highly drinkable.","USA","Driftwood6"
1833,"2008-01-15",3.4,"Notes from Dark Lord Day 07.  Dark brown with a one finger medium brown head, fades to a ring.  Aroma of coffee, roast, some grain, alcohol and raisins--in that order.  Flavor had alcohol, roast, some coffee--spicy alcohol and a bit of soy.  Medium full body with light to moderate carbonation.  Ive got another rating/sample somewhere from the GTMW, I just need to find it.","Ocean Beach, San Diego, California, USA","iowaherkeye"
1833,"2007-10-23",3.8,"GABF 2007.  The beer pours to a deep brown body with a foamy light brown head.  The aroma is grain dust, a unique hop schedule, and nutty brown malts.  The flavor is sweet organic-like grain dusty malts, brown malts, and unique hops.  The palate is sweet, decently textured, and lightly bitter.  Lingering.","Glendale, Wisconsin, USA","1FastSTi"
1833,"2007-10-14",4.4,"Big black pour, tall dark tan head w/ great lacing.  Coccoa powder milk chocolate a bitter coffee lots of roast.  Full thick creamy palate.  Silky milk chocolate flavor nice well roasted malts, lightly bitter coffee in the finish.  Great beer.","Wisconsin, USA","MIBRomeo"
1833,"2007-09-01",4.0,"UPDATED: NOV 20, 2011 
Date: March 03, 2007
Mode: Growler
Source: Tasting
Appearance: opaque brown, fine tan head
Aroma: dark chocolate aroma with light roasted
Body: creamy body
Flavor: rich creamy dark chocolate flavor, bitterness consistant with an unsweetened dark chocolate, light smokey roasted character, rich ripe fruit shows up towards the end, endless waves of rich chocolate

Date: April 27, 2007
Mode: draft
Source: brewpub
picking up more sweetness in the chocolate flavor, the best sweet chocolate flavor ever

Date: April 24, 2009
Mode: draft
Source: brewpub
not as sweet this time around but still the richest chocolate flavor, 

Date: May 25, 2009
Mode: bottle
Source: tasting
Score: 3.5
bottle continues the dry chocolate trend, the magic is lost, 

Aroma: 7/10; Appearance: 7/10; Flavor: 8/10; Palate: 8/10; Overall: 17/20
Rating: 4/5.0Drinkability: 9/10
Score: *** /4","Woodstock, Georgia, USA","kp"
1833,"2007-08-14",4.0,"GTMW. My favorite porter of the day, barrel aged or non. Simply well crafted and well extracted -- an all around pleasurable experience. Notes of chocolate, raisin, sweet cherry, dried fig, and rye blend nicely on the palate. Finish is dark chocolate and dark stone fruit. Well done, an exemplar of the style.","Illinois, USA","Philip"
1833,"2007-07-12",3.8,"On tap at the brewpub. Pours almost black with a medium sized head. Malty with notes of prunes, dark fruit, hops and chocolate.","Copenhagen N, DENMARK","bager"
1833,"2007-05-24",4.3,"Growler
$13.95

Flossmoor Stations new Creation is a baltic porter named Killer Kowalski. Pours the darkest of brown, bordering on black, with faint mahogany stained highlights along the edges only when held directly to the light. A 1 finger super creamy brown head formed on the pour that stayed put for a few minutes before falling to a whispy head thats thick around the edges. Leaves spotty lacing.

The smell is powerful and warming. Deeply roasted malts mingle with coffee grounds and under-ripe banana. Dark fruits abound including fig and plum with a solid dose of boozy sweetness. Complex.

Taste is identical to the aroma. There are no rough edges at all. Every flavor meshes perfectly with the next. Finishes with a sweetened boozy hit with mild fumes in the throat. Very enjoyable and warming.

The body is rich and luxurious. Creamy and velvety with a medium body that goes down smooth. This beer actually soothes the tongue with the mouthfeel.

This is an extremely drinkable Baltic Porter. I could sip this all night long. Until the 8.3% caught up to me anyway.

Flossmoor Station always manages to impress me whether its their special releases like this or their old standbys. This is an extremely well made Baltic porter that isnt over-sweetened and sticky like so many others. They built this beer just right. Another great job.

2/24/07","Illinois, USA","joe1510"
1833,"2007-05-23",4.0,"12-oz hand bottle received via trade with Duane.  Pours very dark brown, some light squeezing in at the edge of the glass, spare fizzy light brown head, somewhat lasting, fair lacing.  Aroma is heavy malt (roasted caramel, chocolate, cookie), light hops (grass), average yeast (dough) with notes of raisins, prune and toffee.  Full bodied, creamy texture, soft carbonation, and a chalky finish.  Short duration, moderate sweetness, light acidity and bitterness; creamy, lightly roasted caramel and chocolate malt flavor.","Escondido, California, USA","BeerandBlues2"
1833,"2007-05-16",4.0,"My 300th Illinois rating!
Pours a deep, dark mahogany with a head that holds as a creamy, tan film. Big, fruity nose of pear, cherry & light prune over a base of chocolate with a touch of coffee. Thick & mildly estery in the mouth with a dry finish. Richly flavored with plenty of chocolate before a fruity, mildly alcoholic finish. Gets very ""comfortable"" as it warms. Im gonna miss this one...
Note: No longer available at the brewpub.
<font size=-4>On tap at <a href=http://www.ratebeer.com/Places/ShowPlace.asp? Station, Flossmoor, IL  60422<font size=-1>","Oak Lawn, Illinois, USA","frankenkitty"
1833,"2007-05-11",3.7,"tap at repeal prohibition festival at Schalflys.  pours almost black/dark brown with a sudsy off-white head.  nose is chocolate, dextrose, and lager character.  The lager shows more than any brewpub baltic i have ever had.  some smokey notes as well.  flavors are all over the place-chocolate, lager yeast twang, with lots of bitter notes (chocolate and earthy hops).  body is a little lite but not bad.  long chocolate finish.  pretty respectible baltic from flossmoor.","St. Louis, Missouri, USA","Terminus"
1833,"2007-05-11",3.9,"Growler acquired in trade with Ughsmash (thanks!). Poured a deep reddish brown color with an averaged sized off white head. A strong roastiness intially hit my nose followed by chocolate, raisins, coffee grounds and some nuttiness. Tastes of milk chocolate, vanilla, caramel, roast, and lighter coffee. Body was slightly thin but smooth and creamy. For a baltic porter, this surprised me with as much roastiness as I was getting.","Lansdale, Pennsylvania, USA","hopdog"
1833,"2007-05-10",3.8,"This was sampled out of the growler in the parking lot at 07 Dark Lord Day.  Dark beer with a foamy brown head.  Thick mouthfeel.  Roast grains, chocolate, and some coffee bitterness.  Nice baltic porter.","St. Marys, Ohio, USA","jsquire"
1833,"2007-05-10",4.0,"Thanks to hopdog. Pours a darker brown with ruby red highlights and a smaller light tan creamy/bubbly head that left some light lacing.  Aroma of coffee grinds, roasted malts, dark chocolate and some slight fruitiness.  Flavor of roasted malts, coffee, dark chocolate and some caramel.","Milton, Delaware, USA","TomDecapolis"
1833,"2007-05-05",3.7,"sampled at the Hampton tasting - Pours very dark brown with a thin tan head.  The aroma and flavor are both really big on the roast malts and some chocolate and coffee notes are rolled into it as well.  Its medium to full bodied and not much of that 8.3% abv is noticeable.","fort wayne, Indiana, USA","patrick767"
1833,"2007-05-05",3.8,"Growler thanks to BBB63 sampled on 3/3/07: Pours a nearly opaque dark mahogany with a nicely-lacing light tan head. Sweet toasty grainy dark caramel malty aroma has a touch of smoke and dark fruity complexity.  Body starts fairly full, viscous and sweet with lots of sticky dark caramel and a touch of earthy dark chocolate, mild smoke and a drier, slightly warming, full-bodied finish.  A pretty good Baltic porter.","Columbia, Maryland, USA","CaptainCougar"
