"beer_id","date","rating","text","user_location","user_name"
2237,"2012-06-27",3.5,"From the little brown plastic barrel (growler they took to go) at Moeder Lambic (Fontainas)

My wife got this one evening, I got it the next. hers was pretty much flat, mine had a small tight well retained head. The color is a kind of orange. 

The aroma is funky and lemony with a mild bit of livestock barn & some sweetness.

The flavor is very lemony, but also earthy and the sugar seems to be of a sort of brown varietal. This is not overly sweet but does the sweet and sour balancing act about as well as any other Faro I had in Belgium. At no point did it seem cloying or oversweet and it allowed for the earthiness of the lambic to play in as much as the sugar.","Pouring Bus, Iowa, USA","CanIHave4Beers"
2237,"2012-06-25",3.7,"23/VI/2012 - little plastic container straight from the brewery @ proeverij bieren van spontange gisting (Gentse Biervereniging) - BB: n/a (2012-646) 
Note: drank this for the first time at the Cantillon Kwintessens 2010, when I wasnt taking notes at every beer event yet. Had the luck to try it again, without even going to Brussels. ;-)
Clear light amber beer, no head. Aroma: bit metallic, lime juice, some barnyard, wet autumn leafs, some chloride (swimming pool). MF: no carbon, medium body. Taste: pretty sweet start, caramel, nice lemon acidity, little bitter. Aftertaste: lemony, some bitterness, a bit earthy, nice acidic finish, caramel. Drinking this faro is not a punishment...","Gent, BELGIUM","tderoeck"
2237,"2012-06-04",3.8,"Cask 4 euro @ Moeder Lambic

A - zest tangerine orange. SRM of 12. 1 finger crystal clear head

S - spices, sugar, raw can sugar and caramel

T - minor metallic taste. No. Metal gets stronger. Grapes and ripe melons. Leather and plastic. Yeah. Banana peeps. Or apple peels. That dry fruit skin taste. Sweet and nice wheat finish.

M - Vigorous mouth swish. 5% carb. Medium body. Grape skin and wheat finish. Dry even covers my teeth

O - 91/100. Not an a+ but pretty good. Would not have again though. Its a very tasty beer.","Enfield, New Hampshire, USA","AdamChandler"
2237,"2012-06-02",3.2,"At the brewery - Burnt sugar, brown and bright. A mild and butterscotchy sweet nose. Sweet and cane-sugary in the mouth. Rich and sweet while still and slick. Very interesting.","Portland, Oregon, USA","Alphadelic"
2237,"2012-06-01",2.8,"Brown coloured. It smells mild-citrus. It tastes bitter-sweet, kandissugar. Not my taste 8/8/8/7/-/8","Otorohanga, NEW ZEALAND","kiwianer"
2237,"2012-05-28",3.8,"On draught at Chez Moeder Lambic Fontainas. Pours a dark golden - amber colour with a thick white head. Aroma of musty yeast, horse blanket, candy sugar, caramel and alcohol. Similar sweet and sour flavours with moderate carbonation and a foamy mouth-feel. Nice and a little sweet to finish (7,5,6,3,16). Also had this from a ceramic jug at Cantillon. Poured a dark golden - amber colour with a lacy white head. Aroma is a little sweet with light candy sugar, lemon and horse blanket notes. Similar flavours and mildly tart with very low carbonation and an oily mouth-feel. Not too sweet. Nice (7,5,7,3,16). I preferred this version but only slightly.","Edinburgh, SCOTLAND","Benjii"
2237,"2012-05-15",3.3,"On tap at Moeder Lambic, Brussels. Looks amber, zero head, but tastes like white wine. Sour, bitter, a little funk. Enjoyed but probably wouldn't seek it out.

---Rated via Beer Buddy for iPhone","Brooklyn, New York, USA","chrispthompson"
2237,"2012-05-12",3.3,"draft at Moeder Fountains... never been a big faro fan, and this didnt do much to change it, sweet hay, decent","Chicago, Illinois, USA","chibuck"
2237,"2012-04-08",3.4,"Plastic canister @ the brewery.
Rated on 20100719.
Amber color with small head. Aroma of sugar, ripe fruits and wood. Flavor of sugar, fruits and grass notes, some berries also.","Tampere, FINLAND","olio"
2237,"2012-03-31",3.5,"Söt, fläderaktig doft. Helt utan kolsyra och mycket söt med en ganska diskret syrlig underton.","SWEDEN","SirLimpsalot"
2237,"2012-03-17",3.5,"From a plastic growler at the brewery in March 2012.

Clear reddish/brownish with no head. The aroma was sweet with toffee, brown sugar, earth and some lemon. The taste was also sweet and rather strange to begin with. (I am not that used to drink a Faro) Then it became better. Toffee, sugar, some earth, funk and light berries. No carbonation. Very easy to drink. It was an interesting beer to try. (only 2 EUR for a glass)","Stockholm, SWEDEN","gyllenbock"
2237,"2012-03-14",3.0,"Cask at Moeder Lambic.  Pours deep amber with no head at all.  Flat as can be.  Smells like pear juice.  Flavor is sweet with just a hint of sour.  Mouthfeel is smooth and creamy.  After a talk with the brewers at Cantillon about this beer, I realize that it is a bit of a gimic.  Not really impressed and wont be searching for any more Faro again.","San Diego, California, USA","dreadnord"
2237,"2012-03-10",3.5,"cask @ moeder lambic.  Sweet sugar with funk on the nose.  Pours amber with a thin white head.  Sweet upfront with acidity sneaking in right away with sweet lemon in the finish with traces of brown sugar.","Orlando, Florida, USA","redlight"
2237,"2012-03-03",3.8,"Cask at Moeder Lambic Fontainas. Brown orange hazy amber colour with massive beige bubbly head. Aroma is sugar sweetness with a bit of funk. Quite grainy and some wood. Taste is sweet and vinous, maybe even a touch of creaminess at times. Bit appley too and just a hint of citrus sourness.","Tokyo, JAPAN","shoulderbroken"
2237,"2012-01-13",4.1,"Casks at Moelder Lambic Fontainas.
Cloudy amber appearance with a froathy white head that stays on the surface till the end... Nice aroma of a real Cantillon brewed Lambic, light grapes and vinous tartness, green leaves and dried peach. Easy character of a Lambic with the added sugars. Sourish tarty taste, light barnyard balanced with a fine sweetness, green leaves. Interesting. Exciting!","Budapest, HUNGARY","armando629"
2237,"2011-12-21",3.1,"Had this at Chez Moeder Lambic, Fontinas Pl location, Brussels, Belgium 16.12.11   Pours light amber with a white head. The aroma reminds me of walking into an old charity shop, there is old clothes and dog eared books and records, this is the most interesting thing about the beer, the aroma is fascinating. However the taste is frankly something of a disappointment, it is sweet, thin and rather watery. I tried to have this at the brewery a few years ago but was repeatedly steered away from it and told by Jean Roy (I think) that I shouldnt try that I need to have the proper stuff, despite repeated requests I seriously wasnt allowed, instead given some of the proper stuff Im beginning to think that when offered up against many of the other Cantillon beers his advice was spot on. To be honest Ill probably be frowned at for saying this but I preferred the Timmermans Lambic Doux which rather surprises me.  A7 A4 T5 P3 Ov12  3.1","Merton, Oxfordshire, England, Oxfordshire, ENGLAND","Fin"
2237,"2011-11-29",3.9,"Tap, Moeder Lambic.  Pours a slightly cloudy amber body with a fizzy and frothy white head.  Certainly sugary on the nose, but much more delicate than other Faros Ive had.  More of the cellar/cobweb funk of a real Lambic.  Very drinkable, great balance on the sweetness.  Still funky as hell but sweet up front.  Dries out a lot on the finish with a slight mineral note.  Mouthfeel is rather light and airy with perfect soft fizzy carbonation.  Long lingering funky finish.  Best Faro Ive had yet.","Sunbury, Pennsylvania, USA","kramer"
2237,"2011-11-15",3.2,"I got this on tap from cantillon when they had there open brewday.
This is by far the best Faro i ever tasted, the ballance of the sour lambic with the cadnico (dark brown) sucre is excelant ! Not a complex beer, but really nice. Would definaitly wanna drink this again !","Antwerpen, BELGIUM, BELGIUM","BelgaBart"
2237,"2011-11-12",4.3,"Poured up at Cantillon with clear deep gold to copper body and almost no head at all. The aroma is a big and yummy kiss of bread, musty funkiness and then a wide variety of fruity goodness. These notes are going together wonderfully with fruit like peach, apricot and plum. The taste is right there too starting with a pleasing fresh bready type grainy wort with a smooth yeasty tartness and plenty of fruit like peaches, apricots, plums and a bit of sugary sweet mango. Man this one is fresh, crisp, complex and refreshing. Love it. The fruit, yeasty tartness and graininess play so well together. It is very tempting to skip everything else planned today and tip more and more of this stuff back until they close.","Tempe, Arizona, USA","Ibrew2or3"
2237,"2011-10-16",3.9,"On tap at Moeder Lambic Fonteinas. It poured a foggy golden liquid with an orange tint. Smell of earth cellar, fruity and sour. Sweet taste of fruits, sugar, farmhouse and horse blanket. Incredibly easy to drink, like velvet on my throat.","Örebro, SWEDEN","olsvammel"
2237,"2011-10-15",3.8,"Very nice. Hardly any sweetness to it. Leaves lots of lambic. Flat and smooth.","Berchem, BELGIUM","txspartan"
2237,"2011-10-13",2.7,"20 cl sample from plastic keg @ the brewery. Rated on 19.07.2010
Aroma is very sweet with brown sugar and syrup. Flavour is very, very sweet and syrupy with brown sugar. Also some distant earthy notes in the background. Very sticky palate that can be observed also on the edge of the glass. This could work as a very small amount after dinner.","Tampere, FINLAND","laiti"
2237,"2011-10-07",3.6,"@ Stone fest , Chez moeder lambic 
Head: creamy, white, thick 
Colour: amber/brown 
Smell: sour, wineous, sweet, bitter red fruits 
Taste: Sweet/sour malty start, hops, malts, apples/peares, sugar, oily dry end , sweet/bitter after , nice !","Antwerp, BELGIUM","BelgBeerGeek"
2237,"2011-09-23",3.8,"light sour aroma,golden, hazy, white foam, lightly sour, medium body, creamy, soft carbonation, nice soft sour finish.","Assentoft, DENMARK","Zita"
2237,"2011-09-21",3.8,"Draft at Moeder Lambic. Light brown coloured and hazy. Has an off-white head, fully lasting. Aroma of herbs, heavy yeasty, barnyard, perhaps leather, acid. Flavor starts light sweet and moderate acidic. Finish heavy bitter and acidic. Long duration. Creamy and dry. Soft carbonation and moderate astringent.","Assentoft, DENMARK","Hansen"
2237,"2011-09-21",3.3,"Bevuta in cask al Moeder Lambic Fontainas, Bruxelles; prima esperienza con un Faro, contrasto notevole tra dolce e acido","Campomorone, ITALY","marcot"
2237,"2011-09-16",3.3,"On cask at the brewery during last weeks trip to Belgium. Reviewed from notes.

Served in a Cantillon big-bowled wine glass, poured from a jug.

Pour yields a brew that looks a bit like apple cider with a few bubbles. No real head or lacing, but thats normal for the style, so I wont dock there. The nose is slightly cidery with some earthy must. Maybe must more than cider. A bit of funk. Light sweetness comes in during the taste. Light body with a faint bit of sugar and mild funk. No real acidity. Nice enough to try, but Id much rather have the young lambic without the sugar.",", Illinois, USA","Thorpe429"
2237,"2011-09-02",3.0,"Draught at Chez Moeder Lambic Saint Gilles, Brussels, Belgium august 2011. Dark orange, almost clear, no head. Dough aroma. Sweet, fruity..maybe a bit pumpkin aroma. Nice, exsiting taste.","Göteborg, SWEDEN","Aniela"
2237,"2011-08-21",3.6,"Tap at moeder lambic. Pours a golden colour. Taste is pretty lively it has a nice tarty ness to it. The beer has a good after taste and a good finish. good offering","Ontario, CANADA","Ontbeertaster"
2237,"2011-08-16",3.2,"Draught at Chez Moeder Lambic Saint Gilles, Brussels. Orange beer. no head. Yeasty aroma, sweetish with some dough. Vinous sourish flavor, a bit sweet, elder notes, pumpkin, maybe some plums.","Göteborg, SWEDEN","rlgk"
2237,"2011-08-08",3.2,"On cask.  A nice reddish brown color with very light to no head.  Earthy and sweet.  Smooth and drinkable.","Shoreline, Washington, USA","hbmason"
2237,"2011-08-06",4.0,"Freshly mixed at the brewery for my 3,000th rating. Glowing bronze-brown color, flat. Nose of caramel, brown sugar, funk, underlying lemon. Flavors of lemon, brown sugar, dary, dusty funk, caramel. Not too sweet at all. Lovwely lemon flavors. Rich and flat body, slightly oily. Somewhat reminiscent of lemon iced tea. Great.","Kyoto, JAPAN","KyotoLefty"
2237,"2011-07-16",3.7,"Red and nut brown, no head, translucent. Nose is earthy with light rind, sugar, and citrus. Flavor more cobeweb, sugar, caramel, mint, and light sweetness leading through the finish. Nice balance, well-carbonated, but the sugar is excessive and a bit muting.","Baltimore, Maryland, USA","MrChopin"
2237,"2011-07-07",3.7,"Poured from the 5l takeaway barrel that was brought home. Dark, flat pour with no head. Dark meaning a dark brown like a lightened, diluted molasses. Smells like a jonge lambic, not surprising since it was a jonge lambic they put sugar into. Tastes sweet and acidic with some tartness and the sourness associated with the typical lambic. Nice, sweetened version for people who do not like the full on lambic twang.","Crestview, Florida, USA","suprchunk"
2237,"2011-07-05",3.8,"Cask pour at moeder lambic. Brownish pour with tan head, very hazy. Nutty, light tartness, woodiness added sweetness, fruit comes through a bit more than the unsweetened lambic.","Wayne, New Jersey, USA","vtafro"
2237,"2011-06-19",3.0,"Künstlich süßer Antrunk, zum Glück stellt dies den süßesten Teil dar. Das Faro wird milder und schmeckt deutlich holzig, leider weiterhin auch etwas künstlich. Der Nachgeschmack geht in Orndund, immerhin ist hier auch mal eine leichte Säuerlichkeit zu erkennen. 	 
Test vom 22.12.2007, Gebinde: Fass 	Noten: -,9,10,10,-,9 - 9,35","Köln (Cologne), GERMANY","Koelschtrinker"
2237,"2011-06-15",3.8,"tap at moeder lambic.  blended half and half with the jonge lambic.    pours dark orange with dark tan highlights.    half inch offwhite head.  peculiar aroma of passion fruit, grassy, herbal lemons, kiwi fruit, melons, and a touch of earthy basement.  uniquie, tasty beer.    would have guessed this was made with some tropical fruits, tangerines, or banananas.  pretty good.","pouring bus, New Brunswick, CANADA","SrSilliGose"
2237,"2011-06-09",3.1,"Cask @ Moeder Lambic Fontainas, Brussels.
Pours hazy amber with a nice, frothy, off-white head. Aroma has clear sugar, light caramel, mild tartness. Almost no carbonation, fat oily and fairly dry mouthfeel. Flavour is dry, milky with quite some lactic acid, light yoghurt, very dry middle and a very sugary sweet finish. Very weird, but somehow drinkable.","Kolding, DENMARK","thewolf"
2237,"2011-06-04",4.1,"Bottle:
No head, clear dark orange colored beer.
Smell fruits, sweets, champagne and yeast.
Taste is sweet with light sour: grains, malts and sugars.
Lovely light sweet sour bitter aftertaste.
Low to no carbo, fuller body, watery texture and a soft light sharp mouthfeel, Great Faro!","Best of E-Town mit 2 Brauhausen, NETHERLANDS","Countbeer"
2237,"2011-06-02",2.8,"On tap at Chez Moeder Lambic Fontainas. It pours light hazy amber, with a tiny bubbly off-white head and no carbonation. The nose is sweet apple, toffee, lemon ice tea, pine and melon. The taste is lemon ice tea, melon, wood, sweet lime, sweet orange, caramel and grass. This is way too sweet and tastes too much like iced tea for my liking. Faro is not for me.","Croydon, Greater London, ENGLAND","Scopey"
2237,"2011-05-30",3.3,"Caramel colour, no carbonation, no head. Aroma mainly sweet. Only slight lambic character. Light brett, light caramel. The sweetness seems to overpower all other aromas. Flavour mainly sweet, caramel, quite cloying. Aftertaste lingering sour and dry, bit astringent. 
Compared to the oude lambic served the same day, it is very one-dimensional. I see again why I dont quite like faro, it is hiding the best qualities of the lambic. But then again, I never had the Cantillon faro before, so Im happy Ive tried it. Not bad, but didnt quite finish the glass as I liked the others of the day more.
(Served from ceramic jug @ the brewery, 27 May 2011, Brussels)","Baarle-Nassau, NETHERLANDS","Martinus"
2237,"2011-05-28",3.6,"From a jug in the brewery.  Golden brown pour with no head.  Slightly sweet, slightly yeasty aroma.  Sweet flavor withthe usual sourness after.","The Hague / Amsterdam, NETHERLANDS","kermis"
2237,"2011-05-06",3.7,"From the cask at Cantillon
Copper amber color with no head. 
The aroma is a mixture of a slight sweetness but definetely a great sourness, the tartness is quite far away. The flavor repeats the aroma but has like most Cantillon a lemon like sour touch to it which makes it very refreshing. Dry finish. 
Decentfaro but less sweet then you normaly expect from a faro.","Leuven, BELGIUM","BigMomma"
2237,"2011-05-06",4.0,"My first authentic faro. Dark unclear amber with a large but dissipating head. Sweet aroma, a little on the mild side, sugar, slight funk and no sourness. The flavour is very sweet without being cloying, some funk, orange and peach also. The palate is quite light.","Antwerp, BELGIUM","onlyrocknroll"
2237,"2011-03-24",4.4,"Ottima, amara ma con moderazione e non eccessivamente aspra. Buon corpo, note di legno e resina, con finale secco.","Rome, ITALY","Labove"
2237,"2011-03-19",4.0,"UPDATED: JUN 9, 2012 March 2011, on cask at Moeder Lambic

A: Deep amber with golden hues. Small bubbly head that quickly receded.

S: First notes are caramel and burnt sugar, lambic funk, and wood.

T: Like the nose, burnt sugar and caramel. The sourness and woody tartness of a straight lambic is also present throughout.

M: Medium bodied. Decent amount of carbonation and zip considering this was on cask.

O: Of the few faros out there, this is one of the better ones.","Philadelphia, Pennsylvania, USA","callmemickey"
2237,"2011-03-14",4.3,"UPDATED: SEP 16, 2014 (14/03/2011) [email protected]/* <![CDATA[ */!function(t,e,r,n,c,a,p){try{t=document.currentScript||function(){for(t=document.getElementsByTagName('script'),e=t.length;e--;)if(t[e].getAttribute('data-cfhash'))return t[e]}();if(t&&(c=t.previousSibling)){p=t.parentNode;if(a=c.getAttribute('data-cfemail')){for(e='',r='0x'+a.substr(0,2)|0,n=2;a.length-n;n+=2)e+='%'+('0'+('0x'+a.substr(n,2)^r).toString(16)).slice(-2);p.replaceChild(document.createTextNode(decodeURIComponent(e)),c)}p.removeChild(t)}}catch(u){}}()/* ]]> */ Moeder Lambic, only place where you can get this? except for the brewery, amazing bar, hazy, golden, whiskey colour with no head in a cute, small Cantillon glass, the sweetness from the sugar & the sourness of the Cantillon have seemingly neutralized each other or are at least in a perfect balance, making this a very unique experience, sweet & tart, caramel taste with minor oak, smooth, velvety, bit dry with almost no carbonation, interesting, definitely worthwhile/// sampled @ brewery from cask: wow, this one is far less, no balance here, thinned out a bit, sour, musty old, wet clothes lambic upfront, empty gap followed by dissolved, watery candy sugar, still far from bad but where is the balance in this one? Why the difference in quality & unison in blending?  ///////////// Couple of samples later over a long period of time, this one really varies a lot so there is no proper assessment of this one.","Antwerpen, BELGIUM","77ships"
2237,"2011-03-07",3.8,"On tap at Chez Moeder Lambik Brussels. Looks good in the glass, deep golden, modest turbid, nice head. Starts quite sweet, mild, then more and more sourish, a bit moldy. Long lasting finish, still moldy, modest sweet. Very well balanced. Nice!","GERMANY","kappldav123"
2237,"2011-02-18",3.9,"Compared to their other beers - this one is very mellow.  Pours yellow with a small off white head.  Mellow aroma and slightly sweet flavor - this is a very easy beer to drink. Well done.","","User29624"
2237,"2011-01-26",4.1,"Fresh at the brewery.  Delicious and smooth, but a bit overly sweet compared to the other samples that afternoon.  Still a delightful beer and worth drinking again.","Scottsdale, Arizona, USA","gdschermer"
2237,"2011-01-19",3.1,"Draft at Moeder Lambic.  Slightly cloudy yellow amber pour, small bubbly off-white head.  Fruit, leather, lots of sugary sweetness, slight sourness in the background.  I am not that impressed, but then I again I really dislike sweetened beers.","San Diego, California, USA","JohnnyJ"
2237,"2011-01-07",4.4,"One of the most beautiful Lambic experiences. Something sensational. I had it at Cantillon Brewery and at Moeder Lambic Fontainas. It is extremely particular thanks to the addition of rock candy. A great balancing between the sharp and sweet. An intense play of flavours giving us a special sensation. Absolutely to try whenever is possible. Served directly from the jug.","ROME, ITALY","flavio_b"
2237,"2010-11-16",3.1,"[3317-20100809] Plastic keg. Caramel toast aroma has strong un-fermented wort and light toasted grapes. Hazy, dark brown body with quick off-white bubbles. More like wort or fermenting apples in the flavour, with just some notes of sweet caramel. Medium-full body has a sour background. Not my favourite style but it grows on you after several sips.
(@ brewery, Brussels, Belgium)","Toronto, Ontario, CANADA","mabel"
2237,"2010-11-04",3.6,"Cantillon faro. Draft at Chez Moeder Lambic Fonteinas... First faro . Pours a  
reddish plum brown hue, mostly opaque, with a huge fluffy soapy white  
head... Aroma of sweet sugar confection and a berry plumminess to  
coincide with it...Flavors have a plummy berry presence, semi-tart  
through the beginning and middle and finishes on a sweeter bent but  
not a total suger bomb like I was expecting. Body is soft as is the  
carbonation. A little sweet for my liking but thats what I was coming  
to expect from a faro.
7/4/7/4/14","Chicago, Illinois, USA","pantanap"
2237,"2010-10-17",2.6,"Pitcher @ the brewery. Pours dark orange. Aroma of candy sugars, caramel, caramel cloying the mouth. Not much going on because of the flatness.","Flanders, BELGIUM","Bontus"
2237,"2010-10-11",4.0,"On tap in Brussels at Moerder Lambic. The aroma is of burnt brown sugar, very potent. The dark caramel color has a creamy cappuccino head on top. There are big sweet notes in the flavor, that unlike of Cantillon! The notes probably come from the sugar and caramel added which are very potent on the palate, especially in the beginning. Then the noticeable tart flavor characteristic of Cantillon comes at the end and settles smoothly.","Royersford, Pennsylvania, USA","Damico"
2237,"2010-09-01",3.8,"On draft at Moeder Lambic. Pours a dark copper almost brown color with a huge white head. On draft. The aroma is sweet sugars and fruit, some dry yeast. Unlike other Faros, a strong fruity lambic base only added to with sugars. Quite natural and earthy. Wonderful. I had two glasses.","Portland, Oregon, USA","douglas88"
2237,"2010-08-24",4.0,"It took a second visit to Belgium to finally get to sample Cantillons faro, I had it cask conditioned at Moeder Lambic Fontainas. Pours a cloudy amber color with a medium, bubbly, beige head. Nice aroma of white wine, acidity, mild funk and candi sugar. Very good flavor of candi sugar with some acidity to balance the sweetness, theres also some funk and a lactic presence. The body is light with a creamy texture and soft carbonation. Its definitely the best Faro Ive had so far.","Montreal, Quebec, CANADA","beerbuzzmontreal"
2237,"2010-08-23",4.2,"Has a nice subtle aroma, no hint of artificial sweetness. Appearance is a perfect dark amber colour, and brilliant head. Taste is lambic but sweet, caramel notes, and a dark syrup finish. Well blended, all articulate flavours, none lost. The folks at Cantillon get it right, yet again.","Alberta, CANADA","DeanF"
2237,"2010-08-03",4.0,"Rich mahogany pour with a creamy, frothy head. Aroma holds lots of cane sugar, a touch of plum, fig, and raisin, and a light tartness- really interesting nose to this brew. Flavor is far darker than expected, with increased dark fruit, candied sugars, and something that reminded me of the best Sour Patch Kids ever created, without the aggressive aftertaste. No carbonation, but a silky smooth mouthfeel. Really impressive stuff.","Seattle, Washington, USA","craftycarl21"
2237,"2010-07-31",3.4,"Lambic and candi sugar, what could possibly go wrong?

Irish whiskey with cream on top is what it looks like. Caramel and molasses is how it tastes. It finishes dry for the amount of sugar. And it has much sugar.

As Ive had just one other Faro, I dont have much to compare this to. This is easier to drink than Boons, hence the 3.5 ratings, but thats not much of a recommendation.","The Court of the Crimson King, California, USA","afrantzell"
2237,"2010-07-25",3.1,"7th March 2010. Draft at Moeder Lambic. Cloudy brown beer, thick frothy off white head. Milky sweet beer - very sweet. Sweet prunes and figs and plums and then more milky sweetness. Just a little tartness in the background but its swamped by the sweetness. All this is good but then there is some off putting paint in there as well and this just makes things a little too weird to score any higher.",", Essex, ENGLAND","madmitch76"
2237,"2010-07-04",3.9,"25cl draft @ Moeder Lambic, Brussels.
pours hazy copper, off-white head.
aroma, nice wooden nose with outstanding sweetness and mild notes of residual sugars.
flavors, a lot more true to style, not sure how you can possibly bottle a faro - some fruit elements, and this one keeps a sugary approach while at the same time keeping a mild tart - wood aspect. Carbonation is close to zero.
Some floating sediments to be noted.
This is tasty, regardless of what many argue pointlessly about Faros not being deserving.","Enghien, BELGIUM","sebletitje"
