"beer_id","date","rating","text","user_location","user_name"
2237,"2017-05-15",3.5,"Draft at the brewery. Clear orange copper. Aroma is funky with notes of Brett and apples. Sweet, flavors of wood, brown sugar, cider, Brett. Light-bodied, flat.","ISRAEL","zvsn"
2237,"2017-05-15",3.7,"Draught at Cantillon Brewery, Brussels. Clear golden with no head. Sweetish aroma with notes of yeasts, sugar, candy and rum, perfumed. Sweet flavor with notes of candy, sugar, rum and apple juice. Flat, medium-bodied.","Kfar Saba, ISRAEL","rayaron"
2237,"2017-05-08",3.1,"Draft - Raisin and green apple or tea leaf notes. Clear copper gold. Bitter and some tea leaf with a long bitterness in the finish. The weird tea bitterness is dominant for me.","Burnaby, British Columbia, CANADA","Ferris"
2237,"2016-10-06",3.6,"At the brewery.  Smooth sweetish and round. Sourish beginning, round and smooth with not too much sweetness. Long sourish-sweet aftertaste, nice.","Wuppertal, GERMANY","Erzengel"
2237,"2016-09-27",4.0,"Draught. Pours dark amber/light brown in clour, quite clear with huge white head. Aroma is sweet, caramel and sugar with tart note. In taste sour at first then it is sweetened with sugary caramel notes, not cloying or tiring. Medium body, fizzy carbonation, sweet finish. One of the best faro I tried.","Poznań, POLAND","mateuszk"
2237,"2016-08-13",3.8,"Glass @ the brewery in 2011. Amber, a bit hazy, with no head. Aroma is a bit sour, with distinct funky, wild notes. Taste is sweet, a bit sour, with wooden aftertaste (from barrel). Very good.","POLAND","scirtes"
2237,"2016-05-06",3.6,"Tap @ Moeder Lambic. Clear golden body with a small white head. Tart, sugary sweetness. It has the Cantillon tartness. Faro isnt my style.","Odense SV, DENMARK","hallinghansen"
2237,"2016-05-05",3.7,"Tap at Moeder Lambic Fontainas. Clear dark golden with quite big and lasting white head. Lots of funky grains, sweet lemon, typical Cantillon wood and twigs, hay, peach, sweet white grapes, bitter herbs. Light sour, under medium bitter and almost medium sweetness tying it all together. Medium bodied with very soft carbonation. Maybe a bit too bitter, but a nice beer and a great faro.","The Hague, NETHERLANDS","Maakun"
2237,"2016-05-05",3.7,"At Moeder Lambic Fontainas. Clear golden with thin white head. Grain, hay, tea, grapes, sugar syrup, young green, resiny. Light sour over medium sweet sugary base, light minerallike saltiness. Balances out really well. Medium body, unnoticeable carbonation. Very drinkable, very nice.","The Hague, NETHERLANDS","sjogro"
2237,"2016-04-02",3.2,"Hazy golden with medium white head. Aroma is caramel and citrus. Taste is sweet with notes of citrus","Hasselager, DENMARK","Karstenborg"
2237,"2016-04-02",3.5,"On tap at Chez Moeder. It pours hazy amber with a bubbly off white head. The aroma is both sour and sweet with malty notes. Quite sweet flavor with the classic Cantillon sour kick. Malty backbone. Nice one.","Helsinge, DENMARK","Plovmand"
2237,"2016-04-02",3.6,"Draft at chez moeder. Aroma of caramel and brown sugar with yeast notes. The flavours is sweet and slightly Sour. The body is medium and the texture is juicy.","Grindsted, DENMARK","Guruhso"
2237,"2016-03-27",3.5,"Glass at the brewery. Poured pale, bit of foam. Still usual Cantillon autumn funk aroma. Taste for this one was sweeter and still feeling light. Sourness there but not too pronounced, more going on in the funk department.","ESTONIA","jinroh"
2237,"2016-03-07",3.6,"Glass @ the brewery, from a jug (presumably straight from a barrel). Copper color, hazy. No head. Aromas: sourish, funky. Retronasal its sour, yoghurt/lactic, some funk and wood. Flavor is moderate sweet, moderate sour. Light bodied. Finishes slightly dry, with some grain and a hint of bitterness. I liked it.","Amsterdam, NETHERLANDS","PotjeBier"
2237,"2016-01-16",3.6,"Tap at moeder lambic. Pours a hazy orange with a lasting bubbly white head. Aroma of vinegar, soy sauce, citrus, caramel, melon. Taste is of vinegar, caramel, dried fruits, butterscotch. Soft oily, slightly sticky mouthfeel, little to no carbonation.","Dublin, IRELAND","Johnstledger8"
2237,"2015-12-18",3.5,"Nov 2015 - Unknown dispense, poured from a ceramic jug at the Cantillon brewery. Hazy dark orange, still, small bubbly white head. Aroma is sweet syrups, biscuits, light sourness. Body is medium, smooth, light carbonation. Taste is light vanilla, red berries, smooth, apple, very light sourness. Not too sweet, which is often what lets the style down.","Richmond, Greater London, ENGLAND","The_Osprey"
2237,"2015-12-15",4.7,"From notes on 9/15/15. On Cask at Moeder Lambic. Poured a light color, almost like a pilsner. Big sweet taste. Hints of apricot maybe? Very good.","Madison, Wisconsin, USA","kkleu357"
2237,"2015-12-14",4.1,"UPDATED: MAY 6, 2016 Sweeter than any other Cantillon ive had and among the most interesting. Brownish in color and very drinkable.","New Jersey, USA","GrumpyOldTroll"
2237,"2015-10-28",3.3,"From tap at Moeder Lambic Fontainas, Brussel. Aroma of tart fruits, ripe citrus, some sugary notes, some malt and caramel. Flavour is moderate sweet and moderate sour. Body is medium. Never thought Id say it, but this is a decent Faro.","Steenwijk, NETHERLANDS","tricksta_p"
2237,"2015-10-22",2.9,"Smell of blue cheese, mold, light barnyard, citrusy, a bit burned sugar. Taste is overly sweet, a bit of citrus, and clear blue cheese. Not really my favourite.","Stockholm, SWEDEN","simont1"
2237,"2015-10-17",3.1,"Cask At moeder. Pours hazy orange with faomy white head. Aroma tart, funk, quite sweet, sugary. Taste is quite un complex, with a very sweet ending. The huge amount of sugar, blocks the real good things beneath.","Odense C, DENMARK","MrOrla"
2237,"2015-10-16",4.2,"Different from all the other Catntillion flavors. Very good but different. Tart with toffee sweetness. Had many times but odd. Still great. Pours dark garnet with no real head. Predominantly sweetness with the tart that did start to balance it out. Finished leather and earthy.","Temecula, California, USA","CLeclercq1961"
2237,"2015-10-06",3.8,"Pours hazy golden with medium white head that has rather large bubbles to her. Notes of sour funk, malt, sugar and cream. Medium bodied. Too sweet for me but was still enjoyable considering the producer.","Philadelphia, Pennsylvania, USA","PhillyCraft"
2237,"2015-09-25",3.1,"From Cask at Chez Moeder Lambic Saint-Gilles. Light hazy dark orange color with small bubbly head that quickly disappears. Aroma is malty, light fruity, apples, caramel, sugar, medicine. Sweet taste like aroma. Light oily body with flat carbonation.","GREECE","rouhlas"
2237,"2015-09-24",3.9,"[email protected]/* <![CDATA[ */!function(t,e,r,n,c,a,p){try{t=document.currentScript||function(){for(t=document.getElementsByTagName('script'),e=t.length;e--;)if(t[e].getAttribute('data-cfhash'))return t[e]}();if(t&&(c=t.previousSibling)){p=t.parentNode;if(a=c.getAttribute('data-cfemail')){for(e='',r='0x'+a.substr(0,2)|0,n=2;a.length-n;n+=2)e+='%'+('0'+('0x'+a.substr(n,2)^r).toString(16)).slice(-2);p.replaceChild(document.createTextNode(decodeURIComponent(e)),c)}p.removeChild(t)}}catch(u){}}()/* ]]> */ lambic fontinas
similar tart, lemony nose, slightly darker gold with noticable candy sugar sweetness that well balances the sharpness making it oh so easy to knock back","NORTHERN IRELAND","Beersiveknown"
2237,"2015-09-23",3.6,"Draught at Chez Moeder Lambic, Brussels, Belgium. Clear chestnut, low head. Cidry, with rummy and sirupy notes. Medium bodied, low carbonation. Semi sweet, medium acidity.","Göteborg, SWEDEN","ekstedt"
2237,"2015-09-19",3.8,"Preparato al the dome con zucchero candito.
Ambrata senza schiuma.
Lambic piatto addolcito.  ---Rated via Beer Buddy for Mi4i","Genova, ITALY","fiammanghilla"
2237,"2015-09-18",3.7,"Cask @ Moeder Lambic Fontainas, Brussels. Pours orange with a large, large-bubbled, white head. Aroma is somewhat sour, fermented apple, sugared soda. Fermented fruit. Taste is appleskin, light sweetness, not very sour.","Alabama, USA","Erasmus_ro"
2237,"2015-09-18",3.5,"2010. At the brewery from a jug. Pours Orange yellow hazy with almost no head. Aroma oak, malts, tasty. Not Bad.","Tampere, FINLAND","ration"
2237,"2015-09-17",4.0,"Pours clear golden. Aroma is sherry, sour. Taste is milder than i expected. Fruity, slightly sour.","NORWAY","borre_m"
2237,"2015-09-05",3.8,"On cask at Moeder Lambic. Poured light hazy amber orange with white head. Aroma sweet little malt funk. Light carb med bod. Very sweet taste, sweetened tea, lemon, orange.","New York, New York, USA","charule"
2237,"2015-08-31",3.4,"[email protected]/* <![CDATA[ */!function(t,e,r,n,c,a,p){try{t=document.currentScript||function(){for(t=document.getElementsByTagName('script'),e=t.length;e--;)if(t[e].getAttribute('data-cfhash'))return t[e]}();if(t&&(c=t.previousSibling)){p=t.parentNode;if(a=c.getAttribute('data-cfemail')){for(e='',r='0x'+a.substr(0,2)|0,n=2;a.length-n;n+=2)e+='%'+('0'+('0x'+a.substr(n,2)^r).toString(16)).slice(-2);p.replaceChild(document.createTextNode(decodeURIComponent(e)),c)}p.removeChild(t)}}catch(u){}}()/* ]]> */ Lambic, Brussels. Hazy orangeish pale brown colour with a mediumsized beige creamy head. aroma is sugar meeting sour wooden notes and some mild caramel and raisins. Flavour is dry wood with some sweet syrupy notes as well as some quite earthy notes.","Vasa, FINLAND","oh6gdx"
2237,"2015-08-16",3.9,"Cask at chez moeder lambic. Pours deep amber, nose is light funk, sugary, taste is sweet, light funk, fruity.","Edinburgh, SCOTLAND","Stuu666"
2237,"2015-08-16",3.9,"Cantillon Faro 5% at Moeder Lambic pours an orange brown with a foamy beige head. Musty fruity wine and sweetness in the nose. Tart but sweet with some acidity and sourness. Wonderful.  Best Faro Ive ever had, then again this is also the only authentic one Ive had.","Kyoto, JAPAN","KansaiBeerLvrs"
2237,"2015-08-07",2.2,"Lasting white head. Almiost clear amber color. Strange beer / acidic wine aroma with fresh fruit acid. Sweet taste with a harsh astringen bitterness and small acidity in the taste. This is a strange beer.","Stockholm, SWEDEN","TEJA"
2237,"2015-07-31",3.7,"(On cask at Moeder Lambic Fontainas, July 24 2015) Pours very murky burnt orange with bubbly lingering white cask head. Aroma has a real sweet undercurrent of caramel and a bit of dates and figs, musty with light Brett, odd overtone of a chlorine pool building. Flavour is sweet candy sugar, tart acidity and a bit of sourness underneath, kind of fruity with fig, orange and a little lemon. Bit of a soft apple cider character going on. Bretty funk is present if not super strong, as is the wood - leather and light barnyard. Medium cask mouthfeel with no carb. Aftertaste is tart and a little astringent. Faro is probably not my style but in fairness this is a pretty good brew and if I werent surrounded by unsweetened lambics Im sure Id be happy to drink another.","Linköping, Sweden/Toronto, Ontario, CANADA","neongolden"
2237,"2015-07-11",3.8,"On cask at Morder Lambic, Brussels . Orangel murky body. Sweet yesay and sour citrus lemonand orange . Smooth palate fromantic the cadk. Nice beer.","Steinbach, Manitoba, CANADA","northropfrye"
2237,"2015-07-11",4.0,"Another great brew. Im assuming Im smelling faro...Lots of grain and sweet and malts with a nice sour and funky and kick. Great.","Steinbach, Manitoba, CANADA","cards04"
2237,"2015-06-23",3.8,"Tap at Moeder Lambic. Hazy orange color, medium white head. Aroma is sweet citrus, funky, light barnyard note, leather. Taste is light sour and sweet. In the past i only drink Faro from lindemans and thinking that Faro is very sweet, broken lambic. Cantillon version is different, nice balanced sour and sweet taste, still have that wild lambic character. Very good and refreshing beer.","Lodz, POLAND","Mesjasz"
2237,"2015-06-14",3.2,"Keg at The 24th Weekend Of Spontaneous Fermentation. I have (had) a really poor opinion of Faro as a style having not really tried many of them. I thought if anyone could make the style work then its Cantillon. The idea of adding sugar to Lambic is criminal. This wasnt totally awful though. The sweetness is incorporated quite well. Funky lemon sourness. With a clear barnyard funk. Decent.","CZECH REPUBLIC","TheCametron"
2237,"2015-06-08",3.0,"Tap @ Chez Moeder Lambic Fontainas, Brussels 13/5-15. Fruity with apples/pear, sweet.","SWEDEN","Gaultier"
2237,"2015-06-08",3.9,"Cask au Moeder Fontainas. Couleur orangée trouble, mousse beige aérienne. Arôme boisé, levure sauvage, fruits mûrs. Goût boisé, acidité faible, un peu sucré, amertume légère en fin de bouche. Absence de carbonatation, corps moyen-faible.","Saint-Jean-sur-Richelieu, Quebec, CANADA","Whatup14"
2237,"2015-05-29",3.2,"On draft at Moeder Lambic with an American friend! Sweet, grain, brown sugar, little citrus. A waste of lambic really, since it's soo sweet almost all complexity is gone.","Scheldewindeke, BELGIUM","ElManana"
2237,"2015-05-16",3.1,"UPDATED: JUN 8, 2015 Tap @ Chez Moeder Lambic Fontainas, Brussels 150513. Really fruity and light acidic, bretty, sweet, flat, medium body with an oily texture. The finish is fruity and sweet.","Ängelholm, SWEDEN","Jorn69"
2237,"2015-05-12",3.9,"Draft pour. Pours a somewhat hazy, dark copper color with a white head. The aroma is sweet and sugary with some grassy notes. The taste is mostly sweet and just a touch sour. Medium body and lower carbonation.","Devola/Marietta, Ohio, USA","JStax"
2237,"2015-05-07",4.1,"[Ölresa Bryssel med Wihlan 2015] @ Moeder Lambic. Fantastisk balans i smaken och kroppen !","Helsingborg, SWEDEN","VictorStr"
2237,"2015-05-05",3.6,"Draft at Moeder - pours orange/yellow. Nose and taste is sweet, sour, lemon zest.","Port St. Lucie, Florida, USA","biggsbowler"
2237,"2015-05-02",3.7,"On tap At Moder Lambic. Cloudy yellow pour with a white head. Mild sour aromas. Really sweet, almost desert wine or sugary sweet, with mild sour backbeats. Some malts and grains in the distance. Average body and mouthfeel.","Florida, USA","50belair"
2237,"2015-04-29",3.4,"Pour at Cantillon. Clear golden light brown color with no head. Very sweet, sugar is quite notable, with a touch of tartness. No carbonation. Thin. Worst beer I had during my visit to Cantillon. But its probably more the style than it is the actual beer.","Norfolk, Virginia, USA","Dr_Fellini"
2237,"2015-04-29",3.6,"Tap. Hazy golden with white head. Aroma of lambic funk, earth, apples. Taste has a lot of sharp green apple with some earthy funk. Little sweet but not overly so, slightly acidic as well.","Edinburgh, SCOTLAND","BenH"
2237,"2015-04-27",3.4,"On cask @ Moeder Lambic Fontainas, Brussels - BE. Color: hazy amber beer with no carbonation and small white foam. Smell: sour nose and small caramel finish. Candy. Taste: sweet sensation, caramel and candy. Fruity notes. Candied fruit finish. Aftertaste: sweet sour sensation.","FRANCE","sir__v"
2237,"2015-04-27",3.5,"Moeder lambic.
Appearance: Not too nice brown, hazy.
Aroma: skunky sour, Strong old fruit.
Taste: Bitter, no bubbles, old. Flat and burned finish, bitter.","SWEDEN","Malin_aiisa"
2237,"2015-04-18",3.7,"Pours golden. No head. Flat. Aroma of brown sugar, wet dog. Slightly mouldy taste. Sweet and sour.

---Rated via Beer Buddy for iPhone","Oslo, NORWAY","Humlehode"
2237,"2015-04-02",3.5,"On tap at Moeder Lambic. Sour orange juice aroma with a some herbal hops and faint celery. Hazy bronze under a bubbly white collar. Sweet and sour flavour thats curiously delicate and finishes quite clean, except for a lingering, tannic bitterness. Very little goaty character. Medium body, low carbonation, slightly mouth puckering and tingly.","Ottawa, Ontario, CANADA","asheft"
2237,"2015-03-09",3.9,"Un peu plus de complexité et de rondeur que le Lambic, un faro ultra raffraîchissant et harmonieux.","Mons, BELGIUM","Ysok02"
2237,"2015-03-06",3.7,"Cask at Moeder Lambic, 5th March 15. Fairly cloudy, aroma is sweet funk, the taste is sour, tempered down and this drinks easily, sour farmyard notes, not overly astringent. Nice","London Town, Greater London, ENGLAND","CraftBeerNick"
2237,"2015-02-24",2.9,"Amber color with little foam. The smell is weirdly like old sweetness. The taste is sweet but not sugary. No carbonation with little to no sourness. Not as convincing as hoped.","SWITZERLAND","King_Alex_II"
2237,"2015-02-19",3.5,"On tap at Moeder Lambic. Dark golden color with white head. Aroma is sweet, balsamico, a bit of subtle funk. Taste is fruity-sweet, not really sour, the Lambiv character gets lost. Not very complex but this is a lovely Faro!","Garching b. München, GERMANY","SinH4"
2237,"2015-02-18",3.8,"Jug pour from le mix du [email protected]/* <![CDATA[ */!function(t,e,r,n,c,a,p){try{t=document.currentScript||function(){for(t=document.getElementsByTagName('script'),e=t.length;e--;)if(t[e].getAttribute('data-cfhash'))return t[e]}();if(t&&(c=t.previousSibling)){p=t.parentNode;if(a=c.getAttribute('data-cfemail')){for(e='',r='0x'+a.substr(0,2)|0,n=2;a.length-n;n+=2)e+='%'+('0'+('0x'+a.substr(n,2)^r).toString(16)).slice(-2);p.replaceChild(document.createTextNode(decodeURIComponent(e)),c)}p.removeChild(t)}}catch(u){}}()/* ]]> */, 02/2015. Silky smooth dark amber pour, flattish. aroma of Cassonade Graeffe aka cured beetroot sugar stored in an open oak container, sprinkled with the mild balsamics of ripe lemons. Drinks likes only slightly funky lemonade, slick not sticky. - My take on the FAQ No. 1 regarding this style: Faro represents a historical chapter in lambieks demotic survival during the dark 70s-90s ages of oude geuzes steady decline and could still be considered the broad publics preferred imbibing state...","Belchium im Biersgau, GERMANY","bartlebier"
2237,"2015-02-17",3.6,"January 23, 2015. On tap at Moeder Lambic Fontainas. 
Cloudy orange with a large white head. Aroma is sweet caramel, some fruity tartness with citrus and green apples, light funky. Taste ss sweet caramel with some fruity and funky notes, dry finish with oak and earth.","Stockholm, SWEDEN","hackobock"
2237,"2015-02-11",3.2,"Cask at Moeder Lambic Fontinas. Pours a nice hazy amber with a reasonable foamy white head. Funky aroma. Citrusy sourness but with an overwhelming caramel sugary flavour (stronger sweetness than I have had before in a Faro). Couldnt help wonder why on earth you would add that sweetness to a delicious Cantillon lambic...","Greater London, ENGLAND","BlizzardOz"
2237,"2015-01-24",3.7,"Cask at Moeder Lambic Fontainas. Pours lightly cloudy amber with a large, rocky off-white head, long retention with good lacing. Aroma is earthy and cellar malt, cherry notes, oak, barnyard yeast. Flavor is sweet and tart fruits and cereal malt, earthy and barnyard yeast notes with a dry finish. Light body and medium carbonation.","Escondido, California, USA","BeerandBlues2"
2237,"2015-01-19",3.1,"Cask during Brussels vacation. Murky dark golden with beige head. Aroma sweet, sugar, malt, light tart notes, ashtray, half-smoked cigarette. Taste has more ash, ashtray, sugar, tart notes, malt and more sugar.","Uppsala, SWEDEN","Pyrmir"
2237,"2015-01-05",3.5,"Tap at Chez Moeder Lambic Fontainas, Brussels. Poured a hazy medium amber with a big frothy white head. The aroma is rich sweet citrus rind, light spice. The flavour is moderate to strong sweet, light sour with a smooth sugary sour yeast palate and some lingering sourness in the finish. Medium bodied with soft carbonation. Lots of sweetness up front and the sourness is all there at the back of your throat. Very refreshing indeed.","Kuala Lumpur, MALAYSIA","jmgreenuk"
2237,"2014-12-12",3.4,"Cerveza turbia de color naranja claro, cabeza espumosa pequeña.
Aroma a malta, caramelo y azúcar moreno.
Sabor dulce y amargo del cítrico, un final seco a madera, realmente buena.","ponferrada, SPAIN","didierlewallon"
2237,"2014-11-09",2.9,"Sickly sugary sweet with some sour aftertaste. Somewhat fruity, not my style. Cask at moeder lambic.","Minnesota, USA","Steasy66"
2237,"2014-11-08",3.1,"from cask at moeder lambic. poured a murky dark golden colour with a white head. lemons, green apple, kind of some, sweetness, caramel, sugar, wood, not my kind of style, why would you add sugar to a geuze....","Alingsås, SWEDEN, SWEDEN","markextrae"
2237,"2014-11-07",3.5,"Cask at Moeder Lambic Fontainas - Brussels. Pours cloudy orange-gold with a lasting, frothy white head. Light grassy nose, some rindy citrus, background funk. Medium to big sweet flavor, mild sour bite, a bit of that cloying faro greatness, some salt, light grass. Light to medium bodied with fine carbonation. Sweet finish with nips of leather, grass, sugar, cereal grains. Faro.","London, Greater London, ENGLAND","Leighton"
2237,"2014-10-24",3.7,"Draft at Moeder Lambic in Brussels. Big white head on a hazy light brownish amber pour. Sweet and malty nose. Sweet taste with a nice touch of funk. Cool.","Twin Cities, Minnesota, USA","Bacterial"
2237,"2014-10-21",4.1,"Smell is barnyard funk. Taste is moderate sourness, apples and tangerine notes in there. A touch of citrus is evident here. quite a nice brew but after a Kriek it is not quite the same.","Glasgow, SCOTLAND","GlasgowTAD"
2237,"2014-10-19",3.6,"Cask @ Moeder Lambic. Clear light brown pour with a generous head. Light funk, brown sugar, hay and some herbal notes.","Aarhus, DENMARK","bursprak"
2237,"2014-10-16",3.4,"On tap at Moeder Fontainas. Pours a dark blond with creamy white head. Aroma is barnyard funk and candied apples. Taste is light rustic sourness, brett and candi sugar. A little harsh. I prefered Girardins faro.","Quebec, CANADA","Luk_"
2237,"2014-10-05",3.7,"(Cantillon Faro) 250 ml glass from tap at Moeder Lambic, Brussels, served into a tumbler.
Murky light orange colour on the body, small frothy head, more like just bubbles actually. Okay retention though.
Aroma of white grapes, sugars, some red fruits too.
Nice taste, sugars, fruits, quite sweet.
Medium thin body, low carbonation, very dry on the palate.
Enjoyable beer and very refreshing in spite of its sweetness.","Arnhem, NETHERLANDS","Christos"
2237,"2014-09-15",3.7,"Cask at Chez Moeder Saint-Gilles and poured into Cantillon lambic glass.

Pours a bronze/orange/red in color, bubbles on top, thin ring of foam. Nose is sweet sugars, light tartness. Flavor is more of the same, not all that complex, but enjoyable for what it is. Sweet, fruity, light oak, sugars. Light body, refreshing, dry finish.

A nice Faro that both my wife and I enjoyed a few pours of. Just easy-drinking, light, and refreshing. Good stuff.","Chicago, Illinois, USA","Sean9689"
2237,"2014-09-12",2.6,"On tap at brewery; cloudy amber color. Somewhat sweet and sour, with vinegar notes .. this one was not for me (didnt finish it).","Vancouver, British Columbia, CANADA","darrennelson12"
2237,"2014-09-11",3.9,"Amber cloudy with medium white cap. Sweet with certain notes of bitterness.","LATVIA","Alusmamuts"
2237,"2014-09-09",4.1,"Thanks to Kraddel. Shared at weekly tasting. Pours orange gold. Nose/taste of funky oak, lemon, light brown sugar and acidic caramel. Medium body.",", New Jersey, USA","jtclockwork"
2237,"2014-09-02",3.9,"Totally traditional faro as it was consumed in huge quantities in Brussels in the 19th century: young lambic with candi sugar added to enhance the drinkability, not bottled and only served from the cask. Tasted at Cantillon where it is sold to visitors. Cloudy amber colour, practically no head; complex funkiness of the Cantillon lambic, sour but softened by the sweetness of the candi sugar. Extremely old-fashioned and very thirst-quenching.","BELGIUM","Alengrin"
2237,"2014-08-24",3.7,"Cask @ Moeder Lambic, Fontaines. Pours light hazy golden with a small white head. Aroma is light sour, grapes, white sugar, some wood, dusty. Flavor is sourness, white sugar, white grapes, barnyards, wood, dust. Medium body, soft carbonation, light sour finish. 300714","Hasselager, DENMARK","Camons"
2237,"2014-08-21",3.1,"Draft a Moeder Lambic wih Taylor and Kimberly. Pours murky bronze orang with big foam bubbles. Aroma is very nice classic cantillon funk with a coolaid sweetness. Taste is very sweet, low acidity, sugar water, hint if nice Gueuze funk, but the beer us sheen destroyed by the addition if sugar. It is a shame the brewery decided to ruin perfectly good Gueuze with sugar, blah.","Dallas, Texas, USA","Experiment_Ale"
2237,"2014-08-09",3.5,"Tap at Moeder. Darker than the gueuze. Woody, vinous notes on a sour backbone. Light sweetness.","SWITZERLAND","crlnts"
2237,"2014-07-27",3.5,"Tap @ moederlambik . Pours hazy amber with an off white head. Aroma of lacto acid, vinegar, some sugar, stable, yogurt and bit of sweet balsamic. Taste of sweet vinegar, some sweet sugar notes, balsamic and some sweeter fruits. Overall a bit of a ""Flemish"" feel to it. Pretty okay faro mayn!","Aarhus, DENMARK","RasmusOtt"
2237,"2014-07-27",4.0,"Z kija w Moeder Lambik, Bruksela. 
Piwo jest mętne o kolorze bursztynu i brudnej pomarańczy. W aromacie można wyczuć świeżość, karmel, kompot z rabarbaru i jabłek. Drewno. Smak piwa potwierdza słodki, łatwy w piciu lambik. Bardzo przyjemny. Wodnisty i mało gazowany.","Warszawa, POLAND","Swaroga"
2237,"2014-07-24",4.3,"Draught @ Moeder Lambic, Brussels. Pours murky amber with airy but stable white head. Clear vinous aroma, with subtle notes of fruit and hops. Bittter, hoppy onset, giving way to hefty vinous notes and touches of fruit and hops. Creamy mouthfeel. Vinous aftertaste with estery hints. Very good.","Sønderborg, DENMARK","Bamsen78"
2237,"2014-07-07",3.7,"Pint at Ches moedeur, standard light barnyard cantillon with a molasses light sweetness in the background, minimal additional sweetness adds a layer of flavors, interesting","Arizona, USA","Ernesto987"
