"beer_id","date","rating","text","user_location","user_name"
3419,"2009-03-15",4.2,"Bomber. Pours dark orange, hazy with a nice full white head. Nose is amazing: citrus, tartness, funk, acid,  bretty-full of flavor. Taste is very tart and tangy, bitter and dry, a bit sweet with some grapefruit. Brett is here but only adds, does not dominate. Full, rich, evervescent body. As good as many Russian River sours.  Well done.","Seattle still not near Beersel., Washington, USA","bleeng"
3419,"2009-03-14",3.4,"poured reddish, not too thick. An aroma of spit and bacteria. Initially, the sourness well controlled by malt. AVerage mouthfeel. Drinkable over a meal, tastes somewhat of a wild ale that builds up in the mouth over repeated sips.Intersting.","Toronto, Ontario, CANADA","Sammy"
3419,"2009-03-05",3.8,"Double wax dip Bottle (what a pain) Pours out a murky amber with red highs topped with a small ring tan head. Aroma was of berrie, sweetness and some of the 9%. Tast was more of the berrie but lots of bitterness at the end like grapefruit peel. A little tart. Not to bad.","Boise, Idaho, USA","BuckeyeBoy"
3419,"2009-03-03",3.8,"Bottle. Body-Dark iced tea with a thick ring of bubbles. Nose-sour, woody, light funk, cherry, toothpicks. Taste-brown ale, little tart, dry, sharp bite on the back end that isnt from the funk, sour cherries, dry wood, lots of tannins, straw, hay. A very nice mild sour.","Carrollton, Texas, USA","Lumpy"
3419,"2009-03-01",4.0,"Brown with dissipating tan head. Aroma is of tart cherries, caramel. Flavor is the same plus some tart apple. Acidic, tart, slightly bitter with some sweetness at the end.  The alcohol is well hidden. Very good, but could be more balanced. I would like a bit more malt flavor.","Orinda, California, USA","haggis03a3"
3419,"2009-02-28",4.1,"Bottle that was handed over in a trade in NYC Nov 08 from the marvellous Miketd consumed 27-02-09, cheers Mike youre a solid gold star  Pours brown with a bit of reddiness, head is white. Aroma is sour, some tart cherries, warm wet woodland and even a bit of porcini mushrooms steeped in hot water. Mmmmmhhh flavour is lovely, bit woody, nice sourness though not to tangy. At times I reminded of Rodenbach and even Suffolk Strong, woodiness is top of the list on taste but there is a deecent fruity sourness. I could happily drink this all night, great beer.  A8 A4 F8 P4 OV16   4.1","Merton, Oxfordshire, England, Oxfordshire, ENGLAND","Fin"
3419,"2009-02-27",4.1,"Bottle: Poured a deep reddish color ale with large foamy head with great retention and great lacing.  Aroma of oak and tart notes are clearly dominant with some light funk also discernable. Taste is also dominated by some oak notes with a tart taste with some lactic funky sour notes also noticeable. Good body with great carbonation with no apparent alcohol. While I really enjoyed the sourness and the oak notes I thought the funky yeast didnt integrated that well with the rest of the flavors. Still very good nonetheless.","Gatineau, Quebec, CANADA","Boutip"
3419,"2009-02-27",4.5,"UPDATED: DEC 19, 2014 ""this one was fun. i had it at a beer tasting party, and although there were a few others that people didnt totally agree on, this one was polarizing. it was like democrats & republicans in there. our host, who spit his out, was in the ""hate it"" crowd, while i was on the opposite end of the spectrum. i have even more respect for Deschutes for creating a beer like this. It pours a ruby brown color and youre immediately hit with a complex aroma of musty apples &/or cherries, with so many other things underneath, I cant describe. The flavor is a wonder. more of the same. tart, complex beyond my expectations with a great finish. this beer stands on its own incredibly well or would bring out the flavor in numerous foods. HIGHLY recomended!!! One of the most unique beers Ive had.""
Still a hightly rated elegant sour, but complexity has never been the same since the first release (4.7)...4.4 or so since.","Reno, Nevada, USA","slowrunner77"
3419,"2009-02-15",3.7,"(sample from enniskillen and irishboy)clear red with a light brown head.light funk in the aroma with some caramel.flavor is much of the same with some brown sugar thrown in.","Bakersfield, California, USA","Odeed"
3419,"2009-02-15",3.7,"Bomber the Chevron station in Port Angeles WA. Nose of caramel, light Horseblanket, and toffee. Clesr rusty brown with a small offwhite, glass lacing head. Flavor was very lightly tart and horse blanket, caramel, and toffee. Tasty but not a very sour ale!","Bakersfield, California, USA","IrishBoy"
3419,"2009-02-13",3.7,"22oz bottle $8.99. I poured this into a snifter and put on Pearl Jam (because I am corny and the namesake of this beer is a good song). Clear, ruby red which seems odd but then I am no expert on flanders reds or oud bruins. First whiff gave off burnt rubber but quickly moved on to a lightly sour vinegar aroma with cherries with the rubber still darting in from the back and a slight touch of alcohol. Nice sour flavors of cherries, just enough to make my mouth slightly pucker but nothing like Supplication or La Folie sour, much more muted and that rubber makes a brief appearance in the flavor. I actually wanted to like this more but I have had too many good sours this year and I am not sure I could taste any hint of wood and the rubber aromas and flavors were off-putting. This is not hard to drink however and does get better as it warms (like most beers).

update 10/12/08
The second bottle contains no rubber and tastes/smells better. Maybe because I drank some Isabelle just prior?

Serving type: bottle

Reviewed on: 09-30-2008 02:59:27","Denver, Colorado, USA","arrogantb"
3419,"2009-02-09",4.3,"Thanks to fogdog for this beer!  Pours reddish brown with orangy highlights.  Aroma is fairly subtle for the style, but I welcome the lack of sour assault.  Oak, dust, cherries, some amount of mustard and vinegar, and hints of the caramel malt foundation.  Taste is malty and sour, but not as sweet as some.  Cherries, sour fruit, big oak, mustard, light vinegar and a bit of caramel, almonds and bread.  Finishes fairly bitter, oaky, dry and cobwebby.  Im not the worlds biggest sour beer fan, some the effortless creamy palate really won me over.  Smooth and silky, big, but without much weight, and so so rounded.  Just the right hint of heat, but its mild.  This is a real treat, a lovely sour ale for those who want something a bit between Goudenband and La Folie, but with a bigger and silkier body than either.","Fort Worth, Texas, USA","RollinHard"
3419,"2009-02-04",4.0,"Poured a golder amber color with an off-white head.  The aroma was just how I like it.  Tart with big leathery notes.  Mildly tart, as in less than the aroma would have led me to believe.  Earthy leather notes.  Light to medium body.","Nesconset, New York, USA","goldtwins"
3419,"2009-02-02",3.8,"Bottle. Dark amber and mainly clear. Mild subtle Brett and other organisms. Soft, low, flat carbonation and silky mouthfeel. Nice and mellow. Lots of fruit pits, natural seed bitterness, mainly cherry pits. One to get to know.","VANCOUVER, British Columbia, CANADA","Beershine"
3419,"2009-02-02",3.6,"Hazy reddish-orange.  Raw nose is woody, very fruity and slightly balsamic.  Livelly body has a fruity, funky taste.  Its a dynamic brew that way...it has a lot of potential but I think Id prefer more tartness.","Vancouver, British Columbia, CANADA","Oakes"
3419,"2009-02-01",3.5,"Bottle. Brown colored with a hint of reddish/gold.  Aroma is sour cherry with earthy tones.  Sour fruit up front taste followed by a woody/nutty taste that leaves a lingering tingle.  Not quite as sour as I was hoping for.","Anchorage, Alaska, USA","rwaters"
3419,"2009-02-01",3.6,"reddish brown with tiny white head.  aroma is very sour and fruity.  the flavor isnt very fruity, but still sour and acidic.  it tastes kind of woody.","Anchorage, Alaska, USA","gator2683"
3419,"2009-01-31",4.1,"Bottle and shared with tjthresh (I think I got this from Jon, not sure but thanks anywho): Bronze hued with a small fizzy head and spotty lace, when the worst part of the beer is the appearance you know you got a winner. The aroma is tart cherry and red grape, lacto acid, earthy, some caramel, woody oak chips, hints of grains of paradise as well. The taste has a nice moderate fruity snap supported by light spice and a backbone of sweet malts. Nutty note lead towards the woody barrel influenced finish. The mouth feel is dry yet mouth watering refreshing. Very well done and quite to style of an Oud Bruin IMO. Mikey Likey and wants another.","La Porte, Indiana, USA","BBB63"
3419,"2009-01-30",4.0,"Courtesy darkguardian.  Pours a very lightly hazy, dark crimson color.  A frothy, well-retained head of tan foam leaves sticky arches of lacing on the glass.  The nose shows elements I never thought I would encounter in a brew of this type.  The requisite sour cherry and oaky vanilla is there, along with some tannic grape notes, but unexpected scents of powdered sugar candy (Necco wafers!) and spicy candied ginger are a real treat.  Flavors arent quite as adventurous, as the sour cherry and aggressive, woody oak take over.  Floral hopping is surprisingly substantial for the style.  Medium-full, tart, and dry, the palate is satisfying.  Sour cherry and vanilla linger on the finish.  Great beer.","Orlando, Florida, USA","Beerlando"
3419,"2009-01-30",4.0,"Yum!  Earthy and sour with a vanilla/citrus finish that delightfully drips with wooden character.","I F&ckin hate those guys from, Ohio, USA","Rogueone"
3419,"2009-01-29",4.0,"UPDATED: FEB 9, 2009 On tap at City Beer Store, then later a bottle at Toronado.  Well done sour ale.  Reddish-brown color with an off-white head. Aroma of fruit and some brettanomyces. Flavor is complex with strong cherries, brett, caramel malts - sweet and sour at the same time.  Very smooth palate.  Pretty drinkable for what it is.","San Francisco, California, USA","nickd717"
3419,"2009-01-28",3.9,"Crushed with Jakebra.  Belgian brown/sour eh?  Quite sour, fruity nose.  Flavor is the same with a great tart finish.  A damn fine whatever-style-it-happens-to-be.","Colorado, USA","That1Guy"
3419,"2009-01-26",4.5,"UPDATED: FEB 17, 2009 Powerful yet smooth sour brown ale.  Nose is of dark cherries, raisins, figs, plums, toffee and chocolate.  Medium bodied and mouth filling, with a tart and slightly tannic aspect to it.  Flavors similar to the nose, but  slightly more wood, earth and slight toast and caramel.  Not overtly farmhouse or barnyard, the brett flavor is subdued, but the sourness and cherries pervade.","San Francisco, California, USA","ryanknock"
3419,"2009-01-26",4.0,"Purchased 22-oz bottle from Liquidsolutions.biz. Pours a hazy reddish copper sour ale with a thin off-white head that slowly dissipates to a fine film top. Aroma of Brett, yeast funk, some black cherry, light brownish malt, and some cinnamon. Taste is medium bodied, plenty of tartness with flavors of Brett yeast, sour red berries, a hint of vanilla and some barnyard funk. Finish continues the tart berry aftertaste with plenty of dry yeast.","Papoose Jct, Minnesota, USA","Skyview"
3419,"2009-01-24",4.1,"Bottle courtesy of beerbill.  Many thanks.  Deep garnet pour.  Aroma is softly sweet with a light cherry sweetness.  Softly vineous with a very soft lactic tartness.  A really rich cherry note and a bit of light balsamic character as well.  Rich cherry/berryish aroma that accents the soft tartness.  Soft cherry and light berryish fruit with a lovely balance of fruit and lean pale malt.  Light funky aroma and a bit of sweetness as well.  Pretty solid brew.  More Flemish Red than Flemish brown to me, but either way, its pretty nice.","Toronto, ON, Ontario, CANADA","JoeMcPhee"
3419,"2009-01-23",3.8,"2008 Vintage 22 oz. bottle courtesy of bvc.  This bottle is double wax sealed, which is interesting.  Aroma of acidic black cherry fruit and oak woodiness right off the bat.  Behind that is boozy grainy maltiness.   The Brett yeastiness is present, though certainly in the background.  Overall, a nice balanced nose.  Taste is black cherry tartness with the oak booziness.  The sour funk is present as a liner around the overall taste experience.  Nice melding, though the alcohol is pretty bright.  Palate is smooth and silky, medium and really drinkable.  This was a fun one, thanks for sending it my way Brandon!","Kansas, USA","theisti"
3419,"2009-01-18",3.9,"Cheeseman strikes again!  Pours a lightly hazy copper maroon, with a light white head.  Smells of yeast, sweet fruits, mild acidity and tannins, with a noticeable maltiness.  Very sharp biting sourness up front right away.  Nice acidic tannins and sweet sour fruits mixed together.  Not overly sweet which I enjoyed, but not totally dry either.  Nice little balance to it.  Not an upper echelon sour, but certainly better than average for me.","Jupiter, Florida, USA","mgumby10"
3419,"2009-01-18",4.2,"Tap @ their Portland Public House...  Poured into a snifter looking foggy, reddish with an off white head that created a ring around the glass throughout the whole brew.  Aroma of wine-like characters and almost lambic in nature.  Really thick palate that filled and expanded nicely in the mouth.  This brown style had a little more bitterness and darker malt notes than its Red counterpart, and it seemed the wild yeast really did a nice job with this recipe/batch.  You could taste a hint of barley-grains in the finish.  It was nice to have this in the same week as the Roots Flanders Red.  Even though they scored similar to me, it was nice to see the immediate contrast between the Brown style and the Red style.  Thanks to Mike Starzec for the complementary round.","Portland, Oregon, USA","boFNjackson"
3419,"2009-01-16",4.1,"Pours hazy amber with a ruby hue. A quarter inch head rose up before settling down to a placid surface, with a few errant dots of lacework.

Aromatics hit the nose as soon as the beer goes into the glass, with fruity acid wafting up.
Cherries, red wine, balsamic vinegar, ripe malt, and warming spice. Hints of cinnamon, peppercorns, cedar, sherry, and rhubarb follow through.

Medium bodied, with a lightly prickled mouthfeel, and drying.

Ripe, red fruits, acid, and oaky tannins are supported by a malty base on the palate.
As the brew warms hints of subtle spice step forward. Nutmeg, anise, and Schezuan peppercorns. Plenty of acid without being lactic or sour. 

Finishes with cherries, sherry, balsamic, pepper-studded earthy cedar, and warming alcohol. 

Wowza. Great beer now, but just wait a few years for this one to really meld, mellow, and complexify. The Pinot Noir barrels add a tremendous depth that is not typically found in Oud Bruins.
The tartness level now is firm, but allows the brew to be very drinkable. Im curious to see if some cellar time will add much sourness.

Do yourself a favor and let this one warm up to room temperature.

Big ups to BA Urwatuh8 for answering the call once more!","Manchester, New Hampshire, USA","brewandbbq"
3419,"2009-01-15",4.0,"Bottle shared by durhambeer.  Pours a hazy dark amber with a small white head. Nose is cherry pits, tannins, oak, light tartness.  Flavor is wood, cherry, nice malts.  Vinous and dry mouthfeel with the alcohol very well hidden. I expected to not think this was sour enough, but the lack of extreme sourness works well in this beer and as Oud Bruin it makes sense. Very nice interpretation of the style.  A very pleasant surprise.","Durham, North Carolina, USA","TURDFERGUSON"
3419,"2009-01-15",3.8,"Bottle thanks much to Eugene.  Tastes and smells like young wood to me... not the dusty, oaky, barrel wood, but more like freshly cut wood.  More wood than sour cherry notes, but those are there as well in a tannic way.  Quite malty and the alcohol is well hidden.","Durham, North Carolina, USA","durhambeer"
3419,"2009-01-14",3.8,"Bottle, courtesy of golubj.  Poured a rich amber-auburn color with a medium, but quick diminishing head.  Aroma was nice, with sour, funky notes, cherries, fruit, earth, and oak.  Was not extremely sour, or maybe I am just getting more used to the style.  Alot of cherry in the flavor with hints of wood and cocoa.  Hints of barnyard funk and yeast, with generic fruit tones.  Actually really nice and I enjoyed it more than I thought I would.  Cant believe I rated it higher than Jon.","Branson, Missouri, USA","alexanderj"
3419,"2009-01-11",4.0,"Great example of the style.  Thanks, WeeHeavySD, for this.  Its been on the radar for a while and I figured Id never try it. I have. Its delicious.  Tart, musky and exactly what I expected it to be.","La Mesa, California, USA","Bartzilla"
3419,"2009-01-10",4.1,"22 oz. bottle courtesy of trades with both mashmaster and bitbucket.  As an aside before I begin my rating, I have to say that I really like the label graphics for this beer, very cool.  Thankfully, the wax on this bottle is soft and easy to cut through.  The beer itself pours a deep golden amber with a thin off-white head.  The aroma is pleasantly sour with just enough funk to give that barnyard smell but not be so strong as to mask the other attributes.  A generous amount of sour cherry in the nose as well.  The flavor is equally nice with old leather, barnyard funk, sour cherry and oak.  The tannins in the finish remind me more of a cabernet than of beer.  Sour ales are a style that I probably have the most difficulty with, as I really dont enjoy (and I guess appreciate) the uber sour beers, but this one I thought was just excellent.  My wife, who doesnt like sours at all, also thought this was very good.","Laurel, New York, USA","beerbill"
3419,"2009-01-09",3.8,"Thanks to durhambeer for sharing. Pours a translucent copper red with a creamy light tan head. The nose is spicy, woody, cherry skin and flesh, mild alcohol, sweet, caramel malt, fruity, fig. Flavor is spicy and woody, crisp hoppy bitterness, tannic feel, mild tartness, cherry skins. Crisp bitterness with a balancing tannic character round out the mouthfeel. Dont feel 9%. Very tasty bruin.","Chapel Hill, North Carolina, USA","emacgee"
3419,"2009-01-07",3.9,"Bottle, shared graciously by darkguardian on 12/30/08. Pours ruby with a wispy cream head. Nose is funky, wood, acidity, quite tart and sour with a little acetic character, soft vanilla from the barrel. Softer acidity in the mouth than the nose would suggest, tart, the wood really comes through. Tannic, puckering drying, medium to low carbonation makes it smoother. Not prickly. Very good at this point.","San Francisco, California, USA","cmillward"
3419,"2009-01-06",3.7,"Thanks to Dark Guardian, I think.  Somewhat light smell of sour apples, tart cherries and a dusty apartment.  Tart cherries move into the flavor with some vinegar.  Not overly sour tasting and much lighter than the aroma would suggest.  Good, but I think would be better with even more sourness.","Orlando, Florida, USA","GodOfThunder"
3419,"2009-01-05",3.5,"22 oz bottle.  Nice looking amber beer.  Nose is tart berries and wine.  Flavor is sour as all get out, but there is a nice sweetness that balances the infected flavors well.  Not a fan of sour beers, but this is pretty good.","Poway, California, USA","Naven"
3419,"2009-01-03",3.7,"22 oz bottle, shared by Axilla.  Pours a hazy amber body with a wispy beige head.  The nose is fairly funky with some cider vinegar and a bit of brett.  The flavor had a nice level of funk to it as well, not the most aggressive Sour, but it seemed pretty well balanced, some oak, tart fruit, it had a very vinous quality to it.  I could use a bit more brett flavor, maybe that will come with time?  Mouthfeel is light to medium bodied with light carbonation and a slightly puckering acidity.  Pretty decent, but not something that I loved.","Sunbury, Pennsylvania, USA","kramer"
3419,"2008-12-31",4.3,"Amazing sour courtesy Mr Stitch- Thanks man! Aroma was perfect- full and strong. Tart vinegar with sour fruit. Pour was also perfect. Medium brown with an amber hue and a nice pillowy 3 finger tan head. Taste was vinegar, sour raspberry and funk with woody undertones. Strong carbonation and very addictive. Near perfect in every way","Moon Twp, suburb of Pittsburgh, Pennsylvania, USA","LinusStick"
3419,"2008-12-31",4.3,"UPDATED: JAN 4, 2009 thanks zeswaft.  bottle pour.  pours 1 inch tan foamy head and is burnt red and clear with lots of carbonation. smells pretty funky and farty,  flavor isnt super sour ale as much as it is like a jolly pumpkin.  but its actually a pretty good one. very mild infection flavors.  pretty sweet.  awesome.","chicago, Illinois, USA","sersdf"
3419,"2008-12-31",3.6,"22 oz. bottle shared by highibus - Pours a mahogany color with a thin off white head.  Light lacing.  The flavor and aroma is tart esters.  Soft carbonation and medium body.  A decent beer.  Thanks Tom.","BFE, Arizona, USA","cbkschubert"
3419,"2008-12-31",3.5,"Hand-waxed bottle shared with Theis, traded from toncatcher. Pours a beautiful clear red with strins of bubbles and an off-white head. Mildly sour with aromas of brett and berries. Medium body. Medium to soft carbonation. Slightly sticky mouthfeel. Bitter, bretty finish with faint aromas of coconutmilk. ’Bit too much brett. Thanks Dennis.","Copenhagen OE, DENMARK","sunevdj"
3419,"2008-12-30",4.3,"Tasted 11/15/08.  22oz bomber.  Filtered with a golden amber hue.  Spiraling off-white head.  Tart berry nose.  Woody and vinuous.  Cranberries and vanilla oak.  Big nose.  Medium to full bodied and bitter.  Red and black berries and totally tart.  Almost a wine and beer meld.  Good flavors and a great palate.  Big yet drinkable.  Robust yet balanced.  Tart fruity and vinegar, just what a sour should be!  Great job.","St. Louis, Missouri, USA","sneagrams3"
3419,"2008-12-30",3.7,"UPDATED: MAY 5, 2009 Bottle at Sunes - thanks. Clear dark deep red/brown - white head. Dark malty, red berries, brett, coconut, light sourish, light wood, spicy, soil, light flowery. Nice - but a bit too much brett, needs more balsamic caracters.... Again: #22 - Amerikaner Blind-Smagning 01-Maj-2009 hos Papsoe. Bottle. (6/3/6/3/14)","Frederiksberg, DENMARK","Theis"
3419,"2008-12-27",4.1,"Very pretty dark red with dirty white head. Pungant aroma of stinky cheese, dirty sweat socks, and ripe cherries. Oddly enough, all are good here. The flavor is pretty approachable. Robust vinager, lactic, a bit of fruit, and even a bit of malt character. Medium body and easy to drink. Very dry. I like this one quite a bit.","Greenfield, Indiana, USA","tjthresh"
3419,"2008-12-27",4.2,"22oz. wax sealed bottle. Served in a Duvel tulip. Poured a reddish copper with a thin off white head. Nice lacing. Great sour fruit aroma. Not quite as sour as the aroma might suggest, but the brett flavor is spot on. Medium bodied with a spritzy mouthfeel. Sour cherry flavor develops, as well as a little wood in the finish. Very refreshing and drinkable. Alcohol is not evident. Very enjoyable.","De Soto, Kansas, USA","HomeBrewHawk"
3419,"2008-12-26",3.8,"Bottle...murky amber pour with a sizeable white head.  Nose has hints of granny smith apples, pears, lightly funky, a bit of sour cheese.  Medium body with great carbonation...flavor has a massive amount of sour apples which leads to a bread dough and sour cherry finish.  Very solid brew.","Ft Wayne, Indiana, USA","bdigital"
3419,"2008-12-22",4.0,"UPDATED: JUL 23, 2010 9/15/2008

huge whiff of fresh cherries as the top is popped...

pours crystal clear a red cherry-ish amber color with a one inch pale tan head. 

initially lots of cherry in the aroma which fades to unveil metal, blood/iron/mineral, woody vanilla and cement-like bretty funk. it smells fairly sweet (for the style).

i get a lot of cinnamon flavor... along with ripe cherries, vanilla, caramel, toasted nuttiness and mineral-y bretty stink. there is a touch of malty sweetness to start. but, by the time the sip is over my tongue is dried off completely.... thanks brett! it*s tart and sour but not overly on either. the aftertaste lingers long into the night as fresh cherries. alcohol does come into play as it warms the sinus and chest the same way wine does... it*s quite pleasant. the medium body leans heavily on full. the carbonation gives it a creamy soft mouth feel which coats my mouth entirely yet it is spicy and prickly with a twangy kick.
8/3/8/5/16/4.0 we will see...

2008 bomber via superdave on 7/4/10.

its not nearly as tart and fruity as it originally was but it is for sure much more funky. seems brett came in to dry the shit out of this! mmm","scottsdale über alles, Arizona, USA","hellbilly"
3419,"2008-12-22",3.6,"Bottle.  Pours clear tawny with an average, fizzy, off-white head, somewhat lasting with good lacing.  Aroma is heavy malt (bread, hay, meal), average hops (flowers, grass), heavy yeast (horse blanket, barnyard) with notes of cherry and wood.  Medium bodied, sticky texture, average carbonation, and a sour finish.  Average duration, light sweetness, moderate acidity and sourness.","Escondido, California, USA","BeerandBlues2"
3419,"2008-12-21",4.0,"Bottle from the Co-op in Davis, CA. I;m always a little wary of sours. They tend to be a little too sour for me, but this one had a the perfect amount of sour. Nice balance of sour with sweet fruity flavors. Will try again.","Winters, California, USA","DTM"
