"beer_id","date","rating","text","user_location","user_name"
3419,"2010-03-05",4.0,"[email protected]/* <![CDATA[ */!function(t,e,r,n,c,a,p){try{t=document.currentScript||function(){for(t=document.getElementsByTagName('script'),e=t.length;e--;)if(t[e].getAttribute('data-cfhash'))return t[e]}();if(t&&(c=t.previousSibling)){p=t.parentNode;if(a=c.getAttribute('data-cfemail')){for(e='',r='0x'+a.substr(0,2)|0,n=2;a.length-n;n+=2)e+='%'+('0'+('0x'+a.substr(n,2)^r).toString(16)).slice(-2);p.replaceChild(document.createTextNode(decodeURIComponent(e)),c)}p.removeChild(t)}}catch(u){}}()/* ]]> */ 1st Vaasa CS/ES beer session (thanks JS). Reddish brown colour, small off-white foamy head. Aroma is sour wood, some tart fruityness as well as mild maltyness as well. Flavour is sour and tart fruits and wood along with some caramel. Very pleasantly balanced. Mild spicyness also after it warmed up a bit. Hides the ABV very well.","Vasa, FINLAND","oh6gdx"
3419,"2010-02-10",3.8,"22 oz. bottle shared by shigadeyo.  Pours a deep reddish copper color with a medium sized fizzy white head.  The nose is cherry fruitiness that is both sweet and sour at the same time.  Some underlying malt sweetness and mild oak are there as well.  The flavor is sweet caramel maltiness, oaky, lightly toasted, earthy, dry red wine with a more subtle tart cherry quality than the nose.  There is a slight funk that I would expect to increase with age.  This was very drinkable when we tasted it because the acidity, funk, etc. were not fully developed.  Finish is smooth and somewhat dry.","Cincinnati, Ohio, USA","alexsdad06"
3419,"2010-01-23",4.0,"( 22oz bomber of 2008 vintage thanks to BA javib458) Pours red-brown with nice tan head. Nose of cherry, oak, and vinegar. Taste of cherries, oak, and light vinegar.","Dallas, Texas, USA","thirdeye11"
3419,"2010-01-09",4.2,"22 ounce bottle courtesy of Sparky27. Thanks! Pours a lightly hazy red color with a thin head. Good head retention and lacing,. Aroma is tart and sour with notes of berries, cherries. Taste is very similar... raspberries, cherries, cranberries, some sugary notes. Medium bodied. Very nice.","Milwaukee, Wisconsin, USA","Drake"
3419,"2010-01-07",4.0,"Pours a reddish orange. Slick texture. medium sweetness, rather bitter and acidic, but drinkable. Sour fruit and some floral notes. Enjoyed.","Tampa, Florida, USA","Odde"
3419,"2010-01-06",4.0,"22 oz.  This beer suprised me.  I planned on it being good.  It ended up being very good.  A nice tartness actually made it refreshing even though the high alcohol content.","Shoreline, Washington, USA","hbmason"
3419,"2010-01-05",4.0,"Bottle courtesy of thirdeye11.

Pours brown with an off-white head. The aroma is a mix of vinegar and very tart cherries. Definitely a very good aroma. The flavor is also heavy on the cherries with some funk as well. It is definitely a sour beer, but not as sour as the aroma led me to believe it would be. You also get some oak and vanilla in the flavor. Medium to high carbonation and very drinkable.","McKinney, Texas, USA","Mora2000"
3419,"2010-01-02",4.1,"08 bottle. Pours a ruby brown with a smallish, off-white head. Aroma is slightly skunky, but very good - cherries, apple cider, a tiny bit of caramel, some grassiness, some lemon. Flavor is just a bit tart, but also very dry. I keep thinking its going to be sweet, but the sweetness is nearly completely countered by the dry, grassy, almost (but not quite) hoppy note. Really tasty, and another great effort from Deschutes.","Seattle, Washington, USA","trevor211"
3419,"2010-01-01",4.0,"Deschutes Brewery--the dissident Flanders Style Brown Ale Reserve--2008 Release--22 oz. Bottle.  9.00% ABV--30 IBUs  4.0 / 5.0  Brown Ale--Belgian.	Thin fizzy mild lace tan head.  Light sediment.  Clear bright dark cherry red color. Mild hop sour fruit ester front. Wild yeast. Doughy sour sweet mild toffee cocoa mellow fruit malty body. Dry sour citrus mild hop cloying toffee end.  Sampled 10/3/2009	2 @ $10.99 each.","Seattle, Washington, USA","philbertk"
3419,"2009-12-29",3.7,"bottle thanks to thirdeye11.  amber/ruby with a white head.  lightly tart, dried fruits and orange peels on the nose.  nice on the palate with some flavors that are pretty much dead on with the nose but not as tart as i was hoping for.","Dallas, Texas, USA","mar"
3419,"2009-12-21",3.9,"Bottle courtesy of thirdeye11. Hazy orange colored. Gentle sour aroma. A fair amount  of cologne. A nice smell. Flavor of tart fruit with some strawberry finishings. An interesting take on the sour.  Would probably age well.","Arlington, Texas, USA","Cavie"
3419,"2009-12-20",3.9,"Amber colored, nice head and lacing.  The aroma was not good, but I can  hold my nose to drink this beauty.  Lots of tart cherry, loads of sour brett which tried to take my tongue and fold it in half.   Some sour vinegar notes made me think this was a cross between a lambic and a flemish sour.  Tough to drink, but still enjoyable....a sipper for sure.","Middletown, Delaware, USA","Goodgrief"
3419,"2009-12-19",4.7,"22oz bottle cellared at least 1 year.  aroma is burinng hot sour/tart note of shoes, socks and BO.  strong rotten white wine.  awesome head retention and burnished amber color, huge nucleation -- this bottle gushed as predicted by my mate gonzoillini right on cue, begging to escape the confines of its container.  the ultimate treat is the crunchy candi end, ultra dry -- typically found only in unblended lambics and near perfect geuze.  big raspberry flavor comes to the table and bends your facial expression with its sourness that begins to delve into club soda and then tonic water with its wild, uncontrollable dryness.  perhaps the nearest perfect beer i will ever sample.","River Grove, Illinois, USA","satan165"
3419,"2009-12-17",4.0,"Draught @ Brouwers Café:   Heavy reddish amber, moderate to large foamy light sandy colored head, nice lacing, lively carbonation.    Reminds me of a lighter version of Duchess.   Faint oak on the nose, slightly sweet, slightly sour.   Weird, almost reminds me of a lighter Duchess on the nose.   Not as cloying or sweet, perhaps a bit more dry.   This is better than I expected.   Yeah, Duchess light, not as sweet, more oak, a bit more dry.   Average body and mouthfeel.   About what I expected.   A little bubbley otherwise.   Well balanced, not over the top on any aspect.   Alcohol is well hidden, but does feel a bit warming.   As it warms up it picks up more of a cherry flavor.   Okay, this one is growing on me.   For an American brewer to do this, great job!   Glad I have a few bottles to put down.","Hardened Liver, Washington, USA","5000"
3419,"2009-12-13",3.8,"Bomber from Nbutler. Pours reddish brown with off-white to tan head. Aroma is sour cherries, wood, vanilla, and some light caramel. Flavor was tart with sour cherries, vanilla, caramel and some wood. Found that the tartness of the beer increased as it warmed. Thicker mouthfeel for a sour. Downed almost the whole bomber myself as my friends I shared the bottle with did not really care for the whole sour beer experience.","Mount Prospect, Illinois, USA","msante79"
3419,"2009-12-11",3.7,"Bottle thanks to dimier.  Pour is slightly hazy dark copper with a small tan head.  Aroma is woody, light wood, cranberry, light rose hips, and faint cherry.  Flavor is woody, effervescent, lightly acidic, faint cherry and strawberry.  The finish is woody for sure, but eventually finished lean.  This is solid, but I would like more tartness.","Iowa City, Iowa, USA","beernbourbon"
3419,"2009-12-08",4.1,"Finally got through the the double wax layer on this 2008 traded bottle to pour a cloudy brown beer with ruby highlights. Just a thin tan head but nice carbonation. The aroma is so strong of sour cherries that my mouth honestly waters before tasting (a little blue cheese too). Very balanced flavour that does not overpower you with sour. Flavours of: cherries, vanilla, oak and some alcohol in the finish. Really enjoyable sour that was exceptional with dark chocolate as dessert.","Panama City, Florida, USA","BelgianBeerGal"
3419,"2009-12-07",4.1,"My kind of sour.   Not overwhelming.  Sour with vanilla, oak and definite alcohol.  Slightly cloudy amber with a small head.","Morganfield, Kentucky, USA","Acknud"
3419,"2009-12-04",3.9,"Wow, this was so amazing. My first sour beer. Didnt know what to make of that first swig, took me by surprise, didnt like it at all. but then i sat down and worked on it, and boy did it grow on me!","Washington, USA","cstuartj"
3419,"2009-11-29",3.5,"Bottle thanks to dmac. Pours a amber color with a little head to it. Has a sour cherry smell to it. Has a cherry taste that is a little sweet that goes to a sour. Its not sour as I thought it was going to be by the smell. There is also a little oak in there as well.","Allentown, Pennsylvania, USA","boamr"
3419,"2009-11-23",3.8,"Bottle. Pours a reddish amber color with a small off-white head. Has a fruity tart aroma. Smooth and slightly tart fruity malty flavor with some hints of caramel. Has a fruity tart waeming finish with a slighlty sour aftertaste.","Malmö, SWEDEN","anders37"
3419,"2009-11-21",3.5,"22oz bottle thanks to Andrew.  Pours a murky red.  Sweet and tart notes.  The vanilla and doughy malts are hidden underneath the sour fruits.  Cherries, red fruit, and citrus flavors are sour with that distinct brett notes.  The acidic sour fruit with the brett wasnt my favorite combination.  This might be better with a different strain of brett or souring with flanders yeast instead.  That said, not a bad beer.","Chicago, Illinois, USA","holdenn"
3419,"2009-11-20",3.7,"22oz, pours hazed amber. Nose of vanilla, sour oak cherry, and caramel. Fl is sour cherry, oak, vanilla, with acidic notes. Thin body, a nice sessionable sour!","Chicago, Illinois, USA","drewbeerme"
3419,"2009-11-12",3.7,"Mild sour ale, brown in colour with a small beige head. Fairly straight forward bretty thing with light subdued fruity notes. Mildly sour and easy going with flavours of brownish malts, brett and light barrel.","Malmö, SWEDEN","andersand"
3419,"2009-11-08",3.8,"Thanks to Dr. Bill for having this at his tasting. 
This is a complex beer whose tangy & vinous notes make it very enjoyable.","Mission Viejo, California, USA","JohnC"
3419,"2009-11-06",4.3,"UPDATED: MAR 19, 2011 2008 bottle. beautiful ruby red body with a reasonably thin head. wonderful sour aroma dominated by cherries and slightly acidic. not as sour as i remember and finishes pretty dry. this one may be past its prime, or i may not have cellared it correctly. still really good with a very dry finish, nearly wine like. still one of my favorite beers of all time","mount pleasant, South Carolina, USA","lukeherinckx"
3419,"2009-11-03",3.6,"Deep brownish red with a rather small tanned head that actually stays on for a while before settling. Some lacings.

The smell is quite interesting. There is a prominent mix of tart vinegar and clean brett aromas going on with notes of really funky barnyard, cherry tannins, red wine-like grapes, grass, yeast and wet wood. Hints of oaky vanilla. A complex smell, but slightly too edgy.

The taste is not as complex nor as interesting as the smell would have you to believe. Its actually quite sweet with prominent malty flavors of caramel coupled with pleasant tart fruit aromas (cherries and grapes). Complementary, somewhat clean, brett aromas and notes of mud, oak, grass and vanilla. Hints of yeast. The finish has a mild bitterness to it, brett, sweetish alcohol and dry cherry notes. I think it would have benefited from less alcohol flavors.

Medium, almost full body, and medium carbonation which is not how I want a Flanders Oud bruin to be - I prefer them with more carbonation. Its actually almost smooth and sticky.

A fairly good attempt at a style that seems hard to master outside of the boarders of Belgium. Its slightly too heavy and big to be really good. The additions from the cherries are really nice though.

Serving type: bottle

(Copy of old Beer Advocate review)","Malme, SWEDEN","ricke"
3419,"2009-10-30",4.0,"Picked up bottles at a gas station in Sequim. Go figure. Not as crazy sour as a Duchesse, but more drinkable. A llittle woody, a little brown sugar. If youre a sour fan, this is a ""must try"" on your list.","Seattle, Washington, USA","ruffhauser"
3419,"2009-10-19",3.9,"A sourness that makes my jaw hurt is rare but this one did it. Color is a dark ruby red with a nice off white head. Mostly wild yeast aroma with a little bit of woodiness. Flavor is subtley complex and very wine like. Apart from the obvious sourness there is some nice fruit flavors mainly cherry. The added cherry fruit is noticeable. Wine like characteristics in the texture and fruitiness. Earthiness from the yeast adds another dimension. Finish leaves a touch of sweetness. Very interesting and well done. I would love to try this with a little bit of age on it.","Atlanta, Georgia, USA","jrob21"
3419,"2009-10-17",4.0,"Thin tan head. Clear amber brown color. Fruity aroma, cherries, cinnamony and lightly tart and woody. Body is med/light with a soft carbonation, lightly oily. Light woody flavors, vinous notes cherries and spices, lightly earthy, doughy and malty. Easy drinkin tartness, light sourness. Nicely done!","Ceciltucky, Co., Maryland, USA","sloth"
3419,"2009-10-11",4.1,"2008 Reserve.  Pours a clear, bright, dark red-orange-brown with a fine, medium-dense light tan head.  Soft, tart aroma with wood and a pleasant ""barnyard"" brett aroma along with fallen orchard fruit, rich, fresh-pressed apple cider, and a hint of hops spice--very autumnal.  Flavor is sour with a soft toasty caramel malt aspect.  A restrained tart red fruit character evolves from the sourness combined with subtle woodiness and some oxidatiion in the finish.  Very good, but only moderate complexity for a beer with these characteristics. (Perhaps it could benefit from some more bottle age?)  Their is good weight and balance in the body but the only drawback is a bit of rawness left on the roof of the mouth.","San Diego, California, USA","Schultsc"
3419,"2009-10-08",4.3,"Bottle from Jake65.  Pours a brownish-amber color with foam patches floating around on top.  As soon as the bottle is cracked I get a very pleasant aroma, currant, berries, brett and a little bit of a lighter citrusy scent.  Flavors are tart and sour but not extreme.  Lively carbonation.  I keep thinking wild berries as Im drinking this with some funk and wood-paper notes.  This can compete with other top tier dark sours like Consecration.  My first beer from Deschutes, this was fantastic.  Thanks Jake!","Lake Mary, Florida, USA","changeup45"
3419,"2009-10-01",4.1,"2009 GABF, Friday session.  Oh yes this is good, and I had this one behind the stages, not sure if it was poured at the stand.  Pours dark brown with almost no head.  Aroma is quite tart, grainy, with notes of dark ripe cherry.  Flavor is robust, tart cherries and plums with dark chocolate and wood.  Very well balanced, with a delicious lingering after taste.  Body is smooth with perfect amount of weight to it.  I want a bottle of this!","Honolulu, Hawaii, USA","elihapa"
3419,"2009-09-25",4.1,"Deep red/pink pour with a 1 finger frothy head; really nice looking brew. Aroma is extremely strong, caught a whiff right after opening the bottle. Notes of red wine, funk, yeast, and sour cherry are predominant , and the lightest bit of spice, perhaps clove, mixes in there as well. The flavor starts with tons of fruit, notably cherry, black currant, and a bit of dark fruit. This seamlessly weaves into the funk that comprises the middle section of the flavor. The finish goes back to a sweeter note, and I think this is where the red wine notes hit. Palate is very drinkable, but the sour sweetness sticks to the tongue exquisitely, and the 9% is absurdly well hidden. Not quite as robust as Cantillons Saint Lamvinus, but definitely reminds me of that, at least in terms of a broader genre. Excellent brew- looking forward to having more of Deschutes offerings.","Seattle, Washington, USA","craftycarl21"
3419,"2009-09-25",4.2,"Brownish grapefruit hue wiith an excellently proportioned tight frothy off white head. Aroma is quite vinous with cabernet and brettanomyces coming through powerfully. A yeasty dough note rounds out with some sour cherries in a swirling torrent of aromas. Flavor starts off fruity and defined with sour cherry and black currant being most notable. The excellently proportioned brett funk and hay follows closely behind, as does red wine grapes and the most subtle of tannins. Sweet considering the style- not attenuated to near the extent of some of its counterparts, though it works excellently here. Funk is quite up front, though vinegar is absent. Palate is medium to full with a slippery, smacking finish. Im very impressed.","New Hampshire, USA","oteyj"
3419,"2009-09-21",4.0,"Bottle shared by JW77...thanks!  Pours a nice brown color with a tan head that leaves some good lace.  Funky aroma full of cherries, brett, wet hay and sweetarts.  Flavor is tangy, funky, lemon, and maybe some red wine notes.  Damn good.","Scottsdale, Arizona, USA","daknole"
3419,"2009-09-13",3.3,"This 2008 reserve wax capped bottled brew from a bottle shop poured a large sized head of foamy finely sized light brown colored bubbles that were and left behind a transparent softly carbonated red brown colored body. The weak aroma was brown malt Irish Red malty and sour. The crisp mouth feel was tingly at the start and at the finish. The mild flavor contained notes of brown malt sour and mild nut. A decent one that I would consider having again.","Fort Wayne, Indiana, USA","thedm"
3419,"2009-09-12",3.8,"Deep jewel-like ruby color with a thin, quickly disappating head.  Very deep velvety nose of sour cherry, musty horse blanket and Brett.  Some cherry flavors, rhubarb, old raspberry Jolly Ranchers, and funky mold.  There is something vaguely forbidding about this beer but somehow desirable.  I hate to say it, but I am starting to like some sour beers.","St. Marys, Ohio, USA","jsquire"
3419,"2009-08-31",4.2,"2008 edition bottle via and shared with oakbluff. Amber in colour with spritzy carbonation. Wonderfully complex aromas of farmhouse funk, pale malts, lemon, apricot, and a bit of wood. Sout lemon. Quite sour in the mouth with lots more lemon, funk, and soft mozzarella cheese. Refreshing and quite dry on the palate. Not overly fruity or vinegary, which is nice for me. This is some classy stuff indeed!","Winnipeg, Manitoba, CANADA","piscator34"
3419,"2009-08-31",4.1,"Dark reddish with small head.  Fruity, mash style aroma, medium body with lively carbonation. sweet sour with some bitterness.",", Florida, USA","BeerBaby"
3419,"2009-08-26",3.7,"poured a burnt ruby orange. Nose was vinegary with a strong cinnamon smell. Taste was disappointing, some vinegar, some brown sugar, but pretty thin and inharmonious.","San Diego, California, USA","tokyogoat"
3419,"2009-08-23",4.0,"Pours a nice brown with a foamy head that disappears quickly. 

Smells great, funky sour cherry lemon goodness. 

Tastes of funk and Brett. Very light oak and fruit hints. Similar to a less fruity red poppy. More apple comes out as it warms. There is no trace of the alcohol content. 

Mouth is medium in body and carbonation.

An excellent drink and dare I say my favorite from
Deschutes this far.","Donora, Pennsylvania, USA","Sonicdescent"
3419,"2009-08-20",3.3,"[2411-20090801] Bottle. Sweet vegetal chewy-like malt aroma. Hazy, dark orange red body with a medium-lasting foamy white head. Mildly spicy flavour continues with the chewy fruit malt. Medium body. Interesting bitter but not to my tastes today, or it could be that I just had a crappy spicy beer beforehand that was still lingering on my tongue. Would try this again anyway.
(w/ others @ BCTC; Cooperstown, NY)","Toronto, Ontario, CANADA","mabel"
3419,"2009-08-08",3.8,"UPDATED: MAR 11, 2013 2013-03-09. Crisp dark red amber, small beige head. 3++ Interesting aroma is fruity, lightly funky and tangy. Mild woody touches, muted cherries and cherry pits. 7+ Flavour is fairly dry, cherry up front, light wood throughout grows in the finish.  Average palate, very light carbonation gives it a dilute wine like character. Pairs intriguingly well with the hazelnut salami. 7/3/7/3/16 Bottle shared by Wilco  ""Where do you get all these meats?!?""
2009-08-01. Orange amber body with a modest beige head. (3+) Aroma has modest sour funk, touches of lemon. (7+) Flavour is modestly sour, light funk, non-specific sour fruit character that I can not place. Muted wood notes. (7+) Average palate is lightly carbonated. Interesting.  8/4/7/3/16 Bottle at BCTC","Toronto, Ontario, CANADA","jercraigs"
3419,"2009-08-04",3.9,"I didnt expect this style to come out of Deschutes and quite honestly did not think they could pull it off, but I was wrong and I am impressed.  This has a great deal of pucker power.  Very clean for the style, with some solid wood tannins and some acidic sour fruits, green apple skins and sour cherries are what first comes to mind when I think of the tang that is happening on my tongue at the moment.  Nicely done and I would like to see how this one lays down.","Gulf Shores, Alabama, USA","BlackDonald"
3419,"2009-07-29",4.1,"Sour vinegar and sharp wood tannins, this beer is aging nicely.  Soft clear tawny, small head.  Apple cider, green apple skin, wine grapes and pie cherries.  Thin in body but rich in character.  Brett is coming through nicely in a dry and cottony sort of way.","Bothell, Washington, USA","scrizzz"
3419,"2009-07-28",4.0,"22 oz bottle, 2008.  Hazy reddish brown with foamy beige coating.  Nose is mild sour cherry, funky wood and strawberry preserves.  Creamy mouthfeel with a soft tang.  Taste is cherry, caramel, vanilla and cola.  Dry, airy finish.  Juicy, lightly sour, very nice.","Media, Pennsylvania, USA","TheEpeeist"
3419,"2009-07-23",4.0,"Bottle shared by shigadeyo.

Poured a clear reddish brown color with an average frothy off-white head that mostly lasted with good lacing. Moderate to heavy sour tart fruit aroma. Medium body with a smooth texture and soft carbonation. Medium to heavy sour & sweet flavor with a medium to heavy sweet & sour finish of moderate to long  duration.

This is a standout beer.","Cincinnati, Ohio, USA","Tmoney99"
3419,"2009-07-19",4.0,"22 oz bottle courtesy of several possible people.. But well give the shout out to mreusch on this one! Thanks, Matt! Pours a murky rusty iced tea hue, reddish sunset works in with decent beige head, dense, dies to a small layer. Aromas smack from a decent distance away: oak, cherries, a touch of sweet malts beat out by vanilla and dry champagnesque feel. Deeper inspection shows more cherry, oak, slight vinegar, and a light sweetness of caramel and vanilla. Initial is a nice tartness, cherry and vanilla follow suit with caramel malts, oaky qualities, dryness, a fairly lively body. Well carbonated, mellower than the aroma originally led me to believe. Finish is tart cherries, dry oakiness, and a very mellow sweetness. Sour finish and tart lactic qualities remain on the palate, touch of soft cheese and sweet malt. Overall, a pretty good sour.. Tamer yet still strong as the sour grows as a wave does.. Stronger as you go on, very very nice.","Aurora, Illinois, USA","TheAlum"
3419,"2009-07-17",4.3,"Scored a 22oz bottle of this via trade.  This style (Flanders brown) has been growing on me in recent months.  Pours a hazy, translucent, amber, reddish brown with a faint, ringing white head.  Aroma is excellent, fruity, floral, funky, red grapes, apples, pears, some light wood, slightly sour.  Flavor is well balanced for something so odd; sweet and sour, apples, tart cherries, lemons, wood, flowers, honey/pollen, grapefruits, butterscotch.  In small sips the caramel malts come through nicely with an enveloping sweetness.  Finish is tart, slightly buttery.  I loved every drop of this, for what its worth my girlfriend did too.","SouthWest, Washington, Washington DC, USA","nimbleprop"
3419,"2009-07-15",4.0,"bottled, pours red/amber with medium tan head, aroma of sour cherries with the slightest sweet malt notes, amazingly fruity sour taste with lingering citrus on palate, no alcohol notes in taste, delicious","Washington, USA","dirt55"
3419,"2009-07-14",3.8,"Pours a ruddy brown with a fleeting off-white head.
Funky tart aroma that reminds me of rotting apples.
Tart, yet balanced by an underlying sweetness.
Smooth","Tennessee, USA","SpringsLicker"
3419,"2009-07-05",4.0,"A Mes rate. Bottle at home thanks to MJ. A lovely dark amber colour. No head but still a very attractive beer. Really fruity, nice barrel notes some faint framboise and a lovely tartness at the back of the throat. Very drinkable. An almost puckery sourness and an all round great blend of wood and fruit. Quite chewy for the style. Framboise and kriek notes in the solid, clean finish. Booze is well hidden but the belly warmth gives it away. Jolly enjoyable and a little under rated if you ask me.","London, Greater London, ENGLAND","MesandSim"
3419,"2009-07-03",3.8,"2008 Reserve - Flanders Style Brown Ale
7/02/2009:  The Dissident has a deep honey color with big bubbles and a thin bubbly crown.  Sweet perfume fills the aroma.  It is also slightly tart and acidic.  As far as flavor goes, it is yeasty with chewy caramel in the front.  It has a nice slightly sour cherry characteristic and a good, lasting finish that has a tartness that sticks in the back of the throat.  This beer is slightly thick and sticky, but is well-balanced overall.

1 pint 6 fluid ounce wax-sealed bottle (234 08 1724 / 9% Alc. by Vol.) from bitbucket.  Thanks Bob!  Rating #245 for this beer.","Cincinnati, Ohio, USA","shigadeyo"
