"beer_id","date","rating","text","user_location","user_name"
352,"2013-01-31",3.7,"Bottle. Poured hazy dark straw with fizzy white head.  Nose is lactic sour mashy fruit, yeasty funk.  Tastes tart, earthy, funky, yeasty, with a level of tartness not at the Cantillon level, but with more lactosy sweetness mixed with the heavy fruit and funk.","Lower Pottsgrove, Pennsylvania, USA","DocLock"
352,"2013-01-30",3.5,"Hazy light orange with a large head that dissipates quickly. Gushed a little when opened. Aroma is barnyard funk, horse blanket, sour milk, mustard. Medium bodied, sour on the palate with a hint of background sweetness and a dry finish. Taste is tart lemon, orange juice, citrus zest, hint of honey. Complex and tasty but the aroma is not compelling.","Vancouver, British Columbia, CANADA","GothGargoyle"
352,"2013-01-27",3.9,"Bottle from Whole Foods at Bills recommendation. Pours an effervescent gold with lots of white head. Aroma is sour, with a slight cheese aroma. Notes of old citrus zest and grapes. Flavor is sour, well rounded, lactic, with the right amount of carbonation. A very nice geuze that is readily available. Not as complex as other big names but very good.","Ambler, Pennsylvania, USA","DeputyAndy"
352,"2013-01-27",4.0,"Bottle at dulle gruit in gent. Very good art od geuze. Taste of beast. Fresch acid . Emotional beer for intensive tasting moment.","ITALY","birrabona"
352,"2013-01-25",3.9,"Bottle from Systembolaget. Hazy golden with a large white forthy head with medium sized bubbles. Aroma is sour, citrus, barn, some blue cheese. Taste starts sour, the tartness is increasing throughout and finishes with hints brett and funkiness.","Stockholm, SWEDEN","hackobock"
352,"2013-01-24",4.0,"A hazed golden gueuze with a thin off white head. In aroma, superb sour cherries, epsom, horseblanket, classic. In mouth, a corse intense sour gueuze, cork, leather, lemon, very nice. Tasted at GRMs tasting.","Ottawa, Ontario, CANADA","Lubiere"
352,"2013-01-23",4.4,"Corked bottle.  Pours a brilliantly clear pale gold with a thin white head and a steady stream of fine bubbles.  Aroma is mild barnyard funk, light citrus, a mellow maltiness, a woodsy bitterness.  Flavor is moderately sour and barnyard funky, lemon, lemongrass, mild woodiness, restrained fruitiness, low sweetness.  Finishes dry.  Incredibly refreshing.  Light mouthfeel, soft carbonation.  Could easily chug it; have to remind myself to sip it slowly to get all the complexity.  One of my favorite gueuzes/sours.","Birmingham, Alabama, USA","coolpop"
352,"2013-01-22",4.1,"Reviewed 12/31/2012. Thanks to Momar42 for all three gueuzes (and the kriek surprise afterwards!) This was part of the gueuze showdown, pitting Tilquins gueuze against the juggernaut duo known as Cantillon Gueuze and Drie Fonteinen Oude Geuze. Part of a 750mL bottle poured into a Cantillon tulip. Notes from last nights Skins/Cowboys game.

A: Pours a cloudy dark amber color. The head is a one finger white shade, with the best texture and retention of the three.

S: Tons of tartness, a lesser white wine-esque fruitiness, and some buried earthy funk. The most seemingly sour of the three.

T: First thing that comes through initially is the combination of pear/apple esters and white wine tartness. The tart sourness breaks through more aggressively through the midtaste, while the finish is mild brett funk. Out of the three, this was the most sour, the least earthy - and the least subtle. Certainly a nice beer, however.

M: Super dry and puckering. Lots of carbonation, too. It lacks the delicate touch of the Cantiloon/3F gueuzes, though its softer than, say, a run of the mill Flemish red.

O: Its a nice sour ale. I wouldnt call it beginner friendly at all, though, due to the tartness. I would point fans of Flanders sours to this one, however. Shame it had compete against the two titans of the style - even though it came in third in the gueuze showdown, I reckon it would be superior to any other gueuze on the market (not from Cantiloon or 3F, that is).","Leonardtown, Maryland, USA","ThisWangsChung"
352,"2013-01-21",4.1,"A fizzy yellow gueuze with a disappearing head.  Nice aroma of barnyard and cheesy lactic sourness.  Notes of green apple and lemon with a dry and sour lactic finish.   Well balanced flavors.  Elegant beer.","chicago, Illinois, USA","Quasimodo"
352,"2013-01-20",4.2,"Poured from bottle an orange hue with a little white head. Smells of barnyard and funk. Tastes of barnyard, acidic, citrus, and tart fruit/green apple. Light and tingly on the palate. Love it.","Kansas City, Missouri, USA","OLDMANDUSTY"
352,"2013-01-20",4.0,"Big crisp aroma from the glass of funky sour fruit. The flavor is also funky sour fruit. Very dry and refreshing. Got to move to Belgium soon.","Sicklerville, New Jersey, USA","keepersj12"
352,"2013-01-19",4.5,"Pours a slightly hazy golden color with a two finger head. Aroma of lemon, green apples, gooseberries, and funk. Flavour is sour and dry with a touch of lemon, unripe fruits, gooseberries and the usual funk. Light to mediumbodied with lively, refreshing carbonation. A lovely Gueuze!","Karlstad, SWEDEN","Ljunkan"
352,"2013-01-18",4.1,"2010 / 2011 Bottle; Pour is murky gold with a medium fairly fine bubbled white head in this glass. It retains excellently - 30 minutes later theres a decent layer. The nose is barn hay, lemon grass, zest, wheat malts, and peppery spice. The flavor profile shines for me with more lemon zest, grass, florals, barn funk, pepper, light bitter, lemon juice near the finish - this is an extremely quenching brew for me. Im loving the mouthfeel, finish, and general quality here for sure.","Illinois, USA","Hair6a11"
352,"2013-01-18",4.6,"Bottle. Aroma is barnyard funk, pear, tart fruit. Appearance is light copper with a thin white head. Taste is funk, tart fruit, oak, grassy hops, and citrus fruit. Medium body, good carbonation, dry finish. Great beer.","Wilmington, North Carolina, USA","Aarond"
352,"2013-01-15",4.1,"Bottle at Le Poechenellekelder (Brussels, Belgium)
Aroma: Hay, basement aromas, citrus, and some spicy aromas.
Appearance: Golden color with a small white head.
Taste: Very sour, with a slightly spicy aftertaste.
Palate: Light bodied, with an average carbonation.
I think I may have had this one before, but I dont remember it being this good. Its widely available, cheap, and quite drinkable, so its pretty easy for me to say that this is one of my favorite beers in the style.","Minneapolis, USA","n00bface"
352,"2013-01-14",4.0,"Bottle with Pat and Sean.  Pours a cloudy orange with fluffy white head. Nose of brett, fruit, citrus, poppy seeds, horse blanket.  Fairly tart and fruity.  Well carbonated.","Pennsylvania, USA","tcane7"
352,"2013-01-12",3.8,"2011-2012. A beautiful gueuze: straw color hides beneath a full finger of fluffy white head, leaving plenty of lace behind. Nose is slightly withdrawn, yet retains its funky presence. Grassy barnyard funk and citrus round things out.

Lemon zest and traditionally soured lambic join forces enthusiastically. Not the most complex gueuze on the block, yet the yeast that's present is quite tasty. I need to stash a few bottles of these away for a decade or so.","Dallas, Texas, USA","brystmar"
352,"2013-01-12",3.5,"Bottle at home. Hazy golden pour, thin white head. Aroma is spicy, hay, horse blanket and basement. Flavor is mild sour, quite spicy, typical geuze. Smooth and drinkable. Bit boring.","Den Haag, NETHERLANDS","Vaiz"
352,"2013-01-11",2.9,"750 ml bottle shared ar GRMs. Hazy amber, no head. Strong barnyard and bitter herbals with a pleasant tart fruitiness, dry, woody, classic Lambic. Medium body with relaxed effervescence. Surprising tart fruitiness, peppery, spicy, bitter herbals, restrained barnyard funk, works for my palate; dry, tart, surprisingly bitter with nice tart fruitiness.","Nepean, Ontario, CANADA","probstblueribbon"
352,"2013-01-08",3.7,"From a bottle at Living Social sour beer tasting DC.  Pours a cloudy gold with a white head. Funky aroma.  Tart apples with a bitter finish.","Jackson Hole/McLean, Virginia, USA","Iphonephan"
352,"2013-01-05",3.7,"750ml Bottle as a Christmas gift (thanks Megan!). Gusher, big yellow-white foamy head on very hazy, yeasty gold body. Sweet, tart yeasty nose, fairly mild and balanced. Rather fruity for a gueze, lemon citrus, with rounding sweet-dry finish. Quite flavorful, rather mild-tart souring notes, but very tasty.","Seattle, Washington, USA","luttonm"
352,"2012-12-31",4.0,"Bottle 2010.  Had a few of these, but never rated.  Nose of lemon and resin.  Get some wood, lemon, acid juicyness in the taste.   Not much in the funk area.  Really nice, tart, solid Gueuze.  Gonna throw a couple in cellar to see how they age.","Asheville, North Carolina, USA","Guyute_Pig"
352,"2012-12-31",3.5,"A very good old gueuze, nice foggy body and also a massive head. Quite yeasty but still complex, pronounced with a dry finish. A good introduction to classic gueuze styles for the uninitiated.","Alberta, CANADA","DeanF"
352,"2012-12-26",2.3,"0, 75 flaske (julegave fra Hans), delt med Egil og Einar: skikkelig sur aroma, men heldigvis er smaken en mer syrlig friskhet. Glem det du vanligvis forbinder med øl, så går det bedre. Har ennå langt igjen før jeg kan si at dette er en nytelse.","Stavanger, NORWAY","Holmen1"
352,"2012-12-25",3.9,"Not on par with Cantillon or 3F but this is a solid Gueuze. More dry and less funky than those as well. Aroma is pretty solid though. Great offering. 

---Rated via Beer Buddy for iPhone","Maryland, USA","Momar42"
352,"2012-12-24",3.9,"Bottle at Craft Clerkenwell, thanks to Duff for the pour - 21/12/12.
Light amber yellow with a thin off white head.
Nose is sour, tarte fruit notes, lemon, wood, touch of smoke.
Taste comprises dank musty fruits, light wood, sour and tarte fruit in abundance, lemon, citrus notes, touch of caramel, some very light smoke.
Medium bodied, light spritzy feel, dry and crisp in the finish,
Decent.","Hazlemere, the lower Xhitlerns, Buckinghamshire, ENGLAND","Theydon_Bois"
352,"2012-12-24",3.8,"375 poured into a glass.  Amber gold with white pillow cloud head.  Smell was citrus and yeast.  Taste was very acidic, lemon funk, grass.  Overall very enjoyable geuze","NYC, New York, USA","Godofthecellar"
352,"2012-12-24",3.9,"Guld färgad, oklar med vitt skum som snabbt faller. Doft: Äpple, jord, päron, druv jouice, jäst. Smak: Äppelmust, citron, jäst, mineraler, jord, omogna jordgubbar. Eftersmak av beska äppelkärnor.","örebro, SWEDEN","beer_est_deus"
352,"2012-12-22",3.9,"Pours hazy straw with a hint of orange. White dissappating head. Nice nose of fruity esters. Nice and sour, with aroma of lemon, some barnyard, and grass. Sticky mouthfeel. Nice brew!","NORWAY","BillHick420"
352,"2012-12-20",3.8,"Geuze old style, a nose of yeast, hay. First taste gives a nice snappy, sour taste in the mouth but not overpowering. Also taste some apple, cider. Pours a nice head that dissapeared quite quickly. Ideal to as an before-dinner drink IMO. Good beer in amongst other old Geuzes!","BELGIUM","KevDesmet"
352,"2012-12-18",4.0,"Bottle from Steins. Pours a hazy yellow with large creamy white head. The aroma is tart fruit and citrus. Thin mouthfeel with a sour fruit and funk with very sour finish. Easy to drink a very impressive gueuze.","Houston, Texas, USA","djd07"
352,"2012-12-17",3.5,"Bottle. Hazy golden colour with a white head. Sour lemony aroma. Flavour is dry, sour, acidic with some lemon to it.","Huddinge, SWEDEN","AndySnow"
352,"2012-12-16",4.4,"bottle poured into a wine glass. this is becoming my favorite gueuze, the aromas of barnyard and slight way come out at first then the smell of that awesome sourness. looks like your standard gueze, solid orangish body and minimal head. taste of mild sour, not an overbearing bite which i enjoy. i dont need my jaw locked all the time. palate is nice and medium body, not too light at all. overall this is a great beer and not overly expensive and pretty easy to find in my area.","Kentucky, USA","kaips1"
352,"2012-12-15",3.8,"Cloud berry coloured and clear. Very sour aroma. Earthy sour taste and citrus fruit bitterness in the after taste.","FINLAND","BitchPls"
352,"2012-12-14",4.1,"Bottle from LAntre Du Vaudree, Liege, Belgium. Aroma is a beautiful malty sweet one with a good funky Brett smell. Appearance has a great head that does not go away for a long time, an off-white colour, it is constantly replenished from the super effervescence of the gueuze. Beer a opaque golden colour. Taste is great, Brett flavours from acid and yeasty characters. i get lots of pear, malt, touch of apple, bit of funk, nice! Palate is good - tangy, bitey feel disappears quickly. Overall, a great gueuze!","Brisbane, AUSTRALIA","barakihunter"
352,"2012-12-13",3.8,"Bottle at home. Light orange color, big white head disappears pretty quickly. Nice aroma of earth, tart, grape. Refreshing taste, citrus, grapefruit, tart. Medium co2. Nice and refreshing.","Tuusula, FINLAND","k0mpsa"
352,"2012-12-12",3.7,"Misty golden body and small white head. Rich acidic aromas, champagne, farmhouse funk. Plucky sourness, fairly dry, especially on the end. Sticky fruits to go with it. Nice, but not complex. (Bottle at Kafe België)","Leuven, BELGIUM","erickok"
352,"2012-12-09",4.5,"Bottle, pours a nice pale yellow, aroma is a nice funk, flavour has a nice funk up front and finishes with a good full mouth feel with lots of citrus, definitely one of the top gueuze I have","Ontario, CANADA","Ontbeertaster"
352,"2012-12-06",3.8,"When the majority of stuff that could be rated in the cellar (which is almost nothing!) is gueuze the choice is obvious. Apricot colour, mostly clear with a small white hugging cap. The smell is smellorific. Fucky with lemony vinegar,  something that instantly reminds me of what I smell at the Yoga Loft - some soothing yet slightly pungent herbal fumes, orange oil from a freshly twisted rind, earthen dankness like the corners of an old rotting farm house. A sit gives it some borderline floralness. Very tasty and thankfully not brutally harsh... maybe another day. Drying and mouthwatering with some punishing vinegar mouth bath, medium cheese stuff, lemon, tart, dry grass, brett (I bet Im the only one to discover this....), it is possible there is a berry touch.. possibly. My teeth feel waxy. Stomach starting to rot away as the acidity level has skyrocketed. Earthy. Very good and easy to consume.","Blerkablerka, VENEZUELA","VertBaconStrips"
352,"2012-12-06",3.7,"Hazy pale amber with a thick white foam. Fruity and acidic notes. Fruits, acid and sourness. Medium body with a nice dry finish. Very balanced !","Göteborg, SWEDEN","thomat"
352,"2012-12-05",4.4,"UPDATED: MAR 14, 2013 Green Apples are the most present in the aroma, but also som spruce. The flavour are very sour, but with the green Apples with som acidicity. Its Just a super refreshing beer, One of my favoritt geuzues.","Kverneland, NORWAY","Bathory"
352,"2012-12-05",4.1,"Bottle 2011. Pours golden, with sediment in bottle. Nose has very malty, and soft, hay, together with dried leaves, cut grass. Young wood / barnyard / brett notes. Body is medium, acidic, dry with some oilyness in the texture. Citrus and tart fruit (green apple?) in the finish. A quite acidic version of a traditional oude gueze. Mouthwatering, beautiful.","FINLAND","jookos"
352,"2012-12-04",4.0,"Pours like a nice gueuze, with lively carbonation and a well-behaved head that settled down rather quickly to form a thin white blanket over a pale golden beer. Aroma is light funk and lemon, rather classy and champagne-like with some grains showing up late. Taste is mild citrus/sour, at least to my accustomed palate with a bearable acidity. Not getting much barnyard or horseblanket/sweat but this is in line with the whole deal. Great gueuze, not lacking complexity but displaying it in a well-behaved manner.","Québec, Quebec, CANADA","mathieuc"
352,"2012-12-03",3.9,"375ml bottle. Pours orange/gold with a touch of bubbly white froth which recedes quickly. Plenty of lemon, cider vinegar, and dusty, earthy yeast funk on the nose. Taste follows up with a big hit of tart lemon juice and lemon rind, old leather, yeast funk, touch of sour cider vinegar, earthy notes - lovely citric tang to it. Well balanced for sure, and theres quite a bit of depth in the tart aftertaste - lingers nicely. A very tasty gueuze, not quite as complex a taste sensation as can be found in the 3F  version, but still a magnificent piece of sour ale brewing that I thoroughly enjoyed.","London, ENGLAND","Beermack"
352,"2012-12-02",3.8,"my 2nd Lambic on zwanze day.  Pours yellow with white head and tart acidic nose.  Tastes grassy, of lemon, woody, some barnyard funk.  Crisp and plenty tarty sourness.  Straightforward gueze but very well done and delicious.","New York, USA","Jow"
352,"2012-11-27",4.0,"375mL bottle BB 2/10/2021.  Poured medium orange with a short, but well-retained off-white head.  The aroma picked up bright acidity and funk, with lemon rind and foot-like notes.. old oak, leather, and vinegar.. very assertive and interesting.  The flavor opened with tangy lemon and vinegar, with very dry oak and a touch of bready character behind.. lemon rind and fruity funk were laced throughout.. never too aggressive or off-balance.. really tasty!  Moderate-plus sourness on the palate, and it worked well.. this went down very easily, and I want more.","Pewaukee, Wisconsin, USA","Ughsmash"
352,"2012-11-26",4.0,"Really nice clean crisp tart and mildly funky gueuze.  Another great example of the style with tons of flavor.  Not as complex or amazing as 3F but still a fine beer.","Connecticut, USA","Reynolds314"
352,"2012-11-26",4.2,"Pours a slightly hazy medium golden color with a huge bubbly white head that held on for over a half hour while I made dinner! Wonderful tart and fruity and funky aroma. Smells of lemons, sour oranges and sour apples, pepper and yeast esters, a bit of funk and a hint of acetic. The flavor is a nice mix of funk and tart with peppery and yeasty funk up front followed by some light tart fruits, plastic phenols, and finishing with a long lingering lactic and lemon finish. Medium body with a moderate level of carbonation and a tart funky lightly puckering mouthfeel. I can see what all the fuss is about here this is a damn fine example of the style if not a hint on the bold side of things. I really enjoyed this, if only they sold it local to me.","Bedford, New Hampshire, USA","johnnnniee"
352,"2012-11-23",4.2,"750 ml green bottle. Pours a clear golden color with a white head. The aroma brings lemons, some green apples, black pepper, funk. Really lovely. The taste has more green apples, sharp lemony twang, and a little bit of doo doo flavors. It follows with a very dry finish. Big wave of mouth puckering and its sparkly in the mouth. This is a great gueuze and I would recommend seeking it out. I know I will.","San Antonio, Texas, USA","Hopper"
352,"2012-11-21",3.9,"More gueuze on the beach? Well...ok.

Hazy orange with a big, white head and plenty of lacing. Similar nose to the Girardin black label, though perhaps just a notch less. The flavor is of authentic Belgian gueuze lambic, though perhaps more raw and aggressive than is customary. Sharp and acetic , though not quite harsh. Lots of oak. Citrus notes are there as well. Acetic finish, light burn. Overall, a really enjoyable beer.","Washington DC, USA","Huhzubendah"
352,"2012-11-20",4.0,"375ml bottle. Slightly hazy gold with short white head. Aroma is basically just how I want a gueuze to smell. All kinds of microfauna buzzing around and a cheesey, earthy funk in the aroma. Tastes of apple, sharp lemon, white grape and oak. Particularly dry. Will surely improve with age but my young-ish bottle tastes like a very good example of the style.","Cheshire, ENGLAND","Nocturne"
352,"2012-11-19",4.1,"wow Im really starting to like guezes. Great subtle farm flavors. Not as awesome as c-Los tunic. Impressive stuff","Arizona, USA","Ernesto987"
352,"2012-11-17",4.1,"A nice blend of tartness, sourness, citrus rind, funk, and oak. It is carefully and well-blended.","Chicago, Illinois, USA","crossovert"
352,"2012-11-17",3.9,"In honor of the Belgian tasting @ statelineliquors that i missed tonight. Hints of wood, tart apple notes. Some oily, resiny aromas, woodlike with a dead carbonation but still lively, somehow. Largely tart and acidic, juicy. A real eye opener. Need to do again. wow.","Ceciltucky, Co., Maryland, USA","sloth"
352,"2012-11-17",3.8,"Bottle.
Pours golden with a small white head.
Balanced gueuze, simply drinkable sweet and tart.","Stockholm, SWEDEN","finol"
352,"2012-11-17",4.3,"375ml bottle Best Before 10/02/2021 which I guess means February 2nd 2021. Cloudy, hazy orange, wispy head with a surprising amount of lace. Smells like rotten oranges, citrus, wheat, straight gueuze! Taste is a little rough around the edges, sour, citrus, a bit of plastic, still delicious. I probably should have waited a couple months until this had been in the bottle a year but oh well. Impressive for a a new gueuze blender and one Ill be happy to add to my collection at any time.

Serving type: bottle

Reviewed on: 11-10-2011 06:07:37","Denver, Colorado, USA","arrogantb"
352,"2012-11-17",4.4,"2010/2011. Has become a little bit improved since the last vertion i think. More complex, a little bit sweet, but the nice geuze flavor is still there. Absolutely a top sour geuze","Kr.sand, NORWAY","Duntoyou"
352,"2012-11-14",3.6,"Golden hazy light, 
Sour and tart, barnyard and hay, 
Taste is sour / vinegar with hints of dried hay.","Hauglandshella, NORWAY","ej"
352,"2012-11-13",3.9,"This brew is a cloudy golden color with a medium fizzy white head that evaporates steadily to an outer ring. Spotty lacing. Aroma of barnyard funk and yeast. Medium body with flavors of funky fruit, malt and yeast. The finish is tart with an apple and yeast aftertaste. Pretty good overall.","Columbus, Ohio, USA","Dogbrick"
352,"2012-11-12",3.7,"375ml bottle, or whatever size it was. Poured a hazy copper color with a small white head. Aroma was light fruits with a touch of sour notes to it. Flavor was sour light fruits. Pretty darn refreshing and quite interesting.","Alexandria, Virginia, USA","radagast83"
352,"2012-11-10",4.3,"Bottled:Pours hazy orange with a big, fluffy head. Sourish aroma of winter apples, oranges and grapefruit. Dry mouthfeel. Sourish flavour of blood oranges and loads of bitter grapefruit. Well balanced and really tasty!","Finspång, SWEDEN","pilsnerrogge"
352,"2012-11-09",4.4,"Bottle. Hazy golden colour with a white head. Acidic, tart, barnyard, lemon, wheat, leather. Dry, crisp and very easy drinking. Basically has everything a really good gueuze needs.","Gothenburg, SWEDEN","Jonte"
352,"2012-11-08",3.7,"Golden with a large white ehad and a lot of carbonation - good sour aroma - sour taste that lasts for a long time - good and lasting finfish - this was very good","Røros, NORWAY","bergstaden"
352,"2012-11-05",4.0,"really nice geuze! i personally like the new 2012 version a lot more than the old one! nice dry sour geuze!","Stockholm, SWEDEN","Ludvig"
352,"2012-11-04",4.1,"Bottle from systembolaget.

When i opened this the cork flew all over the place. Alot of carbonation. Great taste nice funk and alot of sourness.","SWEDEN","fredrik_"
352,"2012-11-03",4.1,"375 ml bottle. Pours an almost clear gold with very little head. Tart aromas of   barnyard, apples, peaches, and cheese. Flavors of sour apple juice, pears, and apricots with a hint of malt and citrus. Quite tart, but in a nice way. Can I say sour and smooth? Great.","Vancouver, British Columbia, CANADA","Gerbeer"
352,"2012-11-02",3.3,"Golden color, white head.  Somewhat funky nose.  Taste is sour, lemon, and vinegar.  Nothing special here.","Minnesota, USA","Steasy66"
352,"2012-11-02",4.7,"Maybe one of the best gauze Ive tried out. Super clean and complex. Great sourness! I really enjoyed this beer, and I want more.","Stavanger, NORWAY","Alexus"
352,"2012-11-01",3.8,"Plura foggy orange with Low disappearing white head
Aromas of sour grapes, bananas, citrus
Fresh sourness, medium body, nice aftertaste. Very good gueuze!","Hässelby, SWEDEN","kryon"
352,"2012-10-31",3.7,"aroma is barnyard funk and a sourness.  extremely clear and orangish hue.  nice head formed.  taste is light, crisp, and tart.  detecting some sour green apple.  a bit of funkiness and sour on the finish.  wouldnt say its extremely sour.  just balanced enough to make it easy drinking.  not the most flavorful though.  seems a bit 1 dimensional.  would drink again but probably not at $10 for a 12.7oz bottle.","Kansas City, Missouri, USA","PD4Ever"
352,"2012-10-29",3.9,"37,5cl bottle, BBE 4/2021. Poured cloudy golden with a thin white head. Lovely tart aroma with some barnyard, dried apricots. Flavor is tart, barnyard, apples coming through alot. Light sweetness. The finish is bonedry and tart. Excellent.","Vantaa, FINLAND","Hermod"
352,"2012-10-27",3.9,"Bottle 37,5 cl, BBE 12.4.2021. Cloudy copperorange in color with thin white head. Sour, barnyard, sour apple, fresh with some vinegar as well. Loads of sourness, tart and fresh apples in taste. Sligtly sweet, but nonetheless very sour, crisp and tasty. Sticky mouthfeel. Nice, slightly sweet and sour fresh apple in aftertaste.","FINLAND","RexTalionis"
352,"2012-10-26",4.0,"375 bottle. Pours golden with a thick, pillowy white head. Taste is sweet, funky, farmhouse/feet. Taste is sweet tarts with a farmhouse spiciness. Very solid gueze.","Colorado Springs, Colorado, USA","RABinCO"
352,"2012-10-26",2.5,"Bottle 37,5 cl. This is a good beer, but i can?t get pass the huge taste of jeast and grape. Not my kind of beer","SWEDEN","pandafisk"
