"beer_id","date","rating","text","user_location","user_name"
352,"2014-01-26",4.2,"Batch 1 375mL bottle at Deep Ellum, Summer 2012Perfect appearance for a gueuze, bottle conditioned and with the sediment dropped out. Fluffy white head recedes to cover atop a light, brassy gold with plentiful bubbles rising.Very lactic in the nose, with a high strength of aroma. Much of the cleanliness of 3F but with a bit of the sulphur from early-mid 2000s Cantillon. Tons of band-aid and green apple. Probably would confuse this for/guess this to be a softer vintage of Girardin in a blind tasting.Very expressive brett in the flavor, with light acetone and a fair amount of green apple. The sourness clears quickly, much moreso than Cantillon and with more body than 3F and Girardin. Acetic finish. Dosent seem any stronger than your average 5% gueuze, which is nice.I cant even imagine starting a Belgian lambic brewery and this being your first offering. Classy and very authentically done. Cheers and I look forward to more from them!","Boston, Massachusetts, USA","ClarkVV"
352,"2014-01-25",4.3,"375 ml bottle into tulip glass, best before 12/20/2022. Pours lightly hazy golden amber color with a 2-3 finger foamy and fluffy white head with good retention, that reduces to a small cap that lingers. Nice dense soapy lacing clings on the glass, with a large amount of streaming carbonation retaining the head. Aromas of big lemon/lime zest, green apple, pear, white grape, oak, clove, hay, straw, grass, leather, pepper, white vinegar, musty funk, and yeast earthiness. Incredible aromas with great balance and complexity of fruity/funky yeast and barrel notes; with great strength. Taste of big lemon/lime zest, green apple, pear, white grape, oak, clove, pepper, hay, straw, grass, leather, light bread, musty funk, white vinegar, and yeast earthiness. Moderate earthy/fruity tartness on the finish; with lingering notes of lemon/lime zest, green apple, pear, white grape, hay, straw, grass, oak, clove, pepper, leather, musty funk, white vinegar, and yeast earthiness on the finish for a good bit. Incredible complexity and balance of fruity/funk yeast oak barrel flavors; with a great balance of malt/acidity with zero cloying flavors after the finish. Medium carbonation and body; with a very crisp, smooth, and moderately acidic mouthfeel that is great. Alcohol is very well hidden with minimal warming present after the finish. Overall this is an outstanding Gueuze! All around awesome complexity and balance of fruity/funky yeast and oak barrel flavors; and very smooth to sip on with the moderate acidity. A highly enjoyable offering.","Michigan, USA","superspak"
352,"2014-01-25",4.3,"375 ml bottle @ home. Cork opens with a huge pop. Pours hazy golden with some off white head. Aroma is tart with green apples and grapes. Taste is funky, mildly sour with grapes. Lots of carbonation.","Aarhus, DENMARK","bursprak"
352,"2014-01-20",4.1,"Bottle. Pours a clear pale gold with a white head that dissipates to the edges. Aroma has a nice funky dryness with sour light fruits and a good amount of acid. Flavor starts with sour lemons and light fruits with a good amount of funk and a dry finish.","Minneapolis, Minnesota, USA","deyholla"
352,"2014-01-20",3.9,"Golden in colour. Great white head. Aroma of grapefruit, lemon. Bit of hay aroma. Sour with a hint of vinegar. Little vanilla aroma in background. Very good gueuze. Enjoyed it.","Bydgoszcz, POLAND","InPivoVeritas"
352,"2014-01-15",5.0,"A sharp floral tartness in the aroma. Pearlesent glowing gold with micro fine constant bubbles. Smooth tart bordering on rubbery and then float towards fruity as it rinses. Smooth clean wet as it runs through your mouth leaves light sourness behind. Amazing balance huge complex sour taste, amazing.","truckee, California, USA","krumbum"
352,"2014-01-11",3.5,"Pours a dark sparkling golden color with minimal white head. Smell is funky and lemon cheese. Taste is sour and fruity with some grape and lemon.

---Rated via Beer Buddy for iPhone","north reading, Massachusetts, USA","ROBC3366"
352,"2014-01-11",3.6,"Bottle at Kaisla. Hazy orange color, white head. Sour taste with citrus, tart, earthy notes, peach and apple. Sour finish with citrus, tart and apple. Very nice gueuze.","Helsinki, FINLAND","Tide"
352,"2014-01-07",4.2,"Had at a tasting at 28 Springs. Pours a golden yellow with a faint white head. Aroma is apricots and lemons. Slight sourness. Flavor is dried apricots and somewhat bitter. Very dry. Very nice beer. Thanks Casey!","Arkansas, USA","BOSSbrewer"
352,"2014-01-06",4.1,"From a bottle aged 2010-2011. Pours dark apricot. Aroma of horseblanket, funky fruit, cheese. Medium carbonation and big mouthfeel. Flavors of funky, sour fruit with slight bitterness and mouth puckering components.","LA, California, USA","DenverLogan"
352,"2014-01-01",3.8,"Poured from a 375ml bottle, thanks to Doug. The aroma is peach, dusty, lemon. The flavor is peach, lemon, slight grape note. This is a strongly acidic beer.","Bountiful, Utah, USA","Gription79"
352,"2013-12-28",3.9,"Une geuze surprenante, acide et sauvage mais bien buvable tout de meme. La base est chouette est pas seche du tout, malgres les levures vorace elle garde une belle structure gourmande.","FRANCE","Kurde39"
352,"2013-12-27",3.7,"Bottle, many thanks to Countbeer. Hazy orange golden color with small head. Tart aroma with funk, basement aromas. Tart taste with vinous notes, lemon, grapefruit, oak. Tart finish. Good.","Bratislava, SLOVAK REPUBLIC","Cuso"
352,"2013-12-27",3.0,"Bottle, courtesy of Cuso. Pours hazy oragne color, white head. Aroma is yeasty, sourish, acidic, lemon. Taste is extra sour, acidic, lemon, wood. My style#65.","Bratislava, SLOVAK REPUBLIC","MisoW"
352,"2013-12-27",3.3,"Bottle. Completely hazy orange colour. Aroma is weirdly yeasty (I am not used to this). Taste is strong sour, with some supporting fruity sweetness (brings to mind peaches). Overall character is mostly yeasty. Nice experience, though not exactly to my taste.","Bratislava, SLOVAK REPUBLIC","Gurthnar"
352,"2013-12-25",4.3,"Poured from bottle. Nice pour with lots of effervescence and characteristic cloudy, orange color. Perfect amount of Brett funk on the nose and beloved horse blankety goodness. Great palate with lots of small bubbles followed by appropriate sourness and a clean finish. This is a great gueuze and one you can fairly readily find in the US.","","topoisomerase"
352,"2013-12-24",4.2,"Champagne-like maize colored beer with a highly active dissipating white head. Mouth-puckering funky aromas, lightly grassy and distinctly European. Flavor was strongly but not overwhelmingly tart and the mouthfeel was clean and crisp with carbonation with lightly lingering sourness. I would drink it any day.","Juneau, Alaska, USA","leeburg"
352,"2013-12-24",4.0,"Bottle, pours pristine topaz with foamy persistent head. Rich barnyardy, musty aroma. Super lemony, clean, with just a bit of funk. Finishes brightly tart. Excellent.","Cincinnati, Ohio, USA","pellegjr"
352,"2013-12-21",4.0,"Smak och doft av jäst, gröna äpplen, gröna vindruvor, gul kiwi, citrus, citron med örtiga toner. Syrlig, frisk med vinös karaktär. Tydlig beska. Väldigt trevlig.","Malmö, SWEDEN","Lilja"
352,"2013-12-21",3.1,"375 ml bottle. 2012-2013 edition. Pours like pale cider with quickly disappearing white foamy head. Citrus, apples and yeast in aroma and taste.

---Rated via Beer Buddy for iPhone","Stockholm, SWEDEN","Hoppsan"
352,"2013-12-17",3.6,"I had this on draught while in Brussels, it was fantastic.
Vintage 2010-2011

Pours a murky golden with a withering finger of white foam. The beer is not much to look at. Smells good and funky with lemon, manure, grass, vitamin, and some hints of peppery sharpness. Smells like its gonna be tart!

Tart with lemons, and some baking soda character. Nice and dry with a mouth watering finish. Sharp carbonation brings out the lemony sourness and the remaining effervescence leaves a nice medicinal flavor mixed with a good funk. A little much on the alka-seltzer quality at times for me. 

Overall a good beer, better when I was in Brussels at a bar (but what beer isnt?). I am hesitant to purchase again given the price tag. Maybe grab a bottle and do a good sized gueuze tasting here in a few. Maybe a couple for the cellar, see how they mature.

Serving type: bottle

01-07-2012","Spokane, Washington, USA","harrymel"
352,"2013-12-16",3.5,"tiny white head disappears fast. copper murky colour. aroma of brett-funk, strawberry, maize, hay, sulphur. taste citric acid, grapefruit, bit wry. dry mouthfeel, medium body and carbonation. nice one.","Antwerp, BELGIUM","berntholer"
352,"2013-12-10",4.2,"Bottle, says ""2010-2011"". Pours hazy gold white head. Nose of lemon, barnyard, wood. Flavour is same, prickly carbonation, finish is quite sour. Excellent stuff.","Phnom Penh, CAMBODIA","WheatKing"
352,"2013-12-08",4.2,"Bottle at Akkurat.

Head is initially small, fizzy/frothy, white, mostly diminishing.
Body is hazy dark yellow.

Aroma is lightly malty (toasted grain), lightly to moderately yeasty (cobwebs, barnyard), with notes of green grape, lemon/lime, sour apple, kiwi.

Flavor is moderately sweet, moderately to heavily acidic.
Finish is lightly sweet, moderately to heavily acidic, lightly bitter.

Medium body, velvety/fluffy texture, lively/fizzy carbonation.

Excellent stuff in terms of what I like in geuze...vibrant aroma (very fruity) and wonderful balance (neither too sweet nor too sour for my taste)...and a surprisingly fluffy mouthfeel for the style. Most geuze by nature is watery and fizzy, but this sample had a superb velvety texture. Really enjoyed this.","Boulder, Colorado, USA","Ernest"
352,"2013-12-06",4.1,"2011 bottle. Aroma is sour with grassy notes. Appearance is the most beautiful golden I've ever seen in a beer. Taste is sour upfront with a malt whiskey background and clean with a great effervescence. Very tiny almost champagne like bubbles. One of the best gueuze I've ever had.","Florida, USA","Weezel"
352,"2013-12-05",3.8,"375ml bottle pours a hazy, pulpy orange with some thin, white head. Very nice nose, mouth watering tartness, pithy, some candy, lots of medicine cabinet, grassy, some nettles, a little stinky cheese rind. Flavor has a moderate level of acid and tartness, some candy sugar, grapefruit peel, pithy, funk, some band aid, grass. Funky finish, but not too acidic. I am hanging on to bottles for a while because I am interested to see how this develops in the bottle. Lacks the acid the great gueuzeries produce, but still very drinkable. I cant regularly get Cantillon, so for now, I will regularly buy this.","SouthWest, Washington, Washington DC, USA","nimbleprop"
352,"2013-12-03",3.8,"Bottle to glass. Pours a slightly hazy light amber color with a thin fizzy off-white head. Aroma is a bit dry on the nostrils, with some light acetic acid and citrusy fruit notes. Flavor brings out the acetic acid notes and is moderately sour. Light sweetness hidden in there. Tingly on the palate with a lingering sour on the back of the tongue. Delicious.","Norfolk, Virginia, USA","Dr_Fellini"
352,"2013-12-02",3.8,"Bottle. Pours cloudy golden with an off white head. Aroma is sour, fresh apples, some wheat and yeast. Taste is quite sour and light sweet. Medium body with average carbonation.","The Hague, NETHERLANDS","Zer0"
352,"2013-11-26",3.7,"Bottle at Nuetnigenough. Fair degree of carbonation, not much head. Curious retro label. Initially found the aroma sweet, although a second go unleashed some sour notes. The Tilquin gueuzes appear well blended, sweeter, with less aggressive sharpness or sourness than say a Cantillon. A nice winey fruitiness. Good.","Greater London, ENGLAND","JorgeLee"
352,"2013-11-26",3.8,"Bottle. Orange color with small white head. Green apples, citrus, apricots in aroma. Taste is sour and fruity, medium body, pleasant mouthfeel. Finish is long, sour and bitter.","SWEDEN","stecken"
352,"2013-11-23",4.0,"DAA; My No. 200. 2011/2012 bottle. BB 21.03.22. 37,5 cl. Pours hazy orange, white fading head. Aroma is sour, citrus, green apples, fruit and grass. Taste of green apples, citrus, sour, yeast and pepper. Complex nose and flavour. Light spritzy and dry. Refreshing, lasting fruity, citrus dry finish.","Stavanger, NORWAY","StilleStorm"
352,"2013-11-23",3.8,"Fizzy and festive! Nice sour sting in the taste. Citrus, berries, and earthy notes dominate.","","HULK777"
352,"2013-11-18",4.1,"2012/2013 bottle, 11/18/2013. Pours cloudy ruddish amber, fluffy white head dies to a nice crema on the surface, great retention, lacing built up around the edges. Aroma is strong earthy barnyard, light horse blanket, mild green apple and fleshy grapefruit, citrus and oak. Taste is soft green apple and light citrus tartness, bitter grapefruit, earthy funk and dry wood finish. Full, round body, silky carbonation. Really great.","New York, USA","jbeatty"
352,"2013-11-14",3.8,"Bottle from Systembolaget.
Ar: lovely funky aroma, lots of fruitiness, barnhouse aromas, tart, Green apples.
Ap: hazy amber colour, medium white head.
T: big tartness, lemon, low bitterness, lovely funkiness.
P: medium body, lots of carbonation, tart finish.
O: lovely big tartness.","Karlstad, SWEDEN","Linnet"
352,"2013-11-14",2.4,"Bottle. Moderate grain for the malt, dried flowers and grass for the hops, musty basement for the yeast, with hints of white grape, green wood and mixed berries. Head is average to large, fizzy/frothy. white with no lacing and is mostly diminishing. Color is hazy medium amber with some small pieces in it. Flavor starts heavily acidic, acetic and sour, then finishes harshly acidic, moderately to heavily bitter and acidic. Palate is medium, dry, with a lively carbonation and a moderately astringent finish and leaves a tingle in the back of your mouth. By the smell and taste of it I can tell its a Gueuze lovers dream, but this just aint my style.","hobe sound, Florida, USA","glennmastrange"
352,"2013-11-12",3.8,"Pours orange with a fading head.
Nose shows elderflower, gooseberries, green apple, soft horseblanket, light skunky notes. Quite a big apple juice character.
Flavours include tart green apples, old hops, gooseberries, horseblanket and a bold acidity.
Carbonation feels excessive.","Melbourne, AUSTRALIA","Davros"
352,"2013-11-09",4.0,"Bottle. Pours a hazy dark orange colour with a small and off-white head. Sour aroma of barnyard and horses, heather, rowanberries, forest floor, vinegar and citric acid. The flavour follows up and feels a bit sweeter but is still pretty sour. Lots of sour and sweet berries. Smooth and slick mouth feel, and a light berry bitterness. A very nice and well balance gueuze.","Bodø, NORWAY","Foffern"
352,"2013-11-07",4.1,"Wonderful lemon, grape skin and vinegar aroma. Nice citrus base and gassy tonic flavour is very fresh and quenching. Highly recommended.","Victoria, British Columbia, CANADA","CapFlu"
352,"2013-11-04",4.0,"750ml bottle pours a straw yellow with a frothy white head. Lemon oak and funk aroma. Tart lemon orange and apricot taste.","fort wayne, Indiana, USA","olr1984"
352,"2013-11-03",4.1,"A: Hazy Golden Straw Hue, Passes Some LIght, White Head Ring, Some Lacing

S: Lemons, Earthy, Funky, Mild Apricot

T: Lemons, Sour Mash, Bitter Apricot

M: Decent Carbonation, Medium Bodied, Semi Sour, Semi Bitter

Overall, this is was you should expect out of a decent gueuze, not a Cantillon in quality but definitely drinkable and available everywhere.","North Tonawanda, New York, USA","merc7186"
352,"2013-10-27",3.9,"Bottle from Tipples. Pours a deep hazy orange color with only a small ring of fizzy white head. Aroma of sour vinegar, some minty effervescence, orange peel, apricots, cherry, green apple. This smells glorious. Flavor is big green apple, sour vinegar, some candy sugar. Effervescent but not as much carb as I expected, easy drinking, mouth puckering. Overall I like this a lot, even more so than Drie Fontenin'a Oude Gueze. Nice beer.","Florida, USA","BMMillsy"
352,"2013-10-24",3.2,"de couleur dore elle degage des arome agrume comme le plamplemousse en bouche c est un sur melanger a du plamplemousse tres agreable biere d ete ou apéro (rate145)","Trois-Rivieres, Quebec, CANADA","stef73"
352,"2013-10-23",4.3,"Bottle. From walts cellar. Shared with friends while telling stories and missing the oompa loompa. Hazed tan body with a minimal head. Sweaty aroma that promises a great tasting beer. Full body earthy sour with a berry note. Leather flavor keeps emerging. Sweaty leather, a beer for the bondage fans. Apparently ratman burned down an elementary school. Or i wasnt listening well.","Montana, USA","Kevin"
352,"2013-10-21",3.7,"Popped the cork and expected massive funk based on the reviews here, but I am happy to report this is dominated mostly by candy apple, lemon, and mustard seed. Its strong, but well-balanced. The appearance is also quite nice - cloudy orange-gold with a frothy off-white head. Taste is sour lemon, horseradish, acid, vinegar, and green apple. While I would not go for this style regularly - I can only take sours, Brett, etc. in small doses - it was great to try this out and find its not as funky, footy, and cheesy as Ive sometimes read. So yeah, Im highly picky about sour/funky beer, but this took me by surprise.","Missouri, USA","kdm1984"
352,"2013-10-21",3.5,"15cl. from bottle at Brassigaume 2013. Pours a hazy golden colour with a good white head. Aroma is sour. Tastes sour with a light bitter suttle sweet fruity end. Medium to low carbonation. I think it should be a little more cooler.","PORTUGAL","ruigo"
352,"2013-10-19",3.8,"Very smooth geuze. Perhaps not the tastiest, but very smooth good drinkability indeed.
From Premier Gourmet.","Toronto, Ontario, CANADA","Sammy"
352,"2013-10-14",4.0,"(Bottle, 2010/2011) Golden amber colour with frothy, off-white head. Fruity, spicy nose with grapefruit, green grapes, barnyard, hay, peaches, white bread and hints of clove. Fruity, tart taste with lemon, grapefruit, hay, unripe green grapes, white bread, apricots and a dry and tart finish with a soft and balanced acidity. Medium body, dry. Excellent gueuze: tasty, tart and well balanced. Lovely beer!","Hässelby, SWEDEN","Svesse"
352,"2013-10-14",3.8,"Really nice and fruity and bitter and sweet and sour and acidic gueuze - frankly on of the best of these lambics Ive tried. Great experience, and much more exciting than fx a bottle of champagne.","NORWAY","TyggaBrown"
352,"2013-10-13",3.6,"375mL bottle 2011-2012 vintage
Hazy orange body with pretty much no head.
Good funky aroma; vinous citrus - grapefruit, lemon rind, bitter orange marmalade - white vinegar, subtle oak influence, with a bit of pale cereal character, a faint hint of washed rind cheesy funk
Highly effervescent carbonation, light on the body, with appreciable citric/acetic acidity.
Citrus continues on the palate - more grapefruit & lemon rind, vinegar, cheesy, slightly horsey funk. Drops away to a somewhat abrupt watery finish, with a mild bitterness and bit of tannic grip.
A very decent Lambic, perhaps not as complex/intense as others ive come across. Nice and funky nonetheless.","Yarram, Vic, AUSTRALIA","Muggus69"
352,"2013-10-13",4.5,"UPDATED: DEC 26, 2013 Big thanks go to tectactoe on splitting this one. Super funky smell as you pop the cork. Huge funky, sour, lemon, citrus flavors here. Very tart. Awesome beer.","Michigan, USA","SpongeRuiner"
352,"2013-10-03",4.3,"Very clean and soft for the style. Sweet, well balanced with nice lemon and oaky notes. Very refreshing stuff. A good start for the beginners. Draft version is fantastic, even better than the bottle one.","Paris, FRANCE","Maltador"
352,"2013-09-29",4.3,"Great aroma. Lovely yellow gold with a fine head. I paired it with mac & cheese adding Pt. Reyes blue cheese to it. Fantastic together. Lemon and sharp bitterness from the barrel. Creamy and soft. Loved it.","Santa Clara, California, USA","mrhoppy"
352,"2013-09-29",3.9,"Bottle - 375ml. Hazy golden body with good carbonation and an average white foamy head. Strong hoppy aroma with fruity (mainly citrusy), malty, and herbal hints. Its sharp hoppy taste carries woody, citrusy, malty, and herbal notes. Ends with a long sour finish. Very good example of Gueuze.","Gatineau, Quebec, CANADA","Eructoblaster"
352,"2013-09-29",4.1,"bottle, enjoyed at mowbeers 30th birthday party. yellow with a light haze and a short-lived spritzy head; loads of damp cellar in the aroma; some tart rotting lemon rind, cheesecake, old rag; crisp and invigorating","Plzen, CZECH REPUBLIC","motelpogo"
352,"2013-09-27",4.7,"375 mL bottle at Seven Monks in Traverse City.  A golden amber pour with a white head.  Aroma is quite sour.  Flavor of sour raspberry or strawberry, funk, lemon, dry.  Maybe not the most complex, but ""sooooo good"" (quote from notebook).  Those words definitely do not describe how much I enjoyed this, so Ill just let the numbers do that.","Northville, Michigan, USA","flatmatt"
352,"2013-09-24",3.6,"bottle at bierhuyske
pours rather dark blond for a geuze
small white head
smell is sour . not per se sharp, not per se bald . some nice in between character.
taste is mouthfilling sour . like a sharper boon , or a balder 3 fonteinen withoud the funk . 
not realy complex, too much carbo . OK but not the best one for sure","Antwerp, BELGIUM","kraddel"
352,"2013-09-22",3.7,"37,5 cl bottle @ Durty Nellys Pub, Borgomanero (NO), Italy.
Pours a clear, golden liquid with a frothy clean white head, dissipating in about a minute. I get mostly apples on the notes, with hints of cellar dust, hay, balsamic vinegar. Not one of the most acidic gueuzes, really pleasant, cleans the palate quite nicely and leaves and apple-y and slightly balsamic note. I find it more easily approachable than other lambics. Cant detect the alcohol at all.","Borgomanero (Novara), ITALY","AlchemikalGab"
352,"2013-09-20",4.0,"Pours a golden beer with a good white head. Smells deliciously sour. Tastes great. Medium sour with a light bitter suttle sweet finish. Average carbo. Thin body and a watery texture.","s-Hertogenbosch, NETHERLANDS","Abijen"
352,"2013-09-19",4.0,"Bottle, 375 ml. Pours dark golden with a big creamy head. Aroma is balsamic vinegar, oak and notes of earth, as well as a funky fruity hint of brett. Full body with soft carbonation. Flavour is sour with funky yeast and brett, as well as wood and fruit giving a nice long tart finish.","Bergen, NORWAY","tmrmwel"
352,"2013-09-15",4.1,"Bottle from Mane Liquor. Pours clear golden yellow, with a lively white head. Immediate aroma of white grapes, lemon, green apple peel and a nice farmhouse funk. Smells really clean, unlike some older lambics Ive had. Flavours are crisp - tart citric zest, lemongrass, green apple balanced a nice dry sourness. Great gueuze in my opinion.","Perth, AUSTRALIA","HopRedHead"
352,"2013-09-13",4.2,"Che meraviglia infinita, aspetto, aroma, palato incredibili, mia moglie ha detto che è una delle cose in assoluto più buone che abbia mai assaggiato. Addirittura lultimo sorso col fondo, mi sembrava di sentire odor di tabacco nei bar fumosi, fantastico...","Firenze, ITALY","Wolfbass"
352,"2013-09-11",3.9,"Bottle. I have had very few lambics. Pour is a hazy gold with some white head. Aroma is tart funk. Flavor is tartness followed by tons of funk. Not sure how to evaluate the funk, but its terrific.","Robbinsdale, Minnesota, USA","TheHOFF43"
352,"2013-09-11",3.8,"12.7oz bottle. Pours a hazy straw color with moderate carbonation and a thin white head. Smells of funk and lemon and cloves. Taste is sour with lemon and mild orange peel bitterness. Finish is lingering yogurt sourness. Thin but slightly oily mouthfeel. A very nice and drinkable lambic.

---Rated via Beer Buddy for iPhone","California, USA","htnicholas"
352,"2013-09-10",4.0,"Bottle thanks to CanIHave4Beers! Solid delicious gueuze. A fresh, banyardy funkiness. Moderately sour. Very drinkable, balanced, refreshing mouthfeel.","Albuquerque, New Mexico, USA","ketchepillar"
352,"2013-09-07",4.1,"750ml bottle. Hazy orange-tan, Oily head, steady rims the glass. Classic funked out barnyard aroma. Lemony and sour, but completely drinkable. Easy going, very authentic. World Class, well done.","Madison, Wisconsin, USA","nuplastikk"
352,"2013-09-06",3.9,"Bottle @ Elfos Pub, Perugia, Italy. Pours with an orange, hazy colour, small off-white head. Aroma has notes of leather, citrus, barnyard, basement aromas and wood. Taste is moderately sweet, little bitter, moderately sour; well balanced. Medium body, oily texture, soft carbonation.","Perugia, ITALY","mecafilo"
352,"2013-09-05",3.8,"750 ml. bottle. Pours a hazy light gold with a nice white head. Aroma of funk, citrus, and wood. Taste is lemon, funk, wood, and florals. Nice and tart.","Lansing, Kansas, USA","RobertDale"
352,"2013-09-04",4.4,"UPDATED: JUL 21, 2014 Bottle from Mane Liquor at PBS tasting. Good looking stuff. Nose is very barnyard like with hay, grass, bread and some astringent acidity there. Very easy going Gueuze thats for sure. Taste is slightly vinegary with some acidity and heavy barnyard notes - citrus, horse blanket, hay. Very quaffable. Considering this was side by side with Armand and Tommy, it held its own. Very good and I couldnt pick a preferred one","Perth, AUSTRALIA","maneliquor"
352,"2013-09-04",3.7,"Bright gold with 5 mm of head that is fairly quick to decay to a flat surface. Aroma/flavor is pickles and tart pear, barn hay, and, specific to the flavor, an evolution to dry wheaty grain about a half second in. The sourness is clean, fruity, and on the heavy side of moderate for the style, but I prefer less. Body is light, a bit foamy. a nice Geuze, but Im not sure if its worth its current rating.","Providence, Rhode Island, USA","PapaSkeetSkeet"
