"beer_id","date","rating","text","user_location","user_name"
352,"2012-03-21",4.1,"UPDATED: DEC 20, 2016 Latest review, December 2016 - 37.5cl bottle, 2014 vintage. It pours a hazy golden color with a large white head. Some slow gushing upon uncorking. Aroma is full on funky and citric notes, big horse blanket, lemon peel, lemon juice, straw, grass, basement dust, must. Taste verges more on the acidic citric lemon juice upfront, with funk kicking in later in the sip. More lemon juice upfront, lactic acid, funky esters, basement and must. Burps hold some vinegarish sourness. As it warms up, the funk becomes more prominent behind the strong lemony initial note. Medium bodied with lively carbonation. Overall, my notes compare quite similarly to the 2012 ones and the strong citrus game is still on point. Score also remains unchanged 8-4-8-3-18

Original review, March 2012 - 75cl bottle, 2011 vintage. It pours a slightly hazy golden color with a big white head. Medium  kasting foam. Aroma is sour and funk with strong citrus notes. Hay, barnyard and dust as well. In the taste you get horse blanket, hay, lemon zest and juice, taleggio cheese and dust. Quite funky and sour with a nice sweetish touch. Medium to thin body with lively carbonation. Extremely balanced and tasty. Quite complex bouquet as well. Top notch for sure. Score: 8-4-8-3-18","Rimini, ITALY","teorn88"
352,"2012-03-18",2.9,"hazy orange coloured body with a white head a sour fruity aroma a sour fruity little bitter taste with a sour finish","Weelde, BELGIUM","Wim"
352,"2012-03-14",4.0,"Corked bottle. Oak, dust, lemon and peach in the aroma. Sour, oaky flavor with grapefruit, lemon and pineapple. Good, sour, fairly complex geuze.","La Tropica, NETHERLANDS","bierkoning"
352,"2012-03-12",3.7,"From notes.  First reviewed 9/28/2011.  Poured from a 350 mL bottle into a tulip. Thanks to bauermj for bringing this over.

My pour is a very hazy pale yellow color with a thin white head. The head remains mostly an island with a few spots of lace. 

The aroma is tart and acidic. A nice level of barnyard funk as well. Some soft malt presence in the back.

Tart lemon, a bit of grainy malt, and lots of pleasant sour flavors dominate the flavor. The finish has a good level of funk in it. 

The mouthfeel is definitely acidic. Light to medium body, light bubbly carbonation. Lightly puckering.

Overall, this is a solid gueuze.","Chicago, Illinois, USA","KickInChalice"
352,"2012-03-11",3.8,"Bottle: Poured a clear bright golden color lambic with a super huge foamy head with great retention and some good lacing. Aroma consists of light sour notes with light funky ester. Taste is also a mix between some sour and tart notes with light acidic undertones and some light funky ester. Body is about average with good carbonation. Well put together lambic mix except it may be a bit too balanced toward sour and acidic notes for my liking. I would have preferred more green apple and barnyard notes personally.","Gatineau, Quebec, CANADA","Boutip"
352,"2012-03-09",4.4,"2010 bottle, pours a gorgeous almost glowing golden liquid under pale and lacy white head with low retention. Smells awesomely gueuze-y: lots of floral funk and meaty aromas with hints of sun-baked hay. Tastes very tame, somewhat peppery up front with undertones of the meatiness. Missing the bite that the Cantillon Classic has at the end which pervades over the whole mouth. This is definitely a little tamer... but oh so delicious. Mouthfeel is slightly dry and initially effervescent. Overall its definitely one of the better regular gueuzes Ive had; I wish I had cases of the stuff.","Hanover, New Hampshire, USA","strawberry"
352,"2012-03-09",4.1,"Best before 10/02/2021 - Poured into some Hill Farmstead stemware.  Slightly hazy golden yellow body with thin white head on top.  Earthy, sour, acidity on the nose.  Wet hay and orange.  Really nice nose on this.  Taste is soured oranges, earthy malts and a touch of dry brett.  Really nice blend between sour acidity and brett funk.  Palate is perfect.  Balanced acidity, good carbonation, slightly slick.  Overall, this was a really nice surprise and an excellent gueuze.  Right up there with Cantillon and Drie.  Flavor is more on the Cantillon side of things, but there is definitely some brett funk lingering in there.  Ill definitely need to pick up a few more of these.  Very excited to see how they age.","New Hampshire, USA","sisuspeed"
352,"2012-03-07",3.9,"375 mL bottle from Gianni.  I love gueuze, so Im hoping this one is pretty good.  Slightly hazy, golden color, small foamy head, lots of little bubbles in this one.  Other than the slight haze this has all the looks of a gueuze to me.  The aroma is really fruity, some graininess, some tartness, and a touch acidic.  Taste is also fruitier and really enjoyable.  Peach, lemon, some yogurt, and a tart finish.  Lighter bodied, and not as acidic as cantillon and 3F.  Really good, but not quite on the same level as other big gueuzes.","Minnesota, USA","mattyb83"
352,"2012-03-07",4.5,"UPDATED: SEP 16, 2012 Picked this up at Hill Farmstead Brewery. Poured into a Flute glass. The bottle was at cellar temp so around 55.

A - Pouring carefully, I still got a 5-finger head with a nice mix of bubbles that quickly resided. This is a pale yellow color almost like a lemonhead candy with a lot of carbonation.

S - Immensely tart scent with some light honeysuckle, floral and leafy scents. 

T - Excellent first taste upon hitting the tongue. Up front tart taste with a great earthy and dirt like taste and a lot of wood. On the back of the tongue, tongue tingling from a very sour taste. Overall, nicely balanced.

M - 90% carbonation on a mouth swish. Light bodied and very very dry. My mouth is left very dry and the aftertaste doesnt linger at all. Its gone pretty fast.

O - Very well balanced beer. Well done and very tasty.

2012 vintage update. Enjoyed from a 37CL bottle from hunger mountain. Much sweeter and more smooth and refined than before. Still an excellent Gueuze.","Enfield, New Hampshire, USA","AdamChandler"
352,"2012-02-29",3.7,"This poured a darker golden color with a fluffy white head. Aroma was acidic green apples, some barnyard funk, and some spicey yeastyness.  Flavor was fairly tart but not overwhelming, a good bit of grainy lemony notes and some light funk. Decent.","Pittsburgh, Pennsylvania, USA","Beerman6686"
352,"2012-02-29",3.8,"Had this at Ratebeers Horny Devil Pittsburgh Winter Tasting 2012. Big thanks to James for this gem.  Cloudy orange yellow. Very sweet tart purfumy aroma. Like many real lambics  simply dee-lish.  Good sour palate that is full of co2 impact, lovely. Really nice James! This Horny Devil rocks. When I think about limbic, I think about beers like this. Very good overall beer experience!","Beaver Valley, Beaver County, Pennsylvania, USA","cheap"
352,"2012-02-26",4.0,"Bottle hazy yellow with a rim of bubbles.  Aroma is crisp apple and bright sour funk, really enticing.  The lactic sourness is just right and not too hard but not too soft.    Exceptional yeasty bitterness and chaulky mouthfeel with a lively envelope of soft bubbles.  Could drink this forever.","Brooklyn, New York, USA","bmerz"
352,"2012-02-26",3.9,"Bottle. Orange color.Really tart and mildy sweet. Really puckers the tongue but not over-doing it. Delicious, one of the best","New York, New York, USA","BrewBoxer"
352,"2012-02-26",3.9,"Hazy golden color with a medium sized, white head that left light lacing on the glass.  Aroma of bacteria, wild yeast, some must, wood, and barnyard funk. Taste was sour, wood, puckering, and dry finish. Not bad, but not quite as good as mine.","Pennsburg, Pennsylvania, USA","egajdzis"
352,"2012-02-19",4.0,"Bottle at Lush on Halsted in Chicago. Pours golden with a white head. Funky aroma, but not as bold as others. Light bodied with a spritzy texture. Flavor of pale wheat malts, sour apples, and pear countered by a firm tartness. Semi dry finish. I know others think this is young, but I think its good now as I dont like my gueze to be overly dry. Pretty solid, but I fell a hair short of my expectations based the recent surge in popularity of this beer.","Nashville, Tennessee, USA","illinismitty"
352,"2012-02-19",4.0,"Pours unclear dark orange golden in color with a very light  and extremely small off white head. The aroma is sweet candy yeast and funk notes, light and pleasant. The flavor is very tart, sour with citrus and funk laying on the palate nicely. The body is carbonated just right, not too light like many guezes.","Royersford, Pennsylvania, USA","Damico"
352,"2012-02-18",4.0,"375ml bottle. Dusted orange with a fine, hissing, persistent foam. Aroma of date expired pineapple chunks on the turn, Love Hearts, hay, faint cheesy hops. Bright and sparkling with a sherbet-like tang, crab apple and Love Heart notes, lemon juice and cream cheese. Sharp, crystalline gueuze without dankness or enamel-stripping acidity, and very much the sum of its respective parts.","NUNEATON, Warwickshire, ENGLAND","DruncanVeasey"
352,"2012-02-14",3.8,"37.5 cl. bottle @ home  purchased from the Streekproducten store in Halle  blend of 1,2 and 3 yr. old lambic according to the bottle, so not one of the earlier versions  hazy apricot orange with a head that quickly disappears to absolutely nothing  smell is sour, lots of wood, acidic lambic soaked wood with a touch of lactic in the back  taste is acidic upfront, acid drenched wood, touch tart, leading into a slightly watery part, harsh acidic, bitter lemon peel, lots of it, lemon juice, bitter acidic aftertaste, bitter lingering aftertaste, I recognise the 3F blending school in this but not the Cantillon one, either way one of the less impressive geuzes I have had, not counting the crappy ones, hope that he will improve in the future, still not quite bad, did prefer the draft version  tad watery, soft carbonation, almost going to flat","Antwerpen, BELGIUM","77ships"
352,"2012-02-12",4.3,".375ml bottle.  Pours light amber with a white head.  Nose is of funky cheese, lemon and leather.  Taste is funky cheese and lemon.  Mouthfeel is medium and very sour.  OK, I had this on draft recently and liked it, but like this bottled version way more as the bottled was more sour and less acidic than the tap version.  This is one fantastic gueuze and Im glad I have a 750 ml bottle still.  This was one of the best gueuze Ive ever had.  Simply delightful.","Land of Sugar, Texas, USA","MaltOMeal"
352,"2012-02-11",4.0,"Bottle thanks to Ughsmash. Pours a bright and cloudy orange color with a large white head. A bursting aroma of hay, lemons, dust, funk. The flavor is a vigorous gueuze; initially quite sour, not acidic but very tart, some sweet wheat, loads of lemon and oranges. Certainly quite drinkable and refreshing with a huge bite of sourness. Of course lots of carbonation. Very good.","Portland, Oregon, USA","douglas88"
352,"2012-02-11",3.9,"Bouteille de 750ml. Bouchon de liège. Bière dorée-ambrée (orangée) avec une mousse blanche peu durable. Le nez est bien équilibré entre laigreur et le sucré. La bouche est agréable, aigre et sure mais pas trop. Il ny a pas de vinaigre.  Une touche boisée agrémente le tout.","Longueuil, Quebec, CANADA","rodenbach99"
352,"2012-02-11",4.3,"Where the Wild Beers Are, 2011. Bright orange color.  Powerful barnyard aroma with yeast.  Very sour and dry. Herbal.  Light grass.  Apricot in the aftertaste.  This is an excellent gueuze.","St. Louis Park, Minnesota, USA","JK"
352,"2012-02-10",3.8,"I believe foofaa opened this 750ml for us at our recent gueuze tasting.

A - Pours hazy golden orange with a nice one and a half finger tall white head leaving light lace down the glass.

S - Smells of citric fruits, dirty funk, green apples, oak and a touch of breadiness. Nothing too complex yet still very enjoyable.

T - Starts off with a big sour kick slowly giving way to hints of dirty gym locker funk, green apples, fresh cut citric fruit and a touch of vanilla / oak sweetness. Finish is quite dry, lingering for some time.

M - Medium body and flavor with moderate carbonation. Tart, dry feel that lingers on the pallet long after consumption.

O - I have had this one three times now and it is really growing on me. It has quite a bit of flavor yet it remains easy to drink. I will have to stock up on this one when I see it.","Pennsylvania, USA","orangesol"
352,"2012-02-06",4.2,"Been itching to try this .. . 750ml amazingly shared by my boy Lee and about 2 other people.. . pours a lightly hazed gold amber .. pretty impressive fluffy head, light white prison bar lacing .. . sparkling light tartness, some hay and minerals .. almost a sour fruitiness too .. . very easy to drink, well balanced and an enjoyable level of sourness .. . not as sour as Cantillon or 3F gueuzes but a delicious and welcomed addition to the lambic world!!  It reminds me of a French Canadian tennis racket, stuck to the back of a Venus snow-goon, bubbling out of my sisters Brazilian donkey - I dont think I can make myself any clearer!",".....Manchester United.........., Texas, USA","SudsMcDuff"
352,"2012-02-05",3.9,"Bottle 37,5 cl. Pours cloudy bright amber with a nice off white head leaving some laces. Aroma is sour, tart, stable, cellar, wet blanket, honey sweet and nicely fruity. Flavor is lemon juice, fruity, a bit sweet, tart, dry and bitter; very nice indeed. Finishes very tart, dry and fruity.","SWEDEN","tkrjukoff"
352,"2012-01-30",3.6,"Bottle, 375ml.
Pours a hazy orange with a big white mostly-dissipating head.
Smells of citrus, sweet, brett, and barnyard.
Tastes a heavy sour, medium sweetness, and mild bitter. Highly acidic, and finishes quite tart. Medium body. Oily texture.","Zurich, SWITZERLAND","magdalar"
352,"2012-01-28",4.2,"hazy yellow pour, small to no head. 
huge aromas or wet hay, and horse blanket, and wet grass. big amounts of funk, and tartness. mouthfeel is bang on, carbonation is perfect. the finish is very very tart, more and more as it warms. medium bitterness, with a great dose of funk in the end. great gueuze!","Sturgeon Falls, Ontario, CANADA","robinvboyer"
352,"2012-01-22",3.8,"Bottle, 375 ml - Clear golden beer with a very small white head. Aroma is tart with notes of hay, wheat, citrus fruit and barnyard. Flavor is acidic and tart with notes of grapefruit, wheat, leather and cereal. Very enjoyable gueuze, strongly recommend to try it with some stilton!","Stockholm, SWEDEN","Joakgust"
352,"2012-01-21",4.1,"Mostly clear golden amber no head no lace... Funky cheesy aroma light lemon quite funky leathery... Cheesy lemony funky dry tart relatively lively lots Of lemon... Medium body..","West Chester, Pennsylvania, USA","jeff789"
352,"2012-01-21",4.0,"Bottle shared by Ryan. Very tasty indeed! Great sour funk aroma with hints of lemon. Tart sour flavor that makes the cheeks pucker. Delicious.",", Florida, USA","dimenhetfield"
352,"2012-01-20",4.0,"Bottle, half champagne sized. Pours  a clear golden, with a finger of a rapidly fading blond head. Superfresh funked up fruit aroma, reminiscent of freshley squeezed lemon, or lemon peel,  and hint of dried horse manure. Taste is utterly tart. Nice fruity tart, that is. There is also a very pleasant citrussy acididiy. Some subtle residual sugars can also be noticed. Lingering tart finish. This is really good stuff!","Oslo, NORWAY","OleR"
352,"2012-01-17",4.4,"A rating for an early bottling version with 1 and 2 year old blend only.  Usually treated as separate entries on ratebeer.  Another rating will be added for the 1, 2, 3 year old blend when I drink one of my bottles
In short: A classy, dry and complex citrusy Gueuze that is not too intensely sour/acidic.  Wow!
How: Bottle 750ml.  One of the early bottling from 2011 (1 year + 2 year lambic).  Consumed when approximately 8 months of age
The look: Cloudy blonde body topped by a persistent small white head
In long: Nose is not the most intense but it is all I want from a Gueuze aroma, barnyard, rustic, funk, horse blanket.  Aroma does not indicates much acidity or sourness.  Taste offers a lot of funk and citrus fruits, plenty of hay, grapefruits and lemons acidity, barnyard.  Very dry.  Very classy, mass-market friendly because not too sour or acidic and also very complex to satisfy the Gueuze connoisseur.  As a lambic drinker I used to prefer the most intense examples of the style, but as years pass I am more and more drawn to more classy and easy to drink offerings of the style like this one.  This is clearly one of the top gueuze out there.  A friend proposed to have a blind tasting, but whats the point really, Im sure I would prefer the more tender Stevie Wonder over Andrea Bocelli","Montreal, Quebec, CANADA","Glouglouburp"
352,"2012-01-16",4.3,"Quite floral aroma with some white grape, tart pear and a bit of mustiness. Appearance is well carbonated gold body with bubbly white head, which did dissipate quite quickly. Flavor matches the nose with a long lemony tart finish; the mustiness is accompanied by a slight cheesecloth note. Palate is very bubbly and builds up to effervescence. Quite good, and very bright Gueuze; this will only get more refined over the next few years.","Louisville, Kentucky, USA","ContemplateBeer"
352,"2012-01-16",4.8,"UPDATED: MAR 14, 2013 Wow! Working in the wine business, if I were served this Gueuze during a blind tasting (poured in a black glass), this could mislead me to a great Chardonnay like a Meursault of a young vintage. Almost not bubbly, very round and complex, with a long lasting finish helped by a perfecly balanced acidity. Best Gueuze Ive ever had!","Andenne, BELGIUM","hazewee"
352,"2012-01-15",3.8,"375ml bottle poured into a tulip.

Appearance is a hazy orange with a small white head. Good head retention but no lacing.

Aroma is funky barnyard but there is also some citrus in there notably lemon, orange, and raspberry. There is also a touch of oak.

Taste is quite a bit more citrusy than some of the other gueuzes I have tried. Orange and raspberry are there almost on a level playing field with the barnyard notes. A dry oakiness comes in strong on the finish. Tartness is quite prevalent throughout imparting a lemony character. Finish is dry but not quite as dry and clean as I would have liked.

Overall this is a decent gueuze but not the best I have had. There isnt enough funk and it doesnt finish quite dry enough. It isnt bad though and I probably would get it again.","Johnson City, Tennessee, USA","rangerred"
352,"2012-01-15",3.9,"Finally!  Hazy dark straw.  The aroma is quite leathery adn the more you inhale the more baby poop pedio you get.  Tart and leathery, then citrus and wood.  Finishes austere woody and dry, and very leathery.  Good gueuze.","Vancouver, British Columbia, CANADA","Oakes"
352,"2012-01-13",4.2,"Pours hazy amber/golden with medium white head. Aroma is funky, barn, yeast and apples. Taste is sour with green apples, barn, funk and some citrus notes. Liked it alot","Göteborg, SWEDEN","SimonRoller"
352,"2012-01-13",3.7,"Bottled. Pours hazy copper with a big white head. Smells and tastes clear sour, abit citrus with a similar finish.","Hallsberg, SWEDEN","Dazz3"
352,"2012-01-13",4.2,"UPDATED: MAY 14, 2013 Best by date 09/02/2022; Sampled April 2013
A soft pour into my New Belgium globe glass produces a voluminous, quickly overflowing, four-finger thick, pale tan colored head; this leaves some light, layered lacing on the sides of my glass as it slowly subsides. The beer is a nice amber color that shows a brilliantly clear, bright, pale-amber tinged, full gold color when held up to the light. The aroma has a certain cider like note to it, this is backed by a solid lactic tartness, lots of woody mushroom notes, earthy oak character, a soft musky / sweaty character, piquant urea, some toasted oak notes, a nutty dried straw aroma, and then a solid fruit character in the finish again that also has some pear like notes to it. The aroma is quite complex, with a definite piquancy to it.

My first sip is effervescent, tart, oaky, slightly astringent, and then with a more biting sourness in the finish. The body has some lactic slickness and tannic structure to it, but is well balanced by the bubbly carbonation; it is really hard to find fault with the body, lots of carbonation (which I like in a Gueuze), with ample body for a beer this dry, yet still eminently quaffable. The finish is phenolic, perhaps a hint of medicinal notes, lots of grassy / dried-hay flavors, and a certain bitterness and oaky spiciness is also here. The malt character accentuates the straw like notes, but also provides a rounded wheat-cracker / rustic-white-bread-crumb like character in the middle of each sip. Quite musky, with plastic overtones, perhaps, with lots of sort of medicinal mushroom like flavors, . This does have quite a chewy, oak stave, woody flavor to it; perhaps a bit more than some Lambics, but it is clearly only playing a supporting role here; I wonder if it has to do with the newness of the barrels that this new Gueuze blender is having to use. This has a firmness to it somehow that is accentuated by a mineral, perhaps slightly metallic character, and these get mixed in with a cider like flavor that shows perhaps a touch of oxidation; the oxidation also adds a slightly nutty overtone to the malt / grain character here. Speaking of fruit, there are also some light grapefruit like notes, and at times, perhaps a touch of pear like notes.

I was expecting this to be a significant let down after the fantastic Girardin Black Label that I had last night, but this is certainly holding its own; not as funky, but perfectly complex and actually a bit more balanced than the latter. This is a big improvement over the first vintage (with only two years of Lambic blended) that I had; much more complex, balanced, and characterful, in fact it makes me realize that I over-inflated the previous vintage, but I excuse myself for that one, since I was so excited about there being a new Gueuze blender in town. With the slightly darker coloring, and the slight cider like notes, it seems that this has seen  a bit more oxidation during aging than most modern Gueuze manufacturers, but it is well in line with what I have had in previous years, and luckily is only a light touch; I wonder if it will have any implication on the aging potential of these beers, only one way to find out. I really love Gueuze, that is all.

4, 8,4,8,4,16
As I pop the cork off this best by 10/02/2021 375ml bottle I get a waft of raspberries.  A steady pour into my large Tripel Karmeliet tulip produces a two finger thick, somewhat creamy textured, pale tan colored head.  The beer is a pale amber color that shows a bright, clear, orange-tinted, gold hue when held up to the light.  The aroma smells of lactic acid, grapefruit and a touch of cider that is backed by an ample funkiness that provides mushroom notes, phenolic funkiness, fruity oak character, dry woody spicy notes, perhaps a hint of clove even.  The nose has a bright fruitiness to it that makes this distinct compared to other Gueuzes; this adds a nice note and at times I would swear there are some raspberries here.  The nose is quite nice, dry and appetizing smelling, but with a fair amount of complexity; as one should expect of a Gueuze.

The beer has bright sourness to it that manages to be quite in control and suggests at notes of grapefruit.  This is backed by a funkiness that wasnt quite as pronounced as it was in the nose.  There is a fruitiness here in the flavor that again reminds me of raspberries; this might be accentuated by a touch of acetic character that isnt really at flavor threshold levels.  This has a dryness to it that is accentuated by some oak derived astringency and some phenolic character. The body of this beer is just about perfect for a Gueuze, light and refreshing, but with that characteristic slickness and texture to it that keeps this a long way from being watery.  The oak character seems to be a touch spicier and astringent than is usual for a Gueuze; given that this is a new Gueuze blender and that the barrels were newly sourced, that is not at all surprising.  As the beer warms up the woody character / oak gets more distinct and, along with the funkiness, makes me think of woody mushrooms.  The acidity also gets a bit more pronounced, almost sharp, though not quite harsh.

This is a damn good Gueuze already, I cant wait to have one that is a proper blend of 3, 2 and 1 year old Lambics. This definitely has me excited as this particular blend shows a lot of potential; it could use a more muted oak profile and the acidity might be a bit more rounded, but I really like the fruitiness and the funkiness, and even the oak and acidity.  I cant wait to get more vintages of this.","Tucson, Arizona, USA","FlacoAlto"
352,"2012-01-12",4.1,"Amberish golden, off white fizzy cover.  Aroma is quite tart, lemony, acidic, slight cheesiness.  Taste is again battery acid, light lemon, not crazy funky, but definitely sour.","Capital of Appalachia, Pennsylvania, USA","lithy"
352,"2012-01-12",4.2,"Stumbling Monk session. Glowing honey gold. Aroma lime skin lemon skin slight baby poop but very slight soil. Prickly carbo. Hanssens character. Light bodied. Lots of lime rind. Pink grapefruit meat and pith. Finishes very dry and astringent. With acidity but citrus fruit pith not vinegar. At all. Nice gueze.","VANCOUVER, British Columbia, CANADA","Beershine"
