"beer_id","date","rating","text","user_location","user_name"
4056,"2017-05-29",3.7,"Bottle pours out a foggy bright yellowish orange with. Bright fresh citrusy pithy aroma and flavors. Bitter full palate. Lingering bite. Fresh and big.","Boise, Idaho, USA","IndianaRed"
4056,"2017-04-25",3.8,"bomber yellowish orange pour with soapy head aroma is citrus and hops taste is lots of grapefruit and bitter zest slight pine and booze finish.","Blaine, Minnesota, USA","Ronritter"
4056,"2017-04-23",3.6,"Approximately 8 oz. from a 22 oz. bottle, consumed on 4-18-17. Fruity aroma features scents of apricot, pineapple, brine, and Smarties. Fruitier than I would prefer in aroma. Floral smell. Pours a cloudy tan/gold with a moderate amount of beige head. Not too cloudy. Looks nice. Floral, lemony taste. Actually pretty malty in flavor: Caramel. Apricot. Pineapple and pineapple upside down cake. Some welcome dryness in the finish. Easy to drink. Medium body. Lively in the palate. Well-made but not my style. Very good for what it is.","Minneapolis, Minnesota, USA","islay"
4056,"2017-04-02",3.5,"Gold cokor, good carbonation. Hop forward, some citrus, dry hops and some pone..","St. Louis Park, Minnesota, USA","JK"
4056,"2017-03-18",3.6,"Bomber. Wonderful fruity sweet hop nose. Hazy amber. Doesnt quite taste as it smells. Somewhat bready. Easy drinking and tastes lighter than the stated 6.5%","Minnetonka, Minnesota, USA","ElGaucho"
4056,"2017-03-02",4.0,"Bottle 22fl.oz. [ As Toppling Goliath Sol Hunter Pale Ale ].Clear medium yellow color with a average to large, frothy, good lacing, mostly lasting, white to off-white head. Aroma is moderate to heavy malty, pale malt, moderate to heavy hoppy, citrus, grass, tropical fruit, peach. Flavor is moderate to heavy sweet and bitter with a long duration, tropical fruit, peach, hoppy. Body is medium, texture is oily, carbonation is soft. [20161230]
 8-4-8-4-16","VestJylland, DENMARK","fonefan"
4056,"2017-03-02",4.3,"Somewhat hazy yellow. Aroma has LOADS of grapefruit with hints of citrus and pine. Nice medium body, dank with a bitter finish. Rather awesome","Reykjavik, ICELAND","haukur"
4056,"2017-02-19",3.7,"Bottle. Pours a hazy golden color with a small white head. Has a fruity malty grapefruit hoppy aroma. Fruity malty peachy grapefruit hoppy bitter flavor. Has a fruity malty grapefruit hoppy bitter finish.","Malmö, SWEDEN","anders37"
4056,"2017-01-16",4.1,"Orange cloudy pour from 22oz bottle. White foamy head. Sweet vanilla and citrus aroma. Yum. Taste is peach, grapefruit and tropical. Great beer","Chicago, Illinois, USA","kaser"
4056,"2017-01-02",3.8,"Bottled. Pours hazy deep golden with an average off-white head. Aroma of citrus, peach and piney notes. Sweet flavor that ends up being more dry and bitter. Medium bodied, oily texture and soft carbonation. A very nice APA indeed. 🌟🌟🌟🌟","Tranbjerg, DENMARK, DENMARK","Habanero"
4056,"2016-12-30",4.0,"Bottle. Hazy golden with medium off-white head. Aroma is malt, fruit, hops, peach and citrus. Flavour is malt, fruit, citrus, peach, fruit peel, hops, little grapefruit and medium bitter.","DENMARK","chrisv10"
4056,"2016-12-30",4.0,"Bottle @ Johns. Pours dark yellow with a white head. Aroma of light malt, grass, rich fruity hops, citrus, grapefruit/-peel. Flavor is rather bitter, light malt, grassy, bitter fruity hops, tropical fruit, citrus. Medium body, average carbonation, dry and lasting bitter finish. 301216","Hasselager, DENMARK","Camons"
4056,"2016-12-30",3.8,"Bottle. Creamy White good mostly lasting head. Yellow colour. Moderate malty and heavy hoppy aroma. Heavy bitter flavor. long heavy bitter finish. Creamy palate, Great. But more IPAish. Grape!","Randers, DENMARK","HenrikSoegaard"
4056,"2016-12-30",4.0,"Bottle @ Saxo tasting. Hazy golden with a big and lasting white head. Aroma is sweet, malty and moderate hoppy - citrus and pine. Flavor is quite sweet and rather bitter. Dry and rather bitter finish. 301216","Beder, Aarhus, DENMARK","Rasmus40"
4056,"2016-12-30",3.8,"Bottle @ Aarhus tasting, my place. Nice head with good duration. Color is golden. Aroma and taste are rich hops, citrus, flowers, fruits, malt and has a nice bitter finish.","Højbjerg, Aarhus, DENMARK","saxo"
4056,"2016-12-29",3.8,"Bottled. Yellow coloured. Hazy. Dense off white head. Aroma. Herbs, flowers, sweetness, citrus. Flavour. Flowers, herbs, tropical fruits, citrus. Medium to full bodied. Ends herbal bitter.","Søborg, DENMARK","madsberg"
4056,"2016-12-29",3.7,"Bottled. A hazy golden beer with a lazing yellowish head. The aroma has notes of hops, lemons, straw, and malt. The flavor is sweet with notes of straw, hops, lemons, and malt, leading to a bitter finish.","Citizen of the universe, DENMARK","Ungstrup"
4056,"2016-12-29",4.0,"29-DEC-2016, bottle @yespr tasting.
Hazy orange with a lasting, fluffy, lacing, white head.
Citrus and dank hop aroma. Taste the same. Some yeast and spice. Nice body for an APA, creamy, bitter, mostly dry. Nice.","Copenhagen, DENMARK","jesperhammer"
4056,"2016-12-29",4.0,"[email protected]/* <![CDATA[ */!function(t,e,r,n,c,a,p){try{t=document.currentScript||function(){for(t=document.getElementsByTagName('script'),e=t.length;e--;)if(t[e].getAttribute('data-cfhash'))return t[e]}();if(t&&(c=t.previousSibling)){p=t.parentNode;if(a=c.getAttribute('data-cfemail')){for(e='',r='0x'+a.substr(0,2)|0,n=2;a.length-n;n+=2)e+='%'+('0'+('0x'+a.substr(n,2)^r).toString(16)).slice(-2);p.replaceChild(document.createTextNode(decodeURIComponent(e)),c)}p.removeChild(t)}}catch(u){}}()/* ]]> */ - Golden orange pour with white head. Citrus and tropical fruity aroma and taste with some punchy notes of grapefruit, mango, some tangerine, slight floral and green hoppy action, light pale malty base, hoppy bitter into the finish. Good stuff.","Copenhagen, DENMARK","Desverger"
4056,"2016-12-29",4.0,"Bottle at yespr. Hazy golden with a large white head with good retention and lace. Super fresh. Citrus, melon, flowers, light persimmon, peach, apricot. Medium body, low sweetness, good bitterness. Long hoppy finish. Super drinkable.","DENMARK","SlackerMads"
4056,"2016-12-29",3.9,"66 cl. bottle. Hazy yellow colour with a white head. Aroma and flavour of citrus, fruit, straw, hops, malt, bitterness, peach and grapefruit.","Albertslund, DENMARK","Borup"
4056,"2016-12-29",3.7,"Bottle at yespr.
Hazy amber colored with a medium sized white head.
Fruity aroma of hops and citrus with notes of pine needles.
Fruity flavor of hops and pine needles with notes of hops.
Hoppy finish.","Frederiksberg, DENMARK","joergen"
4056,"2016-12-29",3.6,"22 fl oz bottle. Pours hazy orange to yellow with a huge white head. Aroma is peachy and grapefruity. Smooth fruity, peachy and grapefruity. Solid hoppy. Crisp, citrusy and fruity. Lingering and fruity and crisp hoppy far finish.","Copenhagen O, DENMARK","yespr"
4056,"2016-12-20",3.5,"Shared bomber poured to snifters showing a hazed, orangey gold color, with a bubbly layer of soft white head foam, and spots & strands of lacing. The nose was dank and resinous, grass & greenery, with esters as grapefruit, pineapple, and some fruity, tropical scent. Medium bodied, with okay carbonation, the taste added a lingering, dry, citrusy, and rind-like bitterness. Not overwhelmed, but decent enough Pale.","Lombard, Illinois, USA","tmoreau"
4056,"2016-12-09",3.6,"Bottle @ Mikkeller Bar, Aarhus. Pours hazy to muddy orange with a white head. Herbal green hops and yeast. Dry and bitter. Grassy , melon and over the top herbal note plus a tad too yeasty. Raw bitter finish. Completely agree on this one Mr. Orla.","Odense, DENMARK","Dedollewaitor"
4056,"2016-12-05",3.4,"The aroma is full of hops, pine, orange zest, lime, lemon, citrus, mango and passionfruit. The color is reminiscent of pineapple juice. The taste is full of hops, pine, orange zest, lime, lemon, citrus, lemon peel, mango, pineapple and passionfruit. Nice but not impressing.","","FraekkeFyr87"
4056,"2016-12-04",3.8,"Bottle @ From Mikkeller Århus. Pours cloudy orange with a white head. Aroma of pine, orange, mandarin, some perfumed foral notes - urinal ball, quite grassy, gasolin. Taste is heavy bitter, quite sweet body beneath the heavy resin and bitternes - loads of resin and pine, citrus and manadrain, a semi peppery / herbal thing, which doesnt suit it. Very dry and bitter.","Odense C, DENMARK","MrOrla"
4056,"2016-11-29",3.9,"Bottle. Pours hazy dark yellow orange with a white head. Aroma of dank hops, mellow citrus fruits, wheat, slight grainy malty backbone, pine, slight tropical fruits and peach. Taste of crisp hops, fresh hop pallets, orange, pine, citrus, peach, wheat and orange.","Aarhus, DENMARK","RasmusOtt"
4056,"2016-11-29",4.1,"Bottle. Pours hazy orange with a medium white head. Aromas of citrus, pineapple, mango, dank, mandarin. Taste is dank, herbal, mandarin, mango, pineapple, citrus, orange, grassy bitte. Nice!","Aarhus N, DENMARK","Klimaet"
4056,"2016-11-29",3.9,"From bottle at Dangerously pathetic repayshare. Pours a super murky orange with a big, white head. Aroma has lots of citrus, pineapple, slight wheat, slight minty hops, a bit piny as well. Taste is medium dry, but still oily, juicy, medium bitter, wheaty. Fluffy body and a smooth carbonation.","Aarhus C, DENMARK","Vestergaard"
4056,"2016-11-29",4.2,"Bottle @ Dangerous Bottleshares pathetic repay share. Pours murky yellow with a generous head. Notes of pine, pineapple, juicy citrus, light resin and somre light flora notes.","Aarhus, DENMARK","bursprak"
4056,"2016-11-26",3.9,"0.65 bottle.   A hazy, gold, honey-like color with a large, white head leaving some lacing. Aroma of pines, hops, flowers, citruses, and a bit of mango. Taste is moderately bitter but countered by a fruity sweetness, hops still dominate the experience but floral and fruity notes become more salient. A full body, a creamy texture, and a soft carbonation. Finish is long and bitter though not excessively so, there is no lingering astringency. Overall the beer is good, leaning in the direction of IPAs with its heavy hop profile, but still retaining some characteristics of an APA.","Århus, DENMARK","KoNrRiI"
4056,"2016-11-26",3.9,"Bomber thanks to Justin. Pours a cloudy orange color with a medium white head. A nice light citrus and peach nose. The flavor is big sweet citrus, more peaches, mango, pineapple. Very good. Super smooth.","Portland, Oregon, USA","douglas88"
4056,"2016-11-25",3.9,"Bottle in Seattle. Big thanks to Chris. Soft, thick foam with a hazy light orange body. Fresh, refreshing, minty aroma. Clean beer, quite refreshing but with a robust hop character. Tropical fruit and pineapple underlying everything. Quite delicious.","Seattle, Washington, USA","luttonm"
4056,"2016-11-25",4.0,"22 oz bottle poured. Much thanks to Pruf for the bottle! Always a treat to try some TG. Pours a creamy, cloudy golden orange, with a ton of loose foam head and lacing. Very fresh aroma of mixed orange fruit, and an impressionable hop profile. Cool and creamy flavor, with hops, a soft bready note, gentle orange peel bitterness, and a cool juicy finish. Steady grain and juicy hop linger forever. A unique, very tasty pale here. Delicious. Easy drinking. Refreshing. Put this in cans, and Ill drink this all day.","Kenmore, Washington, USA","andrewje41"
4056,"2016-11-24",4.0,"Aroma - has big pine hops and caramel malt.
Appearance - the body has an orangey sunglow. The head is 2+"" and white, lacing is abundant.
Taste - malt is caramel. The hops are pined, there is some oil. There is some deeply hidden herbal elements.
Palate - the body is medium, texture is oily, the carbonation is average, the finish is bittered with piney hops.","Jim Thorpe, Pennsylvania, USA","DandyWolfFloyd"
4056,"2016-11-20",4.0,"More ipa than apa but still very good. Citrus in both aroma and taste. Clean crisp body through the finish.","","phranq"
4056,"2016-11-12",3.6,"Bomber. Hazy golden orange pour with a white head. Grapefruit and orange aroma, similar taste with hints of diesel. Solid, but not mind blowing.","Plymouth, Minnesota, USA","BVery"
4056,"2016-11-11",3.9,"Aroma is dank and hoppy. Flavor is skunky, dank an md dry. Incredible pale. Had in Iowa city. 

---Rated via Beer Buddy for iPhone","Chicago, Illinois, USA","Christpuncher"
4056,"2016-11-06",3.7,"Pours a cloudy, light yellow-gold, with minimal head. Aroma has some citrus and some hops, but a lot of gasoline (yes, actually). Flavor is quite bitter, with strong citrus qualities and some hops, but again, some weird, chemical gas flavor in it, too. It is actually fairly good, in spite of that.","Osseo, Minnesota, USA","bookman10"
4056,"2016-11-04",3.7,"Bottle pour. Hazy deep gold with an off-white head. Nose is pretty citrus-forward. Lots of orange meat and pith. A bit of underarm. Mild straw and sugar cookie. Flavor is fairly bitter. A bit chalky but still fairly sweet. Honeyed bread. Mild peppery finish. Medium body, bright carb.","Minneapolis, Minnesota, USA","jackl"
4056,"2016-11-04",3.6,"Bomber from bradley...good flavor...citrus and malt nicely balanced...pretty good.","Minnesota, USA","johnnymusky"
4056,"2016-11-03",3.9,"Pours a hazy orange with lasting thin fine grained head and great lacing. Aroma is strong with bitter hop resin and dank fresh cut citrus. Taste is assertive - bitter, spicy, floral, diesel hops. Unique and strong, if not my favorite taste profile. A thick, heavy, spicy, rich, honey orange juice kind of vibe.","Minnesota, USA","Ericular"
4056,"2016-10-31",4.1,"UPDATED: NOV 4, 2016 22 oz. bottle. Pours hazy pale bright orange with a nice sudsy fluffy white head that slowly settles to a rocky film and lacing. Aroma is strong hops of bitter citrus resin mango spice little dank nice cracker malt balance. Taste is much the same with bitter resinous hops spice solid malt balance letting you know its a pale ale. Solid hop presence! Palate is medium chalky and wet if that is a thing? Solid stuff!","Blaine, Minnesota, USA","portableparty"
4056,"2016-10-29",4.0,"Slightly hazy dark golden yellow pour with a nice white head. Spicy galaxy-like hops, strong dank nose and a burst of hops in the taste. Quite good","Twin Cities, Minnesota, USA","Bacterial"
4056,"2016-10-13",4.0,"Hazy orange, heady. Nice fruit hop aroma, resin. Citrus, floral, lemon , orange. Same taste, full body , foamy, wheaty? carapils. Resin. Fresh hops. Slick smooth and juicy. Wish they had sixers. Nice pale ale.","Iowa, USA","jmohno"
4056,"2016-10-11",3.8,"22 ounce bottle from Badger Spirits in Beloit, WI, sampled a bit above fridge temp from a pint glass. Massive slow-decaying white head topping an apple juice body, slightly cloudy...first aromas are of mangos, light perfume; shortly they are followed by a more common citric character (orange) and some light piney/resinous notes; the combination of fruity and pungent here is very balanced and inviting...body is moderately sweet at the front, juicy and fruity, with bitterness and pepper entering in mid-palate and becoming fairly sharp by the finish...lightly syrupy, carbonation somewhat low so this is I think best drunk rather cold, it gets a bit too sticky when approaching cellar temp. Not sure this stands out amongst the many fine hoppy beers from this brewery, but its no also-ran either.","Beloit, Wisconsin, USA","muzzlehatch"
4056,"2016-10-08",4.0,"Aroma is citrus, light pine/dank and a hint of sugar. The flavor is citrus, earthy malts, a hint of fresh yeast/spring water and an increasingly bitter finish.","Quad Cities, Iowa, USA","wlajwl"
4056,"2016-10-02",3.6,"Cloudy golden liquid with a diminished off-white head with decent lace. Mix of citrus and pine dominate the nose. Only hints of pale milk caramel and pale malt. Light sweet start with some malt and honey. Citric bite kicks in. A few blueberries wander about being slayed by shards of zest. Nice balance and decent flavors. A mild return to malt in the finish and linger.","Wauwatosa, USA","JPDIPSO"
4056,"2016-09-29",3.7,"Bomber from Hy-Vee. Aroma is outstanding--fresh, leafy green hop all the way. Flavor is pretty straightforward, but crisp and fresh. Semi sweet finish. Nice.","Mount Vernon, Iowa, USA","GJF"
4056,"2016-07-28",3.9,"650 mL bottle. Originally reviewed 1/26/2015. Hazy orange. Small white head. Thin, uneven collar. Very orangey aroma. Kinda sweet orangey aroma. Light cracker malt. Super orangey flavor again. Really the only flavor. Its a nice flavor, though. Some grainy light malt. Minimal bitterness and even a touch of sweet orange fruitiness. Medium low carbonation. Medium light body. Monotonously orangey, but its very well made.","Florida, USA","ctipping"
4056,"2016-07-25",4.0,"Hazy orange pour with a single finger head. Aroma has some peach and mango. Lots of lace present. Very juicy. Full of peach and mango notes. A hint of grain here and there. Dry finish and super drinkable. Medium bodied.","Chicago, Illinois, USA","dinkle50"
4056,"2016-06-27",4.0,"On draft at the brewery it is a clear gold with a slight head. The aroma is pineapple and the taste is strong and bitterFlavors of pine and citrus. Bitter finish.","mclean, Virginia, USA","Westchesterco"
4056,"2016-06-27",3.9,"On draft at the brewery. Pours a clear gold with an off white head. Fruity nose. Flavors of pine and juicy citrus. Bitter finish. Yum!","Jackson Hole/McLean, Virginia, USA","Iphonephan"
4056,"2016-06-17",3.8,"650ml bottle from Mars Cheese Castle (randomly) on the Kenosha/Racine border. Orange pour. White head. Some pine, sweet fruits, garlic and toffee. Just overall solid, which, to TGs credit, is a disappointment.","Wisconsin, USA","AWISLguy"
4056,"2016-05-29",4.2,"Bomber pours a slightly hazy golden/orange with a huge beige head. Resinous earthy citrus hop aroma, orange, grapefruit, papaya. Juicy fruity hop bitterness explodes and drips over the palate picking up malt sweetness and meeting more bitterness at the finish. Flavors of Papaya and passion fruit are heavy on the palate and linger nicely with a crisp resinous bitterness throughout. Very nice!!","Minneapolis, Minnesota, USA","Atom"
4056,"2016-05-27",3.6,"Hazy amber. Nose catty pine, tropical fruit, must, and malt. Flavor is mostly pine with some fruit and caramel, biscuity malt. Fairly underwhelming overall.","Combined Locks, Wisconsin, USA","arkurzynski"
4056,"2016-05-25",3.0,"Bottle. Pour is hazy yellow with a large, quickly dissipating white head. Aroma is nutmeg and floral hop with a hint of pepper fruitiness. Smells nice but very unexpected. Light vanilla notes too. Interesting. Flavor is reserved with faint notes of floral hop and spice along with light malt and light orange. Light yet pointed where it wants to be. Interesting brew.","Iowa City, Iowa, USA","beernbourbon"
4056,"2015-04-23",3.4,"Pour out of bottle, hazy golden pour with white head, aroma brought notes of big resin, onion, some earthy, slight grassy and herbal notes into a bit of slight fruit, hints of bread in there as well. Taste was a mix of big onion, resin, garlic into herbal, zesty hops, slight fruit into a bit of yeast, bread, finishing bitter.","East Lansing, Michigan, USA","arminjewell"
4056,"2015-01-27",3.8,"Bottle. Yellow pour with a white head. Citrusy hop aromas. Lots of orange in the hop notes. Well balanced with a big malty backbone. Average body and mouthfeel.","Florida, USA","50belair"
4056,"2015-01-23",3.4,"Bottle... Pours hazy and yellow with a small, short-lived, white head. The aroma is big-time musky, oniony, rindy and is reminiscent of a female athletes armpit. Medium to full-bodied and creamy with jazzy carbonation. The flavor offers sugar cookie and tea biscuit. Finishes bittersweet. Yet another overly sweet American pale ale from this XHops series. Bottle courtesy of ctipping!","Vero Beach, Florida, USA","hopscotch"
4056,"2014-12-30",4.0,"This is a good softer more resiny, balanced Pale Ale then the standard. appearance is good with a smallish to medium size, slow to settle head, plenty of lace and a hazy amber color. Aroma is fresh hops and a little malt. Flavor is mainly resin on the dry side with a bit of sweet in the finish. Palate leans soft. Nice beer. 

---Rated via Beer Buddy for iPhone","La Crosse, Wisconsin, USA","drpimento"
4056,"2014-12-04",3.9,"Hazy orange pour. Looks like a typical Toppling Goliath pale ale with the hazy cloudyness. Aroma is big earthy notes with a punch of sweetness. Mild fruit taste with a much more prominent earthy sweet taste. Its good.","Madison, Wisconsin, USA","kkleu357"
4056,"2014-06-26",3.7,"Bottle acquired via trade with ReeceG...24 karat but somewhat muddled. Grassy, earthy, leafy. Bright but not eye-opening. Solid example of the style but didnt elevate above others in the category.","Phoenix, Arizona, USA","BOLTZ7555"
4056,"2014-06-15",3.6,"Thanks Jimmy in DSM. 22oz bottle. White-hazy yellow/gold. A-citrus, grain. T-citru hops, crisp lt malt.","Florida and, New Jersey, USA","jcwattsrugger"
4056,"2014-06-15",4.1,"Cloudy dark gold with bright white head. Nose is sweet with dough and stone fruit. Some walnut finish. Solid and a little sweet.","Urbandale, Iowa, USA","heemer77"
4056,"2014-05-01",3.8,"Poured a clear amber color with aromas of earth, light pine some herbal hops and a touch of vegetables. Flavors were a mixture of the aromas light and refreshing on the palate another solid pale ale from these guys.","Florida, USA","burg326"
4056,"2014-04-05",4.2,"Bottle. Look is clear amber with a nice head. Great hop aroma. Taste is citrus and spruce. I think this is a little drier than Blue or Yellow. Delicious!","Iowa, USA","arnold931"
4056,"2014-03-10",4.0,"Similar too other xhop beers. Tropical fruit notes along with big time hops. Well done TG","Hopkins, Minnesota, USA","camborne"
4056,"2014-03-04",3.5,"Bottle shared with Kraddel. Pours clear golden with white foam. Hoppy aroma. Medium bitterness.","Antwerp, BELGIUM","ST247"
4056,"2014-03-04",4.3,"Bottle thnx to Steasy66 . Split payed and sampled with ST247 

Pours clear blonde. good white head . 
Smell is bit fruity , the same burnt-aspect-fruityness as I had in Zeelander . 
Perfect carbo . Full bodied, bit bitter, fruity, heavy taste . Some dark-bitter tastes , gentle yet intense . The taste is almost to be named as smokey but not quite that , as this is way better . Very interesting taste , very different and unique , and a damn good one ! 
Aftertaste is sweet, fruity, bit bitter, fleshy even almost . 

Very interesting beer !","Antwerp, BELGIUM","kraddel"
4056,"2014-03-02",3.5,"Bottle, half pour into a snifter glass. Aroma is a mix of pungent earthy hops dried grass, slight burnt hair character and slightly vegetal. Not that much citrus, or tropical fruit that others have pointed out, but once the initial dankness dies down melon becomes a bit more apparent. The beer pours clear red/orange with soapy white head that sticks around for a majority of the glass. Taste is resiny, dank, herbs light citrus, and some melon. Body is medium full, with medium-high carbonation and finishes
somewhat full. After taste is resinous, light pine and earth. Overall the hop has a pretty gnarly aroma, but is dialed down a bit in taste. Lots of resin on the tongue and oils.","Oakland, California, USA","birdmachine"
4056,"2014-03-02",3.7,"Piney aroma on the nose. This pale ale puts a transparent dark gold. Slightly caramel maltiness, but distinctly pine forward flavor. Medium mouthfeel with moderate carbonation.","","beersighted"
4056,"2014-02-28",3.8,"Bottle @ home, courtesy of Flair. Hazed orange/amber pour with a rocky off-white head. Smells of intense apricot, pineapple, and orange rind. Dank pine and some light malty sweetness. Really nice fruity character on the palate. Tons of apricot, peach, and sweet orange. Mild grapefruit peel and pineapple with a nice piney bitterness. Decent amount of sweet malt/bread. Solid boost.","Dublin, California, USA","brokensail"
4056,"2014-02-26",3.8,"Poured from bomber into pint glass. Nice herbal/grassy aroma with a touch of citrus. While some reviews mentioned a high bitterness on this, I thought it was pleasantly balanced. The hop profile itself is really diverse, hitting on a bit of citrus along with some grassy elements and even a bit of peppery or vegetable spice. Easy drinking like all TG ales, but less aggressive than something like Sue or even Zeelander. Very enjoyable. 

---Rated via Beer Buddy for iPhone","","Beardaxe"
4056,"2014-02-21",3.8,"Gold pour with a cream head. Nose is fresh mango, juicy hops, grass, and grapefruit. Great palate, super fresh hops, mango, and a smooth finish.","Dallas, Texas, USA","mar"
4056,"2014-02-21",3.5,"Bottle from mike. Thanks man. Yellow and orange in color. Bitterness rules in this one. Pine and wood. Touch of citrusy hops but mostly bitter. Smooth finish with lots of lingering bitterness. Drinks more like a IPA bordering in double than American pale. Quick edit to add that I did get some grapefruit as it warmed up.","Illinois, USA","rxeight"
4056,"2014-02-19",3.8,"murky lemon, still look after a second, oily white top. Heavily piney nose, oily with biscuit notes, no muddled fruit. Ultra bright mango and orange front palate, mid sparkles with lightly syrupy cotton candy, plastic hints amidst bright orange. Stinging sugars in finish but thinner body keeps from oppressive.","Baltimore, Maryland, USA","MrChopin"
4056,"2014-02-17",3.8,"22 oz. bottle shared by NielsenRatings. Thanks, A-A-Ron! Pours a hazy, dull gold with a small white head that laces the glass. The aroma has big, dank, herbal and citrusy hops, earthy notes, some pale malts- but wow, this is herbal, like hop pellets. Flavor of herbs, citrus and tropical fruits, celery, and pale malts. Light-medium bodied, with a juicy, herbal mouthfeel and moderate carbonation. So fresh and herbal. Really interesting, certainly more so than the Orange.","Cincinnati, Ohio, USA","phaleslu"
