"beer_id","date","rating","text","user_location","user_name"
4100,"2010-09-14",3.3,"Draught. Hazy golden colou, short white head. Calvados sweetish tart fruity woodish aroma. Good mouthfeel. Tart woody calvados fruity flavour. Pleasant.","FAROE ISLANDS","faroeviking"
4100,"2010-09-13",3.4,"Tap @ Mikkeller Bar, Cph.
Pours muddy pale darkish yellow with a small, creamy, white rim. Aroma is softly tart, oaky, light wheat sweetness, some green apple. Highish carbonation, kinda light and slightly watery palate - mostly because of the oaky dryness. Flavour is mildly tart, extremely dry, some vanilla, light malty sweetness in there. Long, lingering, light vinious and very dry finish. Too bad that it feels so thin and the oak takes up so much of the flavours.","Kolding, DENMARK","thewolf"
4100,"2010-09-13",3.7,"Draught at Mikkeller Bar.
Hazy golden coloured with a small white head.
Light acidic aroma of barnyard with notes of oak and calvados.
Light acidic flavour of oak, barnyard and calvados.
Tart finish.","Frederiksberg, DENMARK","joergen"
4100,"2010-09-12",3.1,"cloudy yellow, small white head.
mild aroma, very subdued, 
flavor is dry, fruity flavor like champaigne or white wine , ends pretty much like it tastes. alc well hidden. refreshing.","Copenhagen, DENMARK","Pinball"
4100,"2010-09-12",3.4,"Handbottle 50 cl. Courtesy of KimJohansen. Cloudy and opaque golden with a small white head. Tart Brett and barnyard in the nose. Medium body, tart fruitiness, dry and sulphurous with Bretty notes. Tart and dry finish - like a dry white wine. 120910","Frederiksberg, DENMARK","Papsoe"
4100,"2010-09-11",3.2,"On tap at Mikkeller. 
Pours hazy golden with no head. 
Aroma is grape, apples, wood and a hint for earth, but a little subdued. 
The flavour is very bitter, with notes of alcohol, apples and calvados, almost pungent, and a little bit of dry grape in the finish.","Hillerød, DENMARK","Anker"
4100,"2010-09-11",3.2,"From tap at MikkellerBar. Pours hazy yellow with an almost fully gone head. Aroma is dry barnyard. Flat malty and only slight sourish - not fullblown - rather mellow/subtle. Dry herbal. Dry and slight herbal bitter into the finish.","Copenhagen O, DENMARK","yespr"
4100,"2010-09-10",3.1,"Fad: Orange øl uden nogen form for karbonering. Jeg ved godt det ikke er meningen, men jeg savner det nu alligevel. Duften er fin sur, stald og meget diskret æble. Den er lidt mere tydelig i smagen, men man skal lede en del efter calvados fadene. Men der mangler karbonering for min smag.","Husum, DENMARK","Defreni"
4100,"2010-09-10",3.4,"Draught. Golden coloured. Hazy. Off White fluffy head. Sweetness, lighT fruits. Light sourness, vague calva. Flavour is vague sour, has some sweetness, some citrus. Medium bodied. Citric sourness in the end","Søborg, DENMARK","madsberg"
4100,"2010-09-10",3.9,"Draught at MikkellerBAR. Cloudy golden - white edges. Sourish aroma. Soft body. Apple/calvados taste. High wooden. Light cactus. Lacto. Nice.","Frederiksberg, DENMARK","Theis"
4100,"2010-09-10",3.6,"Draft. A very hazy orangey beer with no head. The aroma has notes of horseblanket, brettanomyces, grapefruit, and grapes. The flavor is lightly sour with notes of grapefruit, brettanomyces, grapes, and a bit of horseblanket, leading to a tart finish.","Citizen of the universe, DENMARK","Ungstrup"
