"beer_id","date","rating","text","user_location","user_name"
2396,"2012-10-01",3.8,"UPDATED: MAR 11, 2013 Tap from mountain goat brewery. Pours a deep copper orange colour with a creamy off white head. Lovely aromas of citrus, hops, grapefruit and toffee. Taste is quite refreshing and malty in the after taste with a nice bitterness hanging around the palate. This is like a half IPA/half amber ale as its quite hoppy and fruity compared to your usual amber ale. Love the chewy maltiness. A winner for me.","AUSTRALIA","jonnyguns"
2396,"2012-09-27",3.8,"This delicious, rascally hoppy amber just made my (late) morning. Theres loads of citrus floral aromas underpinned by a sweet malt flavour. The malt is a little more prominent on tasting but the hops are still lively and lovely. A winner.","AUSTRALIA","LesArgen"
2396,"2011-05-24",3.1,"UPDATED: APR 2, 2014 [5/11] Tap. Amber with an inch of light beige head that lasts well. Aroma has fat caramel, grass, passionfruit, a little pine and citrus. Slightly oily body. Tastes pretty much as smells with some stone fruit and wood too. Sweetish with struggling bitterness despite the punchy hop aromatics. OKish. If this is Hightail without constraints, I look forward to their Prometheus ale. [3.1] [4/14] Can. Previous pretentious smug bastard remarks reiterated.","Melbourne, AUSTRALIA","hawthorne00"
2396,"2010-09-08",3.7,"Top beer. Intense though balanced aroma. Fantastic flavor of malts at first though the bittnes kicks in with a long finish. Pour a dark amber with red hues. Dry in the mouth. Really good.","USA","Mattburns"
2396,"2010-06-21",3.5,"a very nice citrusy beer, strong an the caramel with a floral finish. had on tap at the Local Taphouse Darlinghurst","London, Greater London, ENGLAND","ndon"
2396,"2010-03-12",2.9,"UPDATED: MAY 7, 2011 Nose is quite floral and citric. In the mouth it is 50%caramel 50% lingering citirc/floral hops. Well balanced but the malt tends to get more dominant as it warms.","JAPAN","jonno"
2396,"2010-02-26",3.8,"Tap at the brewery. Very tasty. Aromas of roasted malt, caramel, and flowers. Taste is sweet, with a light bitter finish. Velvety palate, medium body. Amber colour, with a frothy white head.","Sunnyvale, California, USA","davidm"
2396,"2010-02-14",3.8,"Draught at The Local Taphouse (Sydney). Another popular one with the GrandMistress. Looks more light brown than amber in the glass. Sour fruit on the nose. A smooth palate with a little creaminess. The malt and hops are quite mellow, but the balance works well. Toffee from the malt and citrus and fruit from the hops. I love the sourness - farmhouse ale like.","Auckland, NEW ZEALAND","TheGrandMaster"
2396,"2009-04-02",3.1,"Tap at Mountain Goat. Amber (slightly dull) in colour with short head and some lacing. Galaxy hops on the nose and in the taste with some caramel supporting.","Perth, AUSTRALIA","bluevegie"
2396,"2009-03-08",3.1,"Tap at Mountain Goat. Served quite cold and really suffers for it. Subtle, integrated, orangey hop aroma in the Goat style, tasting otherwise fairly thin and dominated by angular dark toffee-ish crystal malt flavour, with surprisingly high carbonation and a yeasty note like you get in some bottle-conditioned beers. As it warms, it opens up a lot more. Esters come forward and the malt character rounds out with the crystal malt becoming a lot more bright and glassy, and the yeastiness fades away. Much improved, but still only nice, not great. And how do you score it? Its not like its a pub butchering their beer - it is served as they intend it (presumably).","Melbourne, AUSTRALIA","mullet"
