"beer_id","date","rating","text","user_location","user_name"
618,"2012-01-16",4.2,"In the recent past Ive avoided Rogue beers as widely available, expensive and well-hyped yuppie brews.  This one changed my mind.  Bomber pours am opaque dark brown with a tan head and lots of lacing.  Chocolate is the overwhelng smell.  Aroma is mostly chocolate with a hint of coffee.Creamy texture without much carbonation Taste is slightly sweet.  Finish is chocolate, with the finish only as bitter as chocolate can be.","Chicago, Illinois, USA","ccex"
618,"2012-01-14",3.8,"[Rated 10/16/2009] Bottle. Pours dark brown with a very thick deep brown head. Aroma is of chocolate and caramel, very nice and soft. Flavor contrasts to the sweet aroma and is a little bittery -- hops and roasted grains. Overall, a good brew, but I am not that fascinated with the flavor, expected it sweeter.","New Jersey, USA","IvoR"
618,"2012-01-13",3.6,"Draught.Dark brown colour with beige head.Aroma is sweet of chocolate and coffee,creamy mouthfeels and light rosted taste of caramel and cream,smooth and well balanced beer.","rødovre, DENMARK","charlotte"
618,"2012-01-10",3.7,"Deep  deep brown with a tan head. Smells like bitter chocolate or cocoa.  Lots of clear chocolate and coffee taste but lots of hops too.  Its a really solid chocolate stout.","Saskatchewan, CANADA","dresden"
618,"2012-01-08",3.8,"Pours a deep black color with a nice medium sized head that leaves good lace on the glass. 

The aroma is primarily roasty but is sweet smelling, fairly mocha like with more coffee character than chocolate. 

The flavor is roasty, fairly bitter,  and while full of rich dark chocolate notes the beer is decidedly not sweet and emphasizes bitterness long before any hint of sweet milk chocolaty flavor. 
This is particularly enjoyable.","Pouring Bus, Iowa, USA","CanIHave4Beers"
618,"2012-01-08",4.2,"Rich dark color. Full creamy head. Light coffee aroma. Smooth palate with pronounced coffee taste and subtle chocolate finish. A very good interpetation of the style!","Illinois, USA","sharkbcr"
618,"2012-01-06",3.5,"Tasted at BevMo Friday tasting. Chocolate, chocolate all the way around. Ok palate and good aroma and light, definitive chocolate flavor. Good beer. 

---Rated via Beer Buddy for iPhone","California, USA","timfoolery"
618,"2012-01-06",3.2,"strong aroma of chocolate.  chocolate flavors present, along with plenty of roasted malts.  very heavy tasting, and i couldnt take too much.  definitely a novelty beer.  not sure why this one is rated so high.  it did smell good though","Sindelfingen, GERMANY","strap"
618,"2012-01-05",4.4,"Chocolate and malts/grains in aroma.  The flavor is chocolate and malts with a decent bitterness.  Overall another very good ale from Rogue.","Quad Cities, Iowa, USA","wlajwl"
618,"2011-12-30",3.4,"Tap @ Beer Temple (from notes): color almost black. Beige head (not much). Smells of chocolate/cocoa powder, some fruits. Flavor is lightly sweet & bitter, lots of cocoa. Medium body. Finishes lightly bitter, bitter chocolate.","Amsterdam, NETHERLANDS","PotjeBier"
618,"2011-12-29",4.3,"Bottle pour.  Ebony color.  Tan head.  Subtle chocolate aroma.  Slight bitter finish.  This beer is more stout than chocolate.  If you are looking for a sweeter chocolate stout, this is not your beer.  But, very good nontheless.","","86Moose"
618,"2011-12-24",3.4,"It pours a very dark brown to black with a foamy, milk shake-like head that lingers.  The aroma is boutinful with chocolate and a noted hopped character.  The body is thin to medium which was a bit of a letdown. The taste has a chocolate malt character with a powerful hopped finale that lingers.","Allenstown, New Hampshire, USA","puboflyons"
618,"2011-12-24",3.9,"UPDATED: JUL 20, 2014 From a bottle poured black with a creamy dark tan head that left great lacing. Aroma was hot cocoa. Taste was dark chocolate and coffee. Nice bitterness and taste was not near as sweet as the aroma. This is very good.","Corinth, Texas, USA","jhamp9"
618,"2011-12-23",3.1,"Draught at Bjergtrolden.
Black with a large brown head, modest lacings. Aroma moderate malty (roasted, chocolate, light burnt). Flavor light sweet, medium bitter of roasted malts and hops. Medium body.","Holbæk, DENMARK","stouby"
618,"2011-12-21",4.0,"Pours a dark black with a nice chocolate and creamy head. Taste is sweet and heavy on chocolate with roasted malts and coffee as well. Finish is bitter, roasty, and smooth. A drinkable chocolate stout that a profound chocolate flavor.","Coral Springs, Florida, USA","zgaier"
618,"2011-12-21",4.2,"Pours pitch black, with a nice chocolate puffy one inch head. Aroma is malty and sweet. Flavor is full of chocolate which lingers nicely. Well balanced, not bitter and a very drinkable stout. This stout does not overwhelm your palate and quite refreshing and enjoyable. Would be more interesting if they cranked
the ABV up a little.....but still very nice chocolate stout from Rogue, cannot wait to try their double chocolate stout.","Coral Springs, Florida, USA","jjgmd"
618,"2011-12-17",3.4,"Sample. Poured a near black with a thin film for a head. Aroma mild raosted malts and... chocolate. Taste: lots and losts of milf chcocolate (think milk shake), mild roasted malts. Body was a little thin to me. Finish was sweet milk chocolate, with just a mild bitterness. Not really my thing.","Birmingham, Alabama, USA","Gustav1996"
618,"2011-12-14",4.1,"Bottle...It pours pitch black with a large very creamy tan head.....the flavor is very pleasant chocolate, milk chocolate.... the flavor is milk chocolate, light coffee and roasted malts..... I sense some cigar flavor in the finish.... very nice.... :)","DENMARK","KingCecil"
618,"2011-12-11",4.3,"Arrived with a one finger dark tan head. Clear dark brown.

Smells of cocoa and maybe a touch of roasted malt. The cocoa really dominates.

The taste is also dominated by chocolate. There is a slight roastiness detectable but it is upstaged by the cocoa. A moderate bitterness comes in at the end. Mouthfeel is medium bodied and slightly sticky.

This is one of the better chocolate stouts I have had. I would definitely get it again.

Serving type: on-tap","Johnson City, Tennessee, USA","rangerred"
618,"2011-12-08",4.5,"Bitter chocolate. This is a pretty heavy stout, but just perfect if youre in the right mood.","Miami, Florida, USA","Danny1217"
618,"2011-12-06",3.1,"UPDATED: JAN 20, 2014 Draft- Nice chocolate color, with a frothy tan head. Smells of chocolates and roasty malts. Taste is pretty big, slight burned rostiness at the beginning evolving into a sweet chocolate coffee finish. Excellent beer......","Sevierville, Tennessee, USA","BadAprilia1000"
618,"2011-12-03",3.4,"UPDATED: DEC 4, 2011 Draught. Pours an opaque black with a tan head. Smells strongly of chocolatey goodness. Tastes of semisweet chocolate and maybe some toffee. The chocolate flavor seems to disappear over time, leaving only the bitterness. Medium body. Texture is creamy. Finishes dry.","Zurich, SWITZERLAND","magdalar"
618,"2011-11-22",3.9,"Black with a dark brown head. Aroma is sweet, roasted malt, vanilla and heavy chocolate. Flavor is quite sweet and moderate bitter. Dry and moderate bitter finish. This is chocolate all the way. 221111","Beder, Aarhus, DENMARK","Rasmus40"
618,"2011-11-22",3.7,"Bottle. Almost black with small brown head. Aroma is roasted malts and strong dark chocolate. Flavour is roasted malts, strong chocolate, medium sweet,, little coffee and a little bitter.","DENMARK","chrisv10"
618,"2011-11-19",4.4,"Looks like chocolate, smells like chocolate and tastes like chocolate.  I think willy Wonka made this, hahahaha.  Seriously, its a good chocolate stout and I find it to be a good balanace of dark bitter chocolate and milk chocolate.  this beer would make an awesome stout float!","Dallas, Texas, USA","BeeRx"
618,"2011-11-18",3.7,"UPDATED: DEC 10, 2011 Smells amazing, like a really chocolaty coffee. Pours very dark and has a nice thick mouthfeel. The only real problem I had, was that I started having trouble drinking it after about 10 ounces. It started to get way too sweet for my taste, but before that point it was fantastic. I liked Youngs Double Chocolate a bit more.","Burgettstown, Pennsylvania, USA","bryanm18"
618,"2011-11-17",4.1,"Aroma is dominated by milk chocolate. Pours black with a tan foam. Flavor is heavy on the chocolate. Nice body as the chocolate sticks with you in the aftertaste. Excellent beer. A dessert in a bottle.","Cerritos, California, USA","Fatalstrike"
618,"2011-11-13",4.3,"From the sound it made when I poured this beer into my glass, I knew it would be thick and creamy.

The head dissipates disappointingly quickly, but while it lingers, notice the rich red tinge.

The aroma is like smores made with marshmallows that have been allowed to catch fire, just for a moment.

Deep, dark chocolate and toasty grain flavour and even a little rum & raisin on second tasting.","","mgsubscr"
618,"2011-11-12",4.5,"Aroma of milk chocolate. Pours a thick chocolate black. Minimal head, but a nice brown color. Smooth beer start to finish, light bitterness on the back end. More of a roasty cocoa flavor than chocolate. All around another good beer from Rogue.","California, USA","Peacehammer"
618,"2011-11-09",3.7,"The smell of this reminds me of a good strong American ale.  I liked the taste and strong hints of chocolate.","Louisiana, USA","adamaustin"
618,"2011-11-06",3.3,"Black with a thin mocha head, big chocolate nose, bitter dark chocolate and roasted malt taste. Thin and fizzy, with a light bitter finish. Nice desert beer. LF (Lagerboy Friendly)","British Columbia, CANADA","Lagerboy"
618,"2011-11-06",3.7,"Bottle @ Ølkonsortiet chrismas beer tasting. 2005 vintage, pours black with a tan head. Aroma of mild coffee, dark and milk chocolate. Taste is roasted malt, light coffee notes, loads of chocolate, quite sweet. Medium body, soft carbaonation. 051111","Hasselager, DENMARK","Camons"
618,"2011-11-05",4.0,"Aroma is sweet chocolate and coffee. Appearance is black with medium brown head. Poured like it was a thick beer. Taste is intense dark chocolate and coffee. Hazelnut and also a bit of cream. Sweet but with enough roast and hop bitterness to remain very balanced. You could easily confuse this with a iced mocha. Palate is full-. Dark chocolate lingers nicely. Overall an impressive beer. Heavy chocolate flavors with great sweetness, but still remaining dark and roasty.","Sacramento, California, USA","theOptimator"
618,"2011-11-05",3.3,"Very good aroma of Chocolate and Coffee. Too much carbonated, finish too bitter.  Strange beer","ITALY","Cialtrone"
618,"2011-10-31",3.3,"Bomber.  Deep brown black, tall tan foamy head.  Powerful chocolate aroma,  overall very good with exception that this is a little watery for a stout.  Had everything going for it... I will try again, see if another batch is a little more complete.","Mount Airy, Maryland, USA","strongpieman"
618,"2011-10-30",3.2,"UPDATED: OCT 31, 2011 On Tap. Pours kinda black with a thin brown head. Aroma is huge sweet milky chocolate which seemed kinda perfumed in a way. Some dark caramel malts and maybe some cocoa. A bit one dimensional on the nose. Taste is the same but add a bit more roastyness along with some weak notes of hops and cocoa. Body is a bit on the watery side for a chocolate stout.","Aarhus, DENMARK","RasmusOtt"
618,"2011-10-25",3.1,"[Bottle at the Bootlegger, High Wycombe] Black with a large beige head. Dominated by fake chocolate, which ruins what appears to be a rather nice roasty stout beneath it.  Shame.","Buckinghamshire, ENGLAND","wheresthepath"
618,"2011-10-22",3.9,"Pours black with a nice tan head. Aroma of chocolate, cocoa, brown sugar, molasses. Taste is roasted malt, cocoa, a sweetness that works into semi bitter chocolate that is very nice. Nicely balance with a semi dry finish. Nice stout.","Kalamazoo, Michigan, USA","NayTron"
618,"2011-10-15",3.8,"On tap at WOB.  Midnight pour with a kaki head.  HUGE chocolate nose.  Dark roasted malts, bakers chocolate, and coffee flavors..","Florida, USA","50belair"
618,"2011-10-14",3.9,"Bottle in Craft Beer Co. Pours black and thin with a small brown head. Nose is intense chocolate and cocoa. Milk and dark chocolate. Lovely. Taste is chocolate, touch of bitterness. Mouthful is light. Palate is not complex but like the simplicity of this. I wanted chocolate and thats what this delivers.","London, Greater London, ENGLAND","EdKing"
618,"2011-10-08",3.8,"Nose is cocoa and chocolate with some lingering hops. Roasty as well. Poured nice and typically dark with a tan head. Taste was surprisingly bitter with hops to begin with. Followed by loads of chocolate and cocoa. An overall great chocolate stout.","Florida, USA","OmegaX"
618,"2011-10-06",4.5,"(Brasserie 4:20)what a good stout...dark,clody...incredible chocolate aroma,massive and persistant...and the taste is similar,qith little hops notes..good body,very good balance..excellent finsh..","ITALY","knodelsuppe"
618,"2011-10-06",3.9,"I remember the days when craft beer was a mystery to me and drinking a good beer was not a stress or a losing race between buddies to show the world you are the best bad-ass killer craziest ego maniac with billions of tasting skills and ten thousand ratings. at THAT TIME the rougue chocolat stout was my #1 ISO but We are beyond that now...
Bottle @ Bir&Fud bottega Roma. Black solid color, surprising almost brown good looking Head; a little bit frothy. Cool milk chocolate/cocoa aroma, very intense, that overpowers some cereal, herbs components. The taste is cocoa/milk chocolate mostly; some licorice on the background. Really smooth mouthfeel, a little bit watery. medium/low carbonation. The light body doesnt support the intense aroma and taste but it isnt a big issue; the beer is a lot enjoyable anyway. sadly The finish is really short. Im really surprised about this beer but i think the total score result has been too way generous this time. To summarize:  even if i had a lot of chocolate beers (ok, i love chocolate) better than this, the Rogue CS is definitely a must try","Berlin & Rome, GERMANY","INDASTRIA"
618,"2011-10-02",3.9,"A: Dark brown-black.. thick white head that slowly fades.. decent lacing...

S: Lots of chocolate.. sweet and bitter.. some caramel and vanilla.

T: Mostly dark bitter chocolate... not much in the way of the softer milk chocolate, caramel and vanilla i got in the aroma...

M: On the lighter end of the the full body spectrum... smooth. creamy.

D: Not too shabby... id certaintly have one or two in a night if its on tap.","Philadelphia, Pennsylvania, USA","callmemickey"
618,"2011-10-01",3.8,"Huge pour from bomber into Maudite glass. Blackish with 2"" head. Intricate lacing, not dictated by sips. Aroma is more like milk chocolate or powdered hot chocolate, vs. the typical bitter dark chocolate you get with these stouts. Flavor is more like dark chocolate milk. Pleasant mouthfeel. Good chalkiness from the hops. Stays balanced with bitter even though its sweet. Just a good stout. Looking forward to pairing with brownies and vanilla ice cream.","California, USA","cmc619"
618,"2011-10-01",3.4,"From notes: Pours opaque black, with a thick, creamy dark tan/mocha- colored head.  Aroma is cocoa/chocolate.  Deep, medium-thick with a slight oilyness.  Chocolate taste that lingers nicely on the tongue with some bitterness from the chocolate.  A mild grainy note appears as it warms.","Philadelphia, Pennsylvania, USA","BillWyce"
618,"2011-10-01",3.6,"Black as oil with brown head.  Aroma domintated by roasted malt.  Taste - roasted malt and chocolate.  Lots of chocolate but this isnt overly sweet.  Also notes of espresso, hazelnuts and vanilla.  Bitter finish.  Full body.  This is very good.","Carver, Minnesota, USA","vikingguy"
618,"2011-10-01",3.6,"pitch dark, small smooth light brown head3 strong chocolate roma, some toffee and caramel too.7 flavor is chocolate , toffee, caramel. Guld karameller, roasted malts, 7","Copenhagen, DENMARK","Pinball"
618,"2011-09-30",3.6,"Pours a nice deep black with a thin brown head that disappeared very quickly. Aroma consists of roasted nuts and espresso. The chocolate has a very nice presence - very bitter and dark. The bitterness is almost too much though, especially in combination with the hops and bite of the alcohol. Though still a well-crafted and tasty beer, not my favorite stout.","California, USA","aveclaudenum"
618,"2011-09-28",3.7,"65 cl bottle @ ISKTR. Rated on 20.03.2011
Aroma has vanilla and sweet chocolate. Flavour has sweet, artificial-like chocolate from an easter egg. Too much CO2 on palate. Nice stuff with lots of chocolate, but the artificial aromas disturb here a bit.","Tampere, FINLAND","laiti"
618,"2011-09-27",4.0,"Date: September 24, 2011 Mode: Bottle Source: Minneapolis Beer Fest.  Full description not available as I sampled way too many beers in 4.5 hours!","Bourbon County, Minnesota, USA","ryanfolty"
618,"2011-09-27",4.0,"From tap. Poured a dark brown with a lighter head. Lots of chocolate on the nose, over some malts. But mostly chocolate. Same with the flavor. Sweet and no more bitter than youd expect from milk chocolate.","DENMARK","cryptobard"
618,"2011-09-20",3.9,"22oz bottle picked up in Evanston 
Appearance: Pours black with a medium sized tan head and good lacing 
Aroma: Roasted malts, rich milk chocolate and roasted coffee 
Taste: Roasted malts, grainy, ashy, roasted coffee and milk chocolate 
Very nice and smooth.","Utah, USA","Sledutah"
618,"2011-09-15",4.1,"Draught @Kaisla, Helsinki 14.9.2011. Poured black color with a brown head, lookin delicious. Strong milk chocolate aroma, with some roasted malt as well. Flavor is chocolate, hoppy notes, roasted malt. Quite sweet, but in this case it fits perfectly. Dry, long chocolaty finish.","Vantaa, FINLAND","Hermod"
618,"2011-09-14",3.1,"UPDATED: MAR 1, 2013 Tap @ Beer Temple, Amsterdam 11/09/11. Pours a very dark brown, almost black with a large, pillowy, latte head. Aroma is chocolate, milk chocolate, mocha, tones of vanilla. Taste is mocha, chocolate, milk chocolate, slight floral hoppiness. Palate is light.","Alabama, USA","Erasmus_ro"
618,"2011-09-12",3.8,"(Draught at Kaisla, 20110912) The beer poured black. Its head was small and light brown. Aroma had chocolate, roasted malts and hops. Palate was full bodied with medium carbonation. Flavours were bitter dark chocolate, roasted malts, hops, ash, sweetness and bitterness. Aftertaste had dark chocolate and bitterness. Despite the strong chocolate aroma and flavour this beer was well balanced and tasted nice.","Helsinki, FINLAND","mjs"
618,"2011-09-05",4.0,"Pours dark brown with a generous brown head.  Chocolate and malt in the aroma.  Taste starts sweet and finishes with a little hop bitterness, with chocolate present throughout.  Creamy texture throughout.  Really good.","Taunton, Massachusetts, USA","annunz123"
618,"2011-09-01",3.9,"UPDATED: NOV 12, 2011 Refrigerated 16.9 oz. bottle poured into a shaker.  Pours black as my soul with two inch medium creamy brown head.  Velvet smooth texture, good lacing, and thick body.  Taste is burnt malt, some chocolate, and finishes dry with some hops.  Pretty good.","Charleston Area, West Virginia, USA","weihenweizen"
618,"2011-08-28",3.9,"66cl bottle from ""A Tutta Birra"". Served into a snifter. Pours a black colour with a huge dark brown head that leaves a very nice lacing on the glass walls. Aroma of dark chocolate, milk chocolate, vanilla, coffe beans and some alchool. Medium body, creamy texture. has a very nice drinkability, with a dry and very bitter finish, Nice!","Rome / Lecce, ITALY","Ragnampiza"
618,"2011-08-25",3.9,"poured from a 22oz from PCC in redmond, wa. poured a thick dark chocolate. head was a creamy, very brown colored. interesting it settled like a guiness with a flat line up. deep caramel flavors and tastes like a chocolate bar liquified. strong aroma of chocolate and sweet after tastes","Levittown, New York, USA","TomTiedemann"
618,"2011-08-24",4.4,"22oz bottle.  Thick pour is completely opaque with short-lived bubbly tan head.  Aroma of dark chocolate, cocoa, bittersweet chocolate, and chocolate cake.  Chocolate.  To best describe the taste: imagine melting a Hersheys bar and drinking it.  Theres a slight dryness on the finish with a slight bitterness.  Sticky in the mouth but not as thick as the pour would have you believe.  I have generally been disappointed with much of Rogues offerings, but this is delicious.","San Diego, California, USA","jlieber17"
618,"2011-08-24",3.7,"Torr, syrlig och tydlig chokladsmak.","Malmö, SWEDEN","Vignale"
618,"2011-08-18",3.8,"Bottle ---> Snifter. Black and smooth was the pour, with a huge promising head. The nose is full of chocolate, a little bit of coffee and even a hint of raisins. Flavors are a tad lighter, high carbonation gives to a dark chocolate character, with a little bit of coffee floating around to give a dry aftertaste. Finished nice and bitter-sweet, nicely balanced.","Florida, USA","Chipalsa"
618,"2011-08-14",3.6,"Nose is chocolate, roasted malt, milk, alcohol, feel is bottomheavy with a thin top, carb is mediumweak, taste is fat dark chocolate, mint, alcohol, mellow bitter hops finish.","DENMARK","kschep"
618,"2011-08-13",3.9,"Pours black with a dark brown, creamy head. Great look to this one. Aroma is full of chocolate, both milk and dark chocolates. The flavor has nice malts, milk chocolate, dark chocolate, and some coffee. Nice aftertaste of chocolate-covered espresso beans. Nice beer.","San Diego, California, USA","tool2scream"
618,"2011-08-13",4.1,"650ml bottle 
6.3% ABV 
I tried this beer on August 5, 2011 at ""The Beerbistro"" in Toronto, Ontario, Canada.  The beer poured a brownish black with a generous creamy brown head.  The aroma was dark chocolate, roasted malt, and molasses.  The mouthfeel is creamy and full bodied with mild carbonation.  The flavour is dark chocolate, with hints of vanilla and toffee.","Milton, Ontario, CANADA","cyrenaica"
618,"2011-08-12",3.8,"A completely black beer with a thick brown head.  The aroma is heavy on chocolate with a bit of coffee.  The flavor has oatmeal and coffee notes, as well as the bitter cocoa taste in the finish.  Very nice.","Missouri, USA","fiercepanda"
618,"2011-08-05",4.0,"A great chocolate stout, sweet, smoth and velvet. Lots of chocolate and it age pretty well, gonna save a bottle a many years just to see how it will continue aging.","SWEDEN","Clyx"
618,"2011-07-29",3.7,"Not big on stouts, but enjoy them ocassionally.A typical good stout, very good milk chocolate aroma,smooth mouthfeel chocolate and coffee roast taste balanced by a good amout of hop bittering that lingers with the dry roast, the aroma is the best feature for me its the best stout chocolate aroma  i have tried.Coffee like bitterness lingers. Kind of thin in the finish.Not my favorite stout but definatlely one of the better ones,glad i tried it wont get it anytime too soon.","Iowa, USA","jmohno"
618,"2011-07-23",3.7,"Bottle from Beers of Europe.  At £7 something per bottle wont be buying too many of these but had to try it out.....
A fair bit of body with this stout, frothy tan head with excellent lacing on the pint glass.  Smells of bittersweet chocolate, bitter coffe, pepper, roasty walnuts evident.
I get alot of the walnut taste with this, a little chocolate, very earthy and its getting more earthy / roasty as this pint glass ends.
Aftertaste is fairly bitter and nutty.  I expected this a bit sweeter but a fine beer to relax with and watch a movie.
At 650ml per bottle, when you have finished your pint you have a few more litres to look forward to!!
Very pleasent.","IRELAND","sevefan"
618,"2011-07-15",3.4,"Bottle from  Beers of Europe. Black colour, tan head. Nose is quite sweet, with milk chocolate, roasted malts, vanilla. Flavour is roasted malts, chocolate, bit of vanilla. Dry, roasty finish.","Burgos, SPAIN","Bullit"
618,"2011-07-09",3.8,"Aroma and taste is chocolate. Shit loads of chocolate. However a bit to thin texture.","Hässelby, SWEDEN","kryon"
618,"2011-07-04",3.8,"Pours dark brown with thin tan head.  Aroma of dark chocolate.  Taste of creamy milk chocolate with smooth creamy finish.  Thin mouthfeel. Tons of chocolate.","Alabama, USA","jsh12bama"
618,"2011-07-03",4.2,"Bottle @ home. Deep brown brown appearance with a dark brown head. Huge bittersweet chocolate, dark chocolate malty nose. Creamy, cocoa, slightly milky, chocolate malty flavor. Huge chocolatey taste. Pretty awesome brew.","Fort Collins, Colorado, USA","adnielsen"
618,"2011-07-03",3.9,"UPDATED: JUL 16, 2014 drank at mondial 2011 in mtl. pours pitch black with a dark beige head, good retention and lacing. intense roasted malts - not quite ashy though, vanilla, cocoa beans, hint of molasses - some sweetness. moderate carboantion, light to medium body - oily and a tad sticky, spicy-resinous finish.","Québec, Quebec, CANADA","czar"
618,"2011-07-01",3.7,"pours nice and dark with a big tan head, decent lacing in my glass, aroma is mostly chocolate and roasty, taste is nice chocolate and slight coffe with a slight bitter end, body is a bit thinner than i would like, but its still a really good beer, would love to try the double chocolate stout, i bet its much better.","Newark, Ohio, USA","mikesaum"
618,"2011-06-21",3.2,"My friends kept telling me to try this but I couldnt find it anywhere. So I leapt in joy when I saw this in a small liquor store in Cape May, despite the extortionate price. Perhaps the expectation got to me. I mean it wasnt bad. Big coffee, chocolate and oat notes, with a decent bitter finish. But it tasted blander than most stouts, was too strong, and goddammit not chcolately enough. Get Youngs Double Chocolate Stout instead.","Dublin, IRELAND","angrybeerman"
