"beer_id","date","rating","text","user_location","user_name"
618,"2006-02-22",4.2,"I really enjoyed this beer. Defintily had to split the bottle as it is an incredibly thick beer, but i certainly enjoyed my half as i slowly slipped. This beer had a chocolate flavor like no other i have had. It almost tasted like a delicious stout with chocolate syrup mixed right in. Everything worked well for a delicious beer.","Richmond, Virginia, USA","crzybob77"
618,"2006-02-21",3.9,"Bottle.  Rich chocolate body with a thick brown head.  Aroma smells like a chocolate bar.  Flavor is chocolate with milk chocolate, bittersweet chocolate, and dark chocolate.  Smooth chocolate palate.  Chocolatey.","Chicago, Illinois, USA","drainey"
618,"2006-02-20",4.0,"Bottle.  Dessert beer for sure - rich chocolate, smooth, witih nice hop undertone.  Full, complex aroma and flavor both a good compliment to vanilla ice cream.  deep blacky brown with tan generous head, a lil lacing.  Tons of roasted malt.  you can taste the fishing boats and the perfect water throughout rogue beer...","Paleolithic, Pennsylvania, USA","xproudfoot"
618,"2006-02-19",4.5,"Wow. Thick mahogany with a thick foamy mocha-colored head. Rich chocolate flavor and aroma. This is good!","Berkeley, California, USA","Aquilo"
618,"2006-02-19",3.9,"Dark chocolate pour matches the dark chocolate aroma and taste of this delightful sweet stout. The thick dark-tan head atop the dark brown body enhances the appearance. Along with the chocolate, the aroma was full of roasted/burnt malts. The flavor started sweet and quickly evoked images of dark chocolate before the Cascade hops kicked in layering the chocolate with a bitter aftertaste. Creamy mouthfeel, somewhat sticky. Moderate finish.","Jasper, Indiana, USA","jcr"
618,"2006-02-19",3.9,"Bottle. Pours thick black with a creamy, thin brown head. Enormous chocolate aroma, - thick, sweet, and creamy. Flavors are there too, but hoppiness is a little detracting, almost nullifying the sweetness rather than blending with it. Still a tasty beer, even if it wins mostly on aroma and a silky mouthfeel.","Washington DC, USA","theacelatrain"
618,"2006-02-17",3.8,"Poured dark dark brown (not QUITE black) into my english pint glass.  Dont bother trying to see through this one unless you have a spotlight behind the glass.  A rich brown head developed with moderate retention.  Nice lacing.  The initial nosing revealed bittersweet chocolate, and then sweetened a bit into a chocolate smell that reminded me of a powdered hot coco drink.  The aroma was basically all chocolate, but it was multilayered and not one dimensional...and that scored big with me.  I didnt notice any hop flavor until the finish, and even then it was mild.  It seemed that they tried to bitter more with dark roasted malts rather than hops.  The massive chocolate dose was a little overpowering in the flavor.  Its a decent beer-it does exactly what it says it does- but its a little cloying to me.","Johnson City, Tennessee, USA","Quixote18"
618,"2006-02-15",4.0,"Pours black with a decent, thick brown head.  Aroma is bittersweet chocolate.  Creamy mouthfeel with taste of chocolate, malts, and oats.  The cascade hops give it a sharp finish.  Very nice.","San Diego, California, USA","trokini"
618,"2006-02-14",4.2,"Valentines Day 2006. 22oz bottle. Pours rich dark and opaque almost-black brown with a lasting head. Pretty. Aroma is chocolate, with fruity aroma like chocolate dipped. Starts sharp and bitter, then quickly mellows to a roasted malty flavor and in between one finds the chocolate. Finishes a bit like a good ipa, the bitter chocolate blends well with the floral hops. Very good; this is MY kind of stout. Looking forward to it again next year.","Pocatello, Idaho, USA","paulmetzger"
618,"2006-02-12",3.9,"650 mL bottle.  Poured to a dark brown/black.  Great aroma of chocolate and a hint of coffee.  Slightly bitter chocolate taste.  Get in my belly!","Grand Rapids, Michigan, USA","Hollywoodt"
618,"2006-02-12",2.9,"Not a bad stout. Still doesnt beat Sam Smiths Oatmeal stout. Great aroma but the flavor falls short on its promise IMO.","New Hope, Alabama, USA","mbeem"
618,"2006-02-09",3.5,"Pours a light blackish brown that shows a little light through around the edges. Head is reddish and thick but fades a little fast. Nose is bitter chocolate with some maltiness, doesnt mix very well. Flavor is semi sweet chocolate with some sweet malt balance. Maybe even a hint of vanilla in the after taste.","Durham, North Carolina, USA","TheBeerNinja"
618,"2006-02-08",4.0,"UPDATED: AUG 21, 2006 giving the aroma a ten simply because the chocolate is so impressive.  appearance is great, though ive come to expect pure opacity in a chocolate stout.  certainly great head, thick as hell.  i dont think it is as good as other chocolate stouts ive had.  i recently had the black sun stout, this isnt as good.  but its pretty good at what it does.  on the downside, the alcohol has a tiny bite more than youd want at 6.3 abv.","chicago, Illinois, USA","sersdf"
618,"2006-02-06",4.0,"Bottle - Poured black with dark brown bubbling through the beer to form a large, foamy deep tan on the top that hung around for a while and left a good amount of lacing.  Aroma, distincly burnt dark chocalate was not impressive to me, but mine was slightly cooler than it should be to start.

Very tastily enjoyed during the Superbowl with dark chocolate being the overriding theme with hop bitterness noticeable throughout.  The aftertaste was surprisingly minimal.  Would drink again, perhaps as a dessert beer.","Naperville, Illinois, USA","kseecs16"
618,"2006-02-05",3.6,"UPDATED: MAY 27, 2006 Bottle.  Pours a dark brown with a nice dark tan head that leaves great lacing.  Aroma is unmistakably chocolate, with some roasty malt notes.  Taste is very hoppy, though still with a definite chocolate flavor.  Not as smooth as Id like a sweet stout to be, but still a good beer.","Falmouth, Cornwall, ENGLAND","Delirium"
618,"2006-02-05",4.0,"Bomber - Poured a very dark black/brown with a quite thick tan head.  Aroma is light of coffee and roasted malts and fairly distinct of chocolate (!).  Some hop bitterness, but still chocolatey!  Rally good beer... I love the chocolate!!!!","Seymour, Tennessee, USA","VTHopHead"
618,"2006-02-04",4.5,"UPDATED: SEP 22, 2007 On tap at Crescent Moon Alehouse in Omaha, 2/4/06: The expected black elixir with a coffee-brown head.  Pure cocoa goodness with a night light bitter finish.  This is awesome.  Delicious with any chocolate desert or good as a desert all on its own.","Yorktown, Virginia, USA","Braudog"
618,"2006-02-03",3.8,"Bottle. Pours a pitch black with a huge coffee colored head. Very hoppy with some chocolate flavor. Hoppier than other sweet stouts, but interesting. Very little carbonation, nice smooth mouthfeel.","anywhere usa, ","mrnutsnbolts"
618,"2006-02-01",3.8,"Very dark, totally opaque.  Odd thick head that looked like sponge toffey.  Very chocolaty scent.  Very hppy.  Fine tinging carbonation.  Goes down very easy for a stout but I an still not a fan of stouts.","Windsor, Ontario, CANADA","gilvanblight"
618,"2006-01-31",3.7,"Smells like quik chocolate with some light hoppiness.  Pours a very dark brown with a brown-tinted head about an inch thick that quickly recedes.  Tastes of bittersweet chocolate with a slight bitter aftertaste.  Enjoyable, not anywhere near as smooth as Youngs double chocolate stout.","Oklahoma City, Oklahoma, USA","kreepindeth"
618,"2006-01-30",3.7,"Tap. Freaking tasty, no doubt about it. I prefer Youngs Double Choc, though. Had a more balanced chocolate edge to it. This one has a great aroma, though.","North Carolina, USA","RazingDreamz"
618,"2006-01-29",4.0,"Black stout pour offers a nose of roast, light chocolate and a bouncing hop presence. Palate is thick, sticky, and appetizing. Flavor is bittersweet chocolate that is never overpowering, becomes a little sweeter before it is removed by a light hop finish. Never monotone, never boring, this is a flavored stout that manages complexity as well as a distinct accent.","New York, USA","lethe"
618,"2006-01-27",4.5,"Rogue Chocolate Stout pours to a beautiful deep ebony color, with a thick, creamy tan head, and a soft carbonation. The first thing that strikes you with this beer is the nose. Incredible chocolate aromas of cocoa, dark chocolate, and roast, flood the nose. The palate is luxuriously delicious. Flavors of bitter sweet dark chocolate, roasted barley, and sweet maltiness coat the tongue. A portion of oats is used in this beer, making it silky smooth and creamy, as it slides down the throat. Rogue Chocolate Stout finishes as impressive as it started. More bitter sweet chocolate flavors up front, followed by some coffee flavor, bitter roastiness, and just a kiss of hop bitterness to balance out this exceptional brew. 

WOW. This beer is like drinking a chocolate truffle. There is chocolate in this beer, and you can tell. This beer as an absolute must for chocolate lovers. A perfect desert beer that would match extremely well with, what else? Chocolate. Pair this glorious beer with milk chocolates, or perhaps a rich and decadent death by chocolate cake. The roasty flavors in this beer, really are wonderful when you pair it with a sweet and creamy chocolate desert. Stout and chocolate is a match made in heaven. I highly recommend this beer.","DC Metro Area, USA","TheBeerLover"
618,"2006-01-27",4.2,"Dark with a big tan head. Smells like cocoa and some espresso.  Lots of chocolate flavour, rich in the mouth with lots of body.  Smooth finish leaves a chocolate aftertaste.","Vancouver, British Columbia, CANADA","BeerPrince"
618,"2006-01-25",4.4,"Thick dark brown/black color with a massive dark brown head and excellent head retention.  Wonderful chocolate aroma - smells just like a chcolate milk shake.  Other aromas include oats, caramel, licorice, vanilla, sweet cigar/pipe tobacco.  Very mouth-watering aroma.  Wow, incredible flavor.  Initially sweet and earthy with a strong taste of oats and ultra smooth floral hops, and finishes like a really good coffee (bitter, but not overly so) with rich dark chocolate in the aftertaste.  This beer has so many complex flavors in it - in addition to the ones mentioned in the aroma, there is brown sugar, molasses, espresso, raisins, and butterscotch, and a smoky finish.  In addition to the gratifying hop kick, the texture is silky smooth and creamy.","Holly Springs, North Carolina, USA","bmanning"
618,"2006-01-24",3.9,"Very nice beer. Dark color, with a very brown head. Flavor is dry chocolate with a surprising amount of hops as well. Roasted malt and chocolate really shine with this one.","Rotterdam, New York, USA","Sregnar35"
618,"2006-01-23",4.7,"Bottle. This is a serious beer. Very heavy sweet roasted chocolate aroma mingling with silky cream, and doughy hops. Pours black with a lovely stacked, dark tan head. Tastes quite sweet at first, then moves to bittersweet dark chocolate. Long, complex, sticky, milky, caramelly finish. Fantastic.","Greenville, South Carolina, USA","FatRabbit"
618,"2006-01-23",4.8,"Wow! As I open this bottle man the aromas of milk chocolate sweetness, floural hop, brown butter, vanilla, Cadbury milk chocolate. This beer pours a jet black and leaves a silky brown head that looks like you poured too much vanilla in your whipped cream. As I smell this beer all the aromas I talked about milk chocolate, brown butter(butterscotch), coffee, floural hops, caramel, sugar, vanilla, are all on display in this beer. The taste of this beer just explodes on your palate. It starts with a vanilla chocolate sweetness then moves to a bitter hop kick followed by a coffee essence and finally finishes with a silky smooth butterscotch aftertaste. This is a fantastic stout Im sad I took this long to get to it, I will not make that mistake again.","Portland, Oregon, USA","fbennett"
618,"2006-01-20",3.9,"Bottle.  Strong chocolate-coffee aroma.  Pitch black with small brown head - pours like motor oil.  Stong chocolate malt flavor with mild hops and smoky finish.","Greenville, Indiana, USA","shrubber85"
618,"2006-01-19",4.0,"Aroma is, guess what, like chocolate, maybe Nesquick.  Pours motor oil black with a light brown head that quickly disappears.  Taste is pretty good, again, lots of chocolate.  It is kind a dry, dark chocolate taste.  Not overwhelming. Dont expect it to taste like chocolate milk.    There is a little bit of hop kick in the aftertaste.  Overall a very good stout.","Seattle, Washington, USA","Zeswaft"
618,"2006-01-19",3.9,"Pours out deep black color with tan color head.  Heavy chocolate aroma.  Very sweet chocolate flavor with hint of hoppiness.  Not bad.","Amarillo, Texas, USA","mjurney"
618,"2006-01-19",4.4,"This is a beer that delivers what it says, The aroma is pure chocolate syrup. The looks is black at night. The taste is a combination of Chocolate soda, many hop, toasted malts. This is the type of beer you drink at the end of a big meal with dessert. A perfect appertif.","Brandon, Florida, USA","Palidor19"
618,"2006-01-19",3.5,"The aroma is full of chocolate and cream soda. There is also plenty of toasted malt and hops. The appearance is black and the head is of average size but its foamy. The flavor has lots of chocolate with malt, caramel, toffee, and coffee. The palate is just right. The aftertaste is bitter. This is the beer for chocolate lovers!","Tampa, Florida, USA","nick76"
618,"2006-01-17",4.0,"The usual dark oil pour with the dark head, strong amount of chocolate comes with the aroma. This beer is smooth and a bit chewy with the biggest emphisas on chocolate  out of any beer Ive tasted thus far, if they went any further Id be apt pour it in a mug and stick a marshmallow in it. A very delicoious beer indeed, yet I found it a bit difficult to polish of the bomber bottle. Perhaps a bit too rich to have more than one every once in a while.","Columbus, Ohio, USA","nolankowal"
618,"2006-01-17",3.9,"Cask conditioned, GBBF 2005:
Big powerful chocolate aroma. Hoppy bitter finish, still with a soft touch of sweet chocolate. Amazing texture and mouthfeeling.","Copenhagen K, DENMARK","Mads Langtved"
618,"2006-01-16",3.8,"on tap, a tasty beer.  Very chocolatey without being too sweet or having that gross old stale chocolate taste.  Very drinkable, sweet finish.  Kind of like drinking dark chocolate.  Has a slight hop flavor that blends well with the chocolate.  I would suggest this for anyone who is a serious fan of chocolate.","allston, Massachusetts, USA","sarah3961"
618,"2006-01-13",3.7,"This is a great chocolate stout.  Its almost as if chocolate was melted into this beer.  Very sweet with a bit of malt all roasted together for a very satisfying drink.","Franklin, Tennessee, USA","Likeburning"
618,"2006-01-10",4.5,"UPDATED: JUN 13, 2006 Draught, Wow this must be a huge beer! Deep black, with one of the most copious, darkest heads Ive ever seen. Robust, caramel, chocolate and toasted malt aroma. Pushing the envelope of chocolate flavor; roasty notes with a sweet finish. Solid stout.","Virginia, USA","Hazmatt"
618,"2006-01-10",3.7,"Bottle. Pours black with nice frothy brown head, some lacing. Slight aroma of a chocolate malt. Flavor is like chocolate flavored coffee, with some hop bitterness. The burnt or dark roast coffee characteristics sticks a tad too much at the back of the throat, but still a very good beer. One  the best Rogue I have tried so far, next to the Shakespeare. This would be great with chocolate cake, screw the after dinner coffee. Gotta keep the buzz going!","Nashville, Tennessee, USA","illinismitty"
618,"2006-01-07",4.1,"UPDATED: FEB 7, 2006 Distint Rogue taste to this beer, sharp with hints of hops.  Bitter finish, good chocolate taste - Head is very light - I find this typical of Rogues, and this one laced well.  Good beer, not my favorite chocolate stout, but its up there.","Franklin, Tennessee, USA","ATOmemphis"
618,"2006-01-05",3.6,"Pours a nice deep dark opaque brown color with a perfect amount of dark tan head and lovely thin streams of white small bubbles cascading up the sides of the glass.  Aroma is a rich creamy lactic chocolate and a different sweet candyish undertone.  Flavor tastes exactly like one of those damn chocolate drinks at starbucks.  Very very sweet chocolate prescence with barely a bit of bitter finish.  Overall, looks and smells good, but sweetness a bit over the top for me.","Pittsburgh, Pennsylvania, USA","roder60"
618,"2006-01-05",3.8,"""Different for Rogue, not all hopes. Poured a dar brown with a light tan head. Smell of chocolate as it was poured. Tasted slightly of hops and sweet roasted chocolate. very creamy mouthfeel. Overall very good beer. ""","Wilmington, Delaware, USA","bfeldmann"
618,"2006-01-03",4.0,"poured a black hue and tan head.  Really chocolate rich aroma with some coffee notes but chocolate was most previlant. 
flavor was sweet and rich with chocolate and some coffee notes body was rich and thick a really full beer yet it was smooth.","New York, USA","crazyvin"
618,"2006-01-02",4.0,"Black pour, good sized dark tan head. A little bit of light comes through the sides. Aroma, chocolate, with a roasty background. Nice flavor, a mild chocolate with a touch of bitterness, as well as some roasted notes from the malt.","Columbus, Ohio, USA","sliffy"
618,"2005-12-30",3.8,"Black pour w/ a large brown head w/ a nice lacing.  Aroma is of milk chocolate almost of chocolate milk and hints of vanilla.  Palate is a nice body some light creminess full feeling.  Flavor is coccoa and lactose and some other roast malts w/ a dry chocolate kind of hop.  Pretty good but not one of my favorites.","Wisconsin, USA","MIBRomeo"
618,"2005-12-29",4.3,"Black without a hint of light coming through. Big creamy brown head with nice lacing. Chocolate aroma with a background of roastiness, and I think I could detect just the faintest aroma of the Cascade. Wonderful full mouthfeel complimented by a fine light carbonation. Flavors of bittersweet chocolate and dark roasted malts follow in the steps of the aroma. Finishes surprisingly dry for a beer so dominated by rich malt flavors. Just luscious. Well done, Rogue!","Morehead City, North Carolina, USA","DrBayern"
618,"2005-12-29",3.9,"650ml bottle.  Pours black with a creamy, chocolaty head.  Aroma of serious chocolate.  First taste is lots o chocolate, but finishes a little bitter.  Very little.  Dont drink it too cold!","Beech Grove, Indiana, USA","ebarnes"
618,"2005-12-26",3.7,"Bottle: Black, blackened coffee edges, large light brown head, frothy, decent lacing.   Cocoa aroma, seems bitter and dry.   Rich dark chocolate on the tongue, high in its percentage of cocao, quite dry, and semi-sweet.   Fairly bitter for a sweet stout, definite hop bite.   Strong bittersweet cocoa finish.   Body and mouthfeel are moderate, at least less thick and full bodied as expected.   Lingering cocoa and hop bitterness after the finish.   Not as smooth or milky as other examples.   This is one for hop heads who like their dark chocolate with a high percentage of cocoa.","Hardened Liver, Washington, USA","5000"
618,"2005-12-22",4.0,"Pours a black with brown head.  Chocolate aroma. Milky texture. Sweet flavor.  Hints of smoke. Roasty, bitter finish.  Good dessert beer.","North Carolina, USA","Bailz316"
618,"2005-12-21",4.1,"Like a huge piece of chocolate cake with rich chocolate icing.  Poored deep brown, smelled intensely like chocolate.  Taste matched smell well; roasted chocolate, and few other flavors were allowed to penetrate.  So tasty and easy to drink, be careful of this candy in a bottle.","Lewiston, Maine, USA","beerseer"
618,"2005-12-20",4.0,"Pours to a huge creamy brown head atop a dark brown/black body with nice lacing.  The aroma is that of M&Ms and Hersheys Milk Chocolate.  OMG.  So exactly like that.  The flavor is roasty oatmeal and chocolate M&Ms.  Definite cocoa powder.  Good but not really what I want in a beer.  The palate is medium bodied and smooth.  Something that doesnt fit.","Glendale, Wisconsin, USA","1FastSTi"
618,"2005-12-20",3.5,"Fantastic aroma - Smells exactly like melted M&Ms.  Black body with a wispy tan head.  The flavor reveals that its a dry stout (theres some charcoaly dryness) with chocolate extract on top.  The mouthfeel is too dry for the sweet flavor - if it were smoother and richer it would really compliment the rest of the flavor.  Still tasty howerver.","Milwaukee, Wisconsin, USA","DavidP"
618,"2005-12-20",3.5,"Thick creamy brown head. Dissipates to a ring fast. Dark brown clear body.
Holy Hershey Batman! Very sweet chocolate aroma. Very unimpressively 1-D though. 
Dry chocolate flavor. Very dry, not much sweetness. Smokey old alfalfa greens too. 
Blah... okay but too obsessively chocolate-laden.","Milwaukee, Wisconsin, USA","JCapriotti"
618,"2005-12-20",4.4,"Wonderful aroma of chocoloate (surprise, surprise).  Pitch black color with a little brown head.  Flavor is wonderful, mixing the best of both worlds; drinking beer, and enjoying cocoa.  Good body, with the right amount of carbonation.  I absolutely loved this one.","Menomonee Falls, Wisconsin, USA","LePoopie"
618,"2005-12-18",4.0,"Pours black with a thick creamy brown head.  Smells very chocolate like, a little molasses and a little bitter aroma.  Very nice.  Taste of chocolate as well a little smoke as well.  Some alcohol is evident a little more so as it warms.   Very full bodied and creamy mouthfeel.  Finishes a little bitter, but smooth.","Sun Prairie, Wisconsin, USA","madcow75"
618,"2005-12-12",4.2,"Dark-brown creamy head over near black beer with brown-red shot lining. Nose is as hanging over a freshly opened package of black chocolate, chocolate malt as cacaopowder. Bitter chocolate taste, as the kind sprinkled over chocolate truffles, Belgian chocolates with brandy, or entering a Godiva shop and taking a deep breath - one can taste the air. Well bodied, smoked hints, but very drinkable. Great chocolate beer, imposing in its authority.","Ursel, BELGIUM","JorisPPattyn"
618,"2005-12-09",3.3,"Pours a dark brown/black with some creamy tan head that quickly dissipates to a ring. Aroma is some roast, some chocolate, and the cascades in all their glory. Starts out pretty roasty, with some coffee and dry chocolate notes. Strange, I was expecting this to be sweeter. Finishes rather bitter, with some hops and alcohol coming out at the end. Pretty dry overall, wondering why this is a sweet stout. Lacking a bit in the body. A bit too much carbonation on the end, a big pet peeve of mine. Mediocre.","Detroit, Michigan, USA","JoshuaB"
618,"2005-12-08",3.5,"UPDATED: DEC 9, 2005 Smells like a scratch-and-sniff sticker from the mid 80s. Yellowish head that disappears quicklya dark stout. Tootsie roll taste that gets smashed by bitterness. After reading reviews, I actually thought it would be more coo-coo for coco puffs in flavor. This isnt bad, but I would drink a Bells Kalamazoo Stout over this any day.","Garden City, Michigan, USA","UnsofistaCat"
618,"2005-12-05",4.2,"650 mL brown bottle purchased from Armanettis, Mundelein, IL.  Black hued stout having a small diminishing light brown head with good lacing.  Succulent aroma bouquet of chocolate, espresso and raisin.  Full bodied with smooth creamy texture that starts with sharpness and slight sweet roasted malt with hints of dark chocolate, espresso and raisin. Finishes dry with lingering bitterness. An excellent chocolate stout, one of the best that Ive tried so far.","Libertyville, Illinois, USA","beervana"
618,"2005-12-04",3.9,"Well think of chocolate milk and then think of how chocolate beer would taste and this is it.  Pretty good stuff.","Lemoyne, Pennsylvania, USA","Nejhleader"
618,"2005-12-02",4.6,"(draft) A fantastic beer, from the intense chocolate syrup aroma through the creamy mouthfeel to the delicious finish. Beyond yummy.","Georgetown, Indiana, USA","barenada"
618,"2005-12-01",3.7,"UPDATED: DEC 2, 2005 Dominated by chocolate, rather unfortunately I guess. Aroma and taste are both overrun by it, which blocks out some nice hops in the flavor and more complexity in the aroma.","New York, New York, USA","puzzl"
618,"2005-12-01",4.5,"Beautiful dark colored body, light brown head.  Heavy chocolate aromas, with roast malts and coffee.  Bitter sweet. Taste is of mocha, chocolate. Very nice. Roasted hints and a very well rounded chocolate finish.","Fort Walton Beach, Florida, USA","oldrtybastrd"
618,"2005-11-24",4.2,"22 oz. bottle.  Poured out like motor oil, thick and blackish-brown with a thick light brown head.  The aroma was heavy with chocolate and roasted malt with some hints of coffee.  The initial flavor is bitter hops, roasted malt and burnt toast.  That later gives way to some caramel and a nice, rich milk chocolate finish.  Nice and full on the palate.  This is the best Ive tasted thus far from Rogue, outstanding on a warm Thanksgiving afternoon here in Tampa.","Oldsmar, Florida, USA","kfarrnd"
618,"2005-11-22",4.2,"Bouteille-Noire pas de mousse consistante. Arôme et goût chocolaté. Très gazeuse. Rondeur pleine bouche. Excellente!--Bottle-Black with no head. Chocolate aroma adn taste. Fizzy. Full mouth palate. Excellent one!","La Prairie, Quebec, CANADA","Paskal"
618,"2005-11-22",4.1,"Pours black with a thin choco colored head.  Smells of chocolate and coffee.  Has a very rich and sweet chocolate taste.  A very nice sweet stout indeed and it washes down smooth to boot.","Raleigh, North Carolina, USA","Hawksfan17"
