"beer_id","date","rating","text","user_location","user_name"
618,"2008-06-24",3.8,"The beer pours a deep black with a thick light brown head. The nose is rich a deep smelling of chocolate and light hops. The flavor is great its like drinking hoppy liquid chocolate. The finish is sweet and biter is a nice chocolate flavor. The only down side is that the beer is somewhat watery, I wish it was thicker.","Sugarland, Texas, USA","texasbartender"
618,"2008-06-23",3.3,"Weirdly enough, this tastes much better cold than warm. Perhaps because its a bit thin for a stout so the carbonation is necessary for a little body. Tastes like chocolate, as it should. Fairly tasty, just not the best.","Washington, USA","killjoy966"
618,"2008-06-23",3.5,"Draught at The Red in Santa Cruz.   Black with a dense tan head.   The aroma is super chocolate powered; leaning a little toward the dark side, but still milky and creamy.   The flavor takes that and adds in a roasted bitterness that doesnt completely blend, but works out alright.   The body is a little thin, but pretty smooth.   This is a really nice smelling beer, with a pretty good flavor to back it up, but the chocolate and roasted malt dont seem to gel as well as they could.","down the whirlpool, California, USA","SamGamgee"
618,"2008-06-21",4.2,"Opaque black with a thick persistent chocolate mousse looking head,  Nose of chocolate and coffee.  Taste of dark roasted malts and chocolate with just a hint of coffee-like bitterness.  Great, creamy mouth feel.  Finish is like a semi-sweet chocolate bar, again with a hint of coffee.","Abita Springs, Louisiana, USA","FishManLA"
618,"2008-06-20",3.8,"Aroma was most definitely chocolate.  Head was not as robust as I would have liked, but was an attractive tan color.  I enjoyed the smoothness of the mouthfeel (from the oatmeal used), and the flavor is nicely sweet at the beginning... but needs something to give it a ""punch"" in the aftertaste. More alcohol, or maybe a hint more hops would make this one more rewarding.","Santa Cruz, California, USA","Frohike"
618,"2008-06-19",3.6,"Bomber. Pours dark brown wuth tan head. Aroma is chocalate malt and some oat. Flavor is malty with big flavor of chocolate and a touch of oats. Creamy mouthfeel. Could use some more hops.","Mount Prospect, Illinois, USA","msante79"
618,"2008-06-19",3.7,"A very tasty beer. The chocolate may be a tad overwhelming, but other than that, I have no complaints. Definitely a sipping beer.","Davie, Florida, USA","rbod"
618,"2008-06-19",3.5,"A nice looking black beer with small tan head. Nose dominated by the chocolate but with slight roast coffee tones, and overall pleasant. The taste is rather odd, very creamy and strongly chocolate but somehow incomplete. Ok beer, but I was hoping for more.","Baltimore, Maryland, USA","MrChopin"
618,"2008-06-18",4.0,"UPDATED: JUN 20, 2008 Bottle pours dark brown with thin brown head. Aroma is chocolate. First taste is sweet then the chocolate takes over. Not much hops, with chocolate finish that does not linger. Good chocolate flavor, nice sipping beer.","Jackson, Georgia, USA","kpresley77"
618,"2008-06-17",3.7,"Like drinking a chocolate bar. Suitable for dessert, after hours, eating ice cream, and giving to your wife. Not that there is anything wrong with that...","Lexington, Kentucky, USA","drfabulous"
618,"2008-06-17",3.8,"decent overall, definite chocolate both in the aroma and flavor.  Some underlying hoppiness.  Missing something however.  Perhaps if it were thicker in terms of mouthfeel?  Complexity didnt seem to be there for me.  Prefer this to youngs double chocolate in that chocolate in noticeable to my palate throughout the bottle.  Left with chocolate on the finish as well.  In that respect it lives up to its billing as a chocolate stout.  Would buy again but not one that I would climb mountains for.","barrie, Ontario, CANADA","yumyum"
618,"2008-06-16",3.2,"Draft-New Orleans. Served with ver little head. Bar was dark but this sucker looked pretty dark and opaque. Tasted like someone went crazy with the chocolate syrup. A good sipper but not one for a hot New Orleans day.","Memphis, Tennessee, USA","KDorgan12"
618,"2008-06-14",3.4,"Pours dark black, small brown head. Chocolatey aroma. That being said, Im also disappointed with the flavor. Its a lot less flavorful than the aroma leads you to believe. It was also more watery than expected. Decent stout, but underwhelming.","Austin, Texas, USA","v64"
618,"2008-06-14",3.2,"Nearly black pour with a decent head.  Smells of chocolate, molasses, and some alcohol.  Flavor was disappointing however.  The aroma would lead one to believe it had more flavor which I didnt find.  The flavors are very subtle and the consistency is a little watery.  I was kind of disappointed, but it is still a nice stout. Just par though.","Alaska, USA","12many"
618,"2008-06-14",3.8,"Bottle: The aroma is of pure chocolate.  Pours a dark black with a brown head.  It tastes of chocolate and malt with a slight hop undertone.  Its extremely enjoyable for a sweet stout, but not as intense by any means when compared to other stronger imperial stouts.","Dayton, Ohio, USA","Bigmmartin"
618,"2008-06-10",4.1,"Poured a great black color, with a dark mocha head. It gave a great aroma of dark, bittersweet chocolate, but not overpowering. Overall, it was extremely smooth and drinkable, and it only got more flavorful as it warmed up.  Will definitely pick up another soon.","New Jersey, USA","urraca"
618,"2008-06-05",4.1,"A good chocolate stout. There was a good roast and chocolate aroma. The taste starts off bitter, but finishes off with a nice chocolate hint.","Louisiana, USA","TheKeg"
618,"2008-06-04",3.9,"Dark brown opaque pour with a thin light tan head.  Chocolate dominates the aroma.  The flavor has more bitter roast and the chocolate starts subtly and builds to dominate the finish.  Very good chocolate beer.  Its much lighter and more easy to drink than many other chocolate stouts.","Seattle, Washington, USA","EricE"
618,"2008-06-03",3.9,"UPDATED: JUN 23, 2008 Draft @ the Magic City Brewfest.  I had the pleasure of volunteering for the first session and was the designated pourer for this beer  Almost globally it was loved.  Personally its the best stout Ive ever had, right in my flavor spectrum  Dark, mellow, very thick frothy head.  Malty and lightly chocolaty","Birmingham, Alabama, USA","JustinFromAL"
618,"2008-06-01",4.2,"My new favorite stout. Pours out very thick, almost sludge like, with a thin head and a big sweet aroma. Flavor is all malts, with some chocolate notes, but note really so much that it ruins the experience. Definitely recommended.","Alabama, USA","posikyle"
618,"2008-05-28",3.9,"22 fl oz bottle. Pours dark brown to black with a dense chocolate brown head. Aroma is dense chocolate with a strange yet nice fruity note - towards berries. I pick up the same distinct berry note in the flavour too. Nicely roasted malt, bitterhops flavour and smooth yet slight dusty chocolate powderish flavour. Solid bitter and roasted finish. Strange with this distinct berry flavour, yet it is very pleasing.","Copenhagen O, DENMARK","yespr"
618,"2008-05-27",4.0,"Ive had better chocolate stouts, but this was very good. Tasty and frothy and thick.","USA","westknife"
618,"2008-05-27",4.0,"Bottled. Unsurprisingly, the flavour of this smooth, deep brown beer is dominated by chocolate, but thats no bad thing. The warming bitterness of the hops adds delightfully to the effect. I thought this was very good indeed.","Nottingham, Nottinghamshire, ENGLAND","albertane"
618,"2008-05-27",3.9,"Bottle. Thick black colour with brown foamy head. Aroma is chocolate, roast malts, smoky, fruity. Taste is cocoa, sweet, coffee, creamy, rich. Finsh is slightly hoppy. A delightful beer.","London, Greater London, ENGLAND","Carlus12"
618,"2008-05-22",4.9,"Rogue Chocolate Stout is a black ale with a foamy, light brown head that exhibits great retention.  It has a strong roasted chocolate malt aroma.  It is sweet, dark and a bit fruity.  It is smooth and full bodied; soft with a snappy finish.  It is a very full flavor: pretty sweet and quite bitter.  Its like dark chocolate with a touch of citrus.  The flavor is well balanced.  This beer is almost like a liqueur.  Damn.  I can find no fault with this beer.  I think its the best beer Ive ever had.","Fairport, New York, USA","yesyouam"
618,"2008-05-21",4.0,"bottle; black pour with one to two finger head that lasts. aroma is of sweet toasty malt with lots of chocolate, very pleasant. medium body, with good complex sweet and toasty malt with notes of coffee that quickly fade to a lingering bitter-sweet chocolate.","gainesville, Florida, USA","topher40409"
618,"2008-05-20",4.1,"1/12/08 notes:  Rogue is fucking amazing. Had this beer a few days after really enjoying their Shakespeare Stout. I have this considerable thought, but I really feel that this beer tops it.  Features an delicious  dark chocolate aroma and a full bodied, rich, creamy toasted chocolate flavor.  Perfect medium carbonation and smooth hop-roast finish. Touch of molasses at the end adds flavor and balance to this brew.","Honolulu, Hawaii, USA","elihapa"
618,"2008-05-19",3.6,"On draft at the GOBF. Pours a blackish red, very thick and creamy head. Aroma is almost chocolate milk, but more roasted grains start coming out as it warms. Taste is dry, chocolaty, with a hoppy bitterness and lots of the roasted grains. Very solid beer.","Orlando, Florida, USA","dchmela"
618,"2008-05-17",3.8,"Man, I remeber this beer better than I what I tasted today.  Still a solid brew and still the best sweet stout out there but I found the chocolate flavor to be not as prominant as in earlier Rogue choco stouts.  The chocolate flavor and aroma just seems to be toned down from previous tastings.  All things considered still a smooth sweet brew and well balanced.   This will require more research ;)","Port Clinton, Ohio, USA","grandridge"
618,"2008-05-16",4.0,"UPDATED: MAR 1, 2010 Pours nice & dark with a full head that lasts.  The smell of sweet chocolate is immediate and dutifully powerful.  Small notes of roasted coffee can be found among the striking flavor of chocolate truffel on the palate.  The hops finish it to help balance the sweet chocolate.  This is a great stout with terrific chocolate flavor.","North Canton, Ohio, USA","beerchugger"
618,"2008-05-15",3.9,"V - black with tan fizzy two finger head. fluffy with a bit of lacing. Head doesnt last.
A - rich aroma, deep malts and chocolate with some caramel and oats present as well and maybe a touch of lavender-like fruit
T - malty with a milk chocolate taste
P - just a touch of creaminess but overall a bit thin.","Seattle, Washington, USA","carruthm"
618,"2008-05-11",4.4,"Great chocolate flavor with a nice body and good mouthfeel.  Head retention could be better.","Orange Beach, Michigan, USA","tomspalla"
618,"2008-05-11",4.1,"I would put this Rogue beer on top of my favourite chocolate beers. Right along with Lost Coast Chocolate Porter.

The joy began right after opening the bottle. It pours a dark body and thick head that settled rather quickly. 
Full body / chocolate smell is heavily present right after opening and in the glass. It has a nice smell that does not overtake the quality of the beer.
A very enjoyable beer, very smooth, full chocolate body, does not leave any bad aftertaste. A near perfect mix of chocolate malt and barley.","Enghien, BELGIUM","sebletitje"
618,"2008-05-09",4.1,"Pours a cocoa colored brown with thin white head.  Aroma dominated by chcolate malts roasted coffee and tostie rolls.  Flavor once again dominated by chocolate and chocolate malts.  Nice roasted character and hops provide a tasty bitter dry finish.  Very Good!","philadelphia, Pennsylvania, USA","corby112"
618,"2008-05-08",4.1,"Tap @ Blind Tiger.  Pours a deep reddish-brown to almost black with a tan head.  Aroma is chocolate malt, almost to the point of chocolate milk.  Flavor is sweet milk chocolate up front dissolving into dark chocolate bitterness with coffee and roasted malt notes barely detectable.  A total winner.","North Bellmore, New York, USA","thenick"
618,"2008-05-07",4.1,"Poured a nice black color with a tan head. Aroma is alot of chocolate mainly. Flavor is also alot of chocolate, sweet and dark chocolate with a nice amount of coffee bitterness to keep it in balance","Pittsburgh, Pennsylvania, USA","Beerman6686"
618,"2008-05-06",4.2,"22oz bottle. Pours black with a thick creamy chocolate colored head. Nose is intense chocolate and caramel but with a very rich smell of fine chocolate. Very distinct body with clear cut changes in palate. Starts of with a strong caramel malt note, very smooth, followed by a giant chocolate truffle middle and it finishes with a strong roasty malty bitterness of Mocha Java Coffee. Outstanding. And as stouts go this is an excellent one for beginners, its very sweet with pretty light bitterness yet a complex and well defined palate. Very well made by Rogue.","Florida, USA","darkguardian"
618,"2008-05-04",4.2,"Pours black, with a very thick creamy head. Rich, sweet, caramelly chocolate aroma that lasts.  Flavour is quite malty, but with a beautiful chocolate-toast finish.  Beer is clean on the palate.  Overall very nice.","Boston, Massachusetts, USA","mannika"
618,"2008-05-03",3.5,"Pours like black Texas T.  Jet black in color with a rich and sweet chocolaty aroma.  At first taste is a bit disappointing compared to the expectations that the aroma and pour had presented.   Very heavy beer (64 IBUs).   Expecting more but didnt completely disappoint me.","Miami, Florida, USA","uoffgator"
618,"2008-05-02",2.7,"UPDATED: MAY 5, 2008 Graduation weekend in Bloomington. Rogue Chocolate Stout is a black beer with a great shaped dark brown head. The aroma is strong and full of chocolate. The flavor is pure chocolate. I can best describe this as drinking a liquid semi-sweet cooking chocolate bar.","New York, New York, USA","mgoy"
618,"2008-04-30",4.2,"nice malty yeasty aroma with hints of coffee, dark pour (very dark) with dark tightly packed foam (similar to Guiness), excellently bittered with a melange of chocolatey flavors and a very pleasant, lingering, sweet chocolate after taste.  I did not know that it was possible to brew this good of a beer and actually use chocolate!","Idaho Falls, Idaho, USA","AdamGott"
618,"2008-04-29",4.6,"Another extremely dark beer, yellowish brown head...looks and smells delicious. sweet chocolaty aroma. Wow...taste amazing, nice amount of hops. This is a great beer!","cullowheee, North Carolina, USA","Nucci"
618,"2008-04-29",4.9,"Fantastic! Smells like Chocolate and Carmel.  Black color with a decent size brown head.  Leaves nice Lacing.  The 10 different ingredients blend very well.  Great beer.","Cullowhee, North Carolina, USA","Dangle"
618,"2008-04-27",3.7,"A- Very dark with an oatmeal yellowish brown head that retains well and leaves some nice lacing.

S- Smells very sweet with hints of Chocolate, rasberries and hops.

T- Begins chocolate with a definate bitter tinge at the end. Also tastes of coffee and is quite acidic.

M- Mouthfeel is a little harsh, very carbonated, lines the inside of the mouth and stays there.

D- This beer is excellent but i couldnt see drinking more than a bomber. Good desert beer to sip on.","California, USA","Lothore"
618,"2008-04-26",4.2,"Aroma is barley rich malt, cocoa, and chocolate syrup. Black pour, medium lacing head. Pretty neat balanced blend of chocolate syrup, grass, and parsley. Charcoal finish. Balanced and drinkable.","Staunton, Virginia, USA","obguthr"
618,"2008-04-26",3.9,"Black with large light brown head. Sweet aroma with loads of chocolate, roasted malt and coffee notes. Sweet flavor dominated by dark bitter chocolate with notes of roasted malt, caramel and coffee. Nice!","Frederiksberg C, DENMARK","KimJohansen"
618,"2008-04-26",3.8,"At Tux place, 240408
Bottled
Nice head and a cream like palate. Flavor and aroma is bitter chocolate but with a lactic touch","Aarhus, DENMARK","Bragesnak"
618,"2008-04-24",3.9,"Pours black with a thin brown head. Aroma is chocolate fudge with a hint of coffee. Strong sweet chocolate start with a bittersweet chocolate head. One dimensional but still good.","Maryland, USA","Vas19"
618,"2008-04-23",4.0,"Poured a dark-dark black. Had the aroma of CHOCOLATE! It made me happy when I first poured this brew because it reminded me of enjoying a nice cup of chocolate milk or hot cocoa. It also had other roasted malt scents. The flavor was great. It tasted chocolaty,malty and you could definitely taste the oats too. It was also sweet. Overall I thought this was a very tasty beer and will probably be buying another in the future.","San Clemente, California, USA","cgort"
618,"2008-04-23",3.7,"Heavy malty and dark chocolate aroma. Large, frothy, light brown head. Good lacing. Mostly lasting longevity. Black body. Heavy bitter initial flavor with powerfull chocolate notes and a long finish duration. Medium palate.","Langå, DENMARK","cheeta"
618,"2008-04-23",4.1,"Maybe the best all-around chocolate stout Ive had, for my taste. Pours a deep, oily black with developing dark brown head. Nose of sweet, dark chocolate and roasty espresso. Flavor is just lightly sweet, going into a very mild, roasty bitterness with more chocolate and espresso lasting into the long aftertaste. Im happy that the hopping is so restrained, to let the chocolate and malty flavors come through. We paired this last night with a cherry tart, and its hard to imagine a better combo. Big thanks to my sister-in-law and future brother-in-law for sending this across the pond to us.","Berlin, GERMANY","JoeinDahlem"
618,"2008-04-22",3.9,"Pours a very dark fudge brown with a small but full brown head. Aroma of sweet chocolate, coffee, and some oats. Has a nice bittersweet chocolate start with a very roasted finish. Body is creamy but a little thin. The oats come through a little sweet, maybe some more could have thickened this up a bit and filled out the body.","Baltimore, Maryland, USA","DocHop"
618,"2008-04-20",4.4,"Wow. On tap. Opaque black pour with a monstrous tan head. A few ruby highlights near the bottom. Big chocolate aroma full of roasted malt and oats. Flavor is very rich and chocolaty, with a smoothness I tend to ascribe to oatmeal stouts. Big dark chocolate taste fading into semi-sweet at the finish.  Great body. A wonderful sweet stout.","Cullman, Alabama, USA","RichJ7"
618,"2008-04-17",4.2,"Bottle. Black Colour with medium creamy light brown mostly lasting head. Aroma and taste is chocolate. Lots of chocolate and then some. Very good sweet stout.","Tjele, DENMARK","EHSRanders"
618,"2008-04-16",3.9,"Dark brown almost black in color with a thick tan head. Bitter chocolate and coffee aroma. Taste is bitter roasted malt and a little coffee, but balanced with some malt and sweetness; nice hops too. This is a medium bodied and carbonated beer and actually very drinkable despite the strong flavors. Nice beer.","Portland, Oregon, USA","apshah99"
618,"2008-04-15",4.2,"65 cl bottle, at my «Hopheads» tasting. Black color, brown head. Aroma is chocolate and coffee. Flavor is chocolate, some fruit ans some bitterness in the finish. I could drink this again!","Bryne, NORWAY","tarjei"
618,"2008-04-13",3.9,"Nose of chocolate, roasted malt, and coffee. Pours a thick black coloured beer. Taste is strongly cocoa, medium bodied.  Hoppy, oaky very mature and balanced. A good beer.","Greater London, ENGLAND","DownsouthGav"
618,"2008-04-12",3.3,"Bottle. Pours almost pitch black with a big grey/brown head. Nice lacing. Aroma is a blend of sweet chocolate and licorice. Okay, but slightly cloying. Flavour is mainly chocolate; tastes like cheap German chocolate  not that good. Actually the chocolate in the aroma has a bit of the same problem. Finish is better; roasted notes and a lingering coffee bitterness. Feels dry. Slight apple notes appear as it warms. An okay beer, but would (probably) be better with a different chocolate profile. 13-04-08.","Frederikssund, DENMARK","NosirIwont"
618,"2008-04-12",3.9,"Bottle. Pours almost completely black with a small light brown head. The nose worships chocolate with bittersweet qualities. Bittersweet chocolate, some milkiness and a good bitter finish. Soft on the tongue and rather full-bodied. Craftmanship!Earlier Rating: 4/6/2008 Total Score: 3.3Bottle. Dark brown, almost black, with a small tan head. Chocolate and cocoa powder nose galore. Overpowering chocolate and cocoa taste. Very sweet, though the dryness of the cocoa powder provides some balance. I enjoyed this one-dimensional beer (but then I like chocolate!)","Oslo, NORWAY","thebeertourist"
618,"2008-04-11",4.0,"Creamy lightbrown good mostly lasting head. Black colour. Heavy malty aroma, fantastic chocolate notes. Powerfull chocolate flavor. Really great. Creamy palate. Fantastic beer.","Randers, DENMARK","HenrikSoegaard"
618,"2008-04-11",4.0,"Dark brown to black in color with a good tan head.  Smells of malts, roastiness, chocolate, and coffee.  Taste is definelty chocolate but well balanced and easy to drink.","Dallas, Texas, USA","travita"
618,"2008-04-10",4.3,"This is my new favorite stout.  Smooth and creamy with a sweet chocolate taste all the way down the gullet.  Doesnt overwhelm as the tastes of roasted malt and hops come through.  I love this beer.","Philadelphia, Pennsylvania, USA","sudline"
618,"2008-04-10",3.7,"Pours with a dark black color and about a half inch of head that dissipates in a few minutes.  The aroma is strongly chocolate.  The flavor is not overpowering chocolate, but seems well balanced.  The roasted malts and hops come through the chocolate fog.  This beer is medium-heavy bodied and medium carbonation.  This is a good beer and good stout.","Christiansburg, Virginia, USA","lightning9191"
618,"2008-04-08",3.5,"(cleaning out my beer bottle collection as pictured in my profile and utilizing ratebeer.com)
As I recall, this was a delicious stout.  Could use more abv, but was just the right balance of bitter and chocolate.","Brunswick, Maine, USA","BeerFanDan17"
618,"2008-04-07",3.7,"UPDATED: OCT 31, 2008 Original rating 3/6/05.  Pours a very black color, moderate tan head that doesn’t last long. Chocolate, malty aroma, although not all that strong. The flavor is pretty nice with dark chocolate right away with subtle malts and bitter hop notes following. This seems more like a dessert. Hell, maybe it can be. I can’t drink too many of these chocolate beers though. A simple 12 ounce would have been fine. 

Re-rate 10/31/08. A nice one for Halloween. Black color with a little amber sneaking through with a thin head, even with an aggressive pour. Wonderful aroma, lots of cocoa. The beer starts off rather tame but quickly turns to a nice mix of milk and dark chocolate flavors. Roasted malts, light hop bitterness and coffee notes prevent this from being too one dimensional. Chocolate lingers long into the aftertaste. Easy drinking stout... no problem finishing a bomber this time. Rogue’s Shakespeare is still better but this is very solid.","Lake Mary, Florida, USA","changeup45"
618,"2008-04-06",3.9,"Pours black with light brown head. Aromas of burnt malts and chocolate. Flavor is bitter burnt malts and chocolate. Full body with minimal carbonation and creamy mouthfeel. An excellent sweet stout.","Winter Springs, Florida, USA","smith4498"
618,"2008-04-03",3.8,"Pours a thick, dark black with a minimal tan head. The aroma is almost all sweet chocolate, with a little bit of roasted malt bitterness in there. The flavor hits with tons of chocolate right of the bat, which fades very gracefully into a somewhat roasted malt/hop bitterness. The chocolate flavor lingers throughout however. This beer is balanced remarkably well, with all the flavors existing together quite harmoniously. The mouthfeel is little sharp for the style, but is still very nicely full bodied. I have to say that this may be my favorite Rogue brew so far, highly recommended.","Columbus, Ohio, USA","crowderm"
618,"2008-04-02",3.9,"Pours black with huge tan head and phenominal lacing. Nose primarilty of grapefruit hops, roasty malt, and roasted coffee. Palate was quite smooth with flavors of roasted coffee, bitter chocolate, and hops. Nice lingering hop presence.","New Hampshire, USA","oteyj"
618,"2008-04-02",3.9,"hoppy for a stout, great chocolate hit to the senses- beautiful brownish head with gorgeous lacing. bitter chocolate with hops and malt, strong flavor overall. palate is solid, with a bitter aftertaste resulting from the chocolate. overall delicious, especially under the sweet stout category- magnificently to maintain beer taste, doesnt get overwhelmed by the chocolate. great stuff.","Seattle, Washington, USA","craftycarl21"
618,"2008-03-31",3.7,"22 oz. Bomber. Pours a nice dark brown to black with a big, puffy caramel colored head. Has a huge chocolate malt aroma. Chocolate, chocolate and more chocolate in the flavor. Also earthy and musty in the background. A bit thin on the palate, but still pretty good. Descent bitterness and a nice finish.","Grand Island, New York, USA","hoptimus"
618,"2008-03-30",3.8,"Pours out black with a nice sized fluffy brown head. Aroma is of cocoa powder, hops and some roasted malt. Nice creamy mouthfeel. Flavors of sweet chocolate, dark chocolate, roasted malts and slight caramel. Solid beer.","Ocean County, New Jersey, USA","pineypower"
